start	end	text
0	6420	Greetings my disciples, it is your leader in prayer and song, Wolf the Dog, and I am
6420	11540	here to preach the good word about all the happenings in this silly thing we call life.
11540	17760	I'm also here to tell y'all about how to attain true salvation and get y'all into dumps to
17760	18760	meet heaven.
18760	22240	The one true secret to life and happiness is...
22240	26920	Oh wait, before that we got a show to run here y'all, apologies.
26920	31300	This week's Howlin' with Wolf comes from Doug Blake, who recommended pretending to be people
31300	32300	on Facebook.
32300	39900	I mean, this week's Howlin' with Wolf is an Ari Manstein event review by ZomBenny2099.
39900	44680	The location for this event could not have been better, set among the classically themed
44680	48640	mausoleum littered venue that is the city cemetery.
48640	54260	The Samba Stone family plots lent a sense of reverence that most crawfish boils sadly
54260	56100	lack these days.
56100	61400	Upon my arrival I was instantly hit with sweet and savory smells that reaffirmed my hopes
61400	63960	that this would be a boil to remember.
63960	68220	But alas, the only thing I will remember is my disappointment.
68220	74320	First and foremost the service was terrible, there weren't even any eating utensils provided.
74320	80080	I actually witnessed a hip, well dressed young man, obviously from the city, resort to eatin'
80080	83660	straight from the pot as no one came to serve him.
83720	87440	Needless to say, I never actually got to taste any crawfish.
87440	91800	Equally as disappointing, the music was nonsensical.
91800	97000	I'm as down with new age music as the next city dweller, but this was just weird gibberish
97000	101560	that seemed to last forever and yet was over as soon as it began.
101560	106580	I was not alone in thinking this as several frustrated diners shot the DJ.
106580	111880	It was around this time that I took my leave, disappointed and hungry.
111900	117740	Still, all things considered, not the worst crawfish boil I've been to, two and a half
117740	119820	stars out of five.
119820	124980	You know, Wolf ain't never been to a crawfish boil that didn't have some kinda crazy shit
124980	126420	go down.
126420	131740	But all that crazy shit always leads to a massive reward at the end of the night when
131740	138820	they dump out all them shells into the trash, a treasure trove of candy red exoskeletons
138820	145040	discarded by the masses, all so your old little old wolf can take a Scrooge McDuck
145040	151280	dive into them, swimmin' around gettin' my fill with my mouth wide open.
151280	155620	That is the kinda spicy bug I like to eat.
155620	160480	So anyway, you need to remember, if you wanna write up somethin' for your wolf to how, tag
160480	166100	at PretendingPod on Instagram or Twitter, tag PretendingToBePeople on Facebook, or write
166100	171160	a five-star review and email us at PretendingPod at Gmail.com.
171160	177960	You are due to get bruised and lose your shoes if you choose to snooze on the news, baby.
177960	181840	Keith Vigna was shoved into a secret room in Jim Cook's house.
181840	187400	Clark Bishop found a well-worn VHS tape of his parents playing Wheel of Fortune and winning
187400	189080	a honeymoon.
189080	194400	John Lee Pettymore found an envelope with a letter from Jim Cook alongside three folders
194400	197700	outlining three different operations.
197700	203640	The group recovered at a walk-in clinic before toolin' up and enterin' Marvin Glass's playground
203640	206940	through a trap door like great in an alleyway.
206940	213940	Speaking of playgrounds, I hear those PretendingToBePeople boys are gonna be playin' around and loitering
213940	215820	on Twitch this Friday.
215820	223060	They can be found at twitch.tv slash pretendingpodstreams.
223080	227240	I hear one of those boys might sound a lot like me.
227240	230000	Yeah, right, that'd be crazy, y'all.
230000	235320	Aw, hell yeah, the thought of those boys streamin' has Wolf's face beamin'.
235320	241200	But until then, I'll keep dreamin' and dreamin' of incessant screamin'.
241200	247280	It's Kudzu with no backbone.
253060	280800	Let it pop, pop, pop, pop, in your butthole pop.
280800	282840	Put all the poppers in your butthole now.
282840	284620	Put them up there and lick them real good.
284620	285620	Let me get that popper.
285620	287440	Make it a spicy butthole.
287440	289600	Spicy butthole in my pants.
289600	291480	Spicy butthole does my dance.
291480	293920	I like dancing with my butt.
293920	296080	You will like me when I strut.
296080	297080	Strut.
297080	298080	Oh!
298080	300080	Luke, what'd you do for your birthday?
300080	306640	I literally woke up, sat on my couch, smoked weed all day, and watched Twitch.
306640	307640	Nice.
307640	309020	What'd you watch on Twitch?
309020	317700	I watched, well, at 8 p.m. is when Lord Caboon plays Grand Theft Auto roleplay.
317700	321500	So I watched that from about 8 p.m. until 3 in the morning.
321500	322500	That's Mr. Chang.
322500	323580	That's Mr. Chang.
323580	324580	He's my favorite.
324580	328740	The voice is a fun character.
328740	335300	Anyway, he's also, I think, the most watched Grand Theft Auto roleplayer on Twitch.
335300	336300	He's a lot of fun.
336300	337780	Anyway, I did that, and I also watched.
337780	338780	It is a lot of fun.
339780	341940	I watched a movie called About Time.
341940	346060	Oh yeah, with Donal Gleason.
346060	347060	Is that his name?
347060	348060	That's Brendan Gleason's son.
348060	349060	No way.
349060	350060	Yeah, Matt I. Moody's son.
350060	351060	Which I didn't know for a long time.
351060	354500	Oh yeah, because he's also in a couple, or maybe one Black Mirror episode.
354500	355500	The fucking fairytale.
355500	356500	Yeah.
356500	360260	But no, it was an enjoyable movie, cheesy at times, but I also love Rachel McAdams.
360260	361260	Oh yeah.
361260	364380	And I forgot, well, didn't forget, but Margot Robbie was in it as well.
364380	365500	Oh, I didn't remember that.
365500	367260	Isn't Bill Nye the dad in that?
367260	368260	Is that how you say his name?
368740	369740	Wait.
369740	370740	I think it's Nye.
370740	371740	Nye.
371740	372740	Oh, I thought you said Bill Nye.
372740	373740	I'm like, no.
373740	374740	Bill Nye, the British guy.
374740	375740	Yeah, no.
375740	376740	I very much enjoyed it.
376740	377740	Bill Nye.
377740	378740	And before I watched About Time, I watched.
378740	379740	Peach, Bill Nye.
379740	387700	I watched some Chef's Table, and I watched a guy play this survival game, I don't remember,
387700	388820	something dark.
388820	389940	Long Winter or something like that?
389940	391380	The Long Dark is what it was called.
391380	392380	The Long Dark.
392380	393380	Nice.
393380	396180	But yeah, I ordered Postmates slash Uber Eats twice.
396180	397180	Oh wow.
397180	398180	Yeah.
399100	400100	Fucking birthday baby.
400100	401100	Yeah, you really hit it up.
401100	404300	And I was thinking about going to Cherry Picker later in the night, and I was like, you know
404300	405300	what?
405300	406300	Fuck it.
406300	407300	I'm literally not going to change out of my pajamas.
407300	408780	I had a great time.
408780	409780	Hell yeah.
409780	410780	Well, heck yeah.
410780	411780	And you can finally vote.
411780	412780	I can finally vote now.
412780	415780	Yeah, listeners, Luke is legal.
415780	420780	You can vote at 16 in Missouri.
420780	421780	Yeah.
421780	427900	We've been trotting out this jail bait for you, but Lukey boys are all grown up.
427900	432860	When I was younger, I leaned very much to the left, but you know, my parents, a lot
432860	436580	of older people say like, once you get older, you'll be more conservative.
436580	441460	And yesterday I woke up and I was like, damn, I kind of want to vote for Donald Trump today.
441460	443500	Oh my God.
443500	445380	Well that's legitimately horrifying.
445380	446380	Happy birthday.
446380	447380	Yeah, thank you very much.
447380	448980	No, that'll never happen.
448980	451120	Listeners, I'm kidding.
451120	452120	Happy birthday.
452120	455460	Unless you like Donald Trump, then give us more of your money.
455460	456460	Yeah.
456460	457460	Pledge to us, not him.
457460	463740	So, uh, Joe, when Joe got into the home today, he opened up the fridge to grab one of the
463740	464800	beers that he brought.
464800	467380	And then he just started giggling like a madman.
467380	469380	I bought myself some long neck Coronas.
469380	474100	It turns out they weren't all long.
474100	479260	I had somehow bought the seven ounce Corona bottles that for some reason look like long
479260	484780	necks coming out of the top of the six pack, but they just got little stubby bottle bottoms.
484780	486580	Why did they make those?
486580	487580	For the light drinker?
487580	488580	I guess.
488580	489580	I don't know.
489580	490580	Well, wow.
490580	491580	It's for kids.
491580	494620	Well, I mean, what is the drinking age in Mexico?
494620	495620	21.
495620	500460	No, it's, I drank when I was like 14 there.
500460	501460	That's so cool.
501460	502460	Like two years ago.
502460	503460	Yeah.
503460	507660	I went to the swim up bar and I was like, I like, whatever that drink is, it looks good.
507660	510020	And it was like a, like a mudslide or a white Russian or something.
510020	512420	And I drink and I was like, tastes good, but kind of bad.
512420	514540	And then my dad was like, what the fuck are you like?
514540	519420	I didn't do it on purpose, but she didn't get a boner in the pool and that's why you
519420	520420	don't like big mouth.
520420	521420	All right.
521420	523900	So I forgot about that.
523900	527980	I mean, I don't hate it, but I mean, I've only, I've only seen like, all right, so let's
527980	531180	get into this episode 39.
531180	532180	That's a big number.
532180	536620	We're almost to a, almost a 30, 30 more to go.
536620	540940	We're almost at, if you listen to us, you could have worked an entire work week, but
540940	544780	instead you enjoyed it with us.
544780	546460	So let's kick it off the bat.
546460	552460	You guys were, I believe, falling through the, the grate in front of the dirty dog grooming.
552460	553460	Is that correct?
553460	559020	The giant building downtown that, you know, is the glass compound or some cool flowers
559020	560020	around.
560020	561020	Absolutely.
561020	564900	Maybe the last time you'll ever see flowers, you know, as you guys are falling, let's go
564900	565900	ahead.
565900	570660	And as you head into the den of sin, as you've been calling it, let's do it.
570660	571660	You called it that.
571660	572660	Yeah.
572660	573660	I certainly did.
573660	578980	As you guys have been calling it, we called it that because you learned it from watching
578980	581520	you.
581520	583980	And as you guys are falling, let's, let's do an equipment check.
583980	585700	Let's see what you guys have on you.
585700	587540	Who wants to start last episode?
587540	590100	I just bought, or I bought three pistols altogether.
590100	593700	I've got two in the waistband and one in my boot.
593700	598720	And then a John Lee Pettymore bought us all a couple of flash grenades, a couple of regular
598720	600480	grenades and a couple of smoke grenades.
600480	601480	Cool.
601480	605880	And you're also wearing an old school contention, police officers uniform.
605880	606880	Correct.
606880	607880	Anything else on you?
607880	608880	I might have one more pistol.
608880	612280	I guess I would still have the one that Maggie gave me to take out, you can have four on
612280	613280	you if you want.
613280	614280	It's a lot of pistols.
614280	615280	Yeah, sure.
615280	616280	All right.
616280	620640	Tell me if it's too meta, but I have giant pockets in my giant shorts.
620640	621640	I don't know.
621640	624760	Maybe I should be carrying your guns at first now.
624760	625760	That's fine.
625760	626760	I hate it.
626760	628040	If I would've thought about it last episode, I would have said it.
628040	630320	He throws it to you while you're falling midair.
630320	631320	Okay.
631320	633280	So what do you have on you Luke?
633280	640560	I have my small but powerful pistol, two frag grenades, two flash grenades, two smoke grenades.
640560	646000	And then on my back I have the giant fully auto machine gun.
646000	648240	Two ARs welded together.
648240	649240	Basically.
649240	650240	Cold fusion gun.
650240	653680	It's like a double neck guitar, but a gun.
653680	654800	That's fucking awesome.
654800	656800	What a great description.
656800	657800	It's balling.
657800	662320	And then, well, I'll ask this later.
662320	663320	And Thomas, what do you have on you?
663320	665840	What does John Lee, Kevin Pettimore have on you?
665840	669500	He's got his robot body.
669500	671760	He's got body armor on top of that.
671760	673740	All the grenades, same as the others.
673740	679760	He's got a powerful pistol with a large magazine and a semi-automatic shotgun.
679760	680760	Absolutely.
680760	682080	Armed to the veritable teeth.
682080	685360	To the veritable teeth indeed, my good sir.
685360	686720	Joe and I were talking.
686720	691240	I think maybe we should say what our health points are before we start, just so the listener
691240	692240	knows.
692240	693240	I think that's really smart.
693240	694840	Let's get a rundown of your health and your sanity.
694840	697320	I am currently at 16 hit points.
697320	703280	I had a maximum of 26 and my current sanity is at 18 with a breaking point at six.
703280	711400	I have 25 out of 25 hit points and my sanity is at 11 with a breaking point of eight.
711400	712400	All right.
712440	716960	That's 19 of 20 hit points and my sanity is at 18.
716960	717960	Good.
717960	718960	Pretty good sanity.
718960	719960	Yeah.
719960	720960	All right.
720960	723680	Does anyone have any final words?
723680	728800	We're here to eat ass and kill bubblegum and we're all out of bubblegum.
728800	731640	You know how that trap door opened at the last episode?
731640	734160	Clark clings to the edge, pulls himself up and leaves.
734160	740400	He just goes back to his house, watches Wheel of Fortune until he dies, until the end of
740400	741400	the world.
741400	749320	It starts out with all of us going, three Wilhelm screams.
749320	758200	Also while we were spot on, I forgot to add while we were at a, unbeknownst to pretty
758200	764260	much anybody at the gun shop, I had filled some of one of the cargo pants.
764260	768740	I went over to the bait shop of the, of the gun store and filled one of my pockets up
768740	770620	with a catfish food.
770620	772900	Oh, very small.
772900	773900	Why catfish?
773900	775100	Have you ever seen catfish food?
775100	777340	It's like real mushy and super stinky.
777340	778980	Is that what you cover your arm with?
778980	779980	Yeah.
779980	781860	Have you ever gone noodling?
781860	785560	I think I might have told this story once, but I went with my dad or my uncle.
785560	788940	We went gigging and noodling one day.
788940	789940	Giggings fun.
789940	791260	You get to eat some frog legs.
791260	796060	Noodling sucks because a catfish bites your fucking arm and that's how you catch it.
796060	798460	So yeah, that sounds like garbage.
798460	800420	Yeah, I'll definitely allow that.
800420	801740	You're supposed to use your dick.
801740	803420	Oh, mine's not big enough.
803420	804420	It's recreation.
804420	805420	Boom.
805420	810820	I can only fold it in half once.
810820	811820	Call back.
811820	814180	Eight times if you really tried.
814180	816820	Uh, anyway, yeah, so I do have that.
816820	822680	As you fall downward into darkness, you almost immediately feel your body's slow and begin
822680	828420	to float gently like you're just hanging weightless in vast nothingness.
828420	834240	And then abruptly a bright light covers your entire field of vision and huge words appear
834240	840520	in front of you in a spray painted font as a rumbling voice reads the massive tag that
840520	845520	says, welcome to the scrap it.
845520	850840	What you can only assume is the biggest Omnimax screen of all time fades to black and a video
850840	852480	begins to play.
852480	856880	It looks to be the inside of an enormous arena made of glass.
856880	862880	In the background, hundreds of screaming spectators in the foreground, a hole begins to form in
862880	866080	the floor and a shadowy form begins to emerge.
866080	872160	But before this person can even hit the lights of the arena, a giant metal tentacle erupts
872160	876620	into view, gripping the humanoid being and ripping it out of frame.
876620	881860	The screen fades to black and you feel your feet touch the ground, your weight coming
881860	885540	back down into your bodies.
885540	892520	You all are standing in a cube of a room 20 feet across, made almost entirely of the oily
892520	896000	obsidian you have previously seen in this building.
896000	897940	It is disorienting.
897940	904420	Across the room is a mouth of a concrete cave with the logo for the scrap pit spray painted
904420	906060	above its entrance.
906060	912160	To your left are two guards standing in front of a red, deep buttoned plush door.
912160	914500	The guards are in full brown jumpsuits.
914500	917720	They each have a large scythe strapped to their backs and the blade of each scythe is
917720	919760	shaped like an enormous fish hook.
919760	924640	A closer look reveals these men have unnatural matching faces.
924640	928360	Their eyes are far apart, almost on either side of their face.
928360	933560	Their noses do not jut out but are rather two slits above their two wide thick lipped
933560	937480	mouths and they have a few flaps on either side of their necks.
937480	943980	They turn and upon seeing you, press a button that lights up green and they move out of
943980	947700	the way to either side of the gaudy door.
947700	948700	What do you do?
948700	949780	Noodle them, Keith.
949780	959780	I think we just go, I think, I think, uh, I think we just go right through that door.
959780	974040	We do a little noodle and nod over at them and then we go right past.
974040	975280	Clark wants to look up.
975280	979600	Can I see where we came from or is it, is it a closed space that we fell from?
979600	982280	It is just darkness above you.
982280	983660	What do we see through the doors?
983660	990200	Through the doors is a, another smaller room made completely out of the same oily black
990200	991200	material.
991200	994280	I just feel like we're going to walk into another Marvin Glass stadium.
994280	997340	I mean, I don't really have any other options at this point.
997340	1001200	I think we go through the gaudy doors and I mean they hit the green button.
1001200	1003820	Gotta be better than a hypothetical red button.
1003820	1006000	Can I see what you guys are picturing?
1006000	1007680	How are you arranged right now?
1007680	1009600	Are you two backing him already?
1009600	1013340	Do you have, he's in the middle and we're escorting them and I on either side.
1013340	1019760	He's got a gun wound that we literally gave him and I think we're just maybe have your
1019760	1022780	hands behind your back, but not like cuffed or anything.
1022780	1027600	And we're like, and we glued dog fur all over him, so he looks real Chewbacca.
1027600	1032120	But I think we just, we look like he's our prisoner and we're walking him.
1032120	1035480	I'll keep maybe a sullen head down kind of look on me the whole time.
1035480	1037480	I like you best when you look like that.
1037480	1043120	All right, so you guys march him into the, I might emphasize my limp even like look real
1043120	1046940	wounded and I'm non-threatening, but they've got me handily.
1046940	1051660	These total fish men absolutely pay attention to your hobble.
1051660	1058340	You guys march Clark Bishop into this room and the room's interior walls, floor and ceiling
1058340	1064220	are the same beautiful like onyx obsidian reflector and the door closes behind you.
1064220	1067900	There's nothing, just the shimmering black mirror on all six sides.
1067900	1071700	And then you feel the room begin to move.
1071700	1074760	Who has the lowest luck?
1074760	1075760	I have 35.
1075760	1076760	I got 60.
1076760	1077760	I've got 20.
1077760	1078760	All righty.
1078760	1080680	Thomas, go ahead and roll luck for me.
1080680	1081680	All right.
1081680	1084600	I'm going to use these dice that Joe got me for the first time.
1084600	1085600	Nice.
1085600	1086600	Hope they serve you well.
1086600	1087600	I'm going to open mine up too.
1087600	1088600	Oh, okay.
1088600	1089600	93.
1089600	1090600	All right.
1090600	1091600	That's my fault.
1091600	1092600	I'm so sorry.
1092600	1093600	Son of a bitch.
1093600	1094600	I loaded you up.
1094600	1095600	I'm so sorry.
1095600	1096600	That's my fault.
1096600	1097600	I'm so sorry.
1097600	1099600	Son of a bitch.
1099600	1103820	I loaded your guys' dice.
1103820	1105820	I'm the only one getting out of here alive.
1105820	1107820	I'm going to win.
1107820	1112100	I'm not going to win.
1112100	1115100	It's a me, Joe-io.
1115100	1119260	Wildy Joe.
1119260	1127760	One of the walls opens, and you are looking into this dark room lit by two lanterns on
1127760	1133640	either side of the room that have open flames coming from them.
1133640	1139240	Right in front of you, there are six individuals passed out all in their underwear.
1139240	1146640	Most are pretty rough-looking young children, and one is Oz, Mayhem, Wolf.
1146640	1154100	They are all unconscious as a group of what I can only describe as grandmothers.
1154100	1155940	They are older women.
1155940	1163780	They are all dressed in long skirts and cardigans, and they have their hair up in tight little
1163780	1167580	buns like Aunt B. How about that?
1167580	1175160	They are all humming and walking in a strange pattern around this room, pouring a strange
1175160	1181600	liquid into the mouths of these six passed out individuals.
1181600	1184900	Real quick, I just need all of you to roll Sanity for me.
1184900	1185900	Fail.
1185900	1186900	38.
1186900	1192820	Oh my god, I passed 14 on an 18.
1192820	1193820	Fuck.
1193820	1195580	I rolled a 33.
1195580	1196580	Crit fail.
1196580	1197580	Yeah.
1197580	1204100	Keith Vigna and Thomas John Lee Pettymore both lose one Sanity, and for this, Joe, I'm
1204100	1208440	going to have you just take your headphones off and plug your ear holes.
1208440	1209440	Okay.
1209440	1211040	And don't read our lips.
1211040	1215320	This is the first time we've mentioned Joe's embarrassing ear holes instead of ears.
1215320	1218520	He just has these weird, like a Voldemort-like sucky-
1218520	1223360	I'm nervous about all the laughter I'm seeing around the room.
1223360	1225360	He really plugged them.
1225360	1227360	His mom is a rhino.
1227360	1231040	Yeah, they are rhino ears.
1231040	1240660	So as you guys are looking into this room, the two of you see two ethereal spirits that
1240660	1246740	are hanging above these grandmothers, and one is a black dog and the other is a red
1246740	1253660	lion, and they are weaving in and out of these grandmothers as they're walking and pouring
1253660	1259940	this liquid into the mouths of the passed out individuals, and these spirits are diving
1259940	1263160	in and out of the bodies that are lying in front of you.
1263160	1267080	Does there seem to be any connection between their movements or who they're diving into
1267080	1269680	and who the grandmas are giving what it is?
1269680	1270680	Absolutely.
1270680	1271680	Okay.
1271680	1274320	Joe, you can come back now.
1274320	1278480	I saw some hand gestures coming from Zach over there, and I turned away real quick just
1278480	1282160	to make sure I wouldn't glean anything from the beautiful sign language you're providing.
1282160	1288500	Well, they say that you can put mute on a good story and still know what's happening,
1288500	1290840	but I don't know if that would work for this medium.
1290840	1291840	Not for this medium.
1291840	1292840	I don't know, listeners.
1292840	1293840	Give it a shot.
1293840	1300240	I am disturbed, and I look at Kevin John, who's like wide-eyed.
1300240	1302240	What the fuck was that?
1302240	1303240	I don't know, man.
1303240	1309020	As you guys are staring at each other, one of the elderly women just walks into the room
1309020	1315520	with you, and the door shuts behind her, and she just turns to face the door and stands
1315520	1317520	there.
1317540	1319540	Blergeith.
1323340	1324340	I don't say anything.
1324340	1328060	I just stand there hoping that this elevator goes to someone we can talk to.
1328060	1331660	It continues moving, and she turns around to the two of you.
1331660	1333620	Oh, do you have a prisoner?
1333620	1334620	We do.
1334620	1335620	Yes.
1335620	1336620	What did he do?
1336620	1337940	He betrayed Marvin Glass.
1337940	1343420	Well, that is not a good idea, young sir, she says to Clark Bishop.
1343420	1344420	That's why we brought him here.
1344420	1346180	He needs to be punished.
1346200	1349640	Well, we'll certainly make sure that he's punished, won't we?
1349640	1350640	I hope so.
1350640	1351640	You better.
1351640	1354600	But we'd like, yeah, we'd like to tell- We need him for a while first, though.
1354600	1360080	We need to tell somebody higher up, well, I was, I don't know who you are, but if you
1360080	1363120	could get us to somebody, I was tasked with a major-
