start	end	text
1363120	1364120	He's new.
1364120	1369840	I was tasked with something major for Marvin, and he got in my way and made that task impossible.
1369840	1371880	Oh, I'm sure you were, honey.
1371880	1374080	This is Keith Vigna.
1374100	1377460	He's going to be around working for us for a while, why don't you go ahead and introduce
1377460	1378460	yourself?
1378460	1379460	Oh, hi Keith.
1379460	1385140	Kevin, thank you for making me aware of not introducing myself, I'm so sorry, that's such
1385140	1387540	rude manners of mine.
1387540	1393220	Keith Vigna, my name is Ursula, it's very nice to meet you, Ursula Oscythe, it's very
1393220	1394220	nice to meet you.
1394220	1398060	It's nice to meet you as well, I can't look, or I am looking forward to working with you
1398060	1399060	in the future.
1399060	1403160	Ursula, you could say it better than me, why don't you tell Keith a little bit about what
1403160	1405140	you and the others like you do here?
1405140	1407220	Oh, well of course, yeah, welcome.
1407220	1414980	So basically what we do is we carry on a very old tradition of making sure that the sacrifices
1414980	1417700	are ready to be useful.
1417700	1418920	And how do you go about that?
1418920	1425920	As you well know, it's a long drawn out process of lots of ingredients and lots of words and
1426100	1433100	lots of specific directions and maths, but after some time we're able to put together
1433460	1440460	a nice sort of change of blood for those that we bathe in our fun time juice.
1441460	1447900	Oh, I think I've heard of, Kevin's been telling me about, it sounds like a fun time, you know,
1447900	1448900	all around.
1448900	1449900	It is, it absolutely is.
1449900	1455420	And I know that you seem to be looking for someone to speak to, Keith Vigna, is that
1455420	1456420	right?
1456420	1465180	Well, I had spoken with Marvin just earlier today and I was supposed to do something for
1465180	1470560	him and I need to talk with him and let him know what happened and ask him what I can
1470560	1471560	do next.
1471560	1477200	The door begins to open and she says, well, I'm sure you're going exactly where you need
1477200	1478200	to.
1478200	1479200	Nice to meet you.
1479200	1481600	And then motions for you to get off the elevator.
1481600	1483560	Have a good one, Ursula.
1483560	1486340	Good to see you, Kevin.
1486340	1491900	And then I think in my head, we're probably supposed to get off here.
1491900	1492900	Yeah, Keith.
1492900	1493900	Yeah.
1493900	1494900	Yeah, you get out.
1494900	1495900	Let's do it.
1495900	1496900	Let's do that.
1496900	1497900	Get the fuck out of the elevator.
1497900	1499460	I didn't say it out loud.
1499460	1501140	This is my elevator now.
1501140	1503740	She was totally hitting on me, right?
1503740	1507100	Dude, did you see the way she looked at you?
1507100	1508100	That was weird.
1508100	1509100	Wow.
1509100	1510940	She's kind of old, but she's not that bad looking.
1510940	1513120	Ursula, it's not maybe the name I would pick.
1513120	1515120	All that torturing kept her fit.
1515120	1516120	Okay.
1516120	1518120	We walk off the elevator.
1518120	1522640	You guys are still having this conversation and the camera zooms out and you are in a
1522640	1524200	massive room.
1524200	1531180	The door is already shut behind you and this room is dark and it is damp and you smell,
1531180	1537580	you know that like that kind of YMCA kind of aquarium kind of smell going on?
1537580	1538800	Nasty chlorine.
1538800	1539800	Yes.
1539800	1546060	It is endless and it smells fucking terrible and also extremely fishy.
1546060	1550020	If there was a place to do noodling, it would be here.
1550020	1551260	Get your arm ready.
1551260	1557580	Looking out, you see that there is a grid of catwalks that are absolutely infinite going
1557580	1559020	away from you.
1559020	1569020	Above them is a light fog and this is all hanging over dark greenish murky water below.
1569020	1570200	It's open water below us.
1570200	1576160	It is open water below you and in the squares of the grid in the opening where the catwalks
1576160	1584600	are not covering, hanging from the foggy darkness above are rusty moss covered chains.
1584600	1590200	Now some of the chains are just hanging like 10 feet out of the water and some of the chains
1590200	1593520	go all the way in the water.
1593520	1599780	In the distance, you see that a handful of these have people hanging from them.
1599780	1603140	Are they alive or are they corpses?
1603140	1605780	They are small in your view.
1605780	1606780	They're far away.
1606780	1608220	No, they're small.
1608220	1609220	They're just tiny people.
1609220	1610220	I mean, I've seen one of those.
1610220	1612820	They're hanging at the bottom of the chains.
1612820	1613820	Still above the water.
1613820	1614820	Above the water.
1614820	1615820	Still well above the water.
1615820	1616820	Gotcha.
1616820	1617820	Yes.
1617820	1618820	This is spooky.
1618820	1619820	Let's keep moving.
1619820	1621460	Dude, that's a really cool image.
1621460	1626800	I just picture that so well in my brain and it's creepy and kind of beautiful in a weird
1626800	1627800	way.
1627800	1629800	Green fog, like on a swampy.
1629800	1633640	I mean, you said they're far away, but can we see movement from any of them that are
1633640	1634640	hanging?
1634640	1635640	Yeah.
1635640	1639680	And let's go ahead and roll alertness for me or search depending.
1639680	1641280	You can each roll on this one.
1641280	1644280	I'll give it to you.
1644280	1647760	Sixteen on a 60 for alertness.
1647760	1649760	Forty one on a 70 for alertness.
1649760	1652180	I got a 38 on 60 for alertness.
1652180	1653180	All right.
1653180	1654180	Did we all pass?
1654180	1655180	Mm-hmm.
1655180	1656180	Nice.
1656180	1657180	Group success.
1657180	1658180	We're alert as fuck.
1658180	1659180	You guys get to see everything.
1659180	1663500	Oh, you guys get to see everything.
1663500	1667060	Is that still Ursula talking?
1667060	1668620	Only for Kevin.
1668620	1676520	So you see there is only one guard in sight and it is one of these unnatural looking fish
1676520	1678500	men wearing a brown jumpsuit.
1678520	1686200	You also hear three voices in the unseen darkness across the enormous chamber.
1686200	1692640	And because you guys rolled so well, you're going to recognize the voices that you hear.
1692640	1695520	Keith, one of them is Francis Beans.
1695520	1696520	My niece.
1696520	1697520	Your niece.
1697520	1701240	The other two are voices that you guys haven't heard in a while.
1701240	1704920	It is Kathy and George Piston.
1704920	1705920	Oh.
1705920	1706920	Wow.
1706940	1708940	It's been a while.
1708940	1709940	Days even.
1709940	1715700	Now, if you'll remember Kathy and George Piston, George is Leo's brother, Leo Piston, and they
1715700	1719420	run the Piston Pig Farm and the Piston Junkyard.
1719420	1720780	Keith spent some time out there.
1720780	1722700	I believe Kathy shot him in the foot.
1722700	1723700	She did.
1723700	1726100	I got to take a little trip on her school bus.
1726100	1729260	Yeah, which was full of about a hundred homeless people.
1729260	1730260	Yeah.
1730260	1734080	It was also that junkyard that kind of started us on this entire path where there was a body
1734080	1735080	that showed up there.
1735080	1736080	Absolutely.
1736140	1737140	Where'd your pencil go?
1737140	1740140	I just dropped it right down there.
1740140	1742100	Real fast, Keith, what was your brother's name?
1742100	1743420	Yeah, real fast, Keith.
1743420	1744800	What was your brother's name?
1744800	1745800	Was it not Francis?
1745800	1748300	No, Francis was my niece.
1748300	1753540	Fucking what was that?
1753540	1754540	Some knew him.
1754540	1755540	It has something to do with beans.
1755540	1756540	Oh, I know what it is.
1756540	1757540	I know what it is.
1757540	1758540	It's Fergie.
1758540	1759540	Fergie.
1759540	1760540	I was thinking it was Francis.
1760640	1764520	Go back and look at all the beans names.
1764520	1769020	There's a pattern there.
1769020	1770020	So yeah, Fergie makes sense.
1770020	1771020	Sorry.
1771020	1772020	Can we hear what they're saying?
1772020	1777120	You are a little bit too far away from them right now to actually hear what they're saying,
1777120	1780480	but you just recognize the tenor of their voices.
1780480	1781680	So we don't have eyes on them?
1781680	1785360	You can kind of see outlines that would help you realize who they were.
1785360	1787480	They are like 200 yards away from you.
1787480	1790060	There is some sort of light source in here.
1790060	1791360	It's not pitch black at all.
1791360	1792360	It is not.
1792360	1794420	No, there is some unseen light source.
1794420	1796480	Are they like in front of us or do they come from?
1796480	1797720	Yeah, they're in front of you.
1797720	1802000	As far as we can tell from here, are they just standing on a random catwalk or is there
1802000	1804680	something near them that they're maybe congregated near?
1804680	1813600	Well, it seems like based on those great roles that Francis Beans is standing on a catwalk.
1813600	1816280	Kathy and George Piston are both hanging.
1816280	1817280	Gotcha.
1817280	1818280	Oh wow.
1818280	1819280	Oh.
1819500	1822620	This is fucking cool.
1822620	1828620	I like whispered, do you guys want to, I mean, want to just approach them?
1828620	1831940	Is it just in front of us that we can walk or can we take other paths?
1831940	1833620	It's a big old grid, baby.
1833620	1836460	John, do you know where we are if you've been in here before?
1836460	1838140	No, unfortunately not.
1838140	1841820	Do you guys want to go straight at Francis?
1841820	1843660	We can just like push her over the rail.
1843660	1845340	I mean, yeah, we could.
1845340	1846340	One down.
1846340	1847780	Let her sleep with the fishmen.
1847800	1851800	We try to get around her, but I don't want to get lost in this place.
1851800	1854160	We might go talk to Francis, see if she can lead us.
1854160	1855160	That's true.
1855160	1859640	We could, if she starts to get violent, we can just three versus one.
1859640	1860880	She's a little girl.
1860880	1861880	Just throwing it out there.
1861880	1865640	We could also wait for her to leave and follow her.
1865640	1870280	Follow and also maybe rescue Kathy and George and have another, have an army with us.
1870280	1871480	I don't know.
1871480	1873080	But maybe also fuck these pistons.
1873080	1874080	Yeah.
1874080	1875080	That's also true.
1875080	1878420	I don't know what it would be to go talk to her, but we can also wait until she leaves
1878420	1880300	and try to follow her where she's going.
1880300	1882300	What do you guys think?
1882300	1883620	I'll do whatever you guys want.
1883620	1885660	I'm the prisoner right now.
1885660	1889060	But not in real life.
1889060	1890820	You can't have that mindset.
1890820	1896340	Oh man, we've already lost.
1896340	1900980	It's like when you were a kid and you were trying to get out of school, so you acted
1900980	1904100	sick, but acting sick made you feel bad.
1904120	1905800	And then you just wasted a day.
1905800	1910200	I just mean you guys captured me fair and square and I don't know.
1910200	1912440	I'm your prisoner, dammit.
1912440	1914920	I think we should just go, let's go talk to her.
1914920	1915920	Let's go talk to her.
1915920	1919760	Worst case scenario, we push her into one of these feed and fish tanks.
1919760	1921880	Just say, Hey, uh, Hey Frankie.
1921880	1924440	Uh, well let's, let's walk up and get closer to her.
1924440	1925440	I say that.
1925440	1927440	I say, Hey Frankie.
1927440	1933240	As you guys are walking down the catwalk, you would see you're getting into a section
1933260	1936100	where there are more people hanging.
1936100	1943180	Most of them are unconscious and they are all hanging from a fish hook that is going
1943180	1946780	through their crossed forearms.
1946780	1951600	So their arms are crossed and through the spot where they are crossing, there is a fish
1951600	1954500	hook going in both forearms.
1954500	1961340	I kind of awkwardly nod and wave as the people, as we pass, excuse me, sorry, passing through.
1962080	1968660	Just one of them sees Kevin and he's like, fuck you, you devil.
1968660	1973320	Every single mess you've ever made in your life is one more thing that's taken you closer
1973320	1975440	to hell fire and brimstone.
1975440	1978440	You absolute piece of devil witch garbage.
1978440	1984840	I get right up in his face and I say, yeah, I'm going to hell and I'll see you there.
1984840	1986360	And then I'd poke him in the eye.
1986360	1991280	Ow, ow, fuck, ow, shit, do you have any eye drops?
1992260	1995060	As you guys continue, you do see that one of the...
1995060	1996560	Can I scan other faces?
1996560	1998940	Is there anybody else here that I recognize or no?
1998940	2006540	Yeah, as you scan the rest of the faces, you do recognize the body of agent Trent Chad
2006540	2013300	also hanging from one of these fish hooks and his eyes rise up to meet yours and he
2013300	2016260	freaks the fuck out.
2016260	2017260	What?
2017280	2018280	What?
2018280	2025600	You guys were, you're dead, you're fucking dead.
2025600	2032800	He looks at Keith Vigna and Clark Bishop and he's like, what the absolute fuck happened?
2032800	2038080	The last time I saw you, you, you, you, and, and now you're...
2038080	2043520	And he kind of notices that Keith is walking a prisoner, Clark Bishop with Kevin.
2043520	2047120	He's like, you're working with these fucking assholes now?
2047140	2048300	What is wrong with you?
2048300	2062020	I stick my tongue out at him and go, wow, have fun DM.
2062020	2068180	I have absolutely no words for the wretch that you have become.
2068180	2070980	I say sayonara bitch and then we keep walking.
2070980	2072260	I want to shoot him a wink.
2072260	2073260	You can definitely wink at him.
2073260	2074260	I shoot him a wink.
2074260	2075920	Does he react at all?
2075920	2077660	He spits it, Keith.
2077660	2079060	I keep looking forward.
2079060	2080060	All right.
2080060	2082980	As you guys are going, you can hear Francis beans.
2082980	2083980	All right.
2083980	2090020	So like, seriously, I'm only going to ask you like one more time.
2090020	2093980	Who started the fucking outbreak in contention?
2093980	2095160	Who did it?
2095160	2097420	Kathy piston spits.
2097420	2102380	I told you, I don't know what that means.
2102380	2104100	I don't know what that means.
2104100	2105100	Where?
2105100	2108560	Okay, like where is the residue collecting then?
2108560	2110320	Like you've been in contention this whole time.
2110320	2114840	So like, just fucking tell me, is the residue collecting in any specific spot?
2114840	2121560	Kathy is shaking her head and she's like, I, I, and you see that Francis beans has a
2121560	2127720	lever and she is slowly lowering George piston toward this water.
2127720	2133920	George begins actually whimpering as he's lowered towards this water and Kathy looks
2133940	2135940	over at him and she's like, no, for real.
2135940	2138940	I don't know what residue you're talking about.
2138940	2141220	I don't know where it would be collecting.
2141220	2146700	I, I just, I don't think I have any of the answers that you're, and she gets cut off
2146700	2147700	by Francis again.
2147700	2148700	Who's like, yeah.
2148700	2149700	Okay.
2149700	2153260	Like seriously though, what is the circle of knowledge use the people for?
2153260	2155060	You of all people should fucking know that.
2155060	2163780	And Kathy just spits at her client confidentiality and then Francis says, all right, well, or
2164760	2165880	she's making fun of her.
2165880	2166880	Yeah.
2166880	2167880	She's mocking her.
2167880	2169720	She's mocking her whale.
2169720	2172920	Have you seen any of them silver spares?
2172920	2177820	Francis says, were they, uh, like, you know, at the circle or were they in contention?
2177820	2180480	Have you ever seen any of these things?
2180480	2184040	And Kathy's just lowers her head.
2184040	2190000	I'm not gonna George, George, I love you.
2190000	2191320	I love you.
2191320	2197300	And George is being dipped slowly into the water and as his feet touch, he starts moaning
2197300	2198300	out.
2198300	2204100	He's like, no Lord, please God, if you're out there, I would be willing if you did me
2204100	2207300	a service right now and just let me.
2207300	2211620	And Francis is laughing maniacally as she's slowly lowering it.
2211620	2214700	And if you guys are still walking, you're approaching right now.
2214700	2215700	Wow.
2215700	2218500	Yeah, you do.
2218500	2223240	I don't do anything yet, but there's still part of my brain that was a police officer
2223240	2226320	that makes me just want to fucking stop this immediately.
2226320	2230120	I'm trying to get her attention and Francis turns around and the lever stops.
2230120	2232600	So George is feeder in the water.
2232600	2236440	She turns around and she's like, Kevin, Oh, God damn it.
2236440	2237440	Nope.
2237440	2238440	What?
2238440	2239440	Just talk like you normally do.
2239440	2240440	Yeah.
2240440	2241440	You know what your normal voice.
2241440	2242440	Here's act with.
2242440	2249540	Keith fucking Figna, if it isn't you and your new best friend, Kevin, and I see we have
2249540	2253180	company finally, wait, what the fuck is he doing here?
2253180	2257460	You were in the room when Marvin told me to, uh, bring Stan Manstein back, right?
2257460	2258460	Yeah.
2258460	2259460	He killed Stan Manstein.
2259460	2260720	What the fuck?
2260720	2264120	So we're bringing him to Marvin to have a little conversation, try to figure out what
2264120	2267480	we can do if we can, you know, I just, I didn't want to come back empty handed.
2267480	2268480	So I brought you something.
2268480	2269480	All right.
2269480	2271700	Well, like you were sent down here, weren't you?
2271700	2272700	Yeah.
2272700	2273700	Okay.
2273700	2276080	Then like, I guess hang him up and we'll talk to him now.
2276080	2277080	Give me a second.
2277080	2281920	I'm trying to get something good out of these fucking contentioners.
2281920	2282920	God damn it.
2282920	2283920	Francis.
2283920	2287340	Marvin told me he needs to see you upstairs when that's a loose end.
2287340	2289920	I'm sorry.
2289920	2292120	Go about your business.
2292120	2296120	Wait, like what's the loose end?
2296120	2298300	Like when did he tell you that leaving?
2298300	2299300	I'm sorry.
2299300	2304180	I'm a little confused the past few days, but uh, the loose end I was talking about was
2304180	2306760	you leaving him here dangling, not tortured.
2306760	2309100	You should torture him a little more.
2309100	2320640	Roll persuade for me there, Thomas 37 on a 60 very nice.
2320640	2321660	I think you're right.
2321660	2326880	I think we should hang him up right now and fucking torture him until he starts talking.
2326880	2329920	So like, uh, just hold on.
2329920	2330920	Just hold on right there.
2330920	2334520	I'm seriously, I'm deadly in the middle of something right now.
2334520	2336360	And she begins lowering George.
2336360	2341840	I use my metal hand to whack her in the back of the head and try to knock her out.
2341840	2342840	Ooh, doggy.
2342840	2343840	All right.
2343840	2347800	Uh, you're going to roll unarmed combat against her unarmed combat.
2347800	2350600	Can I get a plus for my heavy metal hand?
2350600	2353800	I'll give you a plus to damage for the heavy metal hand.
2353800	2356000	So I'm rolling a unarmed.
2356000	2357000	Yep.
2357000	2360920	It's clearly armed though.
2360920	2361920	What did she roll?
2361920	2362920	She rolled a 10.
2362920	2363920	God damn it.
2363920	2366040	I rolled an 82 and a 40.
2366040	2369480	Keith, I'm going to have you roll dexterity.
2369480	2372320	It's going to be a pretty fucking important dexterity check.
2372320	2374320	What's your dexterity?
2374320	2376240	60.
2376240	2377480	And that's a 90.
2377480	2378480	Doesn't matter.
2378480	2379480	It's one 91.
2379960	2387160	Keith, as you go to whack your niece with your big old metal club hand, she uses your
2387160	2391440	momentum against you and throws you directly into the water.
2391440	2392440	God damn it.
2392440	2397520	Do I, can I do some sort of saving chance to cling onto the side?
2397520	2401120	That would have been the dexterity that you just rolled and failed.
2401120	2407080	So as you splash into the water, I need you to roll a sanity check.
2407080	2409120	Oh, just him?
2409120	2410120	Just him.
2410120	2411880	I've failed, but not over my power.
2411880	2412880	Okay.
2412880	2413880	26 on him.
2413880	2416600	Take one sanity damage.
2416600	2417600	Psychic water.
2417600	2422880	As you begin fucking panicking at the thought of what is underneath you right now.
2422880	2428880	Now with that sanity loss, what that reminds you of, do you remember what happened to your
2428880	2432080	little fish boyfriend, Peter Dieter?
2432080	2433080	Yes.
2433080	2437440	You realized that that was an extremely large tank of water.
2437440	2439040	Just like the one I'm in right now.
2439040	2444640	Yeah, which is crazy because that means that you are now swimming around with the thing
2444640	2446680	that you saw inside there.
2446680	2448640	Are these multiple tanks or one giant tank?
2448640	2452200	This is one giant tank, baby.
2452200	2456160	I want to start swimming over to the glass edge of this tank.
2456160	2458720	Oh, it is not even close.
2458720	2459960	You can't even see the edge.
2459960	2463320	I mean, how far above is the catwalk from where I am?
2463320	2464320	Five feet.
2464320	2465320	Help me.
2465600	2469360	Can I, in the confusion of his assail, heaven helps those who help themselves.
2469360	2471080	Yeah, so we are going to move on.
2471080	2472820	So Clark actually does get first action.
2472820	2475320	I would like to finish what Keith tried to do.
2475320	2477840	I want to try and knock her out.
2477840	2478840	Okay.
2478840	2479840	I'm rolling unarmed.
2479840	2480840	Hell yeah.
2480840	2484240	I rolled a six on a 70.
2484240	2485400	Describe what you would like to do.
2485400	2490440	Well, when Keith went for her and swung wide or whatever happened there, I just seized
2490440	2494780	that opportunity because she wouldn't have been looking at the prisoner and I just walk
2494780	2497460	up and wallop her.
2497460	2500540	It's just a straight punch to the side of her head.
2500540	2501540	Alrighty.
2501540	2505820	Go ahead and roll a D6 for damage here.
2505820	2506820	It's a two.
2506820	2507820	Alrighty.
2507820	2509060	You punch her in the head.
2509060	2510060	Jon, what are you doing?
2510060	2516260	I would like to use law to try and handcuff her.
2516260	2517260	Love it.
2517260	2518260	So you go to handcuff her.
2518260	2519620	Roll that law check for me.
2519620	2520620	Fuck.
2520620	2522620	94 on a 50.
2522620	2523620	So you go to hand.
2523620	2524620	Okay.
2525460	2526460	You guys curse dice.
2526460	2532980	So you guys are all standing there and Keith goes to swing at her.
2532980	2538260	She uses his momentum against him and throws him into the water below.
2538260	2543540	Clark goes swings, punches her, makes a connection as Jon goes around the back and tries to get
2543540	2545040	her hands in handcuffs.
2545040	2551660	She wriggles out of his grasp and she kind of backs away and she goes to take off running.
2551660	2554260	She's going to run toward where you guys came from.
2554900	2555900	And it is Keith's turn.
2555900	2556900	What are you doing?
2556900	2563940	I pull the big, huge gun off my back and I try to use the magazine clips to reach up
2563940	2568380	to the catwalk and, you know, kind of hike it in there and pull myself up out of the
2568380	2569380	water.
2569380	2570380	That's super cool.
2570380	2571380	That's very smart.
2571380	2577420	So I'm going to have you roll athletics in order to kick your legs hard enough to lift
2577420	2579220	your body out of the water enough.
2579220	2580220	Fucking shit.
2580220	2581220	Oh boy.
2581220	2582620	It's a crit fail.
2582620	2583620	55 on a 50.
2584620	2586100	Oh damn.
2586100	2587100	Right there.
2587100	2588780	I'm going to use different dice.
2588780	2598500	Keith, as you move your gun into position, the clip lodges itself into the catwalk and
2598500	2604520	you accidentally click, I'm guessing, a button on a gun that makes a clip pop out and then
2604520	2608940	the gun slips out of your hands and falls into the water out of your...
2608940	2610940	It's strapped on my back though.
2610940	2611940	You rolled a crit fail.
2612260	2615220	And you took it off your back too.
2615220	2619060	I like where your head's at, but you done fucked up and you lost your gun.
2619060	2624720	It's in the water and it is floating down into the darkness past where you can see.
2624720	2628580	You can barely see your feet in this murky, dark green water.
2628580	2631700	And above you, this clip is lodged into the catwalk.
2631700	2633300	Clark, it is your turn.
2633300	2635260	I'm going to rush her again.
2635260	2636260	Okay.
2636260	2637260	She is running away from you currently.
2637260	2638260	Oh, that's right.
2638260	2639260	I forgot she was running away.
2639260	2640260	Do you want to chase after her?
2640260	2641260	Yeah.
2641580	2642820	What kind of role would I need for that?
2642820	2644900	Do I have a run skill?
