start	end	text
2644900	2648780	You would be, well, just tell me what you're going to do and then we'll figure it out from
2648780	2649780	there.
2649780	2650780	Well, okay.
2650780	2651780	The problem is that...
2651780	2652780	What would Clark do?
2652780	2655700	You can look at your athletics to know how well you'd hold up in a race.
2655700	2660980	I've got an idea of what Jon would do that wouldn't take any time or action away from
2660980	2661980	his turn.
2661980	2662980	I just want to shout at her.
2662980	2663980	Know what I'm going to do?
2663980	2665380	I'm going to turn and help Keith out of the pool.
2665380	2666380	Yeah.
2666380	2667980	Take that free action and go ahead and holler.
2667980	2668980	Francis!
2668980	2669980	Francis!
2669980	2671260	The blood just got riled up.
2671260	2672260	You know, family.
2672260	2674620	And he's just, you know, he was just trying to wrestle around.
2674620	2675620	Get back here.
2675620	2677220	You've got torturing to do.
2677220	2679060	All right.
2679060	2680660	So let's get that roll.
2680660	2683220	How are you helping Keith out of the pool?
2683220	2687020	I'll lay belly on the catwalk and reach my hands down toward him.
2687020	2688020	All right.
2688020	2692420	Keith, I'm going to have you roll luck for a timing situation here.
2692420	2693420	Nope.
2693420	2694900	54 and a 35.
2694900	2695900	Amazing.
2695900	2698400	And Thomas, do you want to do anything else with your turn here?
2698400	2701120	Can I do a persuade roll on yelling at her?
2701120	2702120	Yeah, absolutely.
2702120	2703120	Yeah.
2703120	2704120	51 on a 60.
2704120	2705120	All righty.
2705120	2708440	And she rolled a 98 to try to fight your persuade.
2708440	2711560	And so she stops and she turns around.
2711560	2716440	She's like, crushed her in my mind vice.
2716440	2723520	She's like, God damn it, Kevin, you know how much I like really like torturing.
2723520	2724520	Yeah.
2724520	2725800	And you know Keith's an idiot.
2725800	2728320	Why don't you come, you know, look, he's in this water.
2728320	2731000	Come get him, help get him out and then you can torture.
2731000	2736400	As she's running back toward you, she's yelling at you and she's like, get your prisoner,
2736400	2737600	handcuff him.
2737600	2743160	And so you, your attempt to handcuff her was so piss poor that she didn't even realize
2743160	2745440	you were trying to handcuff her.
2745440	2749560	And so she's now telling you to get ahold of the prisoner that you had.
2749560	2750560	Right.
2750560	2752720	The person I just tried to handcuff.
2752720	2753720	Exactly.
2753720	2756560	What a persuade roll you had and two in a row.
2756560	2758240	I'll definitely count all that.
2758240	2763960	So Keith, I swim over to the chain that George is hanging from.
2763960	2764960	So smart.
2764960	2770160	And I try to crawl up him and up onto the chain in order to at least one, get out of
2770160	2772620	the water, two to try to get to the catwalk.
2772620	2780100	And with that absolutely dog shit luck roll that you had earlier, that was for the timing
2780100	2782320	of the whole situation.
2782320	2793720	And looking down as you hold on to the body of George piston, you feel this movement from
2793720	2801940	underneath you and you can hear water moving at a rapid pace and looking down, you actually
2801940	2805480	see the creature.
2805480	2811440	It is moving so quickly toward you that all of the grime in the water that is in between
2811440	2814860	you and it is starting to dissipate as it's coming toward you.
2814860	2820300	And you see a clear picture of one of these mutated fish men.
2820300	2826140	But like the one that you saw earlier, it looks exactly like the ones in the Brown jumpsuits,
2826140	2829780	but it is four times larger.
2829780	2836360	And both of its legs are kind of like welded together like this one giant fin.
2836360	2841720	It opens its maw and swims up right at you.
2841720	2842720	Clark it's your turn.
2842720	2843720	What are you doing?
2843720	2846660	You're hanging over the side, but Keith swim away from you.
2846660	2851240	Fuck, I guess I'm standing up.
2851240	2853740	I heard the exchange about the cuff thing.
2853740	2854980	And so I'm going to try and play it cool.
2854980	2858140	I'm just going to stand back up and that's it.
2858140	2859260	I mean, yeah.
2859260	2861940	I yell at Francis, he shot in the leg.
2861940	2862940	He can't get away.
2862940	2864300	Help me get Keith now.
2864300	2871540	She begins running up toward you and Kathy Piston is crying.
2871540	2875960	George Piston is hollering to his God.
2875960	2881900	Keith Vigna is crawling up the body of George Piston.
2881900	2887420	Clark Bishop is standing on the catwalk with his hands behind his back.
2887420	2891920	And Francis beans is running toward Kevin in her eyes.
2891920	2901260	John Lee Pettymore to try to grab Keith when all of a sudden this giant fish mouth comes
2901260	2910300	up from in between the catwalk grid and grabs wholly on to George Piston's body, closes
2910300	2914880	its mouth and dips back into the water.
2914880	2921480	The fish hook is just hanging right above the water covered in blood.
2921480	2926580	And there's a giant splash in the water hits all of your feet.
2926580	2934200	And the four of you stand there in the wake of the disappearance of Keith Vigna and George
2934200	2935200	Piston.
2935200	2936200	Oh no.
2936200	2953680	I bet I could have helped hear more.
2966200	2995880	How am I the only one trying to fool over How can you have enough trying to get me to
2995880	2996880	the end?
2996880	2996880	
