start	end	text
2445520	2448520	It got crazy there, but you know, this is going to be great.
2448520	2449520	Good job, Julius.
2449520	2453520	Oh, you're going to be on top so soon if you keep it up like this, my guy.
2453520	2454520	Are you working all week?
2454520	2456520	You're taking a vacation this week, right?
2456520	2457520	What?
2457520	2458520	I thought you told me.
2458520	2459520	You're taking the week off.
2459520	2460520	No, just a day.
2460520	2461520	Just a day.
2461520	2463520	Had a meeting down at the city, city tower.
2463520	2465520	Well, you sound like you could get some rest.
2465520	2467520	Whoa, is that a burn?
2467520	2468520	Is that a sick burn?
2468520	2469520	Did I get got?
2469520	2470520	I don't know.
2470520	2471520	I'll talk to you later.
2471520	2472520	I've got to find Vivica.
2472520	2473520	Bye.
2473520	2474520	Beep.
2474520	2476520	I couldn't help but hear like some of that over the receiver.
2476520	2479520	Guys, we can't show my uncle the footage.
2479520	2484520	He said as long as it makes the Godel company look good, then he'll be happy.
2484520	2485520	We can't show it to him.
2485520	2487520	We've got to find a way to run it without it going past him.
2487520	2490520	He said only good news for the Godel...
2490520	2491520	Fuck.
2491520	2492520	He said...
2492520	2493520	He threatened you?
2493520	2496520	He said only good news for the Godel company.
2496520	2497520	I mean, he didn't threaten me, but...
2497520	2498520	He threatened the truth.
2498520	2499520	He threatened the news.
2499520	2500520	Basically, yeah.
2500520	2503520	I mean, has my uncle always been like this?
2503520	2504520	Not in my experience.
2504520	2507520	Julius, I haven't felt like this since 1983.
2507520	2508520	What happened in 1983?
2508520	2513520	That was a personal matter.
2513520	2516520	But it is the closest to truth and justice I've ever truly come.
2516520	2522520	And you see a flashback to Cal spending a summer following his brother around
2522520	2529520	and catching him in this elaborate lie about a Christmas gift.
2529520	2532520	Beck, do you know where Vivica lives?
2532520	2534520	You've worked with her closely for so long.
2534520	2537520	Yeah, I know the neighborhood.
2537520	2540520	I dropped her off two or three times over the years.
2540520	2541520	I think I could find it.
2541520	2542520	Roll intelligence.
2542520	2545520	Oh my God, it's a 70 on a 70.
2545520	2546520	Yeah.
2546520	2547520	Ooh!
2547520	2548520	Our smiles.
2548520	2549520	Good boy.
2549520	2551520	Yeah, I know exactly.
2551520	2552520	I could take you right there.
2552520	2553520	Yeah.
2553520	2554520	Totally, dude.
2554520	2556520	I think we've got to go get this shit from Vivica.
2556520	2557520	We've got to get our fucking footage.
2557520	2559520	We've got to get the footage.
2559520	2560520	Vivica has our Pulitzer.
2560520	2566520	I didn't go through all of that shit just to get the footage stolen by some fucking
2566520	2567520	editor.
2567520	2570520	Vivica's good, though.
2570520	2571520	Vivica's good, though.
2571520	2575520	Maybe she just is doing touch-ups at home and forgot to-
2575520	2577520	You saw her face yesterday, Beck.
2577520	2579520	She's not just doing touch-ups.
2579520	2580520	That footage is in danger.
2580520	2581520	We've got to get to her, guys.
2581520	2585520	Vivica taught us an important lesson, which is that this footage is more powerful than
2585520	2586520	even we suspected.
2586520	2590520	We know we've got something here, but we need to be a little more careful with it,
2590520	2592520	and to that end, we have to secure it immediately.
2592520	2595520	Guys, we've got to get this footage from Vivica.
2595520	2601520	Vivica, if the news is like music, these pieces are The Beatles.
2601520	2602520	That's what I've always said, dude.
2602520	2603520	Yeah.
2603520	2606520	The Beatles were very popular when I was a schoolboy, and-
2606520	2607520	They're still popular.
2607520	2613520	I just want to say I resented them at the time, but I do understand their appeal.
2613520	2615520	Let's go, boys.
2615520	2618520	I met them once.
2618520	2620520	You can tell us about it on the way there, Cal.
2620520	2623520	I figure that's what he says as we're walking out the door.
2623520	2624520	Cal, you never told me.
2624520	2626520	You met the fucking Beatles, dude?
2626520	2628520	That's the coolest fucking shit I've ever heard.
2628520	2633520	As we're walking out, Cal points to several pictures, like three pictures with the Beatles
2633520	2639520	at different stages of their career when he's a kid, and then finally in their 70s crazy
2639520	2645520	phase, one is him as a teenager reporter, and then multiple pictures of him with John
2645520	2653520	Lennon up to a point, Paul McCartney, George Harrison, and he shows you some extensive
2653520	2658520	correspondence with Ringo.
2658520	2660520	You got this last one in under the wire.
2660520	2664520	He stopped taking mail, famously stopped taking mail recently.
2664520	2666520	Not for friends.
2666520	2668520	Nice.
2668520	2671520	We play chess by mail.
2671520	2675520	Across the pond, it takes forever.
2675520	2676520	Why are we wasting time?
2676520	2677520	Get in the van.
2677520	2680520	Get in the van.
2680520	2681520	No, wait.
2682520	2683520	Who else?
2683520	2687520	Beck, you've never shown any interest in my pictures before now.
2687520	2690520	I had never noticed that that was George Harrison there that you're sitting on the bench with.
2690520	2692520	Who else haunts these halls?
2692520	2693520	I'm kidding.
2693520	2695520	I figured this was happening in the van.
2695520	2697520	Definitely happening in the van.
2697520	2698520	Is it that one?
2698520	2700520	There it is right there.
2700520	2703520	The van is lined with pictures too.
2703520	2705520	Some of the choicer ones.
2705520	2708520	Vivica has a pretty cool place above a bodega on the corner.
2708520	2710520	A bodega?
2711520	2715520	I thought you said bodega, which would be really fun.
2715520	2718520	She lives above a place called Bodega.
2720520	2723520	They sell bidets and bagels.
2723520	2725520	Bodega.
2725520	2729520	The sign has the water shooting through a doughnut, a bagel hole.
2732520	2739520	It is also just a standard bodega with a cat, but it's also bodega.
2740520	2742520	It's bodega.
2742520	2744520	No, it's clearly not.
2747520	2750520	Julius really wants to stop in, but knows that there's no time.
2750520	2753520	Yeah, and her door is just off to the side.
2753520	2758520	Beck, you would know that when you open up the door, it just immediately stares on the other side,
2758520	2762520	so you'd have to buzz up, but the last time you were here, the buzzer didn't work.
2762520	2765520	Now I'm just picturing your old apartment.
2766520	2768520	They have to run down and meet us?
2768520	2769520	Well, we hit the buzzer.
2770520	2773520	It is July 6th. It's about 1pm.
2773520	2776520	It's a hot day. The sun is shining down.
2776520	2780520	It's a Wednesday. Less kids on the street than usual, and the ones that you do see, you're like,
2780520	2781520	It's Wednesday.
2781520	2782520	There's the urchins.
2782520	2787520	Cal remembers, and it's weird that he and Beck didn't remember before now,
2787520	2791520	but he remembers that they successfully downloaded the Ring app,
2791520	2793520	and that it'll have all the footage from last night.
2793520	2795520	Oh yeah.
2795520	2796520	Oh yeah.
2796520	2801520	Hold on, boys. Before we go in, let's take a moment to watch what came in and out of the front door last night.
2801520	2802520	Of here?
2802520	2806520	No, of my place. Remember how God and Stevie escaped?
2806520	2808520	Yeah, you guys haven't talked about that much.
2808520	2813520	Well, you know, we went to the bridge last night, and then we slept in, and it was at a chance since then.
2813520	2820520	Yeah, I mean, I figured when I saw Kurt's footage that, I mean, I knew that Stevie and God weren't gonna be at your apartment anymore.
2820520	2821520	So what, did you find anything?
2821520	2823520	God is everywhere, Julius.
2823520	2825520	Did you find anything?
2825520	2830520	We found evidence that Stevie may have let Fox out of his bindings.
2830520	2837520	And so we went and just, like, did a cursory check at the bridge, but we were both beat, so we didn't get much there.
2837520	2841520	But then I realized that maybe Cal has security cameras, and sure enough, he does.
2841520	2844520	So I downloaded the app last night, and I didn't get a chance to look at it.
2844520	2846520	Let's watch it.
2846520	2847520	That is a wild sound.
2847520	2850520	Yeah, there's a bunch of owls going crazy outside.
2850520	2851520	Is that what that is?
2851520	2853520	Yeah, take your headphone out.
2856520	2861520	They're like, shut up, Zach's listening now.
2861520	2863520	I thought somebody's, like, phone or something.
2863520	2865520	Yeah, I thought it was his phone.
2865520	2866520	That was nuts.
2866520	2867520	What were we doing? Oh, yeah.
2867520	2868520	The app.
2868520	2869520	The app, I downloaded the app.
2869520	2870520	Yeah, the Ring app.
2870520	2872520	Let's see what happened.
2872520	2874520	For just $4.99 a month, you can subscribe to Ring.
2874520	2876520	In grainy black and white.
2876520	2878520	Get the premium.
2878520	2881520	No, it's a Ring camera, it's not grainy black and white for sure.
2881520	2883520	Oh, but it's nighttime.
2883520	2886520	It's a Ring camera, which is a high quality camera.
2886520	2887520	Yeah, but it's nighttime.
2887520	2891520	It's the only camera I would buy to secure my house.
2891520	2893520	Where can you pick one up?
2893520	2896520	Amazon is where I got mine. You can get them directly from Ring.com.
2896520	2899520	We're not allowed to have separate deals, you rat.
2901520	2903520	So what do we see in, like, the...
2903520	2906520	So hit those show notes for a link to the Ring camera.
2906520	2907520	They're both in on it.
2907520	2908520	Available at Target.
2908520	2909520	Thank you.
2909520	2912520	We see high quality black and white.
2912520	2913520	Yeah, because it's nighttime.
2913520	2915520	Yeah, but it's high quality, it's not grainy.
2915520	2917520	Because it's Ring camera at Ring.com.
2925520	2929520	While Beck is pulling up the footage, I'm ordering a bedagel.
2930520	2932520	Wow, that app looks so user friendly.
2934520	2936520	With just a few simple tabs, I can see who's at the front door.
2936520	2937520	Let's tab away.
2937520	2940520	Yes, one plain bagel please and one everything bidet.
2942520	2952520	Suddenly, you see Stevie walk out the front door, followed by Greg Godle.
2952520	2957520	She holds the door open as Greg passes her and heads down to the front yard.
2957520	2961520	Stevie closes the door, notices the Ring camera.
2961520	2962520	Oh.
2962520	2963520	Everyone roll humit.
2963520	2966520	I thought she was here and I was like, I don't know why she's here, but I'm excited.
2966520	2968520	Oh my god, that's why you were waving?
2969520	2972520	I was going to offer her a bagel.
2972520	2974520	Oh my god.
2974520	2975520	What am I rolling?
2975520	2976520	Humid.
2976520	2978520	I passed 24 on 70.
2978520	2980520	I failed a 93 on a 40.
2980520	2982520	Yeah, Cal fails.
2982520	2984520	I also got a 93.
2984520	2985520	Ooh, spooky.
2985520	2989520	Cal's looking at all the features of his everything bidet on the box.
2989520	2991520	Cover your ears real quick, Thomas and Joe.
2991520	2993520	Luke, something in their face.
2993520	2996520	When Stevie turns back, you see Shane.
2997520	3002520	So like I can tell from the footage it doesn't look like she's doing it completely against her will.
3002520	3003520	That's right.
3003520	3004520	That's exactly right.
3004520	3008520	And you two see the face of Stevie turn back.
3008520	3012520	They look at the camera and they turn back away and head off into the street.
3012520	3017520	The Ring camera footage is so high quality you can see the shame on Stevie's face.
3019520	3020520	I'm sorry.
3020520	3021520	I wasn't getting that from this footage.
3021520	3022520	What did you see?
3022520	3023520	Look.
3023520	3024520	Rewind it.
3024520	3025520	Look.
3025520	3026520	She's not making her do it.
3026520	3028520	She's doing it on her own but she knows.
3028520	3029520	Look.
3029520	3030520	She sees it right there.
3030520	3031520	She sees the camera.
3031520	3032520	She just looks ashamed.
3032520	3034520	I think she looks gassy.
3034520	3036520	I mean, could be.
3036520	3037520	Shame gas.
3037520	3041520	But I mean, Godel's not forcing her to do this.
3041520	3043520	It is her brother after all.
3043520	3046520	I mean, she was pretty forward with the idea that she was trying to help him.
3046520	3047520	Maybe this isn't all bad.
3047520	3052520	Maybe he talked her into this but she has a plan.
3053520	3055520	She wouldn't let him jump off of something.
3055520	3057520	She doesn't want her brother to die.
3057520	3058520	Could she stop him?
3058520	3059520	Yeah.
3059520	3061520	Even if she was on the way to somewhere she thought might help.
3061520	3062520	She's Trixie.
3062520	3064520	She might have something up her sleeve.
3064520	3065520	No, she's Stevie.
3065520	3066520	Oh, shit.
3066520	3069520	Trixie was kind of the burnout in turn.
3069520	3071520	The one with the vape pen.
3071520	3073520	I assume the buzzer.
3073520	3076520	Guys, I don't think the buzzer's working here.
3076520	3077520	We gotta find Vivica.
3077520	3079520	We gotta find Stevie.
3079520	3080520	Her window's that one.
3080520	3081520	Hang on a sec.
3081520	3083520	And I'm trying to find a pebble to throw at the window.
3083520	3084520	Oh, yeah.
3084520	3085520	There's plenty of pebbles.
3085520	3086520	Tink.
3086520	3087520	Vivica!
3087520	3089520	Vivica, it's back!
3089520	3090520	Vivica!
3090520	3094520	Is the door that leads up to the stairs a wooden door or a glass door?
3094520	3095520	What was it, Joe?
3095520	3096520	It was a glass door.
3096520	3097520	No, it wasn't.
3097520	3101520	If you're talking about my old apartment, it had a glass pane that you could see through.
3101520	3102520	On the outside it did.
3102520	3103520	Yeah, like the downstairs one.
3103520	3104520	What?
3104520	3105520	How tall?
3105520	3106520	You could see into the stairwell.
3106520	3110520	It had lettering on the window up to my apartment you could see through.
3110520	3111520	Interesting.
3111520	3114520	It said, Joe Terry, private eye.
3114520	3115520	Very much like that.
3115520	3117520	Dangerous dames turn around.
3117520	3118520	He had legs.
3118520	3119520	Two of them.
3119520	3120520	Guys, watch out.
3120520	3123520	They were walking all over me.
3123520	3127520	He could see through me like the glass door at the bottom of my apartment stairs.
3127520	3129520	Joe's apartment.
3129520	3134520	So yeah, you can kind of see, you can see the top of the stairs kind of through the glass,
3134520	3137520	but then there's the rest of the door is composite.
3137520	3139520	Guys, we gotta get in there.
3139520	3146520	And he hikes up his fancy work shorts and is going to try to kick this door in down.
3146520	3150520	I'm normally not a fan of property damage, but we don't know that our coworker is safe
3150520	3151520	right now.
3151520	3152520	Got those big powerful legs.
3152520	3153520	We should use them.
3153520	3158520	At the exact moment that you rear back on one of your enormous thighs, one of the...
3158520	3161520	Rear back on like he rocks the floor.
3161520	3162520	Yeah.
3162520	3167520	Eat some fucking spinach and one of them gets like Popeye-age.
3167520	3173520	One of the botanical employees walks out and goes to light a cigarette and as they're
3173520	3179520	about to light up, they look over at you as your leg is like up in the air about to kick
3179520	3181520	and their mouth just kind of drops.
3181520	3184520	But the cigarette sticks to their lip because it was dry.
3184520	3195520	Julia says, watch this and kicks.
3195520	3196520	Wow.
3196520	3202520	A plus 20 on strength or criminology, whichever one's higher.
3202520	3203520	Strength or criminology?
3203520	3204520	Yeah.
3204520	3205520	Let's see.
3205520	3206520	I don't think I have any criminology.
3206520	3207520	Nope.
3207520	3208520	Okay.
3208520	3209520	Let's see.
3209520	3210520	Up and down.
3210520	3211520	50-50.
3211520	3212520	With a plus 20 because...
3212520	3213520	Okay.
3213520	3214520	12 on a 70 then.
3214520	3215520	Oh.
3215520	3216520	Oh.
3216520	3217520	Oh.
3217520	3218520	Rocking.
3218520	3221520	Little did Julius know the door was just a little bit ajar.
3221520	3225520	So when he kicks it, it kicks hard and like smashes into the wall.
3225520	3230520	It looks like he kicked it open, like forced it open, but it was just gonna happen anyway.
3230520	3231520	Whoa.
3231520	3232520	Dude.
3232520	3234520	What the fuck?
3234520	3237520	Cal Colorado City Action News, step aside.
3237520	3239520	No persuing.
3239520	3241520	That's hilarious.
3241520	3245520	Did he roll the crit fail?
3245520	3246520	29.
3246520	3248520	I pass.
3248520	3254520	The cigarette trembling, still stuck on his lip as he just like quivers and backs up.
3254520	3259520	And he's just like going to light his cigarette in front of him, but the cigarette's not there
3259520	3261520	as he just kind of backs away.
3261520	3265520	Cal pushes everybody through and after they're up the stairs, I turn around and I'm like,
3265520	3268520	don't hassle my people again.
3268520	3272520	He goes, yes, sir.
3272520	3273520	Good boy.
3273520	3274520	Which apartment is hers?
3274520	3275520	I don't know.
3275520	3277520	Kick down all the doors.
3278520	3279520	We do know, right?
3279520	3281520	Yes, Beck Wilder does know.
3281520	3284520	I mean, in the fiction, I said I dropped her off.
3284520	3286520	But you said that's her window.
3286520	3287520	You did point at her window, you creep.
3287520	3288520	Okay, yeah.
3288520	3292520	It would be this one back here.
3292520	3293520	That's my favorite rock.
3293520	3294520	In the fiction, I said I dropped her off.
3294520	3300520	I didn't tell you that I'd gone around the back and know exactly where she lives.
3300520	3306520	I actually rented a place across the street with a good view.
3306520	3311520	Let me see, if I'm parked over there, then that would make it...
3311520	3312520	Is it this one?
3312520	3315520	And there's a doormat that just says Vivica on it.
3315520	3318520	Welcome to Vivica's place, the editor.
3324520	3327520	Julius wants to knock very aggressively on the door.
3330520	3332520	Vivica, give us our shit back!
3333520	3334520	Vivica?
3334520	3337520	Cowcall her out of here with Beck and Julius.
3337520	3338520	Hey, I'm here. I'm here.
3338520	3339520	We just want to talk.
3340520	3341520	Zach leaned away from the mic.
3341520	3342520	He's not gonna...
3342520	3345520	Yeah, like a toddler refusing to be fed.
3347520	3348520	Julius is gonna...
3348520	3349520	Go away!
3352520	3353520	Okay.
3353520	3354520	Wink.
3354520	3357520	You should open the door, though, for the next people to come in.
3359520	3360520	Great idea.
3360520	3361520	We'll get plumber's jumpsuits.
3362520	3364520	And fake mustaches.
3366520	3367520	Vivica, it's back.
3367520	3372520	Look, I know that you think you're maybe doing something good, and maybe you are.
3372520	3376520	Hey, are you just in there editing the footage with another pass like we talked about, maybe?
3376520	3380520	We just realized that the footage wasn't on us, and we figured maybe you had it,
3380520	3383520	and we want to make sure that we get backups.
3383520	3387520	Vivica, I haven't felt this way about a story in nearly 30 years,
3387520	3393520	and I think that caused me to be fairly short-sighted about showing you what was really on there.
3393520	3396520	So I want to say, I'm sorry. We're sorry.
3396520	3398520	We're really sorry, Vivica.
3398520	3401520	Would you let us in to talk about it?
3401520	3402520	The door opens.
3402520	3406520	Vivica stands in front of you, eyes red.
3406520	3411520	She has been through hell since the last time you saw her,
3411520	3416520	and she is trying so hard not to burst into tears again.
3416520	3419520	I was going to delete the...
3419520	3422520	I was going to delete...
3422520	3427520	I took the thumb drive, I'm sure that you yelled, I understand.
3427520	3430520	It was pretty funny, the sign.
3430520	3431520	I was going to... which sign?
3431520	3433520	Kick me?
3433520	3435520	She laughs a little bit.
3435520	3437520	There's the Vivica we all know.
3437520	3438520	Okay, yeah, thank you.
3438520	3442520	So I had a plan. I was going to take the footage, I was going to bring it back here,
3442520	3445520	I was going to figure out what to do with it, I was going to talk to people,
3445520	3447520	I was going to figure it out, I was going to talk to people,
3447520	3450520	I was going to let you in on it too, but we were high energy
3450520	3452520	and you guys seemed so gung-ho about getting it out
3452520	3454520	and I didn't want to get it out because I'm scared to get it out
3454520	3458520	because it's scary and terrifying and I needed to tell somebody else
3458520	3460520	and I needed to get somebody else's opinion.
3460520	3466520	So I decided to go wait and hide in the parking lot until after you all left
3466520	3470520	and then I went back into the building and I was going to go delete all the footage.
3470520	3472520	I wasn't going to delete it, but I was going to bring it back here
3472520	3475520	and I was always going to have the edit, but wait, let me fucking finish.
3475520	3481520	Cops came and they took it. The cops fucking took it all.
3481520	3486520	Why? They weren't even in uniform, they just came in and they took it
3486520	3489520	and where were you? You weren't there. No one was there.
3489520	3491520	And I couldn't do anything.
3491520	3493520	Did they take the thumb drive?
3493520	3494520	Yeah.
3494520	3495520	Can I hear a bit of that?
3499520	3500520	Yawn.
3500520	3501520	Yawning.
3502520	3503520	Yeah, yeah.
3503520	3505520	Yeah, yeah, yeah, yeah.
3505520	3507520	Can I hear a bit of that?
3510520	3513520	Zach doesn't seem like he's taking this very seriously.
3513520	3515520	Better throw out a yawn.
3519520	3520520	Great, great show.
3520520	3522520	Yeah, good stuff, Zach.
3525520	3526520	This is great, this is great.
3526520	3528520	This is not like it when I yell at him.
3529520	3532520	It's late, I'm sleepy.
3532520	3535520	I thought it was fun when you yelled at me.
3537520	3541520	I just thought you sounded insincere when you said that last thing,
3541520	3543520	so I want to be human.
3543520	3545520	I don't remember what it was, but what did you roll?
3545520	3547520	It was about them taking the thumb drive.
3547520	3548520	Oh, the thumb drive.
3548520	3549520	Oh, okay, yeah, yeah.
3549520	3550520	Ooh, 24, a pass.
3550520	3551520	Yeah, no, she seems sincere.
3551520	3554520	You said they weren't in uniform, how do you know they were cops?
3555520	3560520	Came out of a cop car, went back into a cop car, showed me a badge, had guns.
3560520	3561520	Not nice.
3561520	3562520	Did you see a name?
3562520	3564520	It oinks like a pig.
3567520	3570520	Were the badges City Police Department?
3570520	3571520	Yeah.
3571520	3574520	I'm looking at the other guys, why would the police even know about it,
3574520	3576520	let alone want to come and get it?
3576520	3577520	Why would they want the footage like that?
3577520	3579520	Do you have a ring camera?
3579520	3580520	They got it from the...
3580520	3581520	At the office?
3581520	3582520	At the office, not here.
3582520	3584520	Does the office have a ring camera?
3584520	3585520	I'd assume the office has...
3585520	3586520	A lot of cameras.
3586520	3589520	We can see if these guys are real cops, what kind of car they pulled up in.
3589520	3592520	So Vivica, you're saying though that at the end of the day,
3592520	3594520	you don't have any of the footage at all?
3594520	3597520	You weren't able to maybe sneak some?
3597520	3599520	Maybe pulled out a hard drive or...
3599520	3600520	Just a sneaky little...
3600520	3601520	Her eyes go like blank.
3601520	3602520	I'm talking like my good friend, Ringo.
3602520	3605520	I tried to sneak some, but no, I didn't get any of them.
3605520	3608520	Sounds like it could be God all demons we're working with.
3608520	3609520	God all demons?
3609520	3610520	God turtle?
3610520	3615520	Yeah, like people, you know, God all sending people out to grab the stuff.
3615520	3617520	Maybe not actual demons, but who knows?
3617520	3620520	Let's go look at that footage and we've got to find...
3620520	3621520	We've got to find it.
3621520	3622520	We can't let them have it.
3622520	3627520	Cal has had like kind of an unworried little smirk on his face this whole time.
3627520	3631520	Guys, I'm sorry here, but it's in the hands of the police.
3631520	3633520	It's perfectly safe.
3633520	3639520	It's perfectly safe.
3639520	3642520	Cops like me.
3642520	3647520	Yucky ducky.
3647520	3651520	Cal answers the phone and you hear explosions and like screams in the background.
3651520	3654520	And he's like, Oh God, Julius, think, think, fuck, you're out of the hospital.
3654520	3657520	We got a big situation going on here with Stevie and God.
3657520	3658520	Got to go.
3658520	3660520	Peep.
3660520	3661520	What do you do?
