start	end	text
3661520	3662520	Cal's call.
3662520	3664520	You get like, you see a call coming back like Cal, Colorado.
3664520	3666520	I answer it.
3666520	3667520	I'm sorry.
3667520	3668520	I forgot to tell you.
3668520	3669520	I'm dropping a pin.
3669520	3670520	I know how to do that now.
3670520	3671520	Click.
3671520	3674520	I wait for the pin and how far away is it?
3674520	3676520	How far away is the pin?
3676520	3679520	Like how far from the hospital is his apartment?
3679520	3685520	He gave me until noon to imagine what Cal, Colorado had gotten up to with his day.
3685520	3686520	Oh.
3686520	3687520	And I imagined we got another pic of it.
3687520	3688520	I thought it was real.
3688520	3689520	Yeah, it was all nonsense.
3689520	3690520	He's been asleep.
3690520	3691520	You wake him up.
3691520	3692520	Yeah, I think that's fair.
3702520	3710520	So you would have the footage on the drives that the camera records the footage onto the drives.
3710520	3714520	And then you take the drives to work, load them onto the computer.
3714520	3716520	You tell me how to do my job?
3721520	3725520	Cause my life is great.
3725520	3726520	Oh, that reminds me.
3726520	3727520	I already backed it up to the cloud.
3727520	3728520	We're good.
3728520	3729520	Oh, sweet.
3729520	3730520	I'm going to make pancakes.
3730520	3731520	Cool.
3731520	3734520	As you pull out your phone and look at the cloud and it's like...
3734520	3735520	It's raining.
3735520	3736520	Oh, it's not there.
3736520	3737520	Well, that's so weird.
3737520	3738520	No, no, no, Zach.
3738520	3739520	I'm sorry.
3739520	3742520	The end of music episode already started playing.
3742520	3744520	We are not there yet.
3744520	3747520	End of music episode.
3747520	3748520	The day the music died.
3748520	3750520	The end of music episode.
3750520	3753520	Yeah, that is some fucking dark ass shit.
3753520	3759520	And then Cthulhu comes out and he steals music.
3759520	3761520	Do you want to sing a sad song about it?
3761520	3763520	You can't, nerd.
3763520	3765520	Cut to a child's birthday party.
3765520	3767520	Happy birthday to you.
3767520	3768520	Happy birthday to you.
3768520	3770520	You're putting too much stank on it.
3770520	3774520	It's still like a third of a song.
3774520	3779520	Putting too much stank on it is my Spotify party playlist.
3779520	3786520	In the morning, Thomas was putting too much stank on it.
3786520	3790520	It's How Far is Heaven a hundred times.
3805520	3808520	Julius runs back down and sticks his head out and says,
3808520	3812520	put that on your bagel and smear it and then runs back up.
3812520	3816520	And he's like, Julius is like, fucking nailed it, yes.
3816520	3819520	And it's all my fault.
