start	end	text
1270240	1272680	Hey, I was trying to explore that subtly
1272680	1274120	through character work.
1276000	1278920	I was trying to exaggerate it, but I guess, I don't know.
1278920	1279760	I liked it.
1279760	1282100	If it was me, I'm ready to go to the foundry.
1283760	1287040	I know, but other people aren't.
1288240	1289200	Something I've learned
1289200	1291000	and I'm trying to express through my character,
1291000	1295080	Cal, Colorado, who hasn't learned it.
1298500	1300600	What are you guys doing after this, by the way?
1302360	1304140	But yeah, I said I'm going back.
1304140	1305400	Yeah, we get back there.
1305400	1307480	All right, I'm just gonna crash in the van
1307480	1309000	and I'll see you in the morning, man.
1309000	1310600	No, no, no, no, no, no, no, no, no, Beck, Beck, Beck.
1310600	1311440	I insist.
1311440	1313420	I've got seven bedrooms in this home.
1313420	1314440	You will take one.
1314440	1316120	Yeah, okay.
1316120	1318000	I mean, if you're talking about sleeping, yeah.
1318000	1320400	I am, and Stevie's gonna come back.
1320400	1322320	I mean, well, you know, we're gonna probably,
1322320	1324680	I've got some pretty nice whiskey.
1324680	1327080	Hey, do you, speaking of her coming back,
1327080	1328880	do you have security cameras?
1328880	1331360	Like A, could we see when they left?
1331360	1334060	And B, like get a notification if they come back?
1334060	1336640	I get all these notifications from the Ring app
1336640	1338440	and I don't know what to do with them.
1338440	1340960	I, maybe you can find something relevant in here.
1340960	1343920	Let me see that, let me see that.
1343920	1345940	I'm looking at the hours after we left
1345940	1347680	and seeing if we get any footage of them leaving.
1348240	1350760	Did you see Stevie and God come and go like seven times
1350760	1352840	like they go to the fucking bodega.
1352840	1353840	They are holding pizza.
1353840	1354680	Yeah.
1356800	1359320	Arms full of snackies.
1359320	1361160	They walk away the first time, they come back,
1361160	1366160	they walk away with $1,500 in their arms in cash.
1366400	1367680	They come back with pizza.
1369200	1371600	A little too many, like feed too many red peppers
1371600	1373220	and God goes crazy.
1374180	1377780	The app wasn't downloaded on Cal's phone.
1377780	1380420	Like it had been long enough that he'd clicked on it,
1380420	1381900	that it wasn't downloaded.
1381900	1383500	So you click download on it
1383500	1386900	and as it's finishing up the, oh man, you're asleep.
1389300	1392460	I see Beck just like passed out on the couch with my phone
1392460	1394340	and I like pluck it out of his hands,
1394340	1395780	like plug it in a charger,
1395780	1397980	walk off with the two glasses of whiskey
1397980	1399840	I've just poured for me and Beck.
1399840	1403800	I throw one down my gullet and walk upstairs to my bedroom,
1403800	1406680	pass dozens of pictures of Cal's career
1406680	1409100	from the seventies on to today.
1409100	1412120	And he downs the second glass, brushes his teeth,
1412120	1414000	gets in like some silk pajamas
1414000	1417480	and slips into a pretty fucking nice bed set.
1417480	1418880	This sounds lovely.
1418880	1421720	I'm warm and soft.
1421720	1423320	Just in case either one of you are wondering.
1423320	1426380	Yeah, we know, you're a soft little bitch.
1430840	1431840	Now I'm hard.
1435680	1437520	What was that?
1437520	1438520	You're broken.
1438520	1439520	You said broken.
1439520	1440520	You're broken.
1447520	1450520	I broke and I couldn't breathe.
1450520	1452520	Can that man not breathe every time he laughs?
1452520	1454520	He's like a human bug.
1455520	1456520	Oh my God.
1461520	1462520	You had wake apnea.
1475520	1476520	Oh man.
1476520	1478520	Okay, cool.
1478520	1480520	We dropped so many balls today, man.
1481520	1484520	I was like, I can't see a way in character
1484520	1487520	to get Vivica from just stop her from walking away from here.
1487520	1490520	We didn't really try that hard to go find Stevie and God.
1490520	1493520	I mean, like I said, mechanically and what,
1493520	1495520	because of mechanically what Beck would be feeling,
1495520	1496520	he just wouldn't be able to.
1496520	1497520	He just couldn't.
1497520	1500520	I feel like we could have deployed some energy drink.
1500520	1502520	Yeah, I mean, I had it coursing through my veins.
1502520	1505520	I figured that had already been taken into account.
1505520	1507520	Energy drink coursing through my veins.
1507520	1509520	Energy drink coursing through my veins.
1509520	1512520	Yeah, I think just with the day that you guys have all had
1512520	1514520	hitting that 5 a.m. spot,
1514520	1516520	I was just going to be like, nah.
1516520	1518520	What are we at on recording time?
1518520	1519520	Nothing.
1519520	1521520	I have not clicked record yet.
1521520	1522520	Cool.
1522520	1524520	I think we can really nail it in the second take
1524520	1526520	and lose all that mindless bullshit.
1529520	1532520	Now we're going to double down on the soft bitch stuff.
1532520	1533520	Go back, go back.
1533520	1536520	Find anything that really cut anybody deep.
1537520	1538520	Double down.
1538520	1539520	Double down.
1539520	1540520	Double down.
1540520	1541520	Should we bring Luke in?
1541520	1542520	Yeah, let's get Luke back.
1542520	1543520	So he doesn't...
1543520	1544520	Luke!
1544520	1545520	We got Luke a boy.
1545520	1546520	I'm back.
1546520	1547520	They sent me outside.
1547520	1548520	How was it?
1548520	1549520	I watched TikTok videos.
1549520	1550520	Yeah?
1550520	1551520	It was nice.
1551520	1552520	Did you have a good time?
1552520	1553520	Yeah, but I'm glad to be back.
1553520	1554520	Yeah, back in the hospital.
1554520	1555520	Beep.
1555520	1556520	Beep.
1556520	1557520	Beep.
1557520	1559520	Oh, thank God he's alive and the camera zooms in
1559520	1562520	and sees that Julius Summers is out cold.
1562520	1564520	I'm just kidding.
1564520	1565520	Do whatever you want.
1565520	1567520	It's zoomed in on the monitor, the heart monitor,
1567520	1571520	and it's going beep, beep, beep.
1571520	1573520	Boop.
1573520	1575520	And then it pans over to Julius,
1575520	1579520	who has come to from his not very restful night of sleep,
1579520	1580520	and he's got to pee.
1580520	1581520	So he's disconnecting that shit.
1581520	1583520	Okay, it's disconnected.
1583520	1585520	That's not what happens when you have to pee.
1585520	1586520	My heart stops and I have to pee.
1586520	1589520	Right, it's just disconnected because he's got to go pee.
1589520	1591520	Go ahead and roll a con times five for me
1591520	1595520	and that'll see whether you get your natural healing
1595520	1600520	of one hit point back for the eve.
1600520	1601520	37 on a 50.
1601520	1602520	Nice.
1602520	1604520	So take one more hit point of health.
1604520	1605520	And what does that bring you up to?
1605520	1606520	Seven?
1606520	1607520	Six.
1607520	1608520	Six?
1608520	1609520	Lovely.
1609520	1611520	Nurse comes in, puts your TV on,
1611520	1615520	and you see the same thing that Kurt showed you,
1615520	1616520	but it's all over the news.
1616520	1619520	And there's footage from all sorts of different angles,
1619520	1622520	but you do think that Kurt's footage might be the best
1622520	1624520	of anything that you're seeing flash before your eyes
1624520	1626520	on cable news here?
1626520	1627520	Did it break on can?
1627520	1628520	Hard to remember.
1628520	1630520	Don't really care.
1630520	1631520	How does it make you feel?
1631520	1632520	Scared.
1632520	1633520	But you're okay.
1633520	1634520	You can handle it?
1634520	1635520	This?
1635520	1636520	This.
1636520	1638520	It's some sort of weather tornado they're saying.
1638520	1640520	Tornado lightning.
1640520	1641520	That's what they're saying?
1641520	1642520	Yeah.
1642520	1643520	Keep believing that.
1643520	1644520	I've got to pee.
1644520	1645520	That's what I'm here to help with.
1645520	1647520	I can handle it.
1647520	1650520	I can handle it too.
1650520	1653520	Julius doesn't like this nurse and then looks to see,
1653520	1654520	does she have a badge on?
1654520	1656520	No, she doesn't work here.
1656520	1659520	It's just some wild person roaming the halls.
1659520	1663520	I hit the call a nurse button and then go pee real quick.
1663520	1665520	And I get back in bed and wait for the nurse.
1665520	1667520	When the nurse comes in, he's like, what's up?
1667520	1671520	There's some lady roaming the halls trying to scare people.
1671520	1672520	Did you see this?
1672520	1674520	And he points up at the TV.
1674520	1676520	Oh, yeah, what's going to happen next?
1676520	1677520	Global warming, right?
1677520	1678520	Right.
1678520	1680520	So you think it's weather?
1680520	1682520	Yeah, lightning tornado, is that what they're calling it?
1682520	1683520	Yeah.
1683520	1687520	So watch the evening news tonight, just so you know.
1687520	1689520	Anyway, how am I doing here?
1689520	1692520	Yeah, I mean, everything looks fine.
1692520	1696520	You're going to be in pain for four to six weeks at least.
1696520	1698520	You're going to want to stay on the medicine for,
1698520	1701520	hopefully not too long, but you got to take it when you need it.
1701520	1702520	Don't be a hero.
1702520	1705520	You'll have some serious pain in the face for a while.
1705520	1707520	Yeah, I know what you mean.
1707520	1710520	But yeah, besides that, you should be fine.
1710520	1712520	No severe broken tissue.
1712520	1714520	You're going to look the same after a while.
1714520	1717520	Thank you very much, and would like to be discharged, please.
1717520	1718520	Do you need a wheelchair?
1718520	1724520	Julius wants to send the nurse out while he gets dressed in his clothes and stuff.
1724520	1725520	Sure.
1725520	1728520	But he also wants to search around for any sharp objects in the room.
1728520	1731520	Oh, they don't like to keep those around in hospital rooms typically.
1731520	1734520	Yeah, but how good are the doctors here?
1734520	1736520	Not that great apparently.
1736520	1737520	So what are you looking for?
1737520	1740520	Something to maybe try to cut part of my face off.
1740520	1742520	Oh my God, dude. Fuck.
1742520	1746520	Because the pee didn't take that long, but Julius staring into the mirror in the bathroom,
1746520	1748520	that was like a solid 10 minutes.
1748520	1753520	Roll luck 50-50.
1753520	1756520	You roll under 50, you find something sharp.
1757520	1759520	Although I guess it should be the other way around.
1759520	1760520	I rolled under 50.
1760520	1761520	Okay.
1761520	1767520	Yeah, you see there is a pair of shears, a pair of scissors that is in one of the cabinet drawers.
1767520	1772520	And it's the kind with the plastic grip. It's not super sharp scissors.
1772520	1776520	Julius figures this is probably the best place to do this.
1776520	1781520	And he's going to go in the bathroom and try to poke the scissors right at his jaw.
1781520	1782520	Yeah.
1782520	1784520	And poke them through and try to cut.
1784520	1787520	He's not going to go full face, but he's going to see at least,
1787520	1791520	he's pretty sure underneath is like what he's actually supposed to be.
1791520	1794520	So he's just going to remove that first fake layer.
1794520	1795520	How much?
1795520	1797520	Like the right cheek.
1797520	1798520	The whole right cheek?
1798520	1799520	Yeah.
1799520	1800520	Oh my God.
1800520	1802520	Okay, roll grip to go through with this.
1802520	1806520	I guess he doesn't have to poke through. He can just start at the corner of his mouth.
1806520	1811520	I'm going to make you roll grip to see if you can follow through with this. This is disgusting.
1811520	1813520	21 out of 25.
1813520	1816520	Oh, yeah. No, you're not going to be able to do this.
1816520	1818520	Oh, because I passed.
1818520	1819520	Yeah, you passed.
1819520	1825520	As one half of the scissors is in my mouth and the other half is on the outside of my cheek,
1825520	1827520	I'm about to cut through.
1827520	1829520	Nurse walks in and says, oh.
1829520	1835520	Julius kind of like snaps and like shakes his head and just lets the nurse take the scissors.
1835520	1838520	And thank you. I guess I'll go.
1838520	1842520	And Julius wants to just kind of like go past the nurse and try to leave the hospital.
1842520	1849520	He fucking crit failed his grip check seeing you do that and just stands there, frozen,
1849520	1853520	staring at the most awful, confusing thing he's seen.
1853520	1855520	I mean, he just, you shininged him.
1855520	1862520	He like walked past the door and saw you in there with the scissors inside of your like skin and mouth.
1862520	1867520	Like you were putting butter underneath the chicken skin on fucking Thanksgiving.
1867520	1869520	Is he like completely blocking the doorway?
1869520	1871520	No, no, no, no. You just walk right past him.
1871520	1873520	Yeah, I just kind of squeeze around him.
1873520	1876520	I pat him on the back and say, thanks.
1876520	1877520	And I look at his badge.
1877520	1878520	Darren.
1878520	1880520	Thanks, Darren. Thank you. Bye.
1880520	1885520	And I'm going to start heading towards the exit of the hospital and give Cal a call.
1885520	1887520	Yeah, absolutely.
1887520	1888520	And we'll bring those two back.
1888520	1890520	Bird, bird time.
1890520	1892520	As I'm leaving the hospital, I call Cal.
1892520	1897520	Yeah, let's get a little early morning pickup here from the Colorado home.
1897520	1898520	Yeah, you were in for a while.
1898520	1900520	You had a full rest.
1900520	1903520	I was watching the noon o'clock news, right?
1903520	1904520	Yeah.
1904520	1906520	So we're talking noon thirty.
1906520	1907520	Oh, God.
1911520	1915520	Oh, hello. Hello. Cal, Colorado. Good afternoon.
1915520	1918520	Hey, Cal, it's Julius. I just got out of the hospital.
1918520	1920520	Julius Summers. How are you?
1920520	1924520	Well, they discharged me from the hospital and a clean bill of health.
1924520	1928520	I guess I wouldn't really go back to that hospital if I had the choice.
1928520	1929520	Oh, which hospital?
1929520	1932520	It was St. Luke's Children's Hospital.
1932520	1935520	Well, now I've had several fine procedures at St. Luke's.
1935520	1938520	The procedures they gave me were all too small.
1940520	1945520	I'm sorry, I just woke up. I don't understand at all what you mean.
1945520	1947520	Well, where should I go?
1947520	1948520	Luke, what are your max hit points?
1948520	1950520	Max is ten.
1950520	1953520	Perfect. On a scale of one to ten, how would you say you feel?
1953520	1956520	Oh, like twenty percent better.
1956520	1958520	I'm sixty right now.
1958520	1962520	Okay. Well, you know, we all had a rough night. I feel like I'm about a sixty-two.
1962520	1965520	Curious. Cal and Beck, are the two of you down any hit points?
1965520	1966520	Oh, yeah.
1966520	1973520	Okay, so you can actually roll a constitution check to regain a hit point of natural healing with overnight sleep.
1973520	1976520	I don't have Cal as having lost any hit points.
1976520	1977520	That makes sense to me.
1977520	1978520	I did not pass my con check.
1978520	1979520	Bummer.
1979520	1980520	Bummer.
1980520	1984520	He slept on the shitty basement couch where God was supposed to be.
1984520	1986520	That's unsettling.
1986520	1991520	God fucked it up in the escape, so it's all... your back is just, like, shitty this morning.
1991520	1995520	Should I come over or go to work? What happened?
1995520	1998520	Wow, Julius, I'm still kind of coming around here.
1998520	2007520	Why don't you head over, I'll put some coffee on, and we'll all discuss our next steps around the dinner table. How does that sound?
2007520	2008520	Great, I'll jog over.
2008520	2009520	He's got to exercise.
2009520	2010520	Yeah, that's close.
2010520	2013520	Beck, what's the wake up situation?
2013520	2016520	I wouldn't wake up unless you did something to wake me up.
2016520	2020520	Oh, yeah, remember the intro scene to Beck Wilder.
2020520	2027520	Face down, tighty whities up, that's the way he likes to sleep in.
2027520	2035520	Cal doesn't do anything in particular, but he is loudly whistling, and at a few points, like, definitely running from room to room as he grabs different things,
2035520	2042520	and he's kind of excited and preparing, like, yeah, we're going to have coffee and then we're going to plan our Pulitzer Day, part two.
2042520	2050520	So, yeah, you would hear him running up and down stairs and stuff, and he's a big enough guy that it's booming through the house.
2050520	2052520	You hear one stir from the couch.
2052520	2058520	No, mom, I don't want to walk a dog. It's not my dog.
2058520	2059520	Oh!
2059520	2067520	You hear the, like, the basement door creak open, and Cal peeks his head and he says, Beck, Beck, good morning.
2067520	2070520	Coffee's on in five. Get on up here.
2070520	2071520	Get on up here.
2071520	2073520	Yeah, okay, I'll be right up.
2073520	2075520	We've got to find Stevie and God.
2075520	2076520	Yeah, big day.
2076520	2077520	Julius is coming over.
2077520	2078520	Is he all right?
2078520	2080520	Oh, uh, 60 percent?
2080520	2081520	All right, good enough.
2081520	2082520	That's what I said.
2082520	2083520	All right, I'll be up in a sec.
2083520	2085520	Nothing some coffee can't fix.
2085520	2088520	Julius opens the front door, a little sweaty.
2088520	2092520	Who the fuck is that?
2092520	2093520	Got any water?
2093520	2097520	Oh, he's got some very well-made lattes, each with a little, like, news van in it.
2097520	2099520	He's like, oh, yeah, yeah.
2099520	2100520	Those are great.
2100520	2101520	You can have some water.
2101520	2105520	Julius takes one and then sips it and has a little milk froth mustache.
2105520	2107520	I saw the news broke. I saw God on TV.
2107520	2109520	Cal drops the tray.
2109520	2111520	What do you mean our news broke?
2111520	2117520	I turn it to can on his TV, and magically that is on.
2117520	2118520	You can do magic?
2118520	2119520	That story is...
2119520	2121520	I turn the TV on and it's like they're interested.
2121520	2124520	You turn the TV on and it's in Cal, Colorado's house, so it's on can.
2124520	2128520	And can is currently covering this exclusively.
2128520	2133520	They're just about to intro the whole story on can, so it's perfect timing.
2133520	2136520	Becca's walking up now, up to the back of the couch, into frame.
2136520	2139520	They're running. What are they running? They're running.
2139520	2140520	Is it ours?
2140520	2143520	It's Daddy's. Kurt's. Kurt's footage.
2143520	2146520	Okay, with our pickup from last night?
2146520	2147520	Would you have been able to send that in?
2147520	2149520	Yeah, we sent that in, Link.
2149520	2150520	I think you have to take it to the station.
2150520	2154520	The rules of the universe, as we've established, seems like we would have to take it.
2154520	2161520	I figured we'd run it as an evening news segment, but that was breaking news because people know about it.
2161520	2167520	People saw it, as far as the logistics of Julius' thoughts went.
2167520	2171520	When Kurt's footage ends, you see the can studio.
2171520	2179520	Isabella Kaya back with this absolutely staggering story here on City Action News.
2179520	2185520	I mean, for those of us watching at home who have never seen Lightning Tornado before,
2185520	2193520	it can be scary, but I'm being told from those scientists who we love listening to here at can
2193520	2197520	that there is absolutely nothing to be afraid of.
2197520	2199520	Isabella Kaya, City Action News.
2199520	2202520	Kaya was like, didn't they see our footage?
2202520	2207520	It's not a lightning tornado, it's God! That's God, you idiots!
2207520	2211520	Everybody at the hospital just thought it was a lightning tornado.
2211520	2213520	That's stupid!
2213520	2214520	It's what they're telling him.
2214520	2219520	Wait, maybe we could spin this as a positive. Now we'll be able to answer all the questions.
2219520	2226520	Instinctively, Beckwilder reaches his hand in his pocket for the thumb drive that he copied all the footage onto,
2226520	2229520	and he flashbacks to the moment that Vivica-
2229520	2231520	Put that kick me sign on me.
2231520	2233520	Put that kick me sign on you.
2233520	2234520	She stole it.
2234520	2238520	And you reach the bottom of your pocket and your heart sinks.
2238520	2240520	Beck, what's wrong?
2240520	2245520	You're right, Beck. We can just say teasers that's like the crazy tornado that happened.
2245520	2248520	We'll just tune into can and we'll tell you what it's all about.
2248520	2249520	Beck, what's wrong?
2249520	2251520	Let's get that footage over to the station.
2251520	2252520	Look at his face, Julius.
2252520	2257520	Yeah, the footage, it's on the thumb drive. Remember the thumb drive?
2257520	2258520	Yeah.
2258520	2263520	And I put it into this pocket and that pocket is empty.
2263520	2265520	Check your other pocket.
2265520	2268520	Yeah, yeah, yeah. And I check another pocket, and I check another pocket.
2268520	2269520	Check.
2269520	2271520	And I check another pocket, and I check another pocket.
2271520	2272520	Your coat.
2272520	2274520	And I check another pocket.
2274520	2277520	Check the fucking camera, Beck. Check the can van.
2277520	2281520	Yeah, Vivian took the drive. She had to have.
2281520	2282520	Vivica, she had to have.
2282520	2284520	When would Vivica have taken the drive?
2284520	2287520	When she put that hilarious sign on his back.
2287520	2289520	Oh, we've got to find Vivica.
2289520	2292520	We've got to find Vivica, we've got to find Stevie, we've got to find our footage.
2292520	2295520	All we have is your TikToks, Julius.
2295520	2299520	Julius, like, kind of perks up and then goes to post another TikTok.
2299520	2301520	I posted the Jackalope one yesterday.
2301520	2302520	Yep.
2302520	2303520	Guys, which one should I do?
2303520	2305520	I don't know what you have.
2305520	2308520	Didn't we have footage of the medical device, maybe? Was that something?
2308520	2311520	Yeah, I'll do that, of them healing up your wound.
2311520	2312520	Yeah.
2312520	2313520	He posts that.
2313520	2314520	Do that.
2314520	2317520	And while it's doing it, he puts, like, the sound that would be in a St. Jude's commercial,
2317520	2321520	he puts that in the background as the sound and uploads it.
2324520	2325520	Good edit.
2326520	2328520	We've got to find Vivica.
2328520	2330520	We've got to find Stevie and God.
2330520	2334520	We've got to find out what the fuck is going on at Cannes and where our footage is.
2334520	2335520	I'm going to call Cannes.
2335520	2337520	Bec, do you feel comfortable?
2337520	2339520	Can you hunt down Vivica?
2339520	2340520	Yeah.
2340520	2341520	Do you know her?
2341520	2343520	Of course. I've got to get my footage back, dude.
2343520	2344520	You don't think she got rid of it, right?
2344520	2347520	Julius, can you get a hold of your uncle or go to his home?
2347520	2348520	I call Tyfe.
2348520	2349520	Boing, boing.
2349520	2350520	Boing, boing.
2351520	2352520	Boing, boing.
2352520	2353520	Boing, boing.
2353520	2355520	Julius.
2356520	2357520	Uncle.
2357520	2358520	My guy.
2358520	2359520	Uncle Tyfe.
2359520	2360520	We've got good news.
2360520	2361520	Yeah? Well, I am, like-
2361520	2363520	Well, and bad news.
2363520	2364520	Tell him we've got questions.
2364520	2366520	What are you doing? Why weren't you answering my calls yesterday?
2366520	2369520	I'm fucking hungry for good news.
2369520	2372520	You're going to give me some good news? I love that.
2372520	2375520	We've got crazy footage, but we lost it.
2375520	2378520	Well, like I said, we hungry.
2378520	2380520	All right, tell me about this footage.
2380520	2382520	Grover's Gorge. Have you heard of it?
2382520	2385520	Forget about it. Cut. What are you talking about?
2385520	2389520	We followed that anonymous tip and it led us to Grover's Gorge,
2389520	2392520	which is a hidden utopia that's ran by the-
2392520	2393520	Dystopia.
2393520	2394520	The Godel company.
2394520	2395520	It's a utopia?
2395520	2397520	It's run by the Godel company?
2397520	2398520	That's amazing.
2398520	2399520	It's nice, but it's bad.
2399520	2401520	It was an anonymous tip? What was it?
2401520	2403520	It was just a pin in the middle of nowhere.
2403520	2405520	Just a pin? Who was assigning all the-
2405520	2408520	I mean, I assume it was Isabella who assigned you all the stories?
2408520	2410520	She did a bang up job. She's good.
2410520	2412520	She's all right. She's the best.
2412520	2414520	Well, we've got to find Vivica. Are you at work?
2414520	2416520	Yeah, I'm in the office.
2416520	2417520	Is Vivica there?
2417520	2418520	I don't know. I'm upstairs.
2418520	2420520	Can you check?
2420520	2421520	Let me slack her real quick.
2421520	2423520	Oh, it says she's working from home.
2423520	2424520	Did you-
2424520	2427520	I get on the slack channel and add Vivica?
2427520	2429520	What's up?
2429520	2431520	Oh, no buy? No buy for your uncle?
2431520	2434520	I am doing that with him still on the phone.
2434520	2435520	Uncle type, yeah.
2435520	2439520	When I talk to Vivica, we'll bring you the footage and show it to you, but it's big.
2439520	2443520	Well, if it makes the Godel company look great, that's fantastic, you know?
2443520	2445520	They were really haranguing us about that last story.
