start	end	text
0	3580	Arrrrrrrrrrrrrrrrrrrrrrrrrrrrrrrrrrrrrrrrrrrrrrrrrrrrrrrrrrrrrrrrrrrrrrrr
3580	6140	It's your moon howling and scowling
6140	10320	Puparoni with the side of extra cheese wolf the dog
10320	14520	The moistest DJ this side of the solar highway
14520	20140	And I am a-wooing at you live from 694.2 PTBP
20140	23080	The greatest radio station that ever did
23080	27000	Now let's move on to the greatest things y'all ever did
27000	28740	Write me fan mail
28740	33820	This week's Howlin with Wolf is from at black goat underscore M10
33820	37980	Who instagrammed about the show and tagged at pretending pod
37980	41700	What a super cool way to let your friends know you're a freak
41700	42660	He writes
42660	44660	Greetings Mr. Wolf
44660	48140	Pretty new listener and first time howler here
48140	49240	Great show
49240	52780	I've not really been into RPGs before
52780	57420	But I really enjoy the gang's escapades and contention in the city
57420	58940	Keep up the good work
58940	61820	Big shout out to Victor for sending me your way
61820	66180	Appreciative howls from Mattias in Sweden
66180	67500	Mattias
67500	71180	Are you telling me that THE Victor sent you?
71180	73060	What did he tell you?
73060	75340	Who do you work for?
75340	76420	Mattias
76420	78380	You're on thin ice buddy
78380	80500	And you better watch your back
80500	82340	And you tell Victor
82340	84700	Tell him that Wolf says
84700	86260	Hello
86300	89100	If you want to write up something for your wolf to howl
89100	91540	Tag at pretending pod on twitter
91540	94940	Tag at pretending pod on instagram like Mattias
94940	98300	Or tag at pretending to be people on facebook
98300	102900	Wolf and his producer haven't spent a single dime on advertising
102900	106460	So y'all all here because of words in mouths
106460	107900	Or words in posts
107900	110260	Or words in comment sections
110260	112980	The point is words are powerful
112980	117060	Please use yours to share this show with your friends
117060	118340	Your co-workers
118340	119900	Your grandparents
119900	121540	And step-cousins
121540	124980	And as a reward for your sharing I'll do two things
124980	128540	One, I might choose you to submit a howling with Wolf
128540	134220	And two, I might and definitely always do put the links in the show notes
134220	139740	And while you're posting on them socials about 694.2 PTBP
139740	144260	Keep them ear holes open and receiving my dulcet tones
144260	146900	It's time for the news
146900	150300	Last time the field team at City Action News
150300	154940	Showed the good people of TikTok a glimpse into the calzone
154940	159500	On their way to a potential story from a woman named Kaylee Silver
159500	163380	What they found was the scene of a gruesome homicide
163380	165860	After watching footage from the Furbo
165860	169180	It's clear that Kaylee Silver walked over to her fridge
169180	170340	Cracked a beer
170340	172540	And her friend Kaylee Gold's head
172540	175340	Unnaturally snapped toward the kitchen
175340	180820	Before this differently dispositioned Kaylee Gold lunged at the apartments resident
180820	182100	Kaylee Silver
182100	184540	The attack took place out of view
184540	186420	Behind the kitchen counter
186420	190740	But it seems Kaylee Silver stabbed her friend repeatedly in the neck
190740	192500	With her broken beer bottle
192500	196140	Until Kaylee Gold's head was all but decapitated
196140	198140	Thankfully for this story
198140	200700	The can crew called the city cops
200700	201980	Made statements
201980	206060	And headed off to cleanse their palates with a drink at the foundry
206060	209220	Taking us there now is a bop that don't stop
209220	211020	Good shit that don't quit
211020	213260	An anthem for the handsome
213260	214940	It's Alter Girl with
214940	218620	My Life is Great and It's All My Fall
228140	244060	My Life is Great and It's All My Fall
255060	257460	Also why would we do a season one name?
257500	260780	Everyone from season one is dead to this podcast, Luke.
260780	262780	We are moving on. This is season two.
262780	266540	Dude, Thomas, ask me anything about season one.
266540	267700	What's season one?
267700	271220	I don't remember.
271220	273940	Welcome back to season two of Pretending to be People.
273940	276780	If you got into this podcast because of season one, thank you.
276780	281020	But honestly, that shit is over and done.
281020	288100	And this is a new era of excellence and groundbreaking podcast roleplay.
288100	289820	Straight up, dude.
289820	293380	Get your two tight britches on, which is a reference to nothing.
293380	298860	If you listen to season one, stop listening right now.
298860	300860	Stop. Yeah, you need to stop.
300860	304660	No, no, no, no, no, no, no, no, keep going.
304660	308620	The britches this, oh, I feel like I'm, am I clipping for you guys?
308620	309140	A little bit.
309140	310500	I feel very loud.
310500	311500	I'll turn you down.
311500	312700	Turn me down a little bit.
312700	313940	I'll just talk louder.
313940	315980	Oh, the cat's going in the pod box.
315980	317020	Cat in the pod box.
317020	325940	I will say the main difference after listening to the edited version of the first episode of this season.
325940	328940	Yeah, like once it was edited, we were funny and good.
328940	333740	Exactly, but after listening to that, huge differences.
333740	337580	The britches are going to be small this year, this years.
337580	339620	This years?
339620	341100	All right, they were big in that thing.
341100	343940	They were big last time and now they're small.
343940	346260	Hey, Zach, are they coming out of the ******* world right now?
346260	346860	No.
346860	348100	Oh, okay, nevermind.
348100	352420	Which is a reference to nothing.
352420	359420	Zach is currently aggressively kissing our cat.
359420	361300	And the first two times she was like, yeah, sure.
361300	366020	And then the fifth time she was like, I'm not going to sit on this ******* couch with you anymore.
366020	367100	You lost cat privilege.
367100	372660	Okay, so obviously I know the answer to this, but Joe, where exactly did we leave off last time?
372660	375940	Oh, dude, you should have seen the crazy **** that I saw.
375940	382500	A girl killed another girl in an apartment and it was messed up and we were all kind of exasperated by it.
382500	388060	And so Cal, Colorado asked us to go to the foundry to maybe wind down.
388060	394220	Which is not a reference to the old Joplin, Missouri music venue.
394220	396020	It's a reference to what, Zach?
396060	398140	Oh, it's a reference to what, Thomas?
398140	400620	I don't remember exactly, but isn't it a newsman's bar?
400620	403380	I believe it's a bar specifically for newsman's.
403380	404660	That's right.
404660	406620	I remember the whole thing.
406620	409060	I knew the whole time I knew that.
409060	411220	So vroom, vroom?
411220	412100	Vroom, vroom.
412100	414620	Vroom, vroom.
414620	420940	Julius Summers pulls into the parking lot of the foundry.
420940	422700	Yeah, where's the foundry located, Thomas?
422700	424660	What kind of bar is this?
424660	429660	It's got like dive bar aesthetics, but much like Cal, Colorado's house, there are pictures
429660	432500	all over the walls of local news people.
432500	438820	And it's kind of maybe equidistant downtown from the three different local news stations.
438820	444340	And so they all come and relax and unwind there and talk shop afterwards.
444340	447700	Are there any TVs on the walls at all?
447700	453140	Are they showing the news at this place or is it specifically to unwind away from that?
453140	454140	I think they are.
454140	457580	I think they never play sports, just the news.
457580	460140	How many news channels are in the city?
460140	461140	He just said there are three.
461140	463660	Okay, there's three TVs then.
463660	468540	I think the foundry is like in an older building downtown, but just absolutely like always
468540	470700	in the shadow of these skyscrapers.
470700	477220	We're in like the downtown railroad like intersect.
477220	478220	I love it.
478220	481560	It's right where the train rolls by and there's a...
481560	483060	They do train shots.
483380	485580	Yeah, of course they do train shots.
485580	492780	So pretty much every time this foundry is like rumbling with the train that is basically
492780	494980	right outside its back door.
494980	500420	There's just a shitload of like attractive people in good suits like getting fucking
500420	503220	hammered and the trains come by a lot.
503220	507820	That's one of the reasons that they chose this place because it's very hard to overhear
507820	510140	the conversation like anybody else is having.
510140	511140	You have to lean in close.
511140	515420	It's a great place to like protect your sources.
515420	521040	In your mind, is this place filled with producers and talent or is my ilk of the camera man
521040	522540	and crew there?
522540	524540	Everyone comes to the foundry.
524540	525900	We're all friends at the foundry.
525900	529980	Color 10, KY3, any of the other ones?
529980	533540	I don't think we're like referencing specific networks, but it would definitely be like
533540	540460	the local ABC, CBS, NBC, Fox, like local anchor people all hanging out there except
540460	546420	it's CAN, NNN, Nightly News Now.
546420	548500	ETC is there.
548500	549980	ETC, which is...
549980	550980	Ethical...
550980	553860	This is going to be like PBS and nobody watches it.
553860	554860	Ethical...
554860	555860	Television.
555860	556860	Television channel.
556860	557860	Channel.
557860	560860	Joe, you do one.
560860	565700	Yeah, now that we said them all.
565700	568300	RBQ, you guys have fun.
568300	571020	It's sponsored by Arby's and it's barbeque.
571020	572020	Barbeque.
572020	573420	Yeah, Royal Broadcasting.
573420	574420	Quarterly.
574420	578980	They only air three months.
578980	588100	Anyway, I've speedily pulled into...
588100	590540	I screech into the parking lot of the foundry.
590540	593700	Does Beck say that?
593700	595700	Unless Julius goes...
595700	602740	Yeah, no, Julius pulls in like as any normal person would into a parking spot, but as he's
602740	604540	doing it, he goes...
604540	609780	And then he kind of like looks around at the other two and sees Cal is not laughing.
609780	616200	No, Cal is like holding onto the oh shit handle and is like is clutching at his chest.
616200	623360	Keep in mind throughout these interactions of the sites you just saw at the apartment,
623360	625280	the high rise that you were just at.
625280	628280	Yeah, I bet you we land in silence.
628280	630880	I bet you we pull in a little somber.
630880	632960	I was going to mention, I don't think...
632960	634440	He would not bring his camera in here.
634440	638800	I think that this is a sacred place that he knows not to film and that's a very out of
638800	639800	character for him.
639800	640800	So you guys walk across...
640800	644900	This is like where the witches and the witch hunters meet.
644900	648940	There are as many people outside smoking as there are inside.
648940	649940	Also smoking?
649940	657620	Yes, this is a smoking bar, but it's a nice day.
657620	661860	It's a cool evening from an oppressively hot, hot day.
661860	667060	The humidity kind of dies off into the night and you've got kind of a cool summer evening
667060	673140	as you guys walk across this gravel parking lot and head around back to the entrance of
673140	675900	the foundry on the train track side.
675900	679060	A train is currently finishing up.
679060	686540	It's bustling through this back area and you see a server is haphazardly making their way
686540	690180	through the smokers outside with train shots.
690180	693460	He's yelling, train shots, yeah, who had the train shots?
693460	696300	We got a whole mess of them here.
696300	701020	Cal just like silently takes one off the tray and downs it and puts it back on the tray.
701020	706500	Julius grabs one, takes it, and then puts $2 down on the tray.
706500	707500	Nice.
707500	711900	Which train shots are specifically a special here at the foundry.
711900	721780	It is a single dollar for a shot of whiskey when the train toots its horn as it drives
721780	722780	by.
722780	728460	Oh God, if it's fucking like dollar whiskey, we're talking old crow or worse.
728460	729460	Oh, it's old granddad.
729460	730460	Brown derby select.
730460	731460	It's old granddad.
731460	732460	It's old granddad.
732460	733460	Oh yeah.
733460	734460	Orange bottle.
734460	742180	And you set this down and the server looks at Cal Colorado with a certain appreciation
742180	745260	as he carries on with his job.
745260	747860	I think he knows to just add it to Cal's tab.
747860	748860	Nice.
748860	756680	Julius did put the $2 down on his tray even though he knew that those were not poured
756680	758820	out for Cal and Julius.
758820	764340	Immediately you hear him as he walks over to a group who's calling him over with the
764340	765340	train shots.
765340	768060	He's reassuring them like, yeah, no, I'll be right back.
768060	769220	I'll be right back.
769220	775740	And their understanding after seeing the looks on the pained faces of Cal Colorado, Julius
775740	778880	Summers, and Beck Wilder.
778880	779880	Probably like we recognize.
779880	781780	Are they just like local news crew?
781780	783520	Yeah, it's just another local news crew.
783520	790020	They hold up their shots to you as they all wait on the other two shots to come, which
790020	792200	come quickly and you're all able to.
792200	796720	Beck takes his head off and does an exaggerated bow and puts it back on.
796720	801200	Guys, this is my first time in here.
801200	802200	Very excited.
802200	803600	I've heard a lot about it.
803600	806680	This is the first thing that maybe like brightened Cal's face in a while.
806680	809520	Like he gives a very knowing look to Beck.
809520	813200	Well, we have a first timer here.
813200	814960	I think you know what that means, Becca.
814960	818780	We exchange a look and you see a big smile on Beck looking at you.
818780	823960	Are you thinking like we're going to do like do the full set up like now?
823960	829720	Maggie doesn't let any first timers in without putting them through the printing press.
829720	835500	Oh, Julius, my man, you're going to have fun tonight, dude.
835500	836640	It's going to be good for you.
836640	838720	You're going to want to shake off what we saw earlier.
838720	843560	You're going to forget all about that weird, horrible home brew murder.
843560	849720	I mean, I don't know that I'll forget about that anytime soon, but no, the images will
849720	857360	haunt you for the rest of your life, but we can obliterate them temporarily.
857360	859360	The printing press?
859360	860360	You'll see.
860360	865620	Julius starts walking faster and wants to be the first one in there because he's stoked
865620	870800	to see what the hell the printing press is.
870800	874500	Do you think that you and I have a booth that we haunt?
874500	875500	Probably yeah.
875500	876500	I think that'd be cool.
876500	883180	Julius has done his research asking his uncle all about these guys, so he knows which booth
883180	887780	it is.
887780	892020	So Julius goes and sits down in the booth that you guys usually go sit down.
892020	896220	Do you go sneak in right before Beck gets there?
896220	901140	Leading the way, I'm just going and sitting down and turning around like, look what I
901140	902140	know.
902140	903700	Hey, that's the one we always sit at.
903700	904700	That's weird, dude.
904700	905700	Cool.
905700	913340	Hanging Wes Anderson style directly center frame of the booth is an old picture of Cal
913340	921220	from the night after his first television broadcast as a head news anchor, and it's
921220	927420	beautifully framed in this old oak wooden frame and is sitting gloriously.
927420	928540	He looks like a kid.
928540	929780	The suit's wearing him.
929780	933460	Yeah, Cal sits purposely with his back to that.
933460	934460	In what way?
934460	938900	Is it so that when people look at it, they see your face next to your face?
938900	944700	What they're going to see is a much younger, more handsome man with a huge smile on his
944700	950900	face next to that, aged 30 years and looking absolutely miserable tonight.
950900	955580	It does have that effect that those are contrasted, but he's not trying to do it as a power move
955580	956580	or anything.
956580	957900	He just doesn't want to catch sight of it.
957900	958900	Sure, sure, sure.
958900	965860	As Julius slides into the booth, he's not saying anything, but wiggling with excitement.
965860	968380	He's wanted to do this for so long.
968380	972560	Just be a producer and be part of the news and be able to get into this place.
972560	974140	He is so fucking stoked.
974140	980820	Julius, if you wiggle like that during the printing press, you could lose a finger.
980820	982140	Printing press.
982140	984420	I want to find out what it is.
984420	986420	Your research didn't tell you what it is.
986420	988820	My uncle would not tell me.
988820	989820	That makes sense.
989820	991820	I mean, it's kind of a closely guarded secret around here.
991820	996220	I don't think that anybody goes out there just telling other people about it, you know?
996220	999180	They never do, if they want to live.
999180	1000980	Only kidding.
1000980	1004500	It's a process that happens in three steps.
1004500	1012100	The first step, you are laid across the bar and your belly is exposed.
1012100	1017820	Julius pulls his shirt up as he lays on the table and then realizes what was said and
1017820	1019680	then he goes and sits back down again.
1019680	1022420	Tell him the second part.
1022420	1026580	This is kind of like your last moment of choice here, but you get to decide what liquor you
1026580	1027580	want.
1027580	1031420	Once you're laying on the bar with your shirt up?
1031580	1034620	What would be your choice if you said your favorite liquor?
1034620	1035620	Tequila.
1035620	1041520	Ooh, that's a bad choice to try on.
1041520	1048100	The third step is more tequila than you've ever had in your life, with hungry news crews
1048100	1059180	eagerly licking it off your midriff as Maggie, the hardened barkeep, pours a bottle into
1059180	1060180	your mouth.
1060180	1062540	Same, by the way.
1062540	1069660	So the tequila gets poured into my mouth and your belly button.
1069660	1080500	And they let the older interns just absolutely go at you.
1080500	1085800	So at this point, you're probably asking what's in it for you.
1085800	1087300	The deep respect that comes.
1087300	1095060	I spent a lot of my time in college practicing for this day.
1095060	1097860	Oh, you've had a lot of people lick you.
1097860	1099260	I wish.
1099260	1102540	Oh, has anyone licked you?
1102540	1107780	Julius gets up from the booth and walks over to the bar with his, while he's like untucking
1107780	1115060	his shirt from his pants, his all tan suit.
1115060	1119340	Oh, I thought you were going to describe your body and I was like, he strikes me as
1119340	1121340	a very pale man.
1121340	1122340	He's pretty pale.
1122340	1123340	Yeah.
1123340	1133460	You see a trunk of a woman in a denim vest with long, a long braid down the back of her
1133460	1134460	hair.
1134460	1143980	She clinks a bell above her head and she's like, hot off the press.
1143980	1149540	Oh, that's right.
1149540	1154780	We got a newbie over at city action news.
1154780	1163620	Come on down everyone for Julius Summers.
1163620	1169060	He's in for the printing press, clang, clang, clang, clang, clang, and the entire crowd
1169060	1173620	in circles, like all the smokers come inside when they hear the bell and immediately jackets
1173620	1174620	come off.
1174620	1177860	Ties are loosened, top buttons are undone.
1177860	1183020	And like these very dorky, like you see the interns start circling and they all look like
1183020	1184700	Jonah from Veep.
1184700	1194260	Julius is laying on the bar with his like shirt kind of pulled up, exposing his stomach.
1194260	1208700	And then one of the Jonah interns just rips all of his like upper clothing off.
1208700	1217900	And the chants fade away, much like Julius's memories from the entire night.
1217900	1224700	Beck and Cow, however, don't get printing pressed by a bunch of rabbit interns and therefore
1224700	1228660	are able to keep their wits in their brain helmets for the evening.
1228660	1229660	Let's go check that out.
1229660	1234900	And Oh, Hey, thanks so much for listening to pretending to be people probably means
1234900	1237340	you're fucking cool.
1237340	1246660	We've got a very special guest on today's episode of pretending to be people.
1246660	1251860	I had an idea in my head when we were discussing the recording of season two, Joe and I had
1251860	1257420	talked about who his character would interact with the most.
1257420	1262420	And your answer to that was a mother.
1262420	1263420	The answer was mother.
1263420	1264420	Yes.
1264420	1268060	I think you specifically told me I can't have dead parents this time.
1268060	1275100	Well, not yet, not yet, exactly.
1275100	1281380	And when you said mom immediately, I thought, well, let's get our podcast, uh, dad to come
1281380	1284820	on and play Beck Wilder's mom.
1284820	1288820	It's Scott Norwood is back!
1288820	1290940	Thank you very much for having me back on.
1290940	1295300	And like, this isn't the first time I've been called a mother, but at least the circumstances
1295300	1297300	are different.
1297300	1303020	Well, we really appreciate you coming on for those of you who are just hearing Scott on
1303020	1307140	pretending to be people for the first time for some fucking reason.
1307140	1312360	Scott is my parasocial RPG mentor.
1312360	1319900	He didn't know that he was my mentor, but listening to his podcast that he does with
1319900	1326660	Matt Sanderson and Paul Fricker, good friends of Jackson Elias truly developed me into the
1326660	1329380	GM that I am today.
1329380	1334220	And I am super appreciative of all the lessons I've learned listening to their podcast over
1334220	1335220	the years.
1335220	1336220	Oh, blimey.
1336220	1342740	I thought I'm still amazed that anyone even listens to it.
1342740	1346380	Scott before I was ever aware of who you were, I knew that Zach listened to your podcast
1346380	1350780	and you answered some questions for him one time and he was so excited and told us all
1350780	1351780	about it.
1351780	1355780	And that was way before there was ever a glimmer of hope of meeting you, let alone playing
1355820	1356820	No, yeah.
1356820	1361280	We weren't even talking about recording a podcast, but I was running Helen Texas, which
1361280	1366920	is a scenario that you wrote for the book, The Things We Leave Behind by Stygian Fox
1366920	1368340	Publishing.
1368340	1375100	And that's a great book and your scenario in it is so terrifying and awesome.
1375100	1379880	So I posted some questions on the subreddit and you yourself came in and answered them
1379880	1387720	and I lost my fucking shit, Scott.
1387720	1391600	I waste half my life on Reddit.
1391600	1396080	It is my main time sink and I am not proud of that.
1396080	1401540	Well that time sink made this nerd super happy and validated many, many years ago.
1401540	1402640	So thank you for that.
1402640	1405720	Some might say this podcast wouldn't exist without you, Scott.
1405720	1409640	You gave him the hope, the drive.
1409640	1413000	It's all my fault now, is it?
1413000	1416000	We have to pin it on somebody.
1416000	1432560	I would like to take us to the home of Beck and Kim Wilder as Ramona scoots her cat.
1432560	1436600	Zach has a cat food bowl that is one of those ones that's like a maze.
1436600	1438600	Yeah, it keeps Ramona nice and...
1438640	1440120	But it kind of becomes a game.
1440120	1442880	Smart, yeah.
1442880	1448040	Yeah, she grabs each piece individually and then eats it out of her own paw, which is
1448040	1450440	rad.
1450440	1452400	But noisy, I imagine.
1452400	1453320	Quite noisy.
1453320	1458320	I'm going to move it into the back room.
1458320	1462680	I barely get through a recording session without one of my cats running into the room and
1462680	1468160	screaming like a seagull or jumping all over things and knocking shit over.
1469160	1473320	My cats are named Chaos and Anarchy, and it's with good reason.
1473320	1476400	That's great.
1476400	1481560	Beck Wilder has had a brutal day.
1481560	1482560	Started off fine.
1482560	1491440	Woke up around 2 p.m. in your tighty-whities, in your messy bedroom, headed off, shot a
1491440	1493680	segment out on a farm.
1493680	1494680	He had a rough evening.
1494680	1495680	Was it evening?
1496200	1499160	Yeah, it was a rough evening.
1499160	1503680	You were called out for a potential story that was...
1503680	1506400	We weren't even 100% sure what we were going out there for.
1506400	1507560	And what did you find?
1507560	1510320	Oh, man, it wasn't good.
1510320	1517280	It was a terrible, terrible crime scene, including a partially severed head.
1517280	1520840	That wasn't what Beck was thinking was going to happen that day.
1520840	1523560	Yeah, I mean, a severed head is bad enough.
1523560	1526840	A partially severed head sounds worse.
1526840	1532720	Yeah, it's a lot worse.
1532720	1533720	Just holding on.
1533720	1537640	Just a little hinge.
