start	end	text
1537640	1539200	Beck isn't in the greatest headspace.
1539200	1542800	He's now just gotten back from the foundry, where he had a nice night trying to drink
1542800	1543800	his troubles away.
1543800	1545840	Are you feeling a little loose?
1545840	1547760	You feeling a little warm in the face?
1547760	1550320	Beck always feels loose.
1550320	1554960	He's maybe a little bit looser than normal, but he kind of lives in an equilibrium of
1554960	1555960	inebriation.
1555960	1560360	A loose state, I like that.
1560360	1564640	So as you arrive home, it's late at night.
1564640	1571320	It's 1130 PM, maybe even midnight, which is about as late in the night as you can get.
1571320	1573640	Before it starts becoming morning.
1573640	1576640	That's right.
1576760	1580920	Kim Wilder has the home to herself.
1580920	1590240	Her son is a mid-thirties field cameraman for City Action News, and he is still living
1590240	1593160	in your house, Kim.
1593160	1597320	For now.
1597320	1601200	What is Kim Wilder up to on a random Saturday evening?
1601200	1608320	I think she's sitting there on the sofa, knitting and watching television.
1608320	1614880	The sound is way down on the TV, and there's just the clack, clack, clack of knitting needles.
1614880	1620960	And somehow she is managing to make knitting look angry.
1620960	1626480	Out of the corner of her eyes, she just keeps darting her eyes over and stabbing them into
1626480	1633000	the corner where Beck keeps his camera equipment, which is not there at the time, but there's
1633000	1641040	like a whole corner of this room that is specifically set up to house Beck's livelihood.
1641040	1642200	Oh yeah.
1642200	1646160	You can tell exactly where it is just by all the scuff marks and the skirting board and
1646160	1650000	the floor tiles.
1650000	1656120	And the last you saw Beck, it was maybe even yesterday because today you knew that he was
1656120	1657120	in his bedroom.
1657120	1662880	You knew that he had been sleeping in, but you went to knock on his door for tea or snack
1662880	1664960	or he wasn't even in there.
1664960	1667400	He just left the house without saying anything.
1667400	1673440	And as those thoughts are flowing through your brain, the front door swings open.
1673440	1676440	Hey, Ma, you're up.
1676440	1678880	Oh, this is awkward.
1678880	1684880	Oh dear, oh dear, oh dear.
1684880	1691720	I thought that was a burglar coming in, but no, it's just my son staying out all hours
1691720	1693040	again.
1693040	1695800	And where have you been tonight, young man?
1695800	1697280	Get some drinks with the boys.
1697280	1703160	You know, it's, uh, uh, I had a, I had a bad night, Mom.
1703160	1711000	Yes I could, I can smell just how bad your night was from here, yes.
1711000	1716000	You're not going to bed until you put something in your stomach to soak up some of that beer.
1716000	1722200	There's still some hot dog casserole in the oven, it's probably, oh, it's probably burnt
1722200	1726200	to a crisp by now, but well, give it a try.
1726200	1730720	I cut up the wieners nice and small, just the way you like it, just the way I like it.
1730720	1735520	Cut up more hot dogs.
1735520	1739760	Beck starts walking toward the fridge and you can tell now that he's a little drunker
1739760	1741320	even than you've ever seen him.
1741320	1743600	He's a stumble-ier than you've ever seen him.
1743600	1750680	And he kind of catches himself, woo, a little woozy, sorry, sorry about that, Ma.
1750680	1756800	It uh, I know we don't like to talk about like what I do, but like, I saw some shit
1756800	1758680	tonight Mom, it was bad.
1758680	1762280	And what exactly did you see?
1762280	1766920	Oh, it's kind of like a thing that's like under investigation now.
1766920	1771320	I don't know if like, I might need a lawyer to talk to you about it.
1771320	1777000	Honestly, I really don't understand why you can't have a proper job.
1777000	1778320	You're out all hours.
1778320	1782840	I never know whether I'm going to find you sleeping in your room in the middle of the
1782840	1787080	afternoon or whether you're going to stay out until three o'clock in the morning.
1787080	1790760	Clearly what you're doing isn't making you enough money for you to actually move into
1790760	1792440	your own place.
1792440	1798200	And now you're saying that it's dangerous as well, and it's going to get you into trouble.
1798200	1799560	Why do you do this?
1799560	1801780	Why can't you just get a proper job?
1801780	1808280	You know, Macy Grindel's son, Deke, he's got, he's got a nice thriving business for himself
1808280	1814020	selling secondhand sofa beds and he's moved into a new apartment downtown.
1814020	1815280	It's all his own.
1815280	1820100	Well, I think he's got a couple of flatmates, but he's not living with his mother anymore.
1820100	1821100	That's the important thing.
1821180	1823580	Yeah, but Deke's a fucking asshole.
1823580	1827260	Oh, not this again.
1827260	1829020	Jesus Christ.
1829020	1831420	He's a financially solvent asshole.
1834060	1837660	Sorry, uh, the, uh, the internet connection cut out a little bit right there.
1837660	1847660	He's a financially solvent asshole.
1847660	1848300	Brilliant.
1851260	1855580	As Kim started to go into that diatribe, Beck had his back to her and he was kind of mouthing
1855580	1856700	along with these words.
1856700	1858140	He's heard it so many times.
1861500	1863180	Oh, she's got to mention Deke again.
1863180	1864380	She's got to mention Deke.
1864380	1865500	Oh, there we go.
1866300	1867420	Playing the greatest hits.
1869340	1872380	If you love Deke so much, why didn't you give birth to him?
1875260	1877980	Don't think that I haven't thought about that every day.
1878060	1879100	Ew, gross mom.
1879100	1881180	You think about fucking Deke's dad?
1883420	1885900	A wistful look crosses Kim's eyes.
1891820	1896380	For like half a second, I thought we were going to get something like really meaningful
1896380	1899500	when Kim was like, why do you even do this job?
1900780	1903500	And then Beck's like, go fuck my friend's dad.
1908620	1914220	At this point, Beck has lost the gusto for the hot dog casserole and it's just kind of
1914220	1918540	like slopping it onto a plate and throwing it in the microwave and is trying his best
1918540	1920300	to like avoid eye contact with you.
1921340	1925980	Look, Ma, I know that it's like not like the best paying thing in the world, but it's like
1925980	1927420	what I want to do.
1927420	1932860	Like, I don't know if you can understand like happiness from that perspective, but that's
1932860	1934620	what I've got for me right now.
1934620	1941740	Look, you've got to understand that part of being a grown up is that we all have to do
1941740	1948860	things that we don't want to do, because that's just how we get through life.
1949580	1956380	And yes, all right, you can run around doing your camera stuff and whatever it is you do
1956380	1957820	at three o'clock in the morning.
1957820	1964700	And I try not to judge you, but sooner or later, you've got to grow up.
1964700	1970300	You can't just carry on like this and pretend that everything's all right.
1971420	1975660	You've got to you've got to grow up someday, boy.
1976540	1981820	Beck is now kind of a little more solemn and a little more introspective visually.
1982540	1986220	And he pulls the food out of the microwave and he's holding the plate and he's kind of
1986220	1987340	picking at it with a fork.
1987980	1990300	Yeah, I mean, fine.
1991340	1993900	We disagree on like fundamental things, Ma.
1993900	2002140	I just maybe someday you'll see that I can do this and also like be successful, whatever
2002140	2003100	that means to you.
2004300	2005580	I'm going to my room.
2005580	2006140	All right.
2006140	2008380	You'll have to pick up the clean sheets.
2008380	2011580	I've left them out for you, but you'll have to make the bed yourself.
2011580	2017740	And I tried to get the stains out, but we're going to have to try a new brand.
2023020	2023260	Yeah.
2023260	2023660	Okay.
2023660	2024380	Thanks.
2024380	2025180	Thanks, Mommy.
2025980	2026940	You got any milk?
2033740	2038780	Scott, we didn't bring you on here to roleplay anything other than what's about to happen.
2041580	2047980	Oh, Scott, thank you so much.
2047980	2049580	I think that's the end of the night.
2049580	2050300	That was perfect.
2055100	2057820	Oh, Scott, as always, an absolute pleasure.
2059260	2060060	Oh, thank you.
2061020	2065100	Zach, we live in a weird privileged world that we just had Scott Dorward on to play
2065100	2065820	my mom.
2065820	2066940	And I said, thanks, Mommy.
2066940	2067580	Got any milk?
2067580	2074060	And then we said, have a good day.
2074060	2075420	That is going to haunt me.
2080220	2081260	Scott, thank you so much.
2081260	2082940	Seriously, thank you so much.
2082940	2089820	And for those of you who enjoyed Scott just now, you can hear him.
2089820	2095420	He runs two different full scenarios for us on pretending to be people in our bonus episodes
2096140	2098140	here on the main feed.
2098700	2104940	Scott, you ran Bleak Prospect, a Call of Cthulhu scenario that you wrote so fucking creepy.
2104940	2107100	It's one of my favorite things that we've done on the show.
2107100	2108060	It's so fun.
2108060	2111900	Starts in a Hoover town and goes to worse places.
2111900	2112400	Yeah.
2113980	2119980	And you also recently ran a Pulp Cthulhu scenario, both of which, by the way, that Scott wrote.
2119980	2122380	This one was A New Age of Wonders.
2122380	2128780	And that was, for me personally, I think one of my absolute favorite player experiences
2128780	2130380	I've ever had in an RPG.
2130380	2130940	Oh, man.
2131500	2132780	Oh, I'm glad you liked it.
2132780	2134540	I had an absolute blast running it.
2134540	2135100	You did, too.
2135980	2136940	That's so fun.
2139180	2139500	All right.
2139500	2145180	Well, I'm going to stop gushing and we'll see you soon, Scott.
2145180	2146060	Oh, marvelous.
2146060	2146780	Look forward to it.
2146780	2147420	Good night, Mommy.
2149900	2151260	Got to go and have a bath now.
2152380	2165500	You're just now joining us.
2165500	2167660	Welcome back to Pretending to Be People.
2167660	2171100	We are here with a special guest right now.
2171100	2179420	It is the GM of the Lost Mountain Saga, one of the best players from Glass Canada Network's
2179420	2180780	Androids and Aliens.
2180780	2185660	It is Eleanor de Lorenzo.
2187180	2188620	Let's get one that the people can hear.
2191580	2196300	It's fun to talk like this, but I don't know if anybody can understand Eleanor de Lorenzo.
2198140	2199180	Hey, Ellie.
2199180	2199680	Hello.
2200220	2201500	I understood.
2201500	2203020	There were compliments in that.
2203020	2203820	I understood that.
2204860	2206860	I sucked that up right up.
2206860	2208300	I picked those out right away.
2209020	2210700	Thank you so much for coming back on.
2210700	2212700	Thank you so much for coming and joining us again.
2213820	2216140	I'm so excited to be back.
2216140	2217260	Thank you for inviting me.
2217260	2222060	If you're listening to this and you haven't heard Ellie on Pretending to Be People before,
2222060	2226380	Ellie was a guest and a player when I ran a homebrew scenario that I wrote,
2226380	2230380	Bigfoot Underground Search and Hunt for her and some other guest players.
2230380	2232940	And we had an absolutely phenomenal time.
2233660	2238140	You were such a wonderful player that I was so excited to bring you back on.
2238780	2242940	Another huge reason that I was so excited to bring you on is when I told Thomas, I was like,
2242940	2247740	Hey, dude, Ellie from A&A is coming on Pretending to Be People.
2247740	2248060	Yeah.
2248060	2251420	And then you had her play with a bunch of people who weren't fans of that show,
2253740	2255820	which as a fan was like, well, that's a bummer.
2257500	2262620	Couldn't have anyone except me getting too starstruck on her first appearance on Pretending
2262620	2263260	to Be People.
2263260	2263740	Fair enough.
2263820	2268460	You wanted to protect her from what's about to happen.
2268460	2268960	Yes.
2269660	2273580	Slobbering idiots of the PTBP pod.
2273580	2275260	I love slobbering idiots, though.
2275260	2277260	That's what I'm more comfortable with.
2277260	2277980	Do you know what I'm saying?
2278540	2282140	Now I played with very talented, wonderful women and they were all great.
2282140	2284460	But that sounds deeply intimidating.
2286540	2287660	They were hot.
2287660	2290460	They stared at me with their hot eyes.
2290460	2293500	And one of them was apparently married to you, Zach.
2293500	2294300	That is correct.
2294300	2294700	Yeah.
2294700	2295260	Apparently.
2296780	2297420	Apparently.
2298060	2298300	Yeah.
2298300	2300140	Allegedly married.
2300140	2302220	Taylor and her hot eyes are married to Zach.
2303420	2304940	I'm an allegedly lucky man.
2308940	2309440	Okay.
2309980	2313340	I'm not going to correct that just because I'm waiting for all the chinks in your marriage's
2313340	2316940	armor to collapse at once.
2316940	2317660	Coming in hot.
2317660	2318300	Coming in hot.
2318860	2319500	Love it.
2319500	2320860	I'll have to beat Luke off, but.
2321820	2322220	Wow.
2322220	2322940	I'd watch that.
2323500	2326700	Well, so Thomas, are you married?
2326700	2327660	Uh, no.
2327660	2328460	No, I'm not married.
2328460	2329740	You said that very quickly.
2329740	2332460	No, it was like, it was like a gut reaction.
2332460	2332700	No.
2332700	2334220	Well, I remembered that I wasn't.
2335180	2335420	Right.
2335900	2338140	Well, you looked back at your whole life.
2339820	2343420	Did I leave a wife somewhere along the road?
2343420	2346300	It's like when people ask you if you're like, do you have any kids?
2346300	2348140	And you're like, not that I'm aware of.
2348140	2349260	It's like, do you have a wife?
2349260	2351900	Not that I'm aware of.
2351900	2354540	I'm known for not knowing much about America.
2354540	2361500	And I just realized that I know you guys are from a state, but I don't remember which state
2361500	2363020	right this second.
2363020	2365180	Is it Missouri?
2365180	2365820	It is.
2365820	2367820	Oh, wow.
2367820	2371420	I was going to make a joke about you have a one in 50 shots, so just go for it.
2371420	2373020	You fucking nailed it.
2373020	2373740	I did.
2373740	2374780	Got it in one.
2374780	2378860	It is indeed Missouri, which we like, but a lot of people don't.
2378860	2379660	Oh yeah.
2379660	2380380	We love it.
2380380	2381340	It's nice here.
2381340	2382220	It's really hot right now.
2382220	2383260	Actually, it sucks here.
2384940	2389100	Oh, but still, I would love to go, but like, is it nice because it's like, you know, you
2389100	2393020	can be on a horse ranch and I'm sorry.
2393020	2393580	You can be.
2393580	2395100	Yeah, you can be on a horse ranch.
2396140	2396700	Okay.
2396700	2402860	Well, I mean, I don't make very much money and this is my house that we're recording
2402860	2402940	in.
2402940	2408860	Oh, screw you and making fun of my bullshit New York studio cabin.
2411740	2412620	But that's true.
2412620	2414860	That's a really cool thing about Missouri.
2414860	2416620	You have an actual kitchen.
2416620	2417120	I love that.
2418060	2420300	I want a Missouri kitchen.
2420300	2424460	Let's get into Cal, Colorado.
2425020	2426940	Cal, you've had a very interesting night.
2426940	2432380	I want to dive back into some of the things that you've seen here on this random night.
2432380	2434060	You were, oh, yeah.
2434060	2438780	That makes sense because one of these memories that keeps just blasting into your head as
2438780	2447500	you're leaving the foundry is just this headless, almost headless neck held on by a couple of
2447500	2453580	tendons and skin on one side.
2453580	2459180	Your mind drifts immediately from this severed neck off to your daughter.
2459180	2459740	A little bit.
2459740	2464780	Mostly my mind is just shouting neck hole, neck hole, neck hole as I see like this horrifying
2464780	2468540	like red flash and this image of this nearly headless neck.
2468780	2471580	Neck hole, neck hole, neck hole as you get into your car.
2472300	2476700	Neck hole, neck hole, neck hole as you drive really far back to your home.
2477580	2481180	Neck hole, neck hole, neck hole, neck hole everywhere.
2482060	2486380	Neck hole, neck hole, neck hole as you sit into your chair.
2486380	2489660	And he turns on a 24 hour news channel like he always does.
2489660	2490160	Natch.
2490940	2491980	Drown it out, baby.
2491980	2495500	Honestly, the cleaning person must have turned it off because he kind of likes to just keep
2495500	2496460	it on all day.
2496460	2498620	But yeah, he turns that on.
2498620	2501740	He goes over to his pretty dusty home bar.
2502540	2509500	He grabs a glass and takes a bottle of cheap white wine out of the refrigerator and pours
2509500	2513020	it to the brim and then downs that and pours another.
2513020	2518700	And at that moment, you feel a vibration coming from your pocket and it's not the vibration
2518700	2519820	of a text or a call.
2520700	2522540	Do you not have a phone that vibrates?
2522540	2525500	No, he does, but we don't do vibrates here.
2525500	2528460	We have a ring on this podcast.
2528460	2529020	That's right.
2529020	2531260	Ring, ring, ring, ring.
2531260	2533660	Yeah, he hears the ringtone set to his daughter, Carol.
2536300	2537660	Eleanor de Lorenzo.
2537660	2542060	What is Carol's face look like on the screen of Cal's phone here?
2542060	2545100	It's a young woman, young 20s.
2545100	2549260	She currently looks a little flushed as if she might have been, I don't know, working
2549260	2550300	out or something.
2550300	2555100	But since Saturday night, you might assume that she might be a little tipsy and she's
2555100	2559660	sitting down on a couch that you recognize to be her student room.
2559660	2559900	Hey.
2562940	2566540	Oh, Carol, it's lovely to hear from you.
2566540	2567020	I'm sorry.
2567020	2571180	I've had kind of an extraordinary evening.
2573020	2573820	Honey, how are you?
2573820	2577180	Dad, can you tilt your phone up a little bit?
2577180	2580220	I can't see you like you're filming your forehead again.
2580220	2581980	He tilts it down and you can just see his chin.
2581980	2584940	Is this better?
2584940	2585820	No, please.
2586940	2590620	You remember, like, you can put it a little bit further away from your face.
2590620	2591660	Then that works better.
2591660	2594940	You just see one giant eye as he's looking into the camera lens.
2594940	2595980	It's all right.
2595980	2599020	And she puts down the phone and it's just voiceover.
2603500	2608540	Honey, I'd love to see your darling face, especially with you so far away from home.
2609100	2610700	Please explain FaceTime to me.
2611980	2616540	Oh, Dad, have you been drinking?
2617180	2619340	Not just a little wine.
2619340	2620780	It's a Saturday night.
2620780	2622620	I'm a single man.
2622620	2625420	Can I not enjoy a sifter of wine?
2625420	2626220	No, of course.
2626220	2628540	Actually, that's what I wanted to talk to you a little bit about.
2628540	2632540	I wondered if you have you been doing anything fun lately?
2632540	2633580	Like, except working.
2634780	2636380	Work is fun, sweetie.
2636380	2638140	Your mother and I always tried to tell you that.
2638140	2639100	No, I know.
2639100	2639500	I know.
2640060	2641980	I just, I don't know.
2641980	2642700	I worry about you.
2642700	2647020	That's why I just wish you, you know, would get out there a little bit.
2647580	2650700	Cal thinks about where he just got out to and pauses.
2651500	2655180	And he kind of gulps and he's like, I get out, sweetie.
2655180	2659260	Just today, I saw some corn wrestling while I was out on assignment.
2659260	2662460	They also had crabs, not the men, the farm.
2663420	2664780	They raised corn and crabs.
2665820	2666380	All right.
2666380	2667180	So I get out.
2667180	2669900	Yeah, no, I get it.
2669900	2670460	I know.
2670460	2677660	I just, I don't know if you, I'm sure you already heard, but mom, I think mom's seeing someone.
2678860	2680620	Yes, I heard.
2680620	2682540	He's quite a bit younger too.
2682540	2684220	I heard he was 40.
2684220	2689820	Yeah, but I mean, after you turn 25, it's like age doesn't matter anymore.
2690620	2691120	Oh.
2692080	2698720	She says that with 100% sincerity, because she thinks that if you're over 25, you're
2698720	2704960	ancient and you can tell that suddenly Carol seems a little bit nervous.
2705680	2706960	It's yeah, I don't know.
2706960	2708640	Is there something else on your mind, sweetie?
2708640	2712160	Well, promise you won't get angry.
2712880	2713920	I promise.
2713920	2721040	Well, you know that I know, you know, that I always wanted to make you happy and that
2721040	2724000	that's why I went to journalism school.
2724000	2729040	Of course, just like your mother and I, you went on to journalism school to continue the
2729040	2733840	family business, which is your ultimate dream and desire, of course, right?
2733840	2734560	Right.
2734560	2740160	But well, I've decided and she suddenly gets like defensive as if she's ready to fight.
2740880	2744080	I've decided that I'm not going to do that anymore.
2744080	2749600	I've decided that I am going to pursue something else, something that I am passionate about
2749600	2751120	and it's not journalism.
2751120	2752000	It's not writing.
2752000	2754320	It's not any of that.
2754320	2757280	I have decided I'm going to become a nature photographer.
2760000	2764960	Well, sweetie, that's that's wonderful.
2764960	2765360	Really?
2765360	2769840	You know, photography is still technically journalism.
2773360	2778880	Sweetheart, I just want you to know that no matter what you choose, even if you're not
2778880	2784320	a world class news anchor like me or a Pulitzer Prize winning journalist like your mother,
2786080	2792000	we're happy that what you have chosen is still inexplicably linked to the nexus of
2794000	2799920	of reporting and well, you know, showing the truth of our world to the people.
2799920	2800560	That's what it's all about.
2800560	2805280	OK, well, see, see, that was like I knew that you were going to react like that.
2805280	2808720	So now I'm going to tell you the real my real job.
2811200	2812320	I'm going to tell you the real.
2813200	2815360	It's still related to photography.
2816640	2824960	Yeah, but it's like for like beautiful women posing without clothing.
2824960	2827760	Pornography, pornography.
2827760	2830720	It's not it's not pornography.
2831360	2834240	It's boudoir photography.
2834240	2835600	Oh, I'm sorry.
2835600	2836720	Nerd pornography.
2840880	2841840	See, this is the thing.
2841840	2842880	You never understand.
2842880	2844080	You mock everything I do.
2844080	2845680	That's the problem with you and mom.
2845680	2846880	You're both academics.
2846880	2848400	And I don't want to be involved with this.
2848400	2850080	Like, I don't want to go to school anymore.
2850080	2851280	I'm going to buy my camera.
2851280	2856480	I'm going to take pictures of my friends and and they will pay me eventually.
2856480	2859440	And then I'll start an Instagram account and I'm going to make a lot of money.
2859440	2861040	And there's nothing you can say or do.
2861680	2864080	And yeah, roll grip check, dad.
2864080	2866080	No, I think he's no, no, no.
2866080	2867040	This is hold on.
2867040	2869680	This is specifically because of what you've seen tonight.
2869680	2871840	And the amount of grip that you lost.
2871840	2874400	It is going to affect the relationships that you have.
2874400	2874800	Yeah, I know.
2874800	2877760	But I was like what I was just about to say was all about that.
2878320	2878880	Oh, okay.
2878880	2880400	Why it actually wouldn't.
2880400	2882880	Well, that's part of the game is you have to roll to do that.
2885520	2889120	Yeah, he hates the dice, but he succeeds.
2890080	2890480	Okay.
2890480	2890720	Yeah.
2890720	2891280	All fair enough.
2891280	2898720	Uh, so you see from the part of your father's chin that you can't see it like quivers a
2898720	2905360	little bit, but then he, then he composes itself and he says, honey, your mother and
2905360	2908400	I will support you no matter what you choose to do.
2908960	2910480	We only want you to be happy.
2910480	2916000	And tonight I saw some horrible things that I can never unsee.
2916720	2922880	If you can make beautiful art and put it into this world, that is enough for me.
2923760	2926960	You're going to want to approach this more carefully with your mother.
2927840	2929600	We may not tell her until you've graduated.
2930480	2931760	Well, I'm not going to graduate.
2931760	2932640	That's the thing.
2932640	2934000	Right, right, right.
2934000	2937600	Until you burlesque photography.
2937600	2943440	Well, I'm, this is a whole new world for me, pumpkin.
2943440	2946320	So dad, are you, are you all right?
2946960	2948640	You said you've seen some horrible stuff.
2948640	2949920	I didn't see a neck hole.
2951520	2952000	Sorry.
2952000	2954160	Uh, one of the wrestlers broke his arm.
2954160	2955360	It bent the wrong way.
2955360	2956400	It was gnarly.
2958560	2960800	I love that Cal picked up the word gnarly from Beck.
2962800	2964000	Oh no, Jesus.
2964000	2964320	All right.
2964320	2965440	Is he going to be okay?
2965440	2966000	Yes, sweetie.
