start	end	text
2966000	2967280	I think he'll be fine.
2967280	2973360	Everything will be fine in the world and you will, no matter what you choose to do, you
2973360	2975440	will be an important contributing part of it.
2975440	2977600	And your mother and I love you very deeply.
2977600	2981680	Well, I love you too, dad, but, and she's starting to get worried.
2981680	2984160	Like, wow, he really needs to start getting out there.
2987520	2992560	I don't know that I know it's not my business, but I think it would be good for you to like,
2993200	2998640	there are apps you can download that would like match you with other women.
2998640	3001200	I just don't want you to be like, be alone.
3002160	3004320	I'm not alone, sweetie.
3004320	3007200	I have you, I have my memories.
3007200	3009360	He points to all the pictures around the house.
3009360	3010800	Oh my God.
3010800	3012960	See, that's the definition of being alone.
3014320	3017200	But I will try to get out there more.
3018000	3020000	What are these women apps you told me about?
3020800	3023840	Well, one of them is called Bumble.
3025200	3028160	I mean, like when you've downloaded them, let me know and I'll give you some advice
3028160	3033840	because you can't be like, like, don't start commenting on women's profiles like a weirdo.
3036160	3038000	How do you comment like a normal low?
3038000	3041680	Well, you just wait for them to like, you put up a nice picture of yourself
3041680	3043600	and then you write something nice about you.
3043600	3048480	Like you're an established journalist and then you wait for women to contact you.
3048480	3051120	Is there an app that finds me a woman exactly like your mother?
3054320	3054800	Dad.
3055920	3056420	What?
3058160	3062320	Maybe you should go for the complete opposite.
3063520	3064080	Like a guy?
3067280	3067920	Well, maybe.
3069440	3070320	I don't know, man.
3073120	3077680	Carol, I promise you, I will look into online dating.
3077680	3078000	All right.
3078000	3079360	Carol, exciting news.
3079920	3082400	Do you post your boudoir pictures on TikTok?
3082400	3083120	Well, okay.
3083120	3085920	So dad, you can't follow my friends.
3085920	3087760	Like, they are not part of the dating pool.
3088720	3089520	No, no.
3089520	3090400	Have you heard of this?
3090400	3091520	Have you heard of TikTok?
3093680	3095200	Of course I've heard about TikTok.
3095200	3095920	Oh, I'm sorry.
3096640	3099120	Well, I learned about it today and I did a dance.
3100160	3102480	Carol, no, you should see the dance I did.
3102480	3105120	It's posted on the can TikTok for the station.
3105920	3106720	People liked it.
3108480	3110000	Hey, you'll see, I'm out there.
3110000	3115600	Hey Carol, when you pull it up on your phone, you see it's called the calzone.
3115600	3116160	Oh God.
3116720	3117520	Oh God.
3117520	3122720	And he's doing a dance with a random guy on the street who's doing a very cool dance where
3122720	3128880	it looks like he's sitting while he's upright and dancing around in the sitting position.
3128880	3131600	And Cal does it perfectly alongside of him.
3131600	3132320	Wow, dad.
3132320	3134000	Actually, that's pretty impressive.
3134000	3136160	You should actually, you should keep doing that.
3136160	3140000	I'm in a weird twisted reality that we currently live in.
3140000	3143360	You would actually find more dates based on this video.
3143360	3145120	With women like your mother?
3146160	3150400	Maybe women like my mother.
3150400	3156160	Sure, but you should not narrow your, like, there are plenty of women out there that aren't
3156160	3156720	like mom.
3157360	3158560	Oh, well, that's the problem.
3160240	3160960	All right, dad.
3162160	3166960	I have to go, but thank you for being supportive of my choices.
3166960	3171200	Try to get some sleep and then maybe we'll, yeah, we'll, I'll check in with you tomorrow.
3171680	3177360	But I still, until I have some money, maybe don't cancel my credit card yet.
3179520	3181680	I wouldn't dream of it, sweetie.
3181680	3186000	But again, don't tell your mother she would cancel them in a heartbeat.
3187200	3188160	Thanks, dad.
3188160	3190560	Yeah, take care of yourself and I'll talk to you tomorrow.
3190560	3192560	I love you very much.
3192560	3193920	I love you too, dad.
3193920	3195680	And I, yeah, thank you.
3198160	3198660	Thank you.
3199220	3201540	This has been Cal Colorado.
3201540	3202580	Have a pleasant evening.
3203700	3205140	You really don't have, okay, fine.
3208740	3211300	Ellie, thank you so much for coming on the show.
3211300	3211940	Oh my God.
3211940	3212420	That was great.
3212420	3212980	That was fun.
3212980	3219300	I'm very much looking forward to seeing how this relationship thrives or...
3219300	3220260	Yeah, it was very normal.
3220260	3225060	Like, I love how, like, I expected Zach to come in and be like, and then all of a sudden
3225060	3227540	her head falls over, like she dies.
3228180	3229460	And I'm like, okay, cool.
3229460	3230580	We got a long ways to go.
3230580	3232660	We got time to fuck this shit up.
3232660	3235140	Yeah, there can definitely be a phone call where your head falls off.
3236020	3237220	Hey, if that's what you want.
3237220	3240500	Is season two a homebrew as well?
3240500	3241460	Yeah, very nice.
3241460	3242420	It's all I can do.
3242420	3243220	I don't like reading.
3244260	3245300	You actually can't.
3246740	3247700	I'm too stupid.
3248340	3248980	It's a shame.
3257540	3277540	My life is great and it's all mine Cause my life is great and it's all mine
3287540	3288620	I
