start	end	text
3088100	3088580	Say it.
3089140	3090340	Zach likes it loose.
3095540	3096740	All right, good talk everybody.
3096740	3098420	Did you see my chat to the group?
3098980	3099220	Yes.
3099220	3099460	Yep.
3099780	3103860	Okay, what's Chippy doing?
3103860	3109780	Chip is sprinting as fast as his little chubby legs can take him to try and get to Murphy.
3109780	3112900	Oh yeah, you may get to the vent that's on the other side.
3112900	3116260	Is there a little, can I, is there like a little pocket I can squeeze through in the
3116260	3116980	ventilation?
3119380	3119860	What happened?
3120980	3123620	Yeah, but it's a really wide-
3123620	3124980	No, no, no, listen to me.
3125940	3126020	It's round.
3126020	3127060	It's really wide.
3127060	3132500	But it's really wide and there's some like oil that's just like dripping from it.
3132500	3133300	It's very strange.
3135060	3136420	Wait, what are we talking about?
3136420	3137540	Are we talking about your wife?
3139700	3140420	Holy shit.
3140420	3142900	That is extremely rude, Justin.
3143540	3147220	Yeah, why would you ever say that to me?
3147220	3165220	We are not lazy enough, basically.
3165220	3169060	Did Thomas just say, I'm the devil and I'll be back?
3169060	3170660	Yeah, I think that's what this meant.
3170660	3172260	Oh, Jesus Christ.
3173220	3174580	One, two, three.
3177940	3179300	All right, let's get back to it.
3179300	3183860	My earphones just said my battery is low, so I don't know how much, I don't know what
3183860	3184340	that means.
3185460	3186340	Wait, what?
3187300	3188580	I've got these wireless.
3189220	3189620	Yeah.
3189620	3192260	Can you plug them in while you're wearing them?
3192260	3195940	The cord's like this long, but it should, it should be fine.
3197300	3198420	So let's keep going.
3199060	3199780	Some-
3199780	3200260	Body.
3202260	3202760	Morns.
3203620	3204020	Yeah.
3204100	3211940	On my Animal Crossing game, I made the town theme song All Star.
3213060	3213940	That's really cute.
3214660	3221700	Okay, so you guys are on the outside of this window and the Wilson the woodpecker just
3221700	3224660	asked to turn the glass off.
3224660	3232980	The two dogs are right behind the woodpecker and Chip the chipmunk is about to bust into
3232980	3234900	a grate that is into this room.
3234900	3236660	Chip is always about to bust.
3239780	3242180	I explained that to Murphy.
3242180	3244660	I'm like, hold on there, little fella.
3245220	3248420	Help is coming in the form of a chipmunk.
3248420	3249380	Please don't eat it.
3250580	3255300	Although you might be tempted, he is on our side and he's going to help you get out of
3255300	3255860	that room.
3255860	3258500	I'm curious, do you guys have a plan, Chip?
3258500	3260660	Do you have a plan to help him get out of the room?
3260660	3264820	A real leader takes action and then thinks about it much later.
3264820	3270660	I'm assuming since we're all animals at every door in this hotel is a lever, not a knob.
3271220	3273060	This is a hotel motel for humans.
3273060	3274740	No, it's one of those things.
3274740	3275380	It's a push.
3276580	3278100	So it's just got like a push bar.
3278660	3279860	So none of the doors lock?
3280500	3281380	No, those lock.
3281380	3282980	You just have to use an Allen wrench.
3282980	3286340	I'm going to shout at Murphy from the ventilation.
3286900	3287400	Murphy.
3288180	3288740	Yeah.
3288820	3289860	Now I'm going to come on down.
3289860	3290740	Don't eat me now.
3291300	3291800	Okay.
3292900	3297620	I just really need you to promise me that there ain't going to be no eating of old chip
3297620	3298120	tonight.
3298740	3299700	Roll intelligence.
3300340	3302420	I would never even consider it.
3302420	3304100	I pass 38 on a 40.
3304100	3306420	Oh yeah, no, he would never even consider it.
3307300	3308660	All right now.
3308660	3312260	Well, to be fair, the real Murphy would absolutely consider it.
3312260	3315300	But if you explained it to him, he would know to hold off.
3316020	3317140	That's good to know.
3319380	3323700	Chip will, however he got through the other ventilation, like, I don't know, is it from
3323700	3326260	the ceiling I'm coming or below?
3326260	3326900	Oh yeah.
3326900	3327220	Yeah.
3327220	3327940	From the wall.
3327940	3331460	I have a climbing skill to, to get out safely.
3331460	3331960	Perfect.
3332660	3335780	Describe how you rappel down this hotel wall.
3335780	3341780	Well, uh, chip wants to use some of his old combat moves from the old days.
3341780	3345540	So I'd like to think he like does like a sick ass, like combat role.
3345620	3348740	Like he like slides down the wall with one hand on the wall.
3348740	3353540	So it slows him down with his little tiny, weird, creepy fingernails that rodents have.
3353540	3354820	And he goes down really slow.
3354820	3359060	And then as he lands, he does like a little combat role and like jumps up and he's like,
3359060	3360260	Oh, I love it.
3360260	3362020	Very, very flashy entrance.
3362020	3363380	He's like, now is my time.
3364820	3370980	Speaking of combat and Murphy, he has, uh, he has a hundred in all stats and he, instead
3370980	3373380	of three health boxes, he has a billion.
3373380	3376180	So, so you can't hurt him, Zach.
3377380	3378900	I think you know me better than that.
3380980	3381220	Yeah.
3381220	3381860	I think I do.
3382500	3383940	What do you think of me?
3383940	3386660	I think he would hurt my dog in a role-playing game
3392020	3395380	to elicit like a genuine emotional response from your players.
3396580	3401620	Tyler sees chip fall into the room and he goes and bumps his face into the window.
3401620	3402020	Excited.
3405140	3405640	Yeah.
3406180	3410660	Both the dogs seen the chipmunk forget it's their friend and like bark.
3412580	3417220	When Tyler bumps into the glass, uh, I'm like, Oh, that's a pretty good idea.
3417220	3419380	And I start pecking at the glass.
3420820	3423860	Oh, that's your skill.
3423860	3427700	I'm going to use my pecking skill to pack the glass.
3427700	3428660	Can you break it open?
3429860	3430360	Okay.
3431320	3435960	Luke Wilson, the woodpecker is standing on that little ledge that windows have.
3436840	3445880	And you begin slowly pack, pack, pack, pack, pack, pack, pack, pack, pack, pack, pack,
3445880	3451080	pack, pack, pack, pack, pack, pack, pack, pack, pack, pack, pack, pack, pack, pack,
3451080	3458840	and you start seeing like shards and then sparks as you're going so slowly.
3459800	3465640	So slowly through this glass, but your beak movement is so fast that these little
3465640	3468360	shards sparks of glass begin flying out.
3468360	3474760	And then finally you can smell the stale motel air on the other side.
3475400	3478120	And then the camera zooms out really fast and there's a
3479480	3482040	as a bunch of different spider web breaks on the glass.
3482040	3487240	And then it into pebbles as both dogs from the outside.
3488200	3488700	No.
3489560	3499160	As Murphy on the inside comes bounding through the glass to the outdoors being ridden by chip.
3500040	3501800	And what is chip doing on top?
3501800	3506840	He's a writing it like a Khaleesi does on the dragons where he's like holding it.
3512360	3513160	That's great.
3513160	3516920	He's up near its neck, like holding it and trying to guide it.
3517240	3520920	Rusty gives Murphy a big old lick on the face because he's a good boy.
3520920	3523160	And a lick is returned.
3523160	3524200	Tyler sniffs his ass.
3525000	3525960	Oh, how rude of me.
3528200	3529480	Rusty sniffs his ass too.
3531880	3533160	What kind of vibe do I pick up?
3535160	3538600	Would we know Murphy or is Murphy news to us?
3538600	3546920	So Murphy is just you've heard tell that there's an old wise wizard that lives in
3546920	3554520	Hotel Motel, but you've never you've never met this Murphy, but he seems to just be
3554520	3557800	here passing through or for a short time.
3557800	3563400	No one really passes through contention, but people do come and leave shortly thereafter.
3563400	3568600	Now, Murphy, we're part of something called the Contention Creek Critter Coalition,
3568600	3571400	and we're here to help all the animals we can.
3571400	3573240	And in particular one that's upstairs right now.
3574920	3575800	We got to get up there.
3576280	3580840	Murphy, have you have you smelled the other dog around here, Bean?
3580840	3581560	Oh, yes.
3582680	3585000	Up in room seven.
3586120	3587720	Can you could you guide us there?
3588280	3589800	Well, but of course.
3591000	3592920	And then you're all standing outside room seven.
3592920	3593880	Let's do it again, boys.
3593880	3594680	Come on.
3594680	3595000	Same.
3595000	3595160	Yeah.
3595160	3595960	Same game plan.
3596520	3597480	Go for it, Willy.
3597480	3598200	Holy shit.
3598200	3600120	OK, hold up.
3600120	3608760	Cut to the glass shattering as Bean, a gorgeous golden retriever, jumps through the window
3608760	3610440	with Chip on his back.
3614200	3615080	And we won.
3615080	3617080	Thanks for subscribing to the Patreon.
3619480	3620600	Is this a Patreon episode?
3621240	3621960	Oh, it's high.
3621960	3622460	Well.
3623880	3624760	Go do it anyway.
3626360	3627960	Thanks for nothing, cucks.
3627960	3629160	Subscribe to the Patreon.
3630360	3631960	Oh, boy.
3631960	3633640	We got to get you back to safety, Bean.
3634680	3636200	Wait, did that actually happen, though?
3636200	3637480	Oh, hell yeah.
3637480	3638040	Give us a.
3639480	3641000	Hey, Luke, what is Bean sound like?
3641000	3641400	Yeah.
3641400	3642600	What should I do?
3642600	3644200	Oh, he's like.
3645160	3649320	Remember, you have the opportunity to describe a voice that Zach has to do.
3649880	3650760	Do not waste.
3654760	3656840	He sounds like Captain Peanut Butter.
3656840	3658200	Mr. Peanut Butter?
3658200	3659640	No, Captain Peanut Butter.
3659640	3661640	The like Lumberjack.
3661640	3662680	Mr. Peanut Butter.
3662680	3664520	It's Mr. Peanut Butter's brother.
3664520	3665720	Mr. Peanut Butter's brother.
3665720	3666200	Gotcha.
3666200	3666680	Yeah.
3666680	3667880	BoJack Horseman, y'all.
3667880	3668200	All right.
3668200	3670360	Just do an excited Labrador voice then.
3675080	3677480	So exactly Joe's voice.
3677480	3680120	Do a different dog's voice for this dog.
3684600	3685960	Does someone fart?
3685960	3686680	What was that?
3686760	3687560	Was that Luke?
3688360	3689400	What did you fart?
3690520	3692200	I think it was my chair.
3693480	3698200	As soon as that sound happens, Luke, you coincidentally made a face like you farted
3698200	3701160	and you knew it and you're a real squeaker.
3702120	3705000	My headphones keep telling me I got low battery, so I was like.
3708120	3710040	Luke, what is Bean sound like?
3710040	3713880	Okay, he sounds like Woody from Toy Story.
3713880	3715400	He sounds like Woody the Woodpecker.
3716840	3720200	I'm Bean.
3721960	3722520	There you go.
3725000	3729000	Since Bean's dad is a cop, he's like a rebellious teenager.
3729000	3729720	Okay.
3729720	3731160	Yeah, that's good.
3731160	3732840	Thanks for saving me, guys.
3732840	3735080	But I was fine in there alone.
3735080	3736840	How long have you been in there?
3736840	3737720	How long have you been in there?
3737720	3740200	Also, keep in mind, everyone loves this guy.
3743240	3745560	I thought Bean was the smartest voice.
3746760	3748440	Most compassionate and caring.
3748440	3749720	What's up, fuck sticks?
3752760	3754600	I'm so fucking smart.
3754600	3756520	Hey, pussies, is your mom hot too?
3761640	3762440	Jesus.
3762440	3764040	Do you guys want to sniff my butt?
3764040	3766920	If you'll let us.
3767480	3768680	Yeah, hop on back here.
3770040	3771320	Got you, dude.
3771320	3772280	Ah, shit.
3773240	3773640	Rusty.
3774200	3776760	Did you guys see Rusty get a rusty eye?
3776760	3777960	Oh, shit.
3777960	3783080	Rusty is unbelievably honored that you would gift him with that extra smell.
3783080	3784040	Dude, hell yeah, man.
3784040	3785480	You got my stink on you now.
3785480	3786200	Do you love it?
3786920	3787560	I do.
3787560	3788040	That would.
3788040	3789320	Do you fucking love it?
3789320	3790360	Let's get out of here, bro.
3790360	3793400	That's one of the finest ass smells I've ever smelled.
3793400	3794360	Oh, hell yeah.
3794360	3796120	Thanks, Luke, for doing this to me.
3796120	3798360	How long have you been trapped in here?
3798360	3799080	Oh, God.
3799080	3800440	This piece of shit, man.
3800440	3801560	I don't even know.
3801560	3805640	He's my bro-lo for ro-lo, but I don't even know-lo.
3807720	3809960	How are you surviving in there all alone?
3809960	3813000	Honestly, just jacking it nonstop.
3813640	3816440	Just little red riding head lipstick in this motherfucker.
3816440	3817320	Jack links.
3817320	3818680	There's a bunch of jerky in there.
3818680	3820520	Oh, just rocking my jerky.
3822840	3824040	I hate this character.
3824040	3825080	I hate this character.
3826840	3829240	Yeah, let's put him back.
3829240	3830680	Let's not rescue this guy.
3830680	3831180	Yeah.
3833080	3835080	Hey, Luke, what does Bean sound like?
3835080	3836440	Like a little tiny girl.
3843080	3844840	Thanks for saving me, guys.
3844840	3848840	As you bust through, and the glass just pebbles down and cascades,
3848840	3854120	and you're all standing there in a line from, like, tallest in the middle,
3854120	3857880	and then, like, well-crafted shot design all the way through,
3857960	3860920	and you're all standing in a line sideways, it's beautiful,
3860920	3864280	and the glass just, like, shatters at your feet into pebbles,
3864280	3867160	and then you see, like, in the foreground,
3867160	3871560	the animal control van pulls up, and it is game time.
3871560	3872280	Oh shit, the fuzz!
3874920	3877160	The fuzz is here, but we can take him?
3877160	3882920	Chip starts punching his little tiny fist into his little tiny hand over and over again.
3882920	3885400	Make him surfer god instead of little girl.
3885480	3886920	No time to sniff butts.
3887560	3889640	We've got the man to take on.
3889640	3891160	It's time to...
3891160	3893000	To roll initiative, doggy style.
3895880	3897800	Yes, a hundred percent that.
3897800	3902920	Lettuce, tomato, roll your dice on dexterity.
3902920	3904200	It's a deck structure.
3904200	3905000	That's my worst.
3905880	3907880	I got a 47 on a 60.
3907880	3909080	I failed.
3909080	3910600	17 on a 20.
3910600	3913080	I passed with a 38 on a 70.
3913080	3921640	The animal control folk rolled a 66 on a 60.
3924040	3926120	So you will all get to go first.
3926120	3928520	So you guys can decide as a group.
3929800	3931000	Yes, absolutely.
3931000	3931720	Literally, it's...
3932760	3933800	God, who should it be?
3933800	3936360	It should be a pair of doofuses.
3936360	3940760	Well, I imagine it's just Ron and Hugo from...
3940760	3941960	Oh, that's better.
3941960	3943480	Except Rip Harris.
3944840	3946600	Yeah, it'll be an honor.
3949320	3951480	No, they're both Sewage Joe.
3951480	3952200	Who's that?
3952200	3953160	Sewage Joe?
3953160	3954120	From Parks and Rec?
3954760	3955240	Oh, yeah.
3955240	3957080	Oh, the perverted guy.
3958040	3958540	Yeah.
3959000	3964200	One of them and then the surgeon on scrubs with the do-rag.
3964200	3965080	Oh, the Todd.
3966600	3967720	The Todd.
3967720	3969080	Hell yeah, it's the Todd.
3969080	3973000	And Sewage Joe.
3976040	3977000	Fantastic.
3977000	3979720	And both in dark blue jumpsuits.
3979720	3981640	Oh yeah, I like that.
3981640	3983560	And they both have taser guns.
3983560	3985480	No, not guns, prods.
3985480	3985980	Oh no.
3986600	3988120	And they're just coming from Murphy.
3988120	3994040	No, they're just coming from Murphy.
3994040	3996200	Sacrifices themselves so that we may go...
3998920	4000440	I quit the podcast forever.
4002120	4003000	I love you, Luke.
4003000	4003800	I love you, Justin.
4003800	4004600	I love you, Joe.
4005880	4006840	Fuck you, Zach.
4008520	4010040	It's just that it's 2020.
4010040	4012040	It's gotten me all shook up.
4012040	4013320	I'm gonna go hug my dog.
4015480	4017000	Okay, it's game time.
4017000	4018600	When they pull up, I look at the other guys.
4018600	4023560	I'm like, they cut down my favorite tree just because I was pecking on it in the park.
4023640	4024600	Fuck these guys.
4025560	4027160	Yeah, these guys are bad news.
4027160	4030280	They've been looking for me for days and I've been out running them,
4030280	4032120	but I don't know how we're gonna get out of this, guys.
4032120	4032920	They're right there.
4032920	4037080	It don't take much to get old Chip all riled up for action.
4037080	4042040	First of all, Willie, you know, I don't know much about human bureaucracy,
4042040	4044200	but it seems like that must have been unrelated.
4044200	4047560	I don't know if that's within the purview of animal control.
4048760	4050440	I'm learning a lot of new words today.
4050440	4052520	Bureaucracy, window, glass.
4054200	4055400	It's a big old world.
4055400	4062040	All I know is I've got it out for these fuckers and I take off and I fly towards them
4062600	4066120	and I take a shit aiming for Todd's eye.
4067160	4069320	Yes, dive bomb.
4070600	4075720	Okay, yeah, we'll just do all of these as contested rules, I suppose.
4075720	4079080	And if you hit the same person twice in a round,
4079080	4084440	then they'll be at a disadvantage for that second and whatever role.
4084440	4086840	He's gonna try to high-five it out of the way.
4087960	4093080	You're gonna roll Dexterity or Intelligence, whichever one is higher,
4093080	4097720	unless you have a special skill that would help more in a shitty situation.
4097720	4100040	Oh shit, my headphones just died.
4101240	4104040	Well, Luke, time to find some more headphones to put on.
4104680	4108200	In the meantime, I'd be interested to see what he rolled
4108200	4114920	because I rolled a 49 on the Todd's ability to high-five.
4116680	4117480	Probably pretty high.
4118360	4121480	Okay, so I'm gonna roll Dexterity.
4121480	4122040	Is that what he said?
4122920	4125000	Yeah, or Intelligence, whichever one's higher.
4126360	4127880	I already told them what I rolled.
4127880	4130520	I got a 51 on a 60.
4131640	4132200	Nice.
4132200	4132840	What did you get?
4132840	4136360	Dude, you got a 49, you fucking...
4136840	4138360	You barely beat the contestant.
4138360	4139000	That's so good.
4139000	4144360	As the Todd goes to high-five the stream of shit, it goes right...
4144360	4150760	It literally curves around his hand like James McAvoy shooting a bullet,
4150760	4156360	and it hits the Todd square in the eye, disabling him for the entire round.
4156360	4158360	Rusty barks in approval.
4159400	4160920	Did you guys see that shit?
4160920	4161880	He sure did.
4161880	4163880	God.
4163880	4168840	I don't get it.
4169880	4176280	The rest of you can decide on an idea where you could help each other do something,
4176280	4182040	or basically you have the entire round yourselves before there's a reaction from Sewage Joe.
4183800	4184920	Listen, y'all.
4184920	4191000	We've got four dogs and a chipmunk, and they're just two stupid humans.
4191000	4194520	I think if we work together, we can herd these fuckers.
4194520	4196840	We can round them up and take care of business.
4196840	4200600	Rusty, you think you could throw me on one of them son of a bitching guys?
4201240	4202120	No, I'm a dog.
4202120	4203720	I don't have opposable thumbs.
4203720	4210280	Now I'm talking like using that big old mouth of yours, wiggling me around, tossing me up on them.
4210280	4212680	Then I can do some good work up close.
4212680	4217240	I'm afraid if I get you in my mouth, the temptation to just chomp down will be too high.
4217880	4219400	Tyler runs over and does it.
4221480	4222120	Oh shit.
4224120	4228440	He just flings you with his head real quick in one swift motion.
4229240	4233800	I want to be flipped at the guy who has shit in his eyes and face,
4233800	4237800	so that he doesn't see the beat down that's coming to him.
4237800	4242040	Yeah, so he's got disadvantage, like a lot of it.
4242040	4243400	No, he's like fully disabled.
4244280	4247640	Okay, I want to describe something terrible for you.
4249960	4250360	Do you?
4251960	4253240	I really do.
4253240	4259800	Do you want a mass walk out of your podcast when you fuck with these adorable animals?
4261240	4264440	Choose your words carefully, motherfucker.
4264440	4268120	I always try not to say um or like, but I still do sometimes.
4268120	4268680	It's okay.
4270120	4271480	Um, like is it?
4273160	4277800	As Chip is being flung at the Todd,
4277800	4284360	who has his eyes covered in the fecal matter of Wilson the woodpecker.
4284360	4287720	It's getting in his mouth because it's open because he's screaming about it
4287720	4291240	and it's dripping down into his mouth and it's all over his tongue.
4291240	4294120	Like he just licked ice cream, but it wasn't his bird shit.
4294120	4298680	And he's like, no, no, you hit him square in the jaw.
4299480	4304680	And at the exact same time, you see a masked bandit
4305320	4309960	who has snuck out of its cage in the back of the animal control truck
4310920	4315400	and is hitting the Todd on the opposite side of the head in the opposite direction
4315400	4318440	at the exact same time as you're hitting his chin.
4319000	4328600	And the two of you chip the chipmunk and Rocky the raccoon just snap the Todd's neck.
4330760	4334280	As his shoulders hit the ground, so does the back of his head.
4334680	4337320	Front of his shoulders, the back of his head.
4341320	4347960	So facing up is his back and a face that's covered in Wilson the woodpecker shit.
4348600	4349080	William.
4352280	4353400	It's Wilson.
4353400	4354120	It's Willie.
4355640	4356360	Is it Wilson?
4357160	4358200	I thought it was Willie.
4358200	4359160	You didn't call me Willie.
4359160	4359880	I have been.
4360520	4361000	It fits.
4361320	4374120	Seeing that, Rusty gets into an aggressive stance and it starts growling at Sewage Joe.
4374760	4376920	And I just want to try to intimidate him.
4377480	4380280	We just killed your motherfucking co-worker.
4381720	4384600	Why don't you step the fuck off, idiot?
4384600	4387080	We'll roll power against power.
4387720	4397960	Now I'm going to say Sewage Joe has a mental power of 30 because he's a flatter thing.
4401880	4404680	Rusty is not super physically gifted.
4405720	4409320	He's got a 20 decks and a 30 strength, but he has a 70 power.
4409320	4410760	So unless I fuck up the roll.
4413080	4413720	No, fuck.
4414520	4415880	I rolled a 75.
4415880	4416600	That's over, right?
4417080	4417960	I rolled a 13.
4419960	4421960	There was so much opportunity.
4421960	4425480	I thought that you critically failed based on your reaction.
4426600	4429400	I just thought there was like, yeah, you were going to win.
4429400	4429880	It's good.
4429880	4432200	I like that amount of commitment.
4432200	4433320	That's just my face, man.
4434760	4435640	I like your face.
4435640	4436520	Thanks, baby.
4436520	4445080	So I want you to tell me what is going through the mind of this Sewage Joe.
4445960	4448760	When he looks into the eyes of Rusty.
4448760	4456040	So as soon as Joe sees his best friend in the world, the Todd, shit on and like that
4456040	4457240	like freaks him out.
4457240	4463320	But then he sees his fucking neck get snapped by a chipmunk and a raccoon.
4464200	4469000	And then Rusty in the lead, Bean and Murphy flanking him.
4469960	4473160	Maybe Tyler's chasing his tail in the background.
4474120	4479240	But these dogs with their hackles up are like slowly advancing on him.
4479240	4481320	And you see the wolf in them.
4481320	4485960	They're a pack of predators and they're just staring him down and growling.
4485960	4488600	And he knows he needs to get the fuck out of there.
4489560	4494440	It convinces Sewage Joe to drive you all back to the creek.
4496680	4497800	Isn't it just right there?
4500360	4501720	That would take longer.
4501800	4508840	Rusty like locks eyes with him, growls and then points his snout at all the cages like
4508840	4509340	in the back.
4510040	4513960	And he intimates that he needs to free the other animals as well.
4513960	4516840	Oh, yes, no, I will be just one moment.
4516840	4517800	I will do that.
4517800	4520840	If he takes his time out here, I will head in there and I will take care of it.
4520840	4522120	And then I will be right back.
4522120	4523560	You started out French.
4524280	4525720	No, I have never been French.
4525720	4528760	I have only been what I am, which is Rocky the raccoon.
4528760	4536600	And I will easily take everyone and get them out of there if you just have him stand there
4536600	4537320	real quick.
4537320	4538360	Yes, of course.
4538360	4544360	And so he, this little raccoon runs into the back of the animal control van.
4544360	4549400	And soon there's a parade of animals, three long.
4550360	4555880	It's the raccoon that just went in there, a fox, a little red fox.
4556680	4559800	And there is a goat.
4561640	4566120	Fox and a goat and a raccoon, but that's too many character voices to do.
4566120	4569160	So we're going to get you guys back onto the Creek.
4569160	4574760	And so can I, can Wilson do something else to enact his revenge?
4575320	4577240	One bit of revenge from Wilson.
4577240	4577560	Wait.
4577560	4577720	Yeah.
4577720	4578920	Cause they cut my tree down.
