start	end	text
1553620	1558660	Even though the water is in between them and they can't get it there, they see, it sees
1558660	1562420	more that it can consume and therefore is distracted.
1562420	1567380	And the four of you make your way to the main drag of contention.
1567380	1573380	And you know that just on the other side of this drag is hotel motel, where the dopest
1573380	1576020	of dopes Bean resides.
1577140	1583060	As you approach this business highway, Wilson, are you in the air or are you on the ground?
1583060	1588820	In the air, but I'm like, uh, like on the ground critters level, like just like a foot
1588820	1590420	above, foot above the ground.
1590420	1597140	Up above you see, no, it, it can't be it's, I mean it is a possum, but it's not just
1597140	1597940	any possum.
1597940	1601620	It looks like it's, it's your friend.
1601620	1602740	It's common.
1602740	1605060	And he is laying on his back.
1605860	1611460	This adorable, adorable little possum that Wilson has known for years and years, just
1611460	1613300	right there on the side of the road.
1613300	1616580	I land and go over to him and like pick him.
1616580	1618820	I'm like, you do this all the time.
1618820	1619460	Come on, man.
1619460	1622260	Hey, what the fuck are you doing there, buddy?
1622260	1627540	You can't just come into me with your beak all like sharp and whatnots on me.
1627540	1629460	Why are you playing dead over here?
1629460	1634500	Well, you see, there was some of the mess coming through the area and heading on down
1634500	1636580	to y'all in the water.
1636580	1642740	And it don't find me nothing to be consuming for when I be laying on the backside.
1642740	1645300	Rusty sees a possum and starts barking.
1645300	1651380	Hey, why are you just barking when you could say words at me, friend?
1651380	1653620	Tyler starts barking because Rusty's barking.
1656900	1659060	Guys, this is, this is my friend Common.
1659060	1661300	He, uh, what are you doing here?
1661300	1668020	Well, I was making my way down to the water to hang out with you guys.
1668020	1673700	Cause I heard that you joined away from the birds, people who don't like me much no more
1673700	1675300	no way anyhow.
1675300	1681780	Well, we're on our way to, we're on our way to get bean, but, uh, you can go down to the
1681780	1683220	water if you want.
1683220	1684100	Yep, I do.
1684100	1685060	That was my plan.
1685060	1686260	And now I'm leaving.
1686260	1688420	Thanks for saying hi to all of you.
1688420	1690260	Thanks for barking at me and Chip.
1691620	1692980	I know what you did.
1692980	1693620	Wait a minute.
1694260	1696980	I don't think it's safe for him to be going down there alone.
1697540	1701460	You think a possum can clear whatever amount of slime is down there?
1701460	1709700	You think that looking out for my safety is worth repayment for what you did to my brother?
1709700	1710580	Chip, what'd you do to his brother?
1710580	1711300	What'd you do to his brother?
1711300	1712180	What'd you do to his brother?
1713060	1717300	I never liked no possum no how, and that's all I'll leave it at.
1717940	1719860	Well, first of all, possum is delicious.
1720580	1723380	Okay, now I'm really bailing on out of here.
1724420	1726500	Wilson, it's good to see you.
1726500	1728740	Weird crew you're running with these days.
1728900	1734180	Well, I heard Bean was in trouble, so I came down.
1734820	1740180	The birds are not too concerned with it, so I'm trying this group out to go get them.
1740180	1741940	You're a good man, Willie.
1741940	1745300	Could never trust no possum to be brave when it mattered none.
1746980	1749140	Ouch, that hurt my feelings.
1752500	1755060	I better go now before you seem to cry.
1755060	1760660	Back at Critter College, we called him O-Pussy.
1764820	1768260	He's a better man now that he's not in college anymore.
1769460	1770980	Well, see you later.
1772180	1776260	Bye, this has been a good encounter that definitely helped everyone a lot.
1776260	1779860	And as you guys pass over the road, you make it to the other side.
1781300	1783140	Did Colin have something to offer us?
1785060	1788420	Besides his next dope track?
1790340	1791300	No relation.
1793540	1795620	Was that my role on me?
1795620	1796180	That was it?
1797780	1801300	I mean, anything could have happened, but that's what happened.
1804020	1805780	So you guys make it over to the other side.
1805780	1807140	I'll go back and kill him if you want me to.
1810260	1812740	Rusty, yeah, I was like, I'd really love to eat that possum.
1815220	1818260	He's my friend, don't need him until he's actually dead.
1819140	1829620	In the distance, you see Hotel Motel with its dimly kind of lit sign, and the parking lot
1829620	1839380	is not full at all, and the exterior doors of this place hold as much residue as a sink
1839380	1843860	that is owned by a 19-year-old boy, or girl for that matter.
1843860	1846900	19-year-olds just don't clean their sinks very often.
1846900	1848020	Basically, they're grody.
1848020	1850980	It's grody doors all over the external of this place.
1852020	1858020	And this is Hotel Motel, where you know that Bean is in one of these motel rooms.
1858020	1859060	We've met Bean before?
1859060	1863620	Oh yeah, he's the dopest golden retriever this side of the Mississippi, baby.
1863620	1867620	All rest he can't see so well no more, but he can still hear,
1867620	1870740	and he can still smell like a son of a bitch, literally.
1871300	1877220	So he's gonna try to sniff out Bean.
1877220	1881460	Go ahead and roll for me, Rusty.
1881460	1882100	83.
1882740	1883460	There's too much.
1884660	1885380	He's confused.
1887060	1892660	He's like, I almost smell him, but there's too much in the air.
1892660	1894740	I can't get a bean on what room he's in.
1894740	1898180	You can't get a bean on him whatsoever,
1898180	1905140	but you do hear a bit of a warble in the air that's singing along the winds,
1905140	1905620	and it's like...
1910100	1912260	Does it sound like Bean to us?
1912260	1916260	It does not sound like Bean, but it does sound like a dog.
1918340	1921140	Yeah, so besides smelling, the other thing Rusty can do is hear,
1921140	1923060	so he'd like to focus in on that sound.
1924740	1927540	13.
1928740	1932260	You hear, through this distinct warble in the air,
1932260	1935300	a rich, clear voice come through that says,
1935860	1937700	Hello there to all.
1938980	1947060	My name is Murphy, and I would like someone to let me out of this room.
1949460	1952900	Zach, do not put my fucking dog in a locked hotel room.
1954740	1962500	I do love the cameo, but if you even fictitiously harm him.
1963780	1964340	Oopsie.
1967140	1968500	By the way, I'm dead.
1972500	1974020	I'm the ghost of your dog.
1976740	1982660	I sure would like a friend in these troubling times.
1982660	1983540	Fuck you.
1984420	1985860	Fellers, you know what that means.
1986580	1992420	Contention Creek Critter, coalition don't leave no dog or aminal behind.
1993940	1994580	Namaste.
1995140	1996020	Namaste, brother.
1998660	2003300	And you guys see that to the right, there is a little office
2003300	2008740	where there's a front door with an open sign that is well lit.
2009380	2010260	Well lit.
2010260	2012180	And a different door.
2012180	2020420	There is a man who is pushing a cart with cleaning supplies and fresh towels on it.
2020980	2022420	Don't make me a janitor.
2024580	2025300	Wait, what?
2026500	2028260	If Murphy's there, I assume I'm there.
2029300	2030340	Oh sure, why not?
2030340	2031060	It's Thomas.
2031060	2032260	Thomas is a janitor.
2034180	2035300	No, you're a maid.
2035300	2036660	You've got fresh towels, baby.
2036660	2039940	I'm gonna go ahead and fly into that office, see if I can't find
2040820	2043940	ol' Keith's name on that list, see where Bean is.
2043940	2049460	And I fly towards the office thinking that the window is just open space.
2053620	2055220	What do you mean see his name?
2056820	2058260	I don't know what you mean.
2058260	2059380	What do you mean, what do you mean?
2060180	2061380	What are you talking about here?
2061940	2063860	You can only hear names.
2063860	2064900	Oh, I can read.
2064900	2066180	I went to college.
2067540	2069140	What is reading?
2070580	2073460	It's like human symbols that mean words.
2074100	2075780	You are not making one lick of sense.
2075780	2078020	Yeah, I don't follow none right here.
2078020	2078820	I'll trust you again.
2078820	2080500	Rusty and Ship roll sanity?
2081940	2082660	No, I'm just kidding.
2085140	2087460	But yeah, I fly through the window.
2088420	2089220	Doonk!
2089220	2090900	But there's some sort of force field.
2092420	2093780	What's a force field, brother?
2094500	2102180	The last thought running through your mind before you were stopped out of absolutely nowhere was,
2102180	2104100	holy shit, that's a big cat.
2106100	2108580	Am I knocked out or am I able to fly away?
2109300	2111860	So go ahead and mark one on your...
2112500	2116340	So we're doing a three check box system for damage here.
2116980	2121220	And if you take a bit of damage, that's minor damage.
2121220	2122580	That's the first box.
2122580	2125140	And if you take some more damage, that's going to be major damage.
2125140	2126580	That's the second box.
2126580	2130900	And then if you take damage a third time, you're going to have severe damage,
2131700	2136100	which is going to require a constitution rule to stay conscious.
2136100	2141300	Otherwise, you're going to have to have one of your teammates help you
2141300	2144580	in order to come back and rejoin the squad.
2145220	2151220	This mechanic that I straight up took one for one from Sam running us through that really fun
2151220	2154980	one shot right before all this quarantine broke out.
2154980	2156900	Rusty sees this happen.
2157620	2159940	The damn fool bird don't know about glass.
2160820	2163380	I've seen it happen many times in my...
2164260	2170660	He tries to multiply how many summers he's been by seven, but he can't because he's a dog.
2174740	2180340	So he just says, in my many summers, I've seen quite a few birds slam against the window.
2180340	2185540	They don't know it's only good for sticking your nose up against and linking.
2185540	2188660	So I'm on the ground, very disoriented.
2188660	2190020	What the fuck just happened?
2190020	2193940	Rusty, in an attempt to revive you, sticks his nose up against you and licks you.
2193940	2194580	Hell yeah.
2194580	2196180	Describe it deeper.
2196180	2201860	Oh, he tries to put his ruffle feathers back in place.
2201860	2202500	He's just like...
2204100	2206900	Yeah, it's a very ginger, like, hey, are you all right?
2206900	2209780	Chip gets on the ground and starts shaking him violently.
2211060	2214420	Little tiny fat chipmunk is like, wake your damn ass up, bro.
2215780	2216820	We got work to do.
2217380	2222180	I get up and I stretch my wings out and flap them off to get any of the spit off.
2222180	2227300	And then I fly up and perch on the little thing next to the window and peck it.
2227940	2234820	And you wake up the giant cat that you saw that was sitting on top of the desk
2234820	2236340	right before you ran in this window.
2236340	2238260	As you peck, it kind of slowly...
2242020	2244420	Hello there, everybody.
2245460	2250100	My name's RoPo and welcome to Hotel Moto.
2250660	2253380	You know, I know you spend more time with her, but that's not RoPo's voice.
2257220	2259060	That's very funny, Tom.
2259060	2266100	I love my sister, Ramona.
2267140	2269060	Could you get Taylor in here to do it right, please?
2269620	2270020	Taylor!
2273380	2275300	Thomas wants to hear your RoPo voice.
2278500	2279300	Taylor gets on like...
2283700	2285140	It has to be better than mine.
2285620	2290580	Hi, guys, it's RoPo.
2293220	2298260	I came to tell you that I just took the biggest shot and it was so fun.
2303940	2305780	RoPo seems weirdly high energy.
2306740	2306980	Yeah.
2308340	2310340	Have you ever seen my ass?
2310340	2322180	That's what RoPo says all the time, though.
2322180	2322660	She's right.
2323460	2326900	Every time she walks up to you and she like rubs against you and meows, she's like,
2326900	2328100	have you seen my ass?
2328100	2329060	Have you seen my ass?
2330260	2333780	I can't find it because my belly's in the way.
2334500	2336580	Boys, I will be back in two shakes.
2336580	2338820	This is what we call...
2338820	2339860	Is it a pee break?
2340580	2341380	Pee break.
2341380	2342900	Everyone leave your recording going.
2342900	2344740	I'm gonna go break as well.
2344740	2347060	Question is, which voice do I come back with?
2354900	2355620	Are you sober?
2356980	2357940	I'm not smoking.
2357940	2358900	Oh, yeah.
2358900	2360340	And I'm out of edibles right now.
2360900	2361540	But I will...
2362100	2364660	I'm also intermittent fasting and...
2365940	2367140	I didn't know you were religious.
2368020	2371780	Yeah, I am really, really deeply religious.
2371780	2381380	And I don't think it's cool to personify animals because they don't have souls.
2382740	2384020	They're not going to heaven.
2384020	2384980	Oh, God.
2384980	2387460	That's for people who love Jesus.
2389300	2390900	A dog can't love Jesus.
2390900	2399620	So THC gets stored in your fat cells for a long ass time.
2399620	2401860	Are you saying and you're not fat anymore?
2401860	2404340	No, I'm still fat.
2404340	2411700	But when I intermittent fast, I definitely feel like I've taken a mild edible during
2411700	2415860	the course of the day, which is cool because my body is getting high on its own supply.
2418500	2419780	You got that slow release.
2420660	2423140	And then the only food he's eating is more edibles.
2428660	2429540	It's not the edibles.
2430900	2431620	It's my fat.
2431620	2435700	So which voice do you guys want me to do for RoPo?
2435700	2436420	Your Santa voice?
2436420	2438260	Whatever you feel comfortable with.
2438260	2442100	I like thinking of RoPo as a weird, big, jolly cat like that.
2442100	2442580	Yeah.
2442580	2444020	Santa Claus it is.
2444020	2444340	All right.
2444900	2449700	Welcome to Ho Ho Ho Ho Hotel Motel.
2450500	2452180	Tyler starts growling at the cat.
2452180	2452740	Yeah.
2452740	2456180	Rusty sees the cat and is startled and goes woof.
2456180	2456820	Hi.
2456820	2461700	RoPo's hair doesn't stand up even a little bit.
2463060	2464900	Are you guys trying to intimidate her?
2464900	2466260	Rusty, no, no, no.
2466260	2467380	It's just a reaction.
2467380	2471780	Rusty tilts his head to the side and then when he sees the cat is no threat, his tail
2471780	2472340	starts wagging.
2472420	2477700	Tyler starts doing like the growl starts to turn into a yip kinda and then like pause
2477700	2481220	down, backs up a little, pause forward, backs up a little.
2481220	2483380	Just trying to gaze what this cat's doing.
2483380	2484660	Hello, my friends.
2484660	2486260	Rusty, what you call this stuff?
2486260	2487860	This force field, what you call it?
2488820	2490900	Oh, it's a window.
2490900	2493940	Hey, RoPo, can you turn this window off?
2498420	2499860	That's a picture of me.
2499860	2501620	I would never want to get rid of it.
2503140	2507300	Would Chip know RoPo as a veteran of the 4C?
2508020	2511380	Chip, it's been a long time, hasn't it?
2511380	2515220	It's good to see you're doing well in these trying times, RoPo.
2515220	2518420	Looks like you haven't been hard up for food none lately.
2518420	2522740	Well, I see you are living lavishly as well, my good sir.
2522740	2526100	I miss our nights together every now and then.
2526100	2528500	Chip slaps his belly a few times.
2528500	2529540	He's like, yeah, brother.
2533060	2534420	That's the Chip I knew.
2535060	2536100	Hey, Cat.
2536100	2538260	Cat, don't you know there's a goo out there?
2538260	2541060	Don't you know it can get into buildings and such?
2541060	2541860	A what?
2541860	2542580	There's a goo.
2542580	2544420	There's a black goo that wants to eat everybody,
2544420	2546180	so all the critters are meeting down at the creek.
2546180	2548740	I've not seen this black goo.
2549780	2551140	Well, keep an eye out for it.
2551140	2556580	RoPo, we need your help to find someone or maybe a couple someones.
2556580	2561540	You know any animals that would be trapped or something in these parts?
2561540	2563300	Are you talking about the dogs?
2563300	2564900	Yeah, Murphy and Bean.
2564900	2565380	Bean.
2565380	2566260	Oh, you almost...
2566260	2567700	Oh, you do know their names.
2568820	2569620	Yes, of course.
2570340	2578660	Well, I'm not much for the symbols, but I believe you'll find where they are on those charts over there.
2578660	2580660	I want to look at the charts.
2580660	2581140	Can you...
2581140	2582100	Did you go to college?
2582740	2582980	Yes.
2584580	2585380	Can you enroll?
2586020	2587380	Critter Community College.
2587940	2588180	Yeah.
2589700	2590500	He's got a critter.
2590500	2591780	What is your skill for that?
2593940	2595220	Intelligence.
2595220	2595540	I thought...
2595540	2596420	Don't you have...
2596420	2598420	You said understand human, which I think means...
2598420	2602500	I could have sworn you had a special skill that meant you could understand, like...
2602500	2603140	Yeah, I can...
2603140	2603540	I have...
2603540	2606100	It's called a little birdie told me.
2607860	2608180	What?
2611220	2613780	When I told you that you could have special skills,
2613780	2620180	you wrote down somewhere that your special skill was a little birdie told me.
2620660	2624980	Yeah, which means I can understand humans and read.
2625940	2627060	I see it needs...
2627060	2628500	I think it has to be one or the other.
2630420	2632500	It's I understand human stuff.
2637620	2639780	Willie's like, have you guys watched The Wire?
2643380	2645540	Dude, I love human stuff.
2645540	2646260	Season two?
2646260	2646980	Are you kidding me?
2648500	2650260	Don't bother with season five.
2650260	2652740	This is now dictating that it's...
2652740	2655220	That you can read and understand stuff.
2655220	2655540	Okay.
2656500	2658340	So go ahead and roll those dice, baby.
2659860	2664420	But if people try to talk to you, boy, you ain't gonna know what they're saying?
2664420	2665060	60.
2665700	2666980	Oh, congratulations.
2666980	2671380	So it very clearly says, hey, Luke, do you know what room Keith Vigna is?
2671380	2673300	If we said it, it was probably seven.
2673860	2674980	I think it was.
2674980	2679300	And then we've got Murphy is on the first floor in room three.
2679380	2681780	We got to go to room seven and three.
2682340	2683940	Do you guys know what that means?
2683940	2684340	No.
2684340	2685860	What the hell are you talking about?
2685860	2691780	RoPo, can you help guide us here to whereabouts we're supposed to search for our friends?
2691780	2693060	Not even a little bit.
2693060	2696180	I believe it's the woodpecker that knows the symbols.
2698420	2701860	I don't know what your quest is or give a fuck about you.
2703620	2704820	Any more, Chip?
2706340	2707540	I dream of you.
2707540	2708660	This is a really tight...
2708660	2710180	This is a really tight game, guys.
2711940	2714740	I can read the symbols on the doors here.
2715380	2717780	This one's seven right here.
2717780	2719860	And I fly over to room seven.
2719860	2721540	Yeah, it's up on the second floor.
2721540	2723620	And you guys go to the stairs.
2723620	2727300	I go to three first then, since it's on the first floor, probably.
2727300	2729300	Is this the one that Bien is in?
2729300	2730660	Is this where Bien is?
2730660	2733940	This one right here is Murphy's, but it's closest.
2733940	2740100	Don't you think we should get beans?
2740100	2741220	He's our mission.
2741220	2742820	He might be able to help us get this other guy.
2743460	2745780	I think we should get beans.
2745780	2747700	What about the other way around?
2747700	2749300	Maybe Murphy can help us.
2749300	2751700	Yeah, and this first dog's on the first floor.
2751700	2754100	Tyler, I'm gonna need you to pull yourself together.
2754100	2756980	These old bones don't get upstairs too well.
2756980	2758580	Tyler starts chasing his tail.
2759140	2760180	He has stopped listening.
2760420	2767460	Can Chip Montgomery pick a little tiny pebble up and throw it at Tyler?
2769140	2770660	Don't throw rocks at dogs.
2770660	2774420	Like really, I'm talking, it's a chipmunk size pebble.
2774420	2778580	Wait, like a pebble for a chipmunk or a pebble that's the size of a chipmunk?
2778580	2782180	No, the pebble for a chipmunk.
2782180	2784020	Because if that's true, Chip is so strong.
2784020	2785460	Chip only has 20 strength.
2785460	2788820	He can barely, he can't lift his own body weight up.
2789620	2792900	Okay, so as this weird squabble is happening,
2792900	2798820	where the cartoon's rocks and chips are changing size rapidly back and forth,
2798820	2804980	I need you guys to roll if you have some sort of like perception ability,
2804980	2808420	special ability that is, or intelligence.
2808420	2809860	Should we all roll then?
2809860	2812260	Hearing and smelling counts as perception, right?
2812900	2814180	It absolutely does.
2814180	2818980	I failed an intelligence check.
2818980	2820020	I failed mine.
2820020	2823940	I passed an intelligence check of 12 on 50.
2824500	2829380	Yeah, fittingly, the two dogs immediately turn and look,
2830020	2836660	and you see driving by slowly is someone who is looking at you,
2836660	2842020	and in the shotgun seat, there's an old person with a cane,
2842020	2845460	and they're shaking the cane at all of you out the window,
2845460	2849620	and they're screaming something in their weird human language,
2850260	2854100	convincing the person who's on the phone to do something.
2854100	2858420	Thomas thinks they're probably calling, trying to call animal control.
2858420	2859940	So does Rusty.
2859940	2862740	Well, Rusty just knows they're up to no good.
2863780	2866740	He's like, I think we need to get a move on.
2866740	2867700	Scatter, brothers.
2868340	2871380	Tyler has been on the run for five days now,
2871380	2873940	and he knows how to avoid humans.
2873940	2879220	He's real skittish, and he's already probably running for under the stairs, maybe.
2879220	2886420	Yeah, and I think maybe even, Tyler, you've seen this caned person before.
2886420	2887540	He's my nemesis.
2888660	2889780	Yeah, exactly.
2891460	2895700	Famed Tyler nemesis, Greargin.
2895700	2896660	Greargin?
2896660	2897540	Fuck, guys, it's Greargin.
2897540	2898820	We have to get out of here.
2898820	2902020	The old contention person.
2904980	2907300	The 300-year-old founder of contention.
2909540	2910580	Nope, they're elsewhere.
2910580	2913620	He just won't die.
2913620	2914580	Wow, spoilies.
2916100	2917060	What are you guys doing?
2919140	2921380	How are you getting into room three or seven?
2921380	2925460	Is there a window on these, like a door with a window next to it?
2925460	2927140	Yeah, they all have a window next to them.
2927140	2930500	I want to peck on the glass of the room three.
2930500	2932660	Look who knows what glass is all of a sudden.
2934900	2936660	His allies taught him.
2936660	2937940	He found out the hard way.
2937940	2944340	That's honestly, that's the most character development we've had on any of the shows so far.
2947060	2947560	All right.
2948500	2954900	Is there any kind of ventilation shafts in and out of these rooms that a small rodent
2954900	2956260	could perhaps go into?
2957620	2959060	Oh, hell yeah, dude.
2959060	2959940	Of course there are.
2960660	2967780	Luke, Wilson is tapping on the glass and the curtain slowly opens with a dark chocolate.
2967780	2968980	I'm talking 92%.
2969860	2972180	Beautiful old dog.
2972180	2972900	Long hair.
2973620	2977860	And it looks at you with these gorgeous knowing eyes.
2978900	2984260	And it says, well, hello there, my good bird friend.
2985220	2987700	I sure would like to get out of this room.
2987700	2989300	Can you turn this window off?
2993940	2996820	Zach, that's, while that's not Murphy's voice, it's close.
2996820	2999300	So, oh, thanks dude.
2999300	3004740	Cut to Chip is running on hind legs through an air vent.
3006820	3008340	I'm really out of shape, my brother.
3008340	3008900	Oh God.
3009940	3011780	John McLean in it.
3011780	3013140	Chip, are you wearing shoes?
3014820	3020180	In my mind, I pictured him wearing like a weird, like fatigues for a little fat.
3021780	3022820	He's a warfatter.
3023540	3025060	He's like he's a prepper squirrel.
3029220	3031940	He's got some sick Nike's on combat.
3031940	3034180	No little combat boots for a chipmunk.
3034180	3037540	Oh man, Justin, I don't want to criticize your role-playing decisions, but you should
3037540	3038740	have been a chipmunk.
3039540	3043460	Oh, like bald on top or like Tony Shalhoub.
3043460	3044660	Oh, yes.
3053860	3054900	All right, let's start over.
3054900	3055860	I'm going to start the recording.
3057380	3062820	It is a brisk December 5th here in contention, made all the more bleak by the-
3062820	3066820	Hey, no shit, I would like, I would start over if you guys wanted to.
3067460	3067780	No.
3067780	3069620	I think we could do this a lot tighter.
3069620	3071540	I loved every second of this.
3071540	3071860	Okay.
3071860	3073060	I think this has been really good.
3073060	3075700	It hasn't been tight, but I like it loose.
3079220	3079860	You heard me.
3082260	3083140	Say what I said.
3086260	3087220	I don't like it loose.
