start	end	text
4580840	4582680	Oh, well, one of them's dead.
4583080	4589080	Or yeah, you helped to kill like in terms of eye for an eye.
4589080	4591480	I want to, can I land on his head?
4591480	4594040	If you go for revenge, I will kill you.
4594040	4594280	Why?
4598840	4601640	You are one woodpecker against a grown human.
4601640	4603880	I want to pick his eyeballs.
4603880	4609800	Who just saw that woodpecker and a raccoon kill his best friend and a chipmunk.
4609800	4610840	But I'm not sewage Joe.
4610920	4612920	You're a sewage Joe.
4612920	4613640	Gloves off.
4615640	4623320	He'll try, but Rusty sees you like staring down at him and he's like, I just wanted to
4623320	4629800	reiterate that animal control has nothing to do with cutting down trees in the park.
4629800	4632040	I really think those were different people.
4633480	4639320	Maybe the utility company, or perhaps even just a local, you know, tree service.
4639960	4643080	Uh, that tree might've been rotted, might've been about to fall.
4643640	4645800	I just don't think this is the guy who cut down.
4645800	4651000	Wilson, I know your hatred for humans runs deep, but you're, you're, you're, you're taking
4651000	4652040	it too far, man.
4652040	4654040	We're, we got a mission to complete here.
4654040	4663640	We're not saying he don't deserve to die, but Wilson is blinded by rage and brushes
4663640	4664440	off the comments.
4666520	4667320	Go for it, baby.
4668040	4670600	I want to land on his head and peck his eyeballs out.
4672040	4675240	He's already in the, he's in the, he's in the van.
4675240	4677000	I swooped through the open window.
4678120	4682040	It wasn't open and you smack into it and you're a killer.
4682040	4683800	I only have one box check.
4683800	4684040	Yes.
4684680	4685080	Okay.
4685080	4689320	Take your second damage, you motherfucker, because you definitely just flew.
4691960	4694520	Wait, roll intelligence for the sake of playing.
4694520	4695240	21 on a 20.
4695240	4696520	He knows what class is now.
4697800	4700520	21 on a 20.
4700520	4702040	That makes me so happy.
4702040	4703080	That is so perfect.
4705240	4713560	You slam into the glass of the animal control van and he looks out and you guys make direct
4713560	4716520	eye contact as he's driving away.
4716520	4721000	And let me tell you something Wilson, he looks scared.
4721000	4721480	Good job.
4721480	4726680	Can I at least crack his window to make his day inconvenient other than his dead friend?
4727400	4732440	Other than his partner dying and all the animals is hanging.
4732440	4736040	His best friend died and he was bad at his job.
4736040	4738920	The only two things that exist in this man's life.
4738920	4739560	I'll take it.
4739560	4741400	Oh, my window's cracked.
4741400	4743720	This is a bigger inconvenience than my partner.
4743720	4744280	What a day.
4745560	4748840	But do please roll strength for cracking that window.
4748840	4750120	44 on a 70.
4750680	4751880	Critically succeeding.
4754760	4755320	Yep.
4755320	4756040	I'm content.
4756840	4759480	You crack it so hard that it can't roll down.
4761960	4763240	You fucking showed him, dude.
4765080	4767560	Okay, let's get back to the creek, I guess.
4767560	4771960	As the van speeds away, Tyler's gonna give chase for the tire for a second.
4772520	4776760	And then when it gets fast enough that he can't keep up, he comes back to join the group.
4778760	4783640	When you join the group, Rusty, Bean, and Murphy all sniff your butt in my group hills.
4783640	4785080	Oh, thanks.
4785880	4786680	Thanks, fellas.
4786680	4791880	I'm picturing just like a made pole dance of y'all just going around the circle,
4792920	4794440	conga line butt sniffing.
4794440	4794840	Oh, yeah.
4795960	4800280	Rusty says to the chipmunk and the woodpecker, you guys want to get in on this?
4801480	4801720	No.
4802280	4807240	Chip stands back with his arms folded, but a little wry smile goes across his face.
4810280	4812440	He's like proud of his journey, doesn't he?
4812520	4817800	I go and perch on the goats and horns and what's up, kid?
4824040	4825480	Can this goat be for hand pressure?
4827480	4829000	Well, of course.
4833080	4836200	Hey, well, we're attracted to that goat lady.
4836200	4841400	I don't think it's good.
4841400	4844200	We ought to get back to the safety of the creek.
4844200	4845560	Yeah, Beans, we got you, Beans.
4846360	4849720	The squirrel, he sent us and we're supposed to bring it back to the creek.
4849720	4855240	This actually, this seemed like a really good just like last shot of y'all celebrating in
4855240	4856040	the parking lot.
4856040	4858200	So I think let's just hang it out there.
4858200	4859000	Freeze frame.
4859000	4860840	Freeze frame, credits roll.
4860840	4866360	All right.
4866360	4867720	I think we should start recording.
4867720	4868360	Yeah.
4868360	4869720	Now that we've rehearsed it.
4869720	4871880	That was a really good dry run.
4873080	4874120	What are warmups for?
4874920	4882520	While the credits are rolling, it has a shot of Wilson, the woodpecker, and it says Wilson
4882520	4887480	found a new favorite tree and never left it because he's deathly afraid that there are
4887480	4888760	windows in the sky now.
4891720	4892600	It's really sad.
4892600	4893240	He's content.
4894280	4896600	Are we going back to the creek or is this?
4896600	4898360	No, what's your freeze frame, Justin?
4899720	4900760	Pass for now.
4900760	4901560	Not an option.
4901560	4905080	I'll do some minor characters in between your guys's big ones.
4905640	4907400	And obviously Murphy will be the last.
4908600	4910600	Murphy dies immediately.
4910600	4912040	Yes, be careful, motherfucker.
4913560	4916440	Oh, right off the bat, we've got the very first one.
4916520	4919640	We've got Stallone, the old gray squirrel.
4919640	4927000	And it says Stallone carried his torch well, but not for long as he was gotten on the very
4927000	4933320	next run, laying down his life for others on a run to get nuts.
4933320	4935000	It was Stallone, which one?
4935000	4935480	Yep.
4935480	4936760	See, that's why he was first.
4936760	4940760	He was the squirrel that was the head of the contention Creek critter coalition.
4941720	4943640	Making way for a new leader.
4943640	4945160	Just a little foreshadowing.
4945160	4946120	Chip Montgomery.
4947080	4951880	Can chip Montgomery be the leader or does his beans going to be a chipmunk?
4951880	4955560	He talks about how he wanted to be a leader, but people didn't believe in him.
4955560	4958120	And now he, after the successful mission, he's...
4958120	4958840	I'm sorry.
4958840	4962680	You're, you're questioning whether a chipmunk can be a leader after a squirrel.
4964120	4965720	Well, squirrel is one thing.
4965720	4966200	Wow.
4966200	4966920	But a chipmunk?
4966920	4968200	Thomas, do you have a good one?
4968200	4969960	Yeah, Rusty ate chocolate and died.
4970760	4973880	Oh, Jesus Christ.
4973880	4975400	God, who is the next smallest?
4975400	4976600	Oh, uh, Common.
4977800	4982200	Common died, uh, on the side of the road, dot, dot, dot.
4983240	4984360	Or did he?
4984360	4986120	You know, something of that nature.
4986120	4991960	And then, uh, the dead possum picture up on the screen winks at you with a little star
4991960	4992280	that goes...
4992280	4994440	Oh, I'm glad Common's okay.
4994440	4996120	Even though I hate him and all his family.
4996120	5004120	Uh, and then RoPo is still just, uh, sitting like the picture of her is sitting on the
5004120	5009720	desk and then it says, uh, RoPo found out what the black goo was the hard way.
5009720	5009880	No.
5013880	5018120	The freeze frame on Tyler is him kind of veering away from the group.
5019000	5024520	And, uh, he got distracted and saw a snake in the grass and started following it.
5024520	5026200	And you guys haven't heard from him since.
5026920	5027800	I don't like that.
5029800	5031960	Maybe he'll turn up at a dirty dog grooming in the city.
5031960	5038520	There's a picture of Rocky the raccoon, uh, sniffing the butt of Rusty.
5039480	5047560	Rocky made a, made a good friend and then had to tragically watch him die slowly from
5047560	5048840	chocolate poisoning.
5048840	5050040	Did Rocky give it to him?
5050760	5051560	Oh my God.
5052520	5054600	Shared it with him unknowing.
5055320	5059000	I don't think animals know what they can't eat because then they wouldn't eat it.
5059000	5060120	What is Chip's?
5060120	5066600	Chip would continue fighting to be the leader of the Contention Creek Critter Coalition
5066600	5071320	despite his age, but no one would accept him because he's an old fat asshole.
5072520	5079960	And then there's a picture of Murphy and it says Murphy was immediately elected the new
5080040	5082280	leader of the Contention.
5083960	5086520	Thomas's eyes just lit up so big.
5087640	5093960	The Contention Creek Critter Coalition and remains leader fighting off
5097880	5100120	the chipmunk to this day.
5102680	5104440	That was the end.
5105400	5106520	Did you guys like that?
5110200	5113080	I don't know if we did a good job.
5116680	5120040	I know I did a good job and that's all I care about.
5122920	5124920	That's the only thing in my control.
5124920	5129560	I mean, we can talk more later about Thomas's job.
5131320	5132440	No, it was fun.
5132440	5133400	I like you guys.
5133400	5134360	Yeah, I had fun.
5135160	5136360	You're great too, man.
5136360	5137560	I'm going to start the recording now.
5169960	5176040	The only one trying to pull over.
5176040	5184040	How can you have enough drowning out of the noise.
5184040	5190040	With nobody home.
5190040	5194040	Nobody home.
5194040	5198040	Nobody home.
