start	end	text
1345660	1351240	If you can, then I, you know, that'll be just incredible.
1351240	1352240	And then we can head over there.
1352240	1354160	It's not time sensitive then.
1354160	1358560	It is, but I have a feeling that we've already got a timer on this situation.
1358560	1360920	All right, Leon, I'll follow your lead.
1360920	1361920	I like that.
1361920	1362920	How does he get out?
1362920	1367440	Yeah, and I think you might be, he relinquished the gun to you.
1367440	1368920	Well, I definitely didn't give it back.
1368920	1369920	Yeah.
1369920	1370920	He hasn't asked for it, you mean?
1370920	1371920	No, he hasn't asked for it.
1371920	1372920	Yeah.
1372920	1373920	Okay.
1373920	1374920	Yeah, I'm gonna just hold on to it.
1374920	1397360	John Lee Pettymore and Keith Vigna get out of the car that Clark Bishop and Leon Simpson
1397360	1398360	were in.
1398360	1403920	And you guys look out at the campus of CSU, City State University, and the entire thing
1403920	1407160	is riddled with holiday spirit.
1407160	1411880	There are decorations covering everything.
1411880	1413760	Like say a holiday decoration.
1413760	1414760	Wreath.
1414760	1419480	Yeah, there's a big wreath that's just like on the dorm building right in front of you.
1419480	1420480	Lights.
1420480	1421480	Oh yeah.
1421480	1422480	Oh, you know there's lights.
1422480	1424520	There's like an absurd amount of Christmas lights.
1424520	1429760	They're on every single building up the walls and on every tree on campus as well.
1429760	1431640	It's actually, it's quite pretty.
1431640	1432640	Inflatable minion.
1432960	1434320	There's an inflatable minion.
1434320	1436160	It's a wave.
1436160	1441540	It's Derek and it's wearing the Christmas hat.
1441540	1442540	What is that called?
1442540	1443540	Santa hat?
1443540	1444540	Santa hat.
1444540	1446660	It's wearing a Christmas hat.
1446660	1451240	And yeah, it's arms are just like the only thing that's moving on it.
1451240	1455000	What is the mascot of City State University?
1455000	1458240	The mascot of City State University.
1458240	1460760	Yeah, that was the question he asked.
1461680	1466360	What was the mascot of City State University?
1466360	1467880	I'm assuming you have this written down.
1467880	1468880	Just control F mascot.
1468880	1474160	Oh yeah, let me just look it up on my computer real quick.
1474160	1475880	It is a Venus fly trap.
1475880	1476880	Cool.
1476880	1477880	That's a native to North Carolina.
1477880	1479900	Well, you don't know where we are.
1479900	1481360	Not North Carolina though, right?
1481360	1484240	Probably not, but it's native to the city.
1484240	1487800	Tigers aren't from Detroit, so.
1487800	1489960	Tigers are not from Detroit, Thomas.
1489960	1492640	I know at least three tigers that are.
1492640	1496280	Anyway, wow, this place is Christmassed out.
1496280	1498080	This is a good podcast, guys.
1498080	1499080	Are there trees?
1499080	1506520	Okay, so you get past the Christmas decorations and you have been given directions to go to
1506520	1513680	the dorm room of Harriet Marks, which is 328 Giff's house.
1513680	1517080	And actually you see this building that is right in front of you.
1517080	1524760	It has a sign on it that in big capital letters it says Giff's house, G-I-F-F-S.
1524760	1530800	And the building is covered in a massive wreath that is lousy with lights.
1530800	1533480	Let's go in there up to the third floor, I'm assuming.
1533480	1534480	Room 328.
1534480	1540480	When you guys go into Giff's house, you see that all the lights are out.
1540480	1545160	Hey real quick, do you know how I already knew how that was spelled before you told
1545160	1546160	us?
1546240	1550560	If it had only had one F, you would have said it wrong.
1550560	1551560	That's an opinion.
1551560	1557840	So you guys were going into Giff's house and the lights are out.
1557840	1562960	On your right there is a secretary's desk and there's a computer.
1562960	1567360	The glow of the computer screen is the only light in this room, but you can make out from
1567360	1572400	there that to your left there's like a sitting area with a baby grand piano and ahead of
1572400	1579120	you there is a glass wall of windows with a door leading into that room and then from
1579120	1582320	there there's a hallway that breaks off and it goes left and right.
1582320	1584160	Baby grand piano is my pop star name.
1584160	1586920	Ooh, that's really good.
1586920	1588920	Yeah it is.
1588920	1589920	Is the secretary there?
1589920	1593040	No, there's no one in this room at all.
1593040	1600080	Is there a fire escape plan on the wall to see if we can locate 321 or 328 without?
1600080	1604120	Yeah absolutely, so you've got stairwells on either side of the building and an elevator
1604120	1605120	in the middle.
1605120	1607520	I'd like to see if I can access this computer.
1607520	1608520	Sure.
1608520	1609520	Yeah, you can hop on there.
1609520	1610520	Any good stuff?
1610520	1614840	Oh, there's a directory you can find out that when you look up Harriet Marks, she lives
1614840	1615840	in 328.
1615840	1622560	Her roommate's name is Amelia Locke and right across the hall is 330 Giff's house, which
1622560	1625260	is listed as show dorm.
1625260	1630000	Like one they show to prospective students on tours, yes.
1630000	1633760	Let's go up there and see if we can find anything, probably need to talk to Amelia
1633760	1634760	too.
1634760	1641720	Or sidebar, we change our clothes, we go crash in that show dorm until somebody realizes
1641720	1647920	what's up and we just do a whole spin-off where Keith and John Lee Pettymore go to college.
1647920	1649520	You know what, I like that idea.
1649520	1650520	Spin-off!
1650520	1655320	I certainly never went to college unless it says otherwise on my character sheet.
1655320	1656560	No, I went to...
1656560	1659720	Oh no, I went here.
1659720	1661560	Does it remind you of the good old days?
1661560	1662800	It does, I want to go back.
1662800	1665720	Well, I think we should get this investigation out of the way first.
1665720	1669280	Actually, I have written down City University, which I imagine is City State University's
1669280	1670280	intense crosstown rival.
1670280	1671280	It absolutely is.
1671280	1672280	Yeah, it's their big rival.
1672280	1674440	No, I hate fucking CSU scum.
1674440	1676440	Yeah, you're a poinsettia.
1676440	1677440	Yeah!
1677440	1680440	Well, I always wanted to come here because...
1680440	1681440	Point!
1681440	1682440	Poinsettia!
1682440	1683440	City University leads the way!
1683440	1684440	Nice!
1684440	1685440	That's our fight song.
1685440	1688520	I walk to where the elevator is.
1688520	1695080	And the elevator door opens as the light emits from the elevator into the hallway that
1695080	1696080	you're in.
1696080	1699980	And you can also see it from the light on the vending machines behind you.
1699980	1706200	The walls and the floor of this space are completely covered in numbers, like absolutely
1706200	1707420	riddled in numbers.
1707420	1712300	So many different sequences of numbers, in fact, that you can't make out any specific
1712300	1713300	single sequence.
1713300	1714680	What are they written with?
1714680	1716040	All sorts of materials.
1716040	1724200	We've got Sharpie, paint, spray paint, blood, cum, piss, like there seems to be a smear
1724200	1725640	of shit on the wall at some point.
1725640	1727160	Tell me more about the cum numbers.
1727160	1734120	So the cum numbers, they're dripping, and they were dripping, now they're coagulated
1734120	1735160	in place.
1735160	1737680	Is there a dorm room near us?
1737680	1738680	Just any dorm room?
1738680	1739680	There's actually not, no.
1739680	1743120	Well, damn, do you think people are still living in this dorm room, or in this dorm
1743120	1744120	hall?
1744120	1745120	I have no idea.
1745200	1749040	I'm not able to clean this, literally this shit up, but I don't know.
1749040	1750600	What dorm room are we in her dorm room?
1750600	1756120	No, you were about to get into the elevator from the main floor up to the third floor,
1756120	1762140	but you do see that when you turn to look into the elevator, in the corner that would
1762140	1769040	be out of sight when the elevator door first opened, there is a slumped over body of a
1769040	1770040	student.
1770040	1774600	And the head has been smashed.
1774600	1782360	Her face is no longer a face, it seems to have been hit repeatedly in the forehead and
1782360	1783360	nose.
1783360	1785120	What the fuck kind of hell dorm is this?
1785120	1786600	I don't know, but uh.
1786600	1789320	If John Lee Pettymark could roll a sanity check for me.
1789320	1792200	Yeah, John, you probably shouldn't be looking at that.
1792200	1793200	Fail.
1793200	1795520	Go ahead and lose one sanity.
1795520	1796520	We're getting there.
1796520	1801520	I go over and turn the body over, look for like a, is there a purse on this person?
1801520	1804880	Do you see that there is a fanny pack on this person?
1804880	1807480	I'm gonna dig through and find identification.
1807480	1811120	Yeah, her name was Samantha Carter.
1811120	1812120	Poor Samantha.
1812120	1815600	Well, good thing it wasn't Amelia, because that's who I'm wanting to talk to.
1815600	1818320	And I hit the third floor button in the elevator.
1818320	1820920	Alright, and Thomas, if you could leave the room.
1820920	1822920	Before we do that, can you tell me what I found on the computer?
1822920	1827360	It was just the info for like who lived where.
1827360	1828760	Did you want to find anything else?
1828760	1830320	Yeah, like the answer to all these mysteries.
1830320	1834040	Oh yeah, the answer to all the mysteries isn't on there, unfortunately.
1834040	1835040	But there was a...
1835040	1836040	Wrong computer.
1836040	1837040	Is there a reason I'm not going with him?
1837040	1842560	There was a big, like, when you first got on the computer, the background for the entire
1842560	1849560	thing was a promotional ad, like a poster, for The Jingle Ball, taking place the night
1849560	1852640	of December 6th at CSU.
1852640	1858400	And it says, follow the scavenger hunt to make your way to The Jingle Ball.
1858400	1860580	Is December 6th the night that...
1860580	1861580	That's the night.
1861580	1862580	Okay.
1862580	1864120	And do we know what date Harriet died?
1864120	1865120	December 2nd.
1865120	1866120	Okay.
1866120	1868880	So is there a reason I'm not going up the elevator with him?
1868880	1869880	Yes.
1869880	1870880	Okay.
1870880	1871880	I mean, we would have gone up together, right?
1871880	1872880	Yep.
1872880	1873880	Okay.
1873880	1883760	Hey, Leon?
1883760	1887200	Yeah.
1887200	1892160	Got your gun here.
1892160	1893160	Yeah, I know.
1893160	1895760	Is this these, those mind control darts?
1895760	1901040	He looks at you with like a grimace, like he's about to burp, like I just did.
1901040	1902040	No.
1902040	1906080	What would they have done to me?
1906080	1908200	Probably fall asleep for a while.
1908200	1909500	How long's a while?
1909500	1910500	Not too long.
1910500	1911500	I'm going to hold on to it then.
1911500	1914680	I don't want you sneaking up behind me and doing it, trying to do it again.
1914680	1916160	That seems fair.
1916160	1918840	And I don't want to do that to you now.
1918840	1925220	I mean, if you're willing to, you seem down for the cause and with your current knowledge,
1925220	1926720	I think that we're good.
1926720	1927720	All right.
1927720	1930040	Let's find out what we can about the...
1930040	1931040	It was Harriet Marks.
1931040	1932800	That's what we were looking for, right?
1932800	1933800	Harriet Marks.
1933800	1935120	Let's see what we can find out.
1935120	1941760	And you guys open up the door and now I want to paint a picture for you, Joe.
1941760	1944720	When you're walking on this campus, it's fucking dead.
1944720	1946200	Like it's evening.
1946200	1951920	The sun is going down currently, but there is no one on this campus.
1951920	1958180	It's just kind of, it's Saturday, you know, but it's still a college campus and there
1958180	1963220	are holiday themed decorations obliterating this place.
1963220	1970340	It's almost as if someone like vomited delicious holiday spirit all over for a block square
1970340	1972260	of the city.
1972260	1976180	It's filthy with holiday stuff.
1976180	1977260	Just dirty with it.
1977260	1978340	It's dirty with it.
1978340	1981300	It's lousy with Christmas gear.
1981300	1988860	It's like tiny Santa clauses everywhere and menorah, like blow up menorah, just like in
1988860	1991240	a yard in front of one of the dorms.
1991240	1992820	It's all over the place.
1992820	1993820	It's great.
1993820	1994820	If you love Christmas...
1994820	1996180	How does Clark feel about Christmas?
1996180	1997780	Does he have good memories?
1997780	1998980	Oh shit.
1998980	2000140	That's a good question.
2000140	2005860	He probably has early good memories right up until his old parents didn't have Christmas
2005860	2006980	for him no more.
2006980	2010580	No more Christmas for old Clark Bishop, or young Clark Bishop.
2010580	2012700	A young Clark Bishop still had no Christmas.
2012700	2014020	Old young Clark Bishop.
2014020	2016420	I think you nailed it.
2016420	2020420	The technical name of your character at this point in the show.
2020420	2026620	So when you guys walk in, the administration office is actually open, but inside all the
2026620	2030500	lights are off and there's seemingly no one in here.
2030500	2032340	Do we know what time of day it is right now?
2032340	2034020	The sun is going down.
2034020	2035460	It's about golden hour.
2035460	2037820	It's yay around golden hour.
2037820	2039060	Cool.
2039060	2040060	Take a picture.
2040580	2041580	It looks beautiful.
2041580	2042580	Yeah, you and...
2042580	2043580	It must be.
2043580	2046220	You and Leon could take a great selfie right now.
2046220	2048420	Leon, Leon, hang on a sec.
2048420	2049420	Yeah.
2049420	2050740	Gotta take a picture with you.
2050740	2053380	Well, it's golden hour.
2053380	2056780	We look great in front of all this Christmas stuff.
2056780	2062740	Okay, so we're gonna go into where they have all the files.
2062740	2063740	I don't know.
2063740	2065340	I don't know how colleges work.
2065340	2067300	And so let's just hop in there and see what happens.
2067420	2075900	So you guys turn a corner in this unlit corridor and about halfway down the hallway, you see
2075900	2082820	two figures and one of them, you just hear this like voice that is repeatedly just going
2082820	2083820	like, please.
2083820	2090420	Oh gosh, I would love to four if you just mumble some other words and is like letters
2090420	2094460	and stuff and numbers and is like, please just hit me, hit me, hit me.
2094460	2095460	Oh God.
2095500	2097300	I'll have to do it to myself.
2097300	2099460	He's talking to another figure that I can't see either.
2099460	2105340	Yeah, and the other figure is just staring, just like standing there, not really moving.
2105340	2108980	I nudge Leon, they're saying numbers.
2108980	2109980	Is it the number stuff?
2109980	2110980	I don't know.
2110980	2111980	What do you want to do?
2111980	2112980	Are they totally in our way?
2112980	2118300	Well, and then you guys look over and there's a sign and it says like office and there's
2118300	2120560	an arrow pointing directly toward them.
2120560	2122540	We're both still wearing police uniforms, aren't we?
2122540	2123540	Yeah.
2123540	2124540	Sure, we'll approach them.
2124620	2126140	We'll find the records office, right?
2126140	2127140	Yeah, yeah.
2127140	2128140	Perfect.
2128140	2130140	I'll go get Justin from the other room.
2148140	2154500	Luke, as Keith Vigna and John Lee Pettymore stand in the elevator, the elevator door closes
2154860	2162220	and John Lee Pettymore pulls a Sharpie out and begins writing a sequence of numbers.
2162220	2164200	I just watch him and see what they are.
2164200	2169500	On the elevator wall and it is the numbers that you have seen him write and heard him
2169500	2170500	chant.
2170500	2171500	Right.
2171500	2172500	Bruce Robin.
2172500	2173500	Bruce Robin.
2173500	2176360	The elevator door opens and you are on the third floor.
2176360	2182140	It is also completely dark, the lights are all out and it is silent.
2182140	2184900	I get my phone out to light the hallway.
2184900	2188780	I guess I'll grab John and kind of just drag him behind me.
2188780	2194040	Yeah, and when he can't write anymore he just starts murmuring those numbers over and over.
2194040	2197220	Can I just like kind of slap him a little bit to see if he pops out of it?
2197220	2198220	He does not.
2198220	2203420	Okay, I'm looking for 328 on the placards on the walls and I'm leading John behind me.
2203420	2208460	Yeah, you make it down there and you're at 328 Giff's house.
2208460	2209460	Is it unlocked?
2209460	2210460	It is.
2210460	2216740	It is actually wide open as is the door across the hall, 330, which John told you was the
2216740	2217740	show dorm.
2217740	2221260	Before I go into 328 I'm going to look into 330, what does it look like?
2221260	2226740	It looks like a very well presented dorm room for a college freshman.
2226740	2230260	There's lots of, what did I say the mascot was?
2230260	2231260	Venus Flytrap.
2231260	2238220	There's lots of Venus Flytrap apparel and paraphernalia all throughout this city state
2238220	2240740	dorm room with their logo all over.
2240740	2246580	And in the middle of the room there is one out of place Casio keyboard with a sheet of
2246580	2247700	music in front of it.
2247700	2250340	I'll pull John in behind me and shut the door.
2250340	2251340	Okay.
2251340	2252740	That way he doesn't escape somehow.
2252740	2254220	Are there numbers on the walls?
2254220	2255740	There are, yes.
2255740	2259420	There are numbers covering the walls, the floor, the ceiling, and literally like a desk.
2259420	2261300	Was that also in the hallway and stuff?
2261300	2263340	Yes, every single place that you've been so far.
2263340	2265900	Okay, I'm going to go and see what the music is.
2265940	2270780	A set of music notes written on the staff is pictures.
2270780	2277300	And the pictures are seven eggs, a golf ball, a cat, a demon, and an egg.
2277300	2279380	Are they like cartoons or?
2279380	2280380	They are.
2280380	2287940	And John Lee Pettymore begins writing once again on the back of the chair in this room.
2287940	2290220	Bruce Robin in numbers.
2290220	2291220	Is the keyboard on?
2291220	2292220	It is.
2292220	2295260	If I press on some keys is it just, what kind of sounds are they making?
2295700	2296900	Oh no, it's jingle bells.
2296900	2300700	It's like a, it's like ching, but it's a, I gotta, it's like cling.
2300700	2301980	How do, how do bells sound?
2301980	2305260	Like jingle bells are like chink, chink, chink, chink, chink, chink, chink, chink, chink.
2305260	2306880	So it's a, it's a shunk.
2306880	2309740	It's a shunk, but in a specific tone.
2309740	2310740	So poke around.
2310740	2313340	It's not like fart noises and like bleh, bleh, bleh.
2313340	2314340	No, no.
2314340	2317380	It's more like the, you know how they have like the choirs on there.
2317380	2319660	They're like lah, lah, lah.
2319660	2324940	I guess I'm going to take this sheet and put it in my pocket because I don't know what
2324940	2325940	it means right now.
2325940	2326940	Sure.
2326940	2330340	I guess I'll take one more look around and then I guess go over to 328.
2330340	2331340	Okay.
2331340	2335100	So looking around, the only thing that you would notice is like there's a window in this
2335100	2341740	dorm room and looking out you can see the whole campus from here and it too is completely,
2341740	2344540	the whole campus is all festive.
2344540	2346820	Like there are lights up everywhere.
2346820	2350780	There's all these different decorations all over the place and in the middle of campus
2350780	2352860	there's a large old bell tower.
2352860	2355020	Is there a sheet for the dance in here?
2355020	2356020	The ball?
2356020	2357020	Like a flyer?
2357020	2358020	Yes.
2358020	2359020	Yeah.
2359020	2360020	There are multiple flyers.
2360020	2363180	Can I grab one and see like what is the like first clue or whatever on it?
2363180	2366380	Actually on the back of one of them, they're written in Sharpie.
2366380	2374460	It says one plus three plus nine plus and then it like has a bunch of math and then
2374460	2379420	it says equals three 30 which you would know is the room number that you're standing in.
2379420	2381460	What else does the like flyer say?
2381460	2385260	The flyer just says it's got a bunch of like pictures.
2385260	2390820	It's a lot of like illustration and design and then it says the annual jingle ball.
2390820	2397540	Follow the scavenger hunt in order to make your way to the night of your holiday season.
2397540	2401980	If I look around, is there anything that like looks like a scavenger hunt list or anything?
2401980	2402980	Nope.
2402980	2403980	Okay.
2403980	2405200	I'm going to go head over to 328 then.
2405200	2406200	In 328?
2406200	2407200	With John and Toe.
2407200	2408200	Yeah, John's with you.
2408200	2410620	He's still doing the same dumb shit.
2411020	2414860	In 328 you would see, it's a similar scene.
2414860	2421260	There's shit written all over the place in all sorts of different materials and what
2421260	2426580	you already learned about Harriet Marks is that she is a pro-union activist.
2426580	2433820	There are pictures of her with different groups and different protests and marches and then
2434020	2442020	her roommate, you find out her name, Amelia Locke, and she has pictures of her with different
2442020	2447740	trophies and then you see actually she has all of her trophies displayed and they are
2447740	2456720	for riddle competitions and scavenger hunt competitions and there is a space on her desk
2456720	2459300	where a laptop would be.
2459300	2464380	Like you see where her connecting cable, like her power cord would normally plug in.
2464380	2471740	She's got the cord ready to plug in with one of those little DIY tricks with the binder clips.
2471740	2474300	Right, right.
2474300	2479860	And then you see like on the other side, the USB for her old school USB mouse is like clipped
2479860	2484420	in on the other side for the USB port on the opposite side of this laptop that is not there.
2484420	2488420	If I look around the room, is there any, can I find like a phone number or anything for
2489020	2492140	Roll search for me.
2492140	2493140	Eight on a forty.
2493140	2497500	Uh, yes, you find phone numbers for both Harriet Marks and Amelia Clarke.
2497500	2498500	Okay, I'm gonna...
2498500	2499500	Sorry.
2499500	2500500	Amelia Locke.
2500500	2501500	Right, not Amelia Earhart.
2501500	2502500	Correct.
2502500	2505700	Uh, I'll write those down and I'm gonna give Amelia a call.
2505700	2506700	Okay.
2506700	2507700	Bring bring!
2507700	2508700	And...
2508700	2509700	Bring bring!
2509700	2510700	That was Taylor.
2510700	2511700	Thank you everyone.
2511700	2512700	And it goes to voicemail.
2512700	2514260	Voicemail box is not set up.
2514260	2515900	Okay, put my phone away.
2515900	2517540	What were all the trophies for?
2517660	2520860	Oh, yeah, Brittle Competitions and Scavenger Hunt Competitions.
2520860	2528340	With your correct search role, you actually find a handwritten note in the desk of Amelia
2528340	2533860	Clarke, where she is talking about Amelia Locke, right?
2533860	2534860	God damn it.
2534860	2537240	What did I say that time, Clarke?
2537240	2538700	Who is Amelia Clarke Bishop?
2538700	2540140	I don't know.
2540140	2548820	So Amelia Locke has a handwritten note in her desk where she is freehand writing her
2548820	2555840	views on the suicide of her roommate, Harriet Marks.
2555840	2564300	And basically nothing concrete, but she was very confused by the way it all went down.
2564340	2569980	I did not think that Harriet was the type of person who would commit suicide and said
2569980	2574740	that she had a plan to figure out what actually happened.
2574740	2576020	Okay, interesting.
2576020	2577500	Was it just on a scrap piece of paper?
2577500	2578500	It was, yeah.
2578500	2581780	Is there anything else in the desk that looks of interest?
2581780	2582780	Dildo.
2582780	2584700	I closed the desk.
2584700	2586980	Kind of red-faced.
2586980	2591180	Glad that Jon is kind of in that state so that I'm not more embarrassed than I would
2591180	2592180	be.
2592180	2595700	Is that like where Harriet's stuff was?
2595700	2597700	Can I search around her desk and stuff?
2597700	2598700	Absolutely.
2598700	2601180	Go ahead and roll another search check for me.
2601180	2603660	31 on a 40.
2603660	2609600	Written on a sticky note and tucked away in between other papers, you find something that
2609600	2611120	catches your eye.
2611120	2616460	You find a sticky note that has a to-do list written on it.
2616460	2624700	And the first thing says, research most unethical corporation in the city.
2624700	2630700	And the second mark on the to-do list says, who is the overseer?
2646460	2676300	How am I the only one trying to pull over How can I have enough drowning out of the
2677140	2678140	house?
2678140	2679140	No one knows.
2679140	2680140	There's no one home.
2680140	2681140	No one home.
2681140	2681140	
