start	end	text
0	5500	Greasy greetings to all of our fantastic listeners out there.
5500	10900	It is I, the mesmerizing, masticating mutt, Wolf the dog,
10900	15500	Yo DJ, your host, Angel Parental Figure,
15500	18500	and you, fantastic listeners,
18500	26800	are doing a fantastic job of listening to us here at 694.2 PTBP,
26800	30800	coming at you live from some time somewhere.
30800	34300	Who even knows when or where I am anymore?
34300	36000	I certainly don't.
36000	40500	But what I do know is that we got ourselves another Howlin' with Wolf,
40500	43800	and that makes my teeth rattle with joy.
43800	47300	This edition of Howlin' with Wolf is from Ikaris,
47300	51200	who tweeted about the show and tagged "@pretendingpart",
51200	56600	the equivalent of 8.5 normal-sized good deeds or 3.6,
56600	58700	whatever, either way.
58700	62700	Shouts out to Ikaris for telling folks the good news.
62700	64500	Ikaris writes,
64500	72100	I'm sorry for picturing you drinking the grease I used to eject from the name-redacted fast food bin.
72100	76500	It still makes me sick, and I have no idea how you do it.
76500	79100	But you do you, Mr. Wolf.
79100	85200	That grease has to go somewhere, and I guess you eating it is better than a landfill.
85200	90600	Everyone listen to the podcast. It's a fantastic time, Phil.
90600	92300	Thank you for your time.
92300	95600	Well, damn, thanks for writing in, Ikaris.
95600	99000	I am the gleeful grease trap.
99000	101900	You got grease you need disposed of?
101900	104000	I'm here to gobble it up.
104000	109200	And even if you don't want me to, I'll probably still grab a gulp of three.
109200	116200	Much of the grease I consume immediately spreads itself amongst my many hair follicles,
116200	118600	coating them and making me more...
118600	121100	aerodynamic?
121100	122400	I don't know, y'all.
122400	127800	I just know that after I get that grease, I'm slipping around faster than hell.
127800	131800	Now, if you want to write up something for your greasy wolf to howl,
131800	134700	tag "@pretendingpart on Instagram",
134700	137000	tag "@pretendingpart on Twitter",
137000	139800	tag "@pretendingto be people on Facebook",
139800	145900	or write up a five-star review on the podcast app of your choice and holler at your wolf about it.
145900	152100	If you want to support the show and make sure it doesn't disappear into a smooth void,
152100	160200	exchange financial support for bonus content over at patreon.com slash pretending pod.
160200	166800	If you want to find links to all our shit here at 694.2 PTBP,
166800	170200	the links are in the show notes.
170200	175000	Don't blink, don't think, just sink into the deep.
175000	177200	It's time for the news.
177200	181800	Last time, the Cannes crew went to Julius and X's house,
181800	184800	cleaned up a bit and discussed next steps.
184800	189800	But Julius is clearly having a harder time dealing with recent events.
189800	193600	Will Cal and Beck agree to work alongside X?
193600	200600	This woman who clearly has no regard for Julius's health in the names of truth and journalism?
200600	203800	Will Stevie and Cal keep each other's trust?
203800	208600	Will Julius's loss of grip lead him to losing himself?
208600	212000	Will Beck get even wilder?
212000	216600	All this and more coming at you right after Alter Girl with
216600	220600	My Life is Great and It's All My Fault.
223600	230600	Cause my life is great and it's all mine.
237600	245600	Cause my life is great and it's all my fault.
254600	259600	I was saying, cause you build your sandwich here and then you go, yeah, you go to your next station.
259600	261600	You're only that next station.
261600	265600	Yeah, I don't know, a bunch of shredded lettuce and then I fucking kill myself.
265600	271600	I beat up who's ever keeping me from the meat bins and take what's mine.
271600	276600	I'd take down a bunch of banana peppers probably. I'm a big fan of eating those, just raw.
276600	277600	Yeah, that'd be good.
277600	284600	Banana peppers are solid. Cuc, tomato, Sammy. Cuc on either side of the tomato with some Dijon mustard.
284600	288600	Can you cut the part of him saying, I love eating those raw?
288600	291600	I mean, if meats are out, bread's out.
291600	296600	Yeah, the Sammy was the cucumber. The cuc was the bread.
296600	301600	Can I have the fish scoopables?
301600	303600	Like tuna?
303600	305600	The fish scoopables.
305600	310600	That's a main protein. I think that's excluded.
310600	312600	Damn it. Cheese?
312600	315600	Cheese is a topping. No, cheese goes on first.
315600	318600	Technically cheese is part of that first bracket.
318600	323600	Can I go somewhere else?
323600	326600	I don't like this restaurant.
326600	331600	I'll just eat tomatoes with oil and vinegar.
331600	333600	There you go.
333600	337600	They have secret shakers up there and oregano is one of them.
337600	339600	You guys throw some oregano on there?
339600	342600	Oh, he's definitely getting that on the tomato. Maybe a little salt and pepper too.
342600	348600	I'm going to get the oregano shaker, put oil in it and eat that.
348600	350600	Like soup, oregano soup.
350600	352600	Oregano soup.
352600	354600	Can I throw it in the bread toaster?
354600	358600	Oh, hey, my whole family's from Italy. We were from oregano.
358600	360600	Why can you toast it?
360600	361600	I'm going to say you can toast it.
361600	362600	You can toast it.
362600	363600	That's the perk.
363600	367600	Then I will have shredded lettuce toasted, please.
367600	370600	Line out the door immediately.
370600	373600	Did you say shredded lettuce toasted?
373600	374600	That's it.
374600	376600	Burnt ends, baby.
376600	380600	I'll have the vegan burnt ends.
380600	384600	That's just singed lettuce.
384600	386600	All right, I'll start recording.
386600	387600	Yeah, we should have been recording that.
387600	390600	You know how somebody's doing the transcripts for all the episodes?
390600	392600	Oh, yeah. Can we shout out Cinder Crow?
392600	394600	A true American hero.
394600	395600	Who's doing it?
395600	396600	Or wherever you're from.
396600	399600	You're a hero to us in America, so you're an American hero.
399600	401600	You're our American hero.
401600	403600	Well, I was thinking, because I read through some of it,
403600	406600	and it's really detailed and good,
406600	412600	so what if we made some funny sounds and words to see what it does?
412600	415600	Oh, yeah. We should really start trying to mess with this guy.
415600	418600	Flurbin, lurbin, shlick.
418600	421600	I'm going to say there, there, there, there.
421600	422600	Which ones am I using?
422600	424600	Oh, my gosh.
424600	426600	You're a nightmare to people like him.
426600	427600	Who knows?
427600	432600	Buffalo, buffalo, buffalo, buffalo.
432600	433600	Seriously.
433600	434600	Cinder Crow.
434600	436600	Huge shout out to Cinder Crow.
436600	437600	Absolutely.
437600	438600	That is so insane.
438600	439600	You rock.
439600	440600	Thank you so much.
440600	441600	Bazinga.
441600	443600	Now you've got to write Bazinga in your transcript.
443600	444600	Yeah.
444600	447600	Also, you get to write our season two recap episodes.
448600	452600	Honestly, because of the transcripts, we don't have to do those.
452600	455600	I mean, that seems...
455600	457600	Well, we can do those. It's just you've got notes.
457600	459600	Okay. All right. I'll start now.
459600	461600	Six months off.
461600	463600	I don't think it'll be as hard this time.
463600	465600	No, I'll still do it.
465600	468600	The recap episodes, they were fun for you to do, right?
469600	473600	That was like a pleasurable part of this life venture, right?
473600	474600	This life venture, right?
474600	478600	I started sweating through both shirts.
478600	480600	Seriously, if you haven't checked out the transcripts
480600	484600	or if you know someone who would be into the transcripts,
484600	485600	you can find them.
485600	487600	They're linked over on our Discord,
487600	489600	and you can find that Discord...
489600	491600	In the show notes.
491600	492600	In the show notes.
493600	500600	Another big, big part of this is that I've been training in AI on those transcripts.
500600	503600	And so pretty soon, none of us will be necessary,
503600	508600	which means all of your Patreon money will go straight to making the pod better.
509600	513600	We're all cut out from that process as soon as I perfect this machine.
514600	518600	I read one of the AI transcripts that you generated,
518600	522600	and my favorite part was the guy who is playing Luke,
522600	523600	and he says,
523600	525600	This mystery's mysterious!
525600	529600	And then fart noises for 45 seconds.
529600	531600	It's absurdly accurate.
531600	532600	That was a good one.
532600	534600	Speaking of fart noises...
535600	536600	Yeah.
537600	538600	Human fart noise.
538600	539600	Taylor just walked in.
539600	540600	Wow.
540600	543600	And gave it to us good on the mic.
545600	546600	See you guys.
546600	547600	Bye.
547600	548600	Bye.
548600	549600	We can cut all that out.
549600	550600	Just the end and the buy.
550600	554600	Last night, this home security salesman came to my house,
554600	555600	and it was fucking...
555600	556600	It was after dark.
556600	558600	I had not turned my French ports light on,
558600	560600	so I just get this knock on my door,
560600	561600	and I can see nothing.
561600	562600	Ugh.
562600	563600	So I open it up, it's just the fucking...
563600	564600	Did you turn the light on?
564600	565600	I turned the light on.
565600	567600	It's the vivid guy.
567600	568600	It's good he wasn't blurry.
568600	569600	He's like,
569600	572600	Hey, I assume you're the homeowner or the renter?
572600	573600	And I was like,
573600	574600	Yeah, I'm the renter.
574600	575600	And he's like,
575600	576600	Well, you know, this isn't the highest crime area,
576600	579600	but talking to some of your neighbors tonight,
579600	580600	I know there's a lot of petty crimes,
580600	582600	like package thefts and car break-ins,
582600	584600	so if you'd be interested in a camera or anything,
584600	585600	and I was like,
585600	586600	Oh no, I'm the one doing all those,
586600	587600	so I don't want any more cameras.
587600	588600	What?
588600	589600	Did you really?
589600	590600	Yeah.
590600	597600	Oh my god, what did he say?
597600	599600	He just laughed nervously,
599600	600600	and then I shut the door on him.
600600	601600	He said,
601600	603600	You should buy all my cameras then.
603600	605600	Once they're gone, they're gone.
605600	608600	I opened up my door the other day to a doorbell ring,
608600	610600	and it must have been the knock.
610600	611600	My doorbell doesn't work.
612600	620600	And a young lad on one of those bird scooters.
620600	621600	It wasn't a bird.
621600	622600	It was a plane.
622600	623600	You stand flat on it.
623600	624600	Superman.
624600	626600	And there's just two wheels on either side of your feet.
626600	627600	Oh, those.
627600	628600	Like, yeah.
628600	629600	Like a hoverboard thing.
629600	630600	They call them hoverboards.
630600	631600	Yeah, the hoverboard.
631600	633600	He was just hoverboarding around the neighborhood.
633600	634600	Nice.
634600	635600	How old was he?
635600	638600	He couldn't have been a day over, what?
638600	639600	Seven.
639600	640600	Seven, yeah.
640600	643600	Those labor laws, man, in Missouri.
643600	644600	What was he selling?
644600	646600	How many Bibles did you buy?
646600	647600	He said pest control,
647600	650600	and I just closed my door and was like,
650600	653600	Oh, no, I'm sorry.
653600	658600	That's when they sprinkle the bag of pests on the lawn.
658600	661600	Like, okay, I'll be back in a few weeks.
661600	664600	Yeah, so as you can see, my legs are now covered.
664600	665600	I'm not wearing pants.
665600	666600	These are ticks.
666600	668600	You got pests everywhere.
668600	669600	Should we do it?
669600	670600	Should we do it?
670600	671600	Should we do it?
671600	672600	I'm really excited to do it.
672600	674600	I don't know what we're going to do.
674600	676600	You just said, like, pants made out of ticks.
676600	679600	Are we not already in it?
679600	681600	That's what Beck Wilder sees.
681600	688600	No, as Beck Wilder, Cal Colorado, Julius Summers, his roommate, X, Stevie Godel, and Jeremy,
688600	689600	the intern.
689600	690600	Jeremy.
690600	696600	Do we need, do we need euphemisms like roommate now that we know?
696600	697600	Okay, X.
697600	700600	We'll just go with X, his co-worker.
700600	702600	Yeah, we'll say co-worker.
702600	703600	X.
703600	706600	That's, again, a euphemism.
706600	708600	But technically true.
708600	711600	But so his roommate is technically true as well.
711600	712600	She's many things.
712600	713600	Isn't she your boss?
713600	715600	Some people could look at it that way.
715600	716600	Sure.
716600	717600	Yeah, a little bit, maybe.
717600	725600	And they're all, you're all at the close to empty house where Julius and X are living.
725600	732600	It's Wednesday, July 6th, 2022, and it is quite late.
732600	738600	On a fairly rough note, even though he just taken the time to clean a few folks' guts
738600	746480	and spray from off himself and change suits, Julius is openly bleeding once again, half
746480	750600	of his face now scraped in raw, beating up with his own blood.
750600	757600	And on a more positive note, Stevie just realized they trust Cal Colorado.
757600	763600	Jeremy, the intern, stands up from the Ikea couch and stretches his arms and legs while
763600	766600	letting out a big old yawn, signaling his exit.
766600	771600	And on his way out, he squares his shoulders to Cal and assures you,
771600	776600	I won't say a word until you arrive at Cannes in 48 hours as the producer.
776600	779600	Just idle nose and coffees for everyone.
779600	782600	And with that, he's off.
782600	783600	48 hours?
783600	788600	That's what X had told you is that she needed 48 hours to kind of clean up the Julius mess
788600	792600	before you were to be named the new producer.
792600	794600	And then that's when we can air the footage as well?
794600	795600	Yep.
795600	801600	And X looking down at her phone says to Julius,
801600	803600	I've just alerted the doctor.
803600	805600	She's on her way.
805600	806600	Would I know this doctor?
806600	812600	I'm not exactly sure if you've met this one, but one of the few in the city that
812600	814600	knows to look the other way, I suppose.
814600	815600	What's their name?
815600	817600	She looks down at her phone again.
817600	820600	I guess we just call her Dr. Murray.
820600	822600	Dr. Murray.
822600	823600	Hmm.
823600	829600	Is it going to be the usual or, I mean, do we have access to those Godel things?
829600	833600	She kind of looks at the other three of you.
833600	835600	I can attest that they work like a charm, dude.
835600	837600	He got killed.
837600	841600	No, not killed, but almost died from a rabbit.
841600	848600	He was very much impaled by a, not a real jackalope, but a rabbit who had been senselessly
848600	854600	tied up with antlers to resemble a jackalope and then left to wander willy nilly.
854600	856600	And of course it was going to impale someone.
856600	858600	You know, of course someone was going to trip and impale themselves on that.
858600	859600	It was a hazard.
859600	860600	It was a hazard.
860600	862600	But yes, the medicine thing they had.
862600	863600	It wasn't my fault.
863600	864600	It wasn't his fault.
864600	867600	But, like, it's me that's going to die now.
867600	869600	So, like, do we?
869600	872600	Well, you don't look like you're going to die.
872600	873600	I don't feel very good.
873600	874600	He kind of does, though.
874600	875600	Look at him.
875600	876600	How many hit points do you have?
876600	880600	This is the first time you've cared about that in three days.
880600	882600	It's all rushing back to him.
882600	883600	It hurts.
883600	886600	I'm at 40 percent capacity, it feels like.
887600	893600	You were at, like, 10 percent capacity and insisted we not take you to a hospital.
893600	896600	Sometimes the heat of the moment.
896600	899600	I had the napkins shoved in me and they were helping.
899600	902600	And he points to the napkins shoved in his gun wound.
902600	905600	And Beck winks at Stevie.
905600	906600	Yeah, man.
906600	907600	Good work.
907600	908600	Thanks.
908600	910600	I do the best that I can.
910600	911600	Is she coming here?
911600	913600	Yes, she is close by.
913600	920600	Stevie, as fine as your improvisational work was, we do need a real doctor to look at you.
920600	921600	The door slams open.
921600	922600	What is the doctor, Murray?
922600	923600	A doctor of?
923600	926600	Yeah, the real doctor you say that you need.
926600	935600	And this elderly woman with thick gray hair, thin and wiry and built five feet tall and
935600	939600	created by Chainsaw Unicorn from Augusta, Georgia.
939600	941600	Shout out to Chainsaw Unicorn.
942600	945600	Unicorn noise.
952600	954600	Whoa, is that what a unicorn sounds like?
954600	956600	Yeah, the hiss and squish.
959600	967600	Chainsaw Unicorn is patron at at least the $10 level over on patreon.com slash pretending pod.
967600	973600	And you too can send in an NPC or a location at that tier and support the show over there.
973600	976600	You know what not enough people take advantage of is they can describe the voice.
976600	979600	That's a very true statement, yes.
979600	981600	And I don't know if you can see.
981600	984600	Because otherwise they all sound like this.
984600	989600	I don't know if you can see, but I'm wearing clothes that are two sizes too big.
989600	994600	Looks like a strong wind could turn me into a pretty awesome kite.
994600	996600	But yes, I'm here to help you.
996600	998600	I'm here to help you out.
998600	1003600	Who's the benevolent neither of the help.
1003600	1005600	Oh, look at you.
1005600	1006600	Look at your face.
1006600	1012600	Julius looks at Cal and Beck and is like, yeah, they're generally pretty.
1012600	1014600	They're always this weird.
1014600	1017600	And I thought you hadn't met him.
1017600	1021600	I hadn't, but I mean, like all the doctors that they send are this weird.
1021600	1024600	So why don't you want to go to a fucking hospital?
1025600	1029600	This is like been my only interaction with doctors ever.
1030600	1033600	Yeah, sure. They're all a little weird, but not like this.
1033600	1040600	Julius rips his shirt off and just points to his bloody mess with napkins and everything shoved in it.
1040600	1043600	Oh, yeah. Okay. I see. I see.
1043600	1049600	Okay, you're going to need to have your lay down on the on the kitchen island table over there, the countertop.
1049600	1051600	Just strip on down to your baccas.
1051600	1055600	Yeah, I heard I heard about the incident the last time.
1055600	1059600	Oh, Mr. Big Thighs had had is the doctor.
1059600	1061600	Things got bad.
1061600	1063600	And now we can we talk less?
1063600	1067600	Maybe just kind of I'm for gossip.
1067600	1068600	That's kind of my whole thing.
1068600	1069600	Okay. Tell me.
1069600	1076600	It's funny. Tell me the juiciest stuff, but it hurts and ripping the napkins about.
1076600	1080600	But with a Swift, let's see a Swift.
1080600	1083600	Oh, a extreme.
1083600	1084600	It's not good.
1084600	1085600	No, it's extremely good.
1085600	1088600	I rolled a 77, but she has an 80.
1088600	1089600	Fuck yeah.
1089600	1093600	I was just, you know, I figured that's pretty high.
1094600	1103600	One plus three is four hit points are restored back to you as she rips you up, tears you down and sews you up.
1104600	1106600	Basically without you even realizing it.
1106600	1114600	And then for the final critical role trick here, she goes, oh, and I got something real fucking neat for your face.
1114600	1119600	And she has a suitcase with her that she cracks open for the first time.
1119600	1122600	Everything previous has just been in her bag.
1122600	1132600	And inside the suitcase, you see a contraption that, while familiar, does have very specifically different sort of branding.
1133600	1142600	Cal's trying to be subtle, but he, uh, he very clearly is like taking a picture of this and he's winking to Beck for the story.
1142600	1143600	Yeah.
1143600	1146600	And everyone is like pretty in awe.
1146600	1155600	Like this is as if we were standing around and someone pulled out like a very cool new contraption that yeah, like that we hadn't seen before.
1155600	1157600	Like what would a new three.
1157600	1158600	Thank you.
1158600	1159600	Dicked dildo.
1159600	1160600	Oh my God. Can you imagine?
1160600	1161600	I've seen that.
1162600	1164600	New Xbox.
1166600	1169600	Not with prehensile balls.
1170600	1174600	Those are the two kinds of jokes you're going to get here pretending to be people.
1174600	1176600	Oh doc, patch me up.
1176600	1178600	What do you call that thing?
1178600	1182600	Well, I've been calling it the skin graft 2000.
1182600	1183600	Awesome.
1183600	1185600	We can hook you up with some marketing people to work on that.
1185600	1186600	That does seem fair.
1186600	1189600	I don't know what the folks upstairs are going to call it.
1189600	1193600	It's July of 2022, so 2000 doesn't seem very futuristic anymore.
1193600	1197600	Well, they don't need names for stuff in the military probably.
1197600	1200600	No, no, they, they all have names for their things.
1200600	1204600	Oh, well, who's the marketing people for the military?
1204600	1207600	Oh, well, I mean.
1207600	1213600	And she slams, she slams this, uh, this device on, on Julius Summers face.
1213600	1217600	You know, when the question itself is so wrong, you don't know where to begin to answer.
1220600	1222600	Does it feel good?
1222600	1224600	That's a good question.
1224600	1227600	Beck, do you remember what it felt like?
1227600	1229600	I think it was good.
1235600	1236600	Yeah.
1236600	1240600	Uh, go ahead and, sorry, I was waiting for whatever this is.
1240600	1242600	Feels so good.
1244600	1247600	Beck is filming the process and no one has a problem with that.
1248600	1250600	Oh man, it feels good.
1250600	1251600	Yeah.
1251600	1266600	Dr. Murray says, and you feel the, these like warm rays like shining in, penetrating, and then you feel a sort of tingle almost like a, like a foaming sensation that you can hear.
1266600	1272600	And then it's, it's like, like pop rocks is kind of the vibe.
1272600	1273600	Yeah.
1273600	1275600	Pop rocks with a mouthful of Sprite.
1275600	1279600	And you feel warm.
1279600	1282600	You feel nice.
1282600	1291600	She pulls it off and everyone looking sees Julius Summers with a face, a whole face.
1291600	1293600	Nothing but a face, so help me God.
1297600	1298600	It's his?
1298600	1299600	Yeah.
1299600	1306600	It's just completely cleaned up every single cut and skin is smooth.
1306600	1309600	Just matching the other half of his face.
1309600	1312600	Julius, you look like a million bucks.
1312600	1313600	It feels great.
1313600	1317600	I mean, God, we, we got to tell people about this stuff.
1317600	1319600	Hey doc, can I get a hit of that?
1319600	1320600	Yeah, what do you need?
1320600	1321600	What do you need?
1321600	1322600	What is going on?
1322600	1325600	I mean, I just haven't felt a hundred percent the same since I fell on that Jackalope.
1325600	1327600	Why don't you just give me a top up?
1327600	1328600	Okay.
1328600	1330600	You said it was a, you sat on it.
1330600	1331600	Yeah.
1331600	1332600	All right.
1332600	1333600	Face down.
1333600	1334600	Ass up.
1334600	1335600	All right.
1335600	1338600	That's the way I'll stitch you up.
1338600	1339600	You got it.
1339600	1347600	Beck bends over the couch and he just flips up the shirt tails on his Hawaiian shirt and
1347600	1348600	jacket.
1348600	1349600	Yeah.
1349600	1350600	Jacket.
1350600	1353600	You receive four hit points.
1353600	1354600	Yeah.
1354600	1358600	Cal Cal took the camera from you and it's filming that, but his thumb is like over a
1358600	1366600	quarter of the lens, which is really hard to do on a camera like this.
1366600	1367600	Huge thumbs.
1367600	1369600	We never talked about it.
1369600	1371600	Did I recover any hit points from the face?
1371600	1372600	Uh, healing.
1372600	1374600	Uh, no, that was with two rolls.
1374600	1375600	Unfortunately.
1375600	1376600	That was your sweet.
1376600	1377600	Yeah.
1377600	1379600	At least I look good.
1379600	1382600	Julius thinks and then makes a note to go check.
1382600	1383600	Julius.
1383600	1386600	I have a little pocket mirror, uh, in my makeup kit that you could use.
1386600	1388600	All anchors carry these all reporters carry these.
1388600	1389600	Take a look at that.
1389600	1390600	Don't go back into that bathroom please.
1390600	1395600	Uh, Hey doctor, doctor Murray, could I get one of those for, you know, before I go on
1395600	1396600	air?
1396600	1398600	Oh, you want, you like, you want to have one.
1398600	1401600	I want to, I want to be able to do the face thing.
1401600	1405600	Well, these are very important to the firm currently.
1405600	1407600	And uh, what, what firm?
1407600	1409600	Well, the program, you know, the group, you know?
1409600	1410600	Yeah.
1410600	1411600	What's that called?
1411600	1412600	No name for it.
1412600	1413600	Obviously.
1413600	1414600	Obviously.
1414600	1417600	Julius chuckles too.
1417600	1422600	Well, his name's for things that exist.
1422600	1424600	My dear boy.
