start	end	text
1424600	1425600	Yes.
1425600	1427600	And we don't exist.
1427600	1429600	Wink, wink.
1429600	1430600	She winks.
1430600	1432600	I look back at Beck and see if he was filming that.
1432600	1433600	I was.
1433600	1438600	I wink at Beck.
1438600	1441600	That puts the lens cover on and off.
1441600	1443600	Oh my God.
1443600	1449600	A little camera wink.
1449600	1451600	But you said that it was military issues.
1451600	1452600	So you're military.
1452600	1458600	Well, you know, uh, I suppose every once in a while, you know, I get there, I become it.
1458600	1460600	What kind of doctor are you Dr. Murray?
1460600	1463600	Mostly, uh, surgical.
1463600	1464600	People?
1464600	1465600	People.
1465600	1467600	Yeah, of course people.
1467600	1468600	Okay.
1468600	1472600	Well, and if he got something else laying around, I'll look at it.
1472600	1473600	Of course.
1473600	1476600	Cal thinks about that.
1476600	1483600	Of course.
1483600	1487600	We may have a person who's half a god turtle.
1487600	1489600	He probably, Stevie.
1489600	1492600	I mean, yeah, but we don't know where he is.
1492600	1494600	That should be our top priority though.
1494600	1495600	Right?
1495600	1496600	Finding your brother.
1496600	1497600	We've got a clear 48 hours.
1497600	1500600	I think that's maybe our next plan of attack.
1500600	1503600	Breaks in the news cycle like this don't come often, Stevie.
1503600	1504600	Yeah.
1504600	1505600	Yeah.
1505600	1506600	No, you're right.
1506600	1511900	That, that's exactly, that's exactly what we should do.
1511900	1526480	And they show you a Reddit post that only has like 460, that only has like 800 and 36
1526480	1527480	upvotes on it.
1527480	1528480	That's a lot.
1528480	1529480	Yeah.
1529480	1531480	It's doing all right.
1531480	1532480	Yeah.
1532480	1541480	And it is a hole in the ground somewhere in South America.
1541480	1542480	Oh shit.
1542480	1543480	Uh oh.
1543480	1548080	I don't know if he's like available.
1548080	1549080	He's gone international.
1549080	1554400	I want to show that to X and see what her reaction is.
1554400	1556200	Is this a particularly smooth hole?
1556200	1558920	Oh, it's an incredibly smooth hole.
1558920	1562400	How does she react to that?
1562400	1563880	Um, wow.
1563880	1567240	Uh, what does the article say about it?
1567240	1574920	Yeah, it says that it's, um, there is some sort of like a lightning tornado storm and
1574920	1583080	now the, yeah, that no one's going near the hole cause they can actually see down, but
1583080	1589540	they can keep seeing down until they can't see any more down, I guess.
1589540	1592920	Does your brother have a place in South America or your family?
1592920	1593920	Well, yeah.
1593920	1594920	Where?
1594920	1597520	Is it a place like the gorge?
1597520	1600400	Oh no, no, no, no, no, no.
1600400	1602360	There's, there's no more of those.
1602360	1603960	So it's like a place that you vacation?
1603960	1608640	Well, no, I mean we have a home down there, but it's not even in the same country as this.
1608640	1619840	It's like, ah, we have, we have a, we have a home in Brazil and cow goes, I said it,
1619840	1623280	I said it normally zoom in and enhance that picture.
1623280	1624280	Where's it from?
1624280	1625360	This happened in Chile.
1625360	1632400	She just swipes on the screen to enlarge it.
1632400	1634240	Do any of you guys speak Spanish?
1634240	1635240	Okay.
1635840	1640640	See, that's, that's not a whole, and like one of the top comments is linking another
1640640	1646520	Reddit article that is in Europe and it's like a huge hole in the ground.
1646520	1648520	That's very smooth.
1648520	1651200	Stevie how many, how many of these are there?
1651200	1652200	I don't know.
1652200	1659120	I just started seeing them like today, but there, there seems to be a few, a fair, fair
1659120	1660720	amount of them.
1660720	1662120	Are they just all in the ground?
1662120	1665640	Are they in other, yeah.
1665640	1672440	One went through a building like half, like half of a building is just like gone.
1672440	1677560	So Stevie, do you know anything about this power your brother has or what these holes
1677560	1678560	are for?
1678560	1689080	I mean, I know that, um, they're starting to get tears in their eyes.
1689080	1700920	I know that my granddad and I guess my dad were keeping it trapped and we like let it
1700920	1701920	out or whatever.
1701920	1707040	And then I let it out or whatever.
1707040	1708040	On the bridge?
1708040	1710040	I didn't know it was there.
1710040	1713760	I didn't, he just did like immediately.
1713760	1714760	What did you see?
1714760	1716400	I mean, I saw the same as everybody else.
1716400	1721120	I saw, I saw the lightning, like the tunnel from like afar.
1721120	1727520	I wasn't even over there, but I didn't know what it was at first and it started dawning
1727520	1728520	on me.
1728520	1732760	This is a very important question, Stevie.
1732760	1736320	Between then and now, have you contacted anyone in your family?
1736320	1745120	No, just like the cops, you know, to like try to do the whole blackmail thing.
1745120	1748640	How come God couldn't teleport out of Grover's gorge?
1748640	1750800	Is there a spell?
1750800	1752200	No, I think he is.
1752200	1754200	I think he was in a turtle.
1754200	1756720	So being in a human is what caused?
1756720	1760720	Or maybe there's a spell like, oh, that might be it.
1760720	1763600	When it was in a turtle, were there like little holes maybe?
1763600	1764600	Or slow holes?
1764600	1765880	Oh, there you go.
1765880	1769360	Slow tiny holes.
1769360	1774520	Like aerated lawn or like, no, I don't.
1774520	1775520	Little microbursts.
1775520	1777160	Not that I know of.
1777160	1782280	They might've looked like potholes, divots, but very smooth.
1782280	1785320	Sorry, it's like so late.
1785320	1788240	It's been a long day.
1788240	1789240	Okay.
1789240	1791040	Beck, get them an energy drink.
1791040	1792040	You got it.
1792040	1793200	Oh, energy drink?
1793200	1794200	Give me one.
1794200	1795200	Oh, okay.
1795200	1796200	Yeah.
1796200	1798200	I love energy drink.
1798200	1799200	Me too.
1799200	1800200	Go, go, go.
1800200	1801200	Well, where are the...
1801200	1806200	Where the fuck is he going next?
1806200	1807320	I don't know.
1807320	1809320	Do you see any rhyme or reason to it?
1809320	1810320	Can we...
1810320	1811760	Let's maybe start plotting them out.
1811760	1813920	Like where are they ending up?
1813920	1814920	Okay.
1814920	1816920	Maybe it's a drawing.
1816920	1817920	Maybe it's a symbol.
1817920	1819880	A good old fashioned connect the dots.
1819880	1821480	We saw symbols in the pit.
1821480	1823560	Maybe that's it.
1823560	1825800	Let's Google map them.
1825800	1827080	Let's Google map them.
1827080	1829080	Let's Google map them.
1829080	1834720	Wait, Stevie, have any of the nerds in your phone started doing that already?
1834720	1836560	Oh, that's really smart.
1836560	1839240	Yeah, those Reddit tweets have been breaking a lot of shit on us.
1839240	1842600	Yeah, they could move this forward like so fast.
1842600	1848120	Can you talk to them?
1848120	1851200	Can you talk to them?
1851200	1853000	I feel like sometimes everything I say is wrong.
1853000	1854240	Oh, no, no, no.
1854240	1855240	I didn't mean like...
1855240	1856240	No, no.
1856240	1857240	No, it's good.
1857240	1858240	I can't.
1858240	1859240	I can't ask.
1859240	1862200	And they're just like going through the phone and...
1862200	1866560	Beck says, I'll help you out and Beck starts doing it too because that's where he lives
1866560	1867560	is online.
1867560	1871080	He's already had burner accounts that he can start putting stuff in different forms.
1871080	1872600	Do you have the stats to back that up?
1872600	1873840	I think I do.
1873840	1876040	I've got computer science if you want to use that.
1876040	1877800	Yeah, that's what I use to scroll Reddit.
1877800	1878800	Hold on.
1878800	1879800	Yeah, that's it.
1879800	1884840	It does not take computer science to know how to troll on Reddit with backup accounts.
1884840	1886000	What skill do you want me to roll?
1886000	1888560	No, I'd like you to roll computer science, please.
1888560	1890040	It's the only one that makes sense.
1890040	1891040	Oh, fuck.
1891040	1892040	Hold on.
1892040	1895240	I think it intrinsically makes sense with Beck's character.
1895240	1897960	Oh, that it's automatic?
1897960	1898960	Yeah.
1898960	1900960	What's your percent?
1900960	1904440	I've got 60 in computer science and I rolled a seven.
1904440	1905440	Okay.
1905440	1909240	Then suspicious activity was detected on your accounts.
1909240	1910360	You were upvoting.
1910360	1914320	It was clear that you were upvoting from the same like ISP on your multiple accounts.
1914320	1915520	God, I'm out of practice.
1915520	1922440	Julius pulls his phone out, but can't figure out how to navigate off of the leg day subreddit.
1922440	1924340	So he just puts it back.
1924340	1927520	He doesn't want to leave that page anyway.
1927520	1929920	No one on there is talking about it?
1929920	1932800	He scrolls through a few scrolls.
1932800	1933800	Does he see anything?
1933800	1934800	What?
1934800	1935800	Roll computer science?
1935800	1939400	I have zero.
1939400	1940920	The baseline is zero?
1940920	1941920	Yeah.
1941920	1947560	I have U10 that's like giving Beck a 70, so I can't do that.
1947560	1951400	No, you can do that.
1951400	1958600	The only post he sees is the title is like, did a whole lot of leg workouts today.
1958600	1962400	It's spelled H-O-L-E.
1962400	1965120	And everybody gets what he's talking about.
1965120	1967800	So it's the highest upvoted on the page right now.
1967800	1972880	The weightlifter is spreading whole while showing off thighs.
1972880	1975920	So there's no map made or what?
1975920	1976920	Yeah.
1976920	1980920	How long is it going to take these nerds?
1980920	1981920	I don't know.
1981920	1987120	Like, I mean, they don't always crack everything like right away and even if they do, it might
1987120	1993200	just be like in some lost thread somewhere that we haven't found, but I'll keep looking.
1993200	1998680	I mean, just tell me where the points are and I got a map here somewhere probably.
1998680	1999680	Okay.
1999680	2000680	Let's do this.
2000680	2005640	Julius goes upstairs and finds just like a, he never hung it up on the wall, but like
2005640	2015480	a big map as art, not huge, like that Luke is holding his hands about two feet apart.
2015480	2018160	It's two feet map, two foot map.
2018160	2024200	Is a SIGINT specifically technology or could it be used to like decipher a cipher?
2024200	2025200	It's absolutely.
2025200	2026200	It's for deciphering.
2026200	2027200	Specifically.
2027200	2028200	For deciphering.
2028200	2029200	Yeah.
2029200	2030200	If we lay out the plots, can I use a SIGINT roll?
2030200	2031200	Yeah.
2031200	2032200	Me too.
2032200	2033200	All right.
2033200	2034200	Let's roll those SIGINTs boys.
2034200	2035200	Oh.
2035200	2036200	Oh fuck.
2036200	2037200	I got an 86.
2037200	2038200	I got a 92.
2038200	2039200	Oh my God.
2039200	2040200	Damn.
2040200	2041200	I have a 70.
2041200	2047200	I thought that was a 69 at first.
2047240	2048240	Oh yeah.
2048240	2049240	Joe, you're reading it wrong.
2049240	2051240	You got a 69.
2051240	2052240	Damn.
2052240	2053240	Fuck.
2053240	2054240	God.
2054240	2055400	It's just like dots on a map.
2055400	2056400	It does.
2056400	2057680	It just looks like dots on a map.
2057680	2062120	Well, I think if we maybe give these Reddit nerds some time while we prepare in other
2062120	2064720	ways, maybe that will come to fruition for us.
2064720	2066520	Have we tried calling your brother?
2066520	2067520	Uh, yeah.
2067520	2068520	Hmm.
2068520	2076520	Where'd he say he was?
2076960	2082320	They hold their phone up and it's like outgoing call, outgoing call, outgoing call, outgoing
2082320	2084200	call, outgoing call, outgoing call.
2084200	2090200	Cal leans over the back and goes, rent free.
2090200	2096680	Stevie, when you like let him loose, did he like say anything?
2096680	2102480	Did he seem like he was himself at first or like, did he communicate with you at all?
2102480	2105280	He was, he was really, he was really wet.
2106280	2107960	And he looked afraid.
2107960	2109920	He looked afraid.
2109920	2115560	Wet and afraid was the alternative title of this podcast.
2115560	2126320	I've just felt this presence just emanate like through my mind and it was so scared.
2126320	2132760	And I, I just, I wanted to show that I was on its side and I wanted to, I thought that
2132760	2139560	if I could prove that I wasn't a threat, you know, like, I don't know, I, when he,
2139560	2143200	when he physically like went away from you, was he running?
2143200	2145160	Like, was he like scared?
2145160	2146160	Scared?
2146160	2156160	No, no, we walked out the door and he just looked back at me and in his eyes it looked
2156160	2157880	like he, it looked like he was there.
2157880	2168520	It looked like, it looked like Greg and just like a single tear rolled down his face and
2168520	2172080	then he wasn't, rolled for what?
2172080	2182320	Greg, yeah, I just, I'm sopping wet, just walked away.
2182320	2189640	I called after him and I ran for him and I, I tried to grab onto him and push me off.
2189640	2193480	It wasn't, it wasn't him, it wasn't him anymore.
2193480	2199000	It wasn't, just kept walking.
2199000	2205040	Stevie did Greg display an interest in wet smooth holes from a young age?
2205040	2215600	What, why, why is everyone giggling?
2215600	2219600	Well I personally think it was because of the pussy joke.
2219600	2224400	Oh, Cal turns very red.
2224400	2232440	This is, this is quite a lot and this whole time X has been just on her phone typing stuff,
2232440	2234120	swiping and such.
2234120	2239020	When we saw you at the bridge hole, were you, was that your first hole?
2239020	2240020	You saw her at the bridge?
2240020	2241520	Yeah, at the bridge hole.
2241520	2243440	You didn't tell me about the bridge hole.
2243440	2250280	Yes, I ran into your compatriots so we hadn't agreed whether you were going to bring them
2250280	2259000	in or not and yes, that was my, my first of these incidences of the holes.
2259000	2261800	Is it like coming up in your, on your guys's radar?
2261800	2266120	Yeah, it seems like maybe if you're investigating that first hole you'd be investigating the
2266120	2267120	subsequent holes.
2267120	2272800	Yes, I'm being told that the holes are being attended to.
2272800	2275360	But you and Julius were here before the hole.
2275360	2276840	What were you here doing?
2276840	2277840	Hey, yeah.
2277840	2280800	Well, that Godel technology that you saw.
2280800	2281800	Yeah.
2281800	2282800	Yeah.
2282800	2291560	Yeah, we would like to just like make the world aware that it's being used and his whole
2291560	2294280	situation.
2294280	2297760	Beck is pointing at the device.
2297760	2298760	You have one.
2298760	2299760	Yeah.
2299760	2304840	I mean, we got them, they got them, but it's kind of like the government's scared to like
2304840	2309640	tell people so they want to expose it so that they're the bad guys that gets everybody scared
2309640	2312320	and then we can just make it normal.
2312320	2314760	What's, what's bad about these?
2314760	2315760	In my mind?
2315760	2316760	Uh, nothing.
2316760	2317760	Do you feel that?
2317760	2318760	Yeah.
2318760	2319760	Okay.
2319960	2321800	Why does Godel have to be the bad guy?
2321800	2325800	Oh, because you know, some people are like, don't be God.
2325800	2331160	And so they can, if, Hey, if it's all good stuff, then Godel, that's good.
2331160	2333840	If it's all bad stuff, then it's not us.
2333840	2334840	That's good.
2334840	2336520	It turns out it's good.
2336520	2337520	Everybody.
2337520	2338520	It's good for everybody.
2338520	2341600	Cow's looking at X. What power is this?
2341600	2348760	Oh, um, well, we're not like, like just hope.
2348760	2350660	Like the humanity's hope.
2350660	2354480	He looks at X to see if that was a good answer or not.
2354480	2359400	She's just kind of looking back at you with like, uh, as good as any.
2359400	2361560	How do you get that hope out of a human?
2361560	2366800	Oh no, no, it's, um, nothing so sinister.
2366800	2368680	We just don't know.
2368680	2370880	But do you suspect?
2370880	2374440	Well, Otherwise, what's wrong with the skin graft
2374440	2375440	2000?
2375440	2377320	It seems like a miracle technology.
2377440	2383640	Godel wouldn't be a bad guy if he released this, unless there's something sinister about
2383640	2384640	it.
2384640	2390400	Well, Nope, I guess you're wrong about that.
2390400	2393400	Can I come at that?
2393400	2394400	Yeah.
2394400	2395400	94.
2395400	2396400	39.
2396400	2402280	Cow's like, well, I have been wrong before.
2402280	2409120	Well, it's like, you know how you feel right now, the explanation that like, we don't know
2409120	2413120	and how that makes you feel, but that's going to be everybody.
2413120	2415440	And they're going to be mad about that.
2415440	2419220	I'm still a little confused, like how you have one, is he like a military contractor
2419220	2421920	and you got a hold of their part of their contract?
2421920	2426120	Did the Godels make one specifically for one for the military?
2426120	2428000	How mass produced are these things?
2428000	2431680	Those are all big questions, Mr. Wilder.
2432080	2436240	Yeah, I would say that, you know what you're talking about.
2436240	2437240	Thanks.
2437240	2438240	Absolutely.
2438240	2439240	Yeah.
2439240	2445920	I, uh, I, I've got this one and, uh, I do know that if I, if something were to happen
2445920	2449840	to it, I probably wouldn't, you know, it'd be hard to get a replacement.
2449840	2451760	You know what I mean?
2451760	2456400	Do you have other stuff that Godels have engineered?
2456440	2463840	Dr. Murray is looking at X and X is looking at Dr. Murray and X kind of gives it a reluctant
2463840	2471720	nod and Dr. Murray is like, Oh yeah, like, like what?
2471720	2479000	I mean, I don't, I don't have the, um, necessarily the, uh, authorization to get into it, but,
2479400	2489080	I don't want to undersell you, but if you can imagine it, it can possibly be done now.
2489080	2491640	Like a machine that makes cappuccinos on demand?
2491640	2492640	Done.
2492640	2493640	Well, we already did.
2493640	2494640	Yes.
2494640	2499640	We already, uh, yeah, we already did that on all of the NPCs.
2499640	2500640	Okay.
2500640	2501640	Cow's like, yeah.
2501640	2502640	Yeah.
2502640	2503640	Beck.
2503640	2508640	I mean, we had one in the lobby for quite a while until, well, you remember, you kind
2508680	2510440	of knocked it over with your camera.
2510440	2512440	Oh, it scared me.
2512440	2513440	Yeah.
2513440	2514440	Yeah.
2514440	2515440	Yeah.
2515440	2523080	I told you there's no, yes.
2523080	2525080	And I told you there's nothing to fear.
2525080	2530080	It's just a cappuccino maker.
2530080	2532080	All right.
2532080	2536120	Well, uh, you said anything I could think of, it's what I think everyone knows what I can
2536120	2537120	think of.
2537560	2538560	Another one of those.
2538560	2540560	No, no, no, no, no.
2540560	2547560	Dr. Murray X, can we have Dr. Murray's thing for our dangerous mission to find God?
2547560	2549760	You seem to have plenty.
2549760	2553360	You cannot fucking touch my, uh, my device here.
2553360	2554760	Seems like you answer to her.
2554760	2555760	Yes.
2555760	2556760	Uh, you cannot have her device.
2556760	2559760	Uh, Dr. Murray, that will be all.
2559760	2560760	Thank you so much for your time.
2560760	2566600	Can I human that to see if she's lying and that we can have it?
2567080	2575080	I want to try a persuade role X please.
2575080	2581080	91 critical success.
2581080	2585080	Dr. Murray, it's always a pleasure.
2585080	2586080	Yeah.
2586080	2587080	Yeah, yeah, yeah, yeah.
2587080	2588080	Of course.
2588080	2592080	I hope you're feeling better and, uh, everyone, uh, feel good and stuff.
2592560	2594560	Don't, don't have any need for me.
2594560	2595560	Okay.
2595560	2598160	But if you do, I'll be just right around for you.
2598160	2599160	If we do.
2599160	2600160	Do you have a card?
2600160	2604280	Is there a way to get ahold of you?
2604280	2605280	And she shuts the door.
2605280	2610240	She opens the door real quick and she goes, Oh, I forgot to tell you that it was a crazy
2610240	2611240	fucking night.
2611240	2612240	Last night.
2612240	2619320	I found a parallel.
2619560	2632400	A pair of legs, lambs, lobsters, a paradise.
2632400	2638800	You found a paradise where, where was the paradise?
2638800	2639800	What is happening?
2639800	2641720	Dr. Murray, did you forget to tell us anything?
2641720	2642720	She's having a stroke.
2642720	2643720	She's just standing there.
2643720	2646000	I told you they're weird.
2646000	2649100	It's like she came back to ask for help.
2649880	2650880	You couldn't get it out.
2650880	2651880	She's just standing there.
2651880	2652880	Stuck frozen.
2652880	2655980	Hey Julius, could I have my makeup kit back?
2655980	2659780	Oh, he never looked at his face, but he, he gives it back.
2659780	2662780	Cow gives it like a quick kiss and is like, how are you doing old girl?
2662780	2666780	And slips it in his coat pocket.
2666780	2667780	Legs.
2672780	2673780	What?
2673780	2678340	That's the, that's the first thing I said, and not even just one, but two, can we talk
2678340	2684700	about how you didn't say anything for like 10 minutes, two sets of legs and a top half.
2684700	2685700	It was nuts.
2685700	2686700	It was a woman.
2686700	2691540	I, it was a, no, I mean, obviously not one of the halves, a whole, whole woman had a
2691540	2693060	wild story in this whole time.
2693060	2697660	She's just poking her head out back into the door of Julius and X's place.
2697660	2699980	I, yeah, it was a, it was last night.
2699980	2702020	It was absolutely naughty.
2702020	2704820	Total cleanup over at the zeitgeist.
2704820	2706300	There was people in half.
2706300	2707300	Yeah.
2708260	2713020	Like two bottom halves and one top half is very weird.
2713020	2714020	It was very strange.
2714020	2715020	Did they see what happened?
2715020	2718420	Well, I mean, there was a woman there and she was like all sorts of wild.
2718420	2721120	I won't say a name, but what was her name?
2721120	2723780	She was a fine girl.
2723780	2725580	And tell us the initials.
2725580	2728060	She was telling me about this dirty girl.
2728060	2734580	Apparently like went into another person, like inside the tum tum of another person
2734580	2741140	is what she got eaten, like, but like in, like sucked into the belly or whatever.
2741140	2745500	And then like somebody else was punched in half, uh, it's happened at the bar.
2745500	2746500	Yeah.
2746500	2747500	No, no, no.
2747500	2748500	At the zeitgeist.
2748500	2749500	Oh shit.
2749500	2750820	What was the bar called?
2750820	2751820	The printing press.
2751820	2752820	No, that's the drink.
2752820	2753820	Where are we?
2753820	2754820	We're at bucky kid's bar.
2754820	2755820	No, the first bar.
2755820	2756820	The foundry.
2756820	2757820	The foundry.
2757820	2758820	Sorry.
2758820	2759820	I was confused.
2759820	2763700	The zeitgeist is the city's famous secret spot to me.
2763700	2764700	Space Needle.
2764700	2765700	I think you just call them Space Needles.
2765700	2768420	They don't have another name, do they?
2768420	2773380	Um, not that I know of, I think it's just called a small Space Needle.
2773380	2778180	Well, last time I was up there, it didn't look like anybody been up there in forever.
2778180	2779180	Was it inside?
2779180	2781820	No, it was actually down on the ground.
2781820	2782860	Huh?
2782860	2784580	It's our city's famous spire.
2784580	2789260	Oh, yes, of course a spire.
2789260	2793820	My uh, my wife and I had our first date in the rotating restaurant.
2793820	2797020	Damn, you are old.
2797020	2800420	Yes, Julius.
2800420	2803340	Damn it.
2803340	2807740	Yes, I am.
2807740	2810580	Was it cool or was it like gimmicky?
2810580	2815060	Cal's eyes get misty and he like looks into the distance and a single tear rolls down
2815060	2818620	his cheek and he says, it was very cool.
2818620	2824820	Yeah, Julius honestly thought it was probably gimmicky until he just heard that and now
2824820	2831500	he longs to have been able to go to the rotating restaurant.
2831500	2832500	Top class.
2832500	2837740	So, like, did you fix them or clean them up?
2837740	2838740	What happened?
2838740	2840580	Well, I didn't fix the halfs, no.
2840580	2841580	Does that thing?
2841580	2843500	Yeah, would it fix a half?
2843500	2845500	How much can that thing grow back?
2845500	2849140	Oh, not like a half on half, although.
2849140	2853340	And she gets a weird look in her eye and she goes, actually, gotta go and slams the door
2853340	2854340	open.
2854340	2860420	Son of a bitch, that thing rehaves halves.
2860420	2861420	What the?
2861420	2865340	That thing refools halves.
2865340	2871540	I mean, I know we're focused on finding God, but like we drew the dots and it's nothing.
2871540	2873300	What if we go check out the halves?
2873300	2874980	I think we should go.
2874980	2879780	I mean, we got two days until we can run the scratch fixer 2000 or what our skin graft
2879780	2880780	2000.
