start	end	text
0	7820	Good morning my babies, it's everybody's favorite radio DJing contention wolf the dog and we
7820	16020	are hitting you live from 694.2 PTBP today with a little news for y'all.
16020	20700	Councilwoman Carrie Page's dog is missing and let me tell y'all she is pissed about
20700	23960	it she is not happy at all.
23960	32080	Jimmy sanders saw an oil spill while tripping on those sweet sweet good mushrooms.
32080	37280	And Mildred Mitchell that old cookie pot head saw a bright flash of light from across the
37280	42020	street in John Peters house and now speaking of that old boy wouldn't you know it John
42020	46680	Peters is missing heard he had a long stay in the hospital a couple years ago poor guy
46680	48840	can't catch a break.
48840	53880	And two people came to John Peters house packed a drunken to their white Toyota and took off
53880	60200	coming in hot off the presses we got a new song for y'all it's No Backbone by Kudzu.
83880	95440	Remember when my knee was up this morning and you kept saying that it was my boner?
95440	96440	That was funny.
96440	101260	Luke was on the couch like prone right and his knee was just like right in the middle
101260	105880	of his body sticking straight up and it looked like his dick was like a uh.
105880	112280	As big as it is if not smaller.
112280	113680	What happened last time Zach?
113680	119680	Last time you guys were standing at John Peters house and uh you just reviewed Keith Vigna's
119680	120680	excellent policing.
120680	121680	Yeah you're welcome for that.
121680	126440	If I remember it seemed like a really anticlimactic place to end an episode.
126440	127440	Yeah yeah yeah.
127440	130480	Because I didn't do any I didn't have a climax.
130480	136860	You had figured out that Mildred Mitchell drives a white car.
136860	138960	Is this a goddamn logic problem?
138960	144000	Mildred Mitchell drives a white car but John Peters will never eat ham.
144000	146240	John Peters drives a maroon car.
146240	151400	We decided it was something like a Cutlass Supreme or a La Sabre or it could be a Honda
151400	152400	Civic.
152400	157240	And the car that came picked up the trunk and also drove off with John Peters car were
157240	160480	two men in a white Toyota.
160480	161480	Fucking exotic dude.
161480	163600	You ever been to Japan?
163600	166080	It might it might be exotic for contention.
166080	167320	What did the trunk say?
167320	169640	Do not open if you want to live.
169640	170640	Correct?
170640	171640	Yes.
171640	175840	Or conversely it said open if you want to die.
175840	177280	That was just implied.
177280	179720	It's about 2pm on December 2nd.
179720	181580	Today's actually January 1st.
181580	182580	But um chuh dude.
182580	183580	Happy New Year.
183580	186280	I had a great time last night.
186280	187280	Me too.
187280	193120	I repeatedly told you that I loved you a lot and it still rings true today.
193120	194680	We'll see about tomorrow but.
194680	195680	I wish you'd been there.
195680	196680	Me too.
197040	198040	I was sleepy.
198040	199040	Hahaha.
199040	200040	Dude wait here.
200040	201040	Can you do this?
201040	207840	For the listeners, Thomas and Luke are drying up their top lip and the gums above their
207840	208840	front teeth.
208840	211400	Joe just like moved his lip a little bit and was doing it.
211400	212400	Pretty much there.
212400	213720	It's kind of my face.
213720	215440	He had that dry vape mouth.
215440	218640	You got a real wet mouth so I got to dry mine off.
218640	219640	I got weird teeth.
219640	223800	The best way to do it is like to not have to move your muscles in your lip and just
223800	226040	have it hang on there because of how dry it is.
226400	229680	Do we really know that it's a white Toyota that went blazing by?
229680	230680	Yeah we found that out.
230680	231680	That the men came in.
231680	232680	Not for sure.
232680	233680	That's what Mildred told you.
233680	236040	I don't think we can put out an APB for a white Toyota.
236040	239000	Yeah also we didn't.
239000	241040	Wait were they in a white Toyota?
241040	243920	Cause she drives a white car right?
243920	244920	Yep.
244920	245920	And they were in a white Toyota.
245920	246920	Yep.
246920	247920	I think this is a dead end guys.
247920	248920	Wait hold on.
248920	251340	Is this a cool like knocking on the door sound?
251340	252340	Hold on.
252340	253340	No.
253340	256220	It's like a really weird hollow metal door.
256220	257220	Yeah it is.
257220	258220	Okay let's go.
258220	259220	Set the scene.
259220	265020	The three of you are standing in the midst of Keith Vigna's excellent police work and
265020	271780	Mildred Mitchell is headed back across the street to her home which has her white car
271780	272780	in the driveway.
272780	278300	There's a black car in her driveway as well since we're just talking colors of cars.
278300	280260	I drive a silver car.
280260	282020	That's a police work that I do.
282020	284860	What color is your car?
284860	288740	Got it.
288740	292280	Radical new direction for the podcast.
292280	293280	What color is your car?
293280	294280	What color is your car?
294280	296020	Are we in the house or out of the house right now?
296020	298500	I think you are standing in the house of John.
298500	301460	Can I roll a search roll just to do.
301460	303380	I think you already crit succeeded right?
303380	307200	Well I yeah I crit succeeded but I also want to do just one more just because I feel so
307200	311760	bad about how shitty I did this first that first time around where.
311760	313080	You're like seeing their faces.
313080	316680	I think that's a really good direction for your character to go.
316680	321100	I really want to redeem myself on this like shoddy police work that I've done and I want
321100	325480	to like try to find something now and be like oh yeah I remember that.
325480	329720	You like see the faces of your fellow police officers and want to work even harder.
329720	332040	Tell me if it's good or not, 21?
332040	336840	You look around the house you see that the trunk is no longer there and the picture frames
336840	344000	that you saw earlier are cleaned up, the bedding stubs are still there, bottles are still around.
344000	347800	The people who were clearly here did not drop anything.
347800	351000	I want to look at the pictures real fast are they anything interesting?
351000	352120	Picture the family right?
352120	357840	Yeah basically it's just pictures of him and like maybe some friends from college.
357840	364160	He obviously doesn't have like a nuclear family he has like cousins and friends.
364160	366400	But they were broken before and now they're all cleaned up?
366400	370640	They would probably want to move them in order to have a clear path.
370640	373320	So obviously he did not come back to the house.
373320	377200	So we got to figure out who was in that white Toyota.
377200	380280	Who do we know who drives a white Toyota?
380280	386000	You guys would also be dealing with the fact that there was a dead body out in the junkyard
386000	387000	last night?
387000	388000	That's true.
388000	391160	I think this is not a huge concern for us right now honestly.
391160	394840	Frankly all that seems secondary to the city councilor stuff.
394840	401800	I just wonder if we were real police officers we wouldn't just be like oh well.
401800	403880	Like how would we wrap this up as far as a case goes?
403880	408080	I don't know I feel like if there's three of us on the force and a murder just happened
408080	410340	this is not gonna be in our mind.
410340	415720	This is only important because we're playing a mystery podcast.
415720	421480	You guys literally went to a like drunk fueled site that didn't exist and you went to talk
421480	423860	to a council person about their dog.
423860	428100	The hardest lead we have right now towards the big mystery is the dogs.
428100	434100	What I'm really concerned about now is I made the chief cry with a gift that I didn't actually
434100	435760	get her that I said was mine.
435760	438500	And I'm really concerned about finding out where she is.
438500	439820	You wanna go hit up that chief?
439820	441820	That is probably the most pressing mystery.
441820	444900	We all drive all three of our cop cars back to the station.
444900	448300	Did I lay out too many mysteries right off the top?
448300	452300	No we're just bad.
452300	454620	I think it's good leads to more.
454620	456980	You just gotta focus our energy on...
456980	462420	Okay let me get an intelligence check from whoever has the highest intelligence.
462420	463420	I got 50.
463420	464420	75?
464420	465420	55.
465420	466420	Yes.
466420	470860	You do have the dead body and you basically have one lead from that.
470860	474100	Which is the woman who called and then crashed your car.
474100	476260	Have we heard back from the coroner on...
476260	477260	Yes.
477260	479260	She had the brand on her back that said this is a fool.
479260	480260	Oh that's right.
480260	481260	Would I know this?
481260	489060	The brand that she had on her back was that in like the same size or font that the do
489060	492740	not open if you want to live was branded into the trunk.
492740	494660	You haven't seen a picture of the back.
494660	499820	Hey do you guys have a picture of the back that I could see?
499820	501980	He says to the wind.
501980	504260	Hey uh...
504260	508580	We all look at Keith.
508580	509580	What?
510180	511180	She was...
511180	515140	This just popped up in my mind because I'm a good detective.
515140	516140	He says confidently.
516140	517900	I'm a good detective.
517900	523220	So what I just thought that neither of you did, which proves how good of a detective
523220	525480	I am.
525480	532520	So the do not open if you want to live was branded into the trunk and that lady had that
532520	533980	brand in her back.
533980	538860	Yeah so I'd like to see a picture of the text on her back.
539300	541100	We can just have the coroner send that over.
541100	542460	Yeah what do you guys want to do next?
542460	546200	I think we maybe are interested in what's going on with the chief.
546200	548300	So I would call her real quick first.
548300	551160	Okay so you left John Peters house in what state?
551160	552160	I closed.
552160	555820	It seems like Keith did his due diligence so.
555820	557420	We closed the door this time.
557420	558420	And then just bailed.
558420	559420	And we leave.
559420	560420	Alright cool.
560420	562320	So you guys are back at the police station.
562320	567260	You let Drew know that you want to get a hold of county and get a picture of the back of
567260	568660	the body that was found out in the junkyard.
568660	572420	Honestly I'd like to have all the pictures that the coroner took just for posterity.
572420	573420	Sure.
573420	574420	Perfect absolutely.
574420	579100	So none of this in the box that we gave her made any sense to you?
579100	580260	I didn't recognize any of it.
580260	586140	It seemed like it might be symbolic of some sort of stratification in the city or perhaps
586140	587140	amongst the cult.
587140	591780	I panicked when that box was there and I said yeah I gave that to you.
591780	594340	Didn't know that it would make her react that way so.
594340	597620	I asked Drew so you didn't see anybody drop off that box?
597620	598620	No.
598620	599980	I called the chief.
599980	601620	Okay on her cell phone.
601620	603140	It goes straight to voicemail.
603140	605220	In my seventeen years with her.
605220	606220	This has never happened.
606220	607220	Not even remotely?
607220	608220	Not even close.
608220	609380	Okay so I'm a little maybe worried.
609380	610380	I would be.
610380	614140	Guys I think I'm going to go head over to the chiefs house just check on her.
614140	615900	She's never missed a day of work like this before.
615900	619780	Can I ride along with you I just I feel really really really bad.
619780	620780	Yeah sure.
620780	622420	I just want to apologize when we see her.
622420	624100	John Lee what are you thinking?
624100	625220	A man of few words.
625220	627500	Which ones do you want to use to describe your actions?
627500	628500	Tag.
628500	629500	Tag along.
629500	630500	Are you going to come with?
630500	631500	Yeah.
631500	632500	Might as well.
632500	633500	Shotgun.
633500	634500	We do that.
634500	635500	Okay you guys head over to the chiefs house.
635500	639940	The chief lives in the old neighborhood right by beans pond.
639940	641020	She has.
641020	642020	A nice old house.
642020	643020	Is that the northwest?
643020	644020	Is that beans pond?
644020	646020	No this is just southwest of downtown.
646020	651680	Where is the chiefs house in relation to John Peters and also Kerry pages?
651680	659620	The chief lives a few blocks northeast of John Peters and Mildred Mitchell and just
659620	662720	east of pages Kerry pages.
662720	665080	So they're all like within blocks of each other?
665080	666080	Oh yeah.
666080	667080	Cool.
667080	668080	Yep yep yep yep yep.
668080	672160	So you go to the chiefs house and her cruiser is not out front.
672160	677380	Does she drive her cruiser as her personal vehicle or does she have a personal vehicle?
677380	680000	I think she probably has a truck.
680000	681000	Like a F-150.
681480	683760	Can I do a search roll for the chief?
683760	688480	Yeah go for it.
688480	690520	He doesn't do a search roll for the chief.
690520	692920	Eighty four on a fitty.
692920	693920	You don't find her.
693920	694920	Oh darn.
694920	695920	Hey guys.
695920	696920	Guys I've really tried my best here.
696920	699020	Is her truck in the driveway?
699020	700560	You would know.
700560	701920	I think you've known her for a long time.
701920	703520	Her truck is in the garage typically.
703520	705720	I'm going to go and knock on the door.
705720	707120	Okay there's no response.
707120	708680	I look in the windows.
708680	713200	There is probably just like one window up front that you can see through the curtains
713200	714800	a little bit and you can't see it.
714800	716640	Could you describe her house to me?
716640	717640	It's nice.
717640	719960	Like are we?
719960	720960	Thank you for that.
720960	722760	This is a range style house.
722760	727120	It's got a nice little front patio area with a bench on it.
727120	728120	Nice.
728120	729120	Nice.
729120	730120	Made a note.
730120	731120	Cool.
731120	732120	Rick?
732120	733120	Uh yeah.
733120	734120	Of course.
734120	737120	What did it, what was my looking in the windows?
737120	738120	What did that?
738560	739560	See it's dark in there.
739560	740560	There's no movement.
740560	741560	I tried the handle.
741560	742560	See if it's open.
742560	743560	It's not.
743560	744560	It's locked.
744560	747880	I'm going to swing around back guys and see if the back door is open because I feel so
747880	752640	bad about making her storm off and I just, I need to apologize and this seems a little
752640	753640	fishy.
753640	754640	I don't know.
754640	755640	Go check it.
755640	756640	So I'm going to, yeah.
756640	759740	She's got a gate on her privacy fence that doesn't have a lock on it so you just go into
759740	764780	her backyard and as you're walking through her backyard you can see in her back windows
764780	765920	and the lights are off.
765920	766920	Nobody's home.
766920	767920	I'm going to check the back door.
768720	769720	Absolutely.
769720	770720	Yeah.
770720	771720	Hold on just a second.
771720	773480	I'm going to do a roll for her real quick.
773480	774800	That's a spoiler that she is alive.
774800	775800	Oh yeah.
775800	776800	No, no, no.
776800	777800	Everything's locked up nice and tight.
777800	778800	Everything's locked up.
778800	779800	Okay.
779800	780800	Yep.
780800	781800	Well I swing back around front and uh.
781800	785780	Uh you guys think we should uh go and check on uh at Klinker's?
785780	787280	Does she hang out at Klinker's?
787280	788440	That's where she does her drinking.
788440	790280	I didn't, well the more you know.
790280	791860	I didn't see her there last night.
791860	794420	Let's go check and just see if, was it Harry Klinker?
794420	795420	Who's the guy that runs that place?
795420	796420	You know Harry.
796420	797420	I don't know Harry.
797920	798920	I don't know anybody in this town.
798920	799920	It's a few boys.
799920	802420	Let's go to Klinker's and check out and see if anybody saw her.
802420	807740	If not, you know, I think between the three of us we can handle this murder mystery.
807740	811460	We don't need the chief, but I'd love to apologize to her.
811460	813700	Her steady guidance would be appreciated.
813700	815900	So yeah, we head over to Klinker's.
815900	817300	Okay, you walk into Klinker's.
817300	820620	Klinker's is like a small shitty dive bar.
820620	823760	When you walk in, there's cigarette smoke hanging in the air.
823760	825000	There's three tables.
825000	827340	There's a pool table and a bar.
827340	831500	There's a couple of regulars in there and Harry, the owner and bartender is back behind
831500	832500	the bar.
832500	837340	He is a tall older man with turkey neck and bad teeth.
837340	839540	Yo turkey neck.
839540	843860	You stand under your breath as you walk in.
843860	845820	What did Harry do to you?
845820	846820	Dick?
846820	851100	I bet, like honestly, I bet Harry would be pretty anxious to see all three cops in town
851100	852620	walk into his establishment.
852620	854560	Absolutely he would be.
854560	855560	Can we establish this?
856280	857280	Do you know this guy?
857280	858280	Probably.
858280	859280	Yeah.
859280	860280	I think we all do.
860280	861280	I don't.
861280	862280	I'm playing the new kid in town.
862280	863280	I know, but you've been here for a few months.
863280	864280	You probably at least.
864280	865480	Wait, you are from here, right?
865480	869160	I'm from here, like elementary school, moved to the city.
869160	872240	Harry Klinker babysat every child.
872240	873240	Yeah.
873240	874240	He was my babysitter.
874240	875760	Did your mama never drop you off at Klinker's?
875760	877800	Oh, I forgot to mention there is a-
877800	878800	There's a baby seat.
878800	883280	You see, there's a doorway in the back right of the bar and it's got one of those baby
883280	888640	gates on it and there are three toddlers standing over the edge trying to crawl over.
888640	889640	No one's watching.
889640	890640	Harry?
890640	891640	We have some questions for you.
891640	892640	Hey, Harry.
892640	893640	Well, hey, question.
893640	894640	Have you seen the chief?
894640	897640	Not in a couple of days.
897640	898640	All right.
898640	899640	Thanks.
899640	900640	And we head out.
900640	901640	Bye, Harry.
901640	902640	Bye, Harry.
902640	903640	See you tonight.
903640	904980	That was Harry.
904980	908880	As we walk out, I'm a little bit shaken.
908880	911520	Did a bunch of memories from your childhood just come rushing back?
911560	915040	I pull out my pack of cigarettes that you guys have never seen me smoke.
915040	916760	Is this how you're going to vape on?
916760	918760	No, no, no, no.
918760	923640	I go, I just had some weird thoughts from my childhood come in.
923640	927960	I spent more time at Klinker's when I was a kid than I have since I've lived here.
927960	929800	Harry's like a second father to us all.
929800	930800	Yeah.
930800	931800	Oh, hey.
931800	933800	You came outside, Harry?
933800	934800	Yeah.
934800	936120	He's been following you.
936120	939280	He steps outside for a smoke.
939280	941100	Nice fresh air.
941100	944100	Harry, was Keith a picky eater?
944100	947280	I like hot dog sandwiches.
947280	948580	The city has changed you.
948580	954180	You cut up those hot dogs that boy eat them up real quick on some white bread.
954180	956300	Well, that doesn't really answer the question.
956300	961220	Can't really say we offered him much else.
961220	963220	So in your experience, no.
963220	966060	He's the pickiest eater I've ever seen.
966060	969500	He would only eat hot dogs cut up on white bread.
969500	970500	What are you guys doing?
970900	972300	Uh, where are we going?
972300	973300	Great question.
973300	974300	Okay.
974300	976080	What's, what's the hottest lead we got?
976080	978900	So I ran the body's prints and hair.
978900	979900	Got nothing back.
979900	980900	Yeah.
980900	981900	Took the body to the corner.
981900	982900	I guess we could run.
982900	985380	Have I, have I seen, have I seen those pictures from Ju yet?
985380	986380	Oh, uh, yeah.
986380	987820	Drew will send them on over.
987820	990260	Oh, go ahead and roll a sanity check for me.
990260	991260	No.
991260	992260	93.
992260	993260	Okay.
993260	994260	Yeah.
994260	997740	You're going to lose one sanity as you see this brutal act shown out on this, uh, this
997740	999300	woman's back.
999300	1002940	The skin is blistered and boiled around each letter.
1002940	1006620	And instead of looking at the picture, I take his word for it.
1006620	1007740	Smart.
1007740	1013380	Did the corner and doing the autopsy of the body do anything more to identify it than
1013380	1014380	we did?
1014380	1015380	Would they have done anything like that?
1015380	1020300	The report came back with a bunch of odd results, so they're going to run them again to double
1020300	1021300	check some stuff.
1021300	1022300	They're not sure what's going on.
1022300	1023300	Okay.
1023300	1026260	And then also the Julie gal who crashed her car.
1026260	1027260	Yeah.
1027260	1028260	Julie Maxwell.
1028260	1029260	Rest in peace.
1029260	1030220	Yeah.
1030220	1032700	They called and said that she was pronounced dead last night.
1032700	1034740	We should maybe do some investigation on her.
1034740	1039380	We should probably get, uh, have the coroner look at her and give us some information.
1039380	1040380	Some kind of inquest.
1040380	1044220	Cause this is a, this is my main person of interest.
1044220	1047620	John, when you searched her car, did you get identification?
1047620	1048620	Yes.
1048620	1049620	Let's look into that.
1049620	1050620	Let's see if she's, let's run her name.
1050620	1051620	See if she's on casenet.
1051620	1052620	Yeah.
1052620	1053620	Right.
1053620	1057380	You want to just run her info in the database and maybe even Facebook or just like see if
1057380	1058740	you get any background on her.
1058740	1059740	Okay.
1059740	1060740	Sounds good.
1060740	1065420	You are going to find that she has an Etsy page for her taxidermy.
1065420	1066700	She's a taxidermist.
1066700	1070100	What's her last name, Julie Maxwell.
1070100	1075580	Maybe like a few, uh, disorderly conduct charges from a couple of years ago.
1075580	1076580	Here in town.
1076580	1077580	Here in town.
1077580	1078580	Was it alcohol related?
1078580	1079580	Yeah.
1079580	1087260	And then also she was given a restraining order 15 years ago and it was against a Leo
1087260	1088260	piston.
1088780	1092260	So she got it awarded to her against Leo or Leo put it out on her.
1092260	1095740	Leo put it out on her and Leo is the junkyard man.
1095740	1096740	Right?
1096740	1097740	Yeah.
1097740	1099020	Is Leo the one we met or did we meet his man?
1099020	1103180	Maybe we shouldn't have let him just go home last night.
1103180	1105240	I hope they're still there.
1105240	1107820	What's what's Leo's brother's name, George.
1107820	1108820	And we talked to Leo.
1108820	1109820	Right.
1109820	1110820	I think we talked to Leo.
1110820	1111820	Yep.
1111820	1112820	All right.
1112820	1113820	Well let's take off toot sweet to the piston boys.
1113820	1116100	We at least got to inform him what happened on his property.
1116100	1118820	That can be the auspices in which we visit them.
1118820	1119820	Yeah.
1119820	1120820	Okay.
1120820	1125860	And just to stay on the same thread, you guys wanted to talk to the hospital about Julie
1125860	1127100	Maxwell's body.
1127100	1131900	So you have Drew send over a message to them saying that you want a full report on the
1131900	1134220	autopsy of Julie Maxwell's body.
1134220	1135220	Okay.
1135220	1139080	And then the three of you head out to the piston farm.
1139080	1141820	It's kind of by the junkyard in the far Southeast corner.
1141820	1143860	So they like live right next to it.
1143860	1144860	Gotcha.
1144860	1153980	Googled it and I did not use auspices close camera close.
1153980	1157380	Well too hungover for some of these words.
1157380	1158380	Happy new year.
1158380	1159380	Okay.
1159380	1161580	So the three of you drive out to the piston farm.
1161580	1163160	It's a pig farm.
1163160	1168900	And when you arrive, it's on the old country road and there is a gate that is locked at
1168900	1170780	the insurance farm gate.
1170780	1171780	Yeah.
1171780	1172780	Call Leo.
1172780	1173780	You got his number, right?
1173820	1174820	Hey Leo.
1174820	1175820	Oh, the farm.
1175820	1181860	You can see the farm and it is probably 150 yards off the road.
1181860	1184300	I started hollering, but I also call him on myself.
1184300	1186300	I call him on myself.
1186300	1187300	Click.
1187300	1188300	Hey.
1188300	1190300	Oh, I thought, I thought he hung up.
1190300	1191300	Hello?
1191300	1192300	Hey Leo.
1192300	1193300	Hey buddy.
1193300	1194300	We're we're outside.
1194300	1198660	We need to, uh, yeah, this is, uh, this is John Lee Pettymore, the fourth of a deputy.
1198660	1199660	You know me, Leo.
1199660	1200660	You're the deputy?
1200660	1201660	I'm a deputy.
1201660	1202660	All right.
