start	end	text
1202740	1205960	Just four, one we rarely see.
1205960	1206960	Can you let us in buddy?
1206960	1207960	To what?
1207960	1208960	You guys got my key?
1208960	1209960	Your pig farm?
1209960	1213340	Your very ominous pig farm.
1213340	1216300	We do also have his key to return to him.
1216300	1217860	We told him that we would do this.
1217860	1218860	Yeah.
1218860	1219860	Hey Leo, that's why we're here.
1219860	1221060	We're bringing you your key back.
1221060	1223100	I'll be right out.
1223100	1229320	So you wait a second after the phone call ends and his beat up old truck comes driving
1229320	1233440	down the road and goes up to the other side of the gate and he gets out of the truck
1233440	1237400	and walks up, kind of leans over the gate and he's still, he's wearing those overalls
1237400	1241160	and they're covered in shit and he's got no shirt on underneath it.
1241160	1248240	He's got one of the overalls, unstrapped, all sexy like, and uh, he leans over and he's
1248240	1249240	like, all right.
1249240	1251240	It's like piggy couture.
1251240	1254320	You got my key?
1254320	1255320	Oh boy.
1255320	1258160	Can't nail this voice down.
1258160	1259160	What's happening?
1260000	1265220	And cut and you got my key?
1265220	1266220	And one more.
1266220	1268000	You got my key?
1268000	1269000	Let's try it.
1269000	1270000	Let's try a funny one.
1270000	1271000	I'm so angry.
1271000	1272000	You got my key.
1272000	1273000	Sad.
1273000	1274000	One more time.
1274000	1275000	I think you nailed this.
1275000	1276000	I've got my key.
1276000	1277000	No, Leo.
1277000	1278000	Actually we do.
1278000	1279000	That's why we're here.
1279000	1280600	Oh, I like that back now.
1280600	1281600	Can we come in?
1281600	1284160	Could you put on some tea for us Leo?
1284160	1285160	We'd like to talk.
1285800	1291840	If you want to give me my key and then we could say bye, that'd be best case scenario
1291840	1292840	for me.
1292840	1295680	Well, Leo, that makes me want to talk to you even more.
1295680	1299800	Well, I'm a fun boy to talk to, but I just like my key.
1299800	1300800	Yeah.
1300800	1304200	Let's, uh, let us in here.
1304200	1310300	We'll, we'll get you your key once we settle down and, and, and y'all stay right there
1310300	1313720	and I'll reach my hand over this fence here, which I'm doing now.
1314720	1315720	Put your hands up.
1315720	1316720	Oh geez.
1316720	1317720	Okay.
1317720	1322320	So now he's horrified and he puts his hands straight in the air and he's like, what?
1322320	1323320	We're all good here.
1323320	1325120	Let's just go back to your house.
1325120	1326120	Let's sit down.
1326120	1327120	Let's have a drink.
1327120	1328600	And we gotta have, we have a few questions.
1328600	1329600	I'll be right back.
1329600	1332600	No, no, no, no, no, no, no, no, no, no, no.
1332600	1333600	Okay.
1333600	1334600	Well we hop over the gate.
1334600	1335600	Yeah.
1335600	1336600	We come in.
1336600	1339400	Oh, he comes back on his cell phone and he's like, George, George, the police are here
1339400	1343320	and they hopped over the fence, but I don't think you should, they should be here.
1343320	1347640	They just came to return my key and now they're on the property.
1347640	1349680	So yeah, that actually, that we probably fucked up there.
1349680	1355400	If you could, if you could come down here and then he listens for a second and he's
1355400	1361920	like, Oh, warrant, warrant, warrant and or probable cause warrant.
1361920	1362920	Yeah.
1362920	1367520	Our probable cause is a dead body and you having a pig farm and it was on the dead body
1367520	1369120	was on your property.
1369120	1371320	There's a dead body on my property.
1371320	1372320	You knew this.
1372320	1374400	We told you this last night.
1374400	1376260	I'm angry at this guy right now.
1376260	1382040	I don't know him very well and he's not following my city cop orders and I'm kind of mad at
1382040	1383040	him.
1383040	1386160	So I'm going to step in the middle and try and diffuse the situation.
1386160	1387600	Hey, whoa, whoa, whoa.
1387600	1390320	Hey, hey, uh, Keith, hang on, hang on a second.
1390320	1393600	Hey, I've got my hand on my gun and I'm looking at it.
1393600	1394600	Leo.
1394600	1395600	Uh, I'm sorry.
1395600	1397200	We, we kind of bum rush you right here like this.
1397200	1399760	Uh, it's just, we've got a, we're all pretty hungover.
1400280	1402200	We got a pretty strong case going here.
1402200	1406560	That's uh, it's real messed up, but uh, there's a chance that Julie Maxwell's caught up in
1406560	1407560	something here.
1407560	1409880	We found out that you had a restraining order against her.
1409880	1411800	We just wanted to know what that was about.
1411800	1412800	Yeah.
1412800	1413800	What's up with Julie Maxwell?
1413800	1414800	What an elegant way to put it.
1414800	1422080	I just don't, you know, that was the past and it's over and I, and she's, she's fine
1422080	1425320	now and everything, I did everything fine.
1425320	1426320	I'm fine.
1426320	1427320	No, no.
1427320	1429520	We know you got the restraining order against her.
1429520	1430520	We know that.
1430520	1431520	Yeah.
1431520	1432640	We just wondered what was the cause of all that?
1432640	1435800	It was because she thought I'd done killed her sister.
1435800	1438120	Why did she think that you killed her sister?
1438120	1441200	I accidentally, huh.
1441200	1444620	Wait, would we know about this case?
1444620	1449120	Go ahead and roll, uh, not you Keith, but the other two who are in town.
1449120	1450440	If you want to roll law.
1450440	1451440	Yeah.
1451440	1452440	54 and a 50.
1452440	1453440	Oh, bummer.
1453440	1454440	Uh, 29 on a 60.
1454440	1455440	Oh, awesome.
1455440	1464400	Uh, Clark Bishop, you would remember roughly 15 and a half years ago or so Leo piston,
1464400	1472200	uh, was involved in a manslaughter case for the death of Julie Maxwell's younger sister.
1472200	1473200	He did a year in juvie.
1473200	1475480	Wait, how old was he at the time?
1475480	1476640	He was 16.
1476640	1477920	How old is he right now?
1477920	1481120	Well, that was about, yeah, he's like 32.
1481120	1483160	Were you just testing his math?
1484160	1490040	I was thinking of Leo is like a 60 year old man.
1490040	1494040	So that no, I definitely did not think this Leo.
1494040	1498480	You look a little worse for where I think this Julie business has been, it's been way
1498480	1499480	in on you.
1499480	1503320	I've been, I'm been good and I've been good and everything's been fine.
1503320	1505080	Does Clark remember the sister's name?
1505080	1512400	Uh, her sister's name was, uh, it was, uh, well, Ashley boom.
1513240	1516480	Does Clark connect the dots?
1516480	1520640	As soon as he hears Leo say that, would I have been like, Oh yeah, the Maxwell girls,
1520640	1521640	like, did I know them?
1521640	1525480	You wouldn't, it was kind of a big deal, but that was 15 years ago and a lot, you know,
1525480	1526480	a lot of stuff happened.
1526480	1528440	A lot of clinkers between then and now.
1528440	1529940	A lot of TV dinners.
1529940	1533680	They were going for a second degree, which is a cop.
1533680	1536680	I of course know means.
1536680	1547480	Well, obviously as a cop manslaughter law and order has taught us is when some somebody's
1547480	1550320	dead, but you didn't mean nothing.
1550320	1556580	Second degree murder is any intentional murder with malice, a forethought, but is not premeditated
1556580	1557580	or planned.
1557580	1558580	Hmm.
1558580	1559580	A crime of passion.
1559580	1563280	We're in a pretty heated moment in world right now.
1563280	1564280	Definitely.
1564280	1567000	All these memories are flooding into your brain.
1567000	1574140	Clark Leo immediately just throws his hands into his overalls like kind of childlike hands
1574140	1575140	in his shirt.
1575140	1578400	Luke, I think you said Keith Vigna has his hand on his gun.
1578400	1583980	Yeah, I have my hand on my gun, but also I can sense the little relationship that Clark
1583980	1585360	and him have going on.
1585360	1589000	So I moved my hand from my gun to my taser.
1589000	1591520	Keith, Keith, there's no need for that.
1591520	1593680	I looked, I'm looking straight at Leo.
1594080	1595080	Leo's a good boy.
1595080	1597760	I'm a good, I'm a good, I'm a good, I'm a good boy.
1597760	1598760	He's a good boy to talk to.
1598760	1599760	I'm a good boy.
1599760	1601800	Let's go back to your house and let's talk about this.
1601800	1602800	No, it's fine.
1602800	1603800	It's fine.
1603800	1604800	No, we can talk.
1604800	1605800	We can talk right here.
1605800	1606800	We can talk right here at this gate.
1606800	1607800	I turned to Keith.
1607800	1608800	Hey, Keith.
1608800	1616960	I forgot that I knew all about this restraining order that Ashley girl, that happened right
1616960	1619080	around when I joined up with the force.
1619080	1620680	It was, it was a bad time.
1620680	1625000	I ease my grip up on my taser, but I'm still kind of hovering.
1625000	1626000	I turn back to Leo.
1626000	1627000	Leo.
1627000	1628000	I'm sorry we brought all that up.
1628000	1630520	It's just, we've got a, we've got a real sticky case here.
1630520	1631520	Sticky?
1631520	1632520	Hairy.
1632520	1636080	Hey Leo though, have you had any contact with Julie in the past few weeks?
1636080	1637080	No, no.
1637080	1638080	She stayed away.
1638080	1639080	She stayed away.
1639080	1640760	She hasn't, she hasn't reached out to you recently?
1640760	1641760	No.
1641760	1645800	I think with that information that you had before, you would know that the, her sister
1645800	1648760	died on December 1st, 15 years ago.
1648760	1651000	So wait, this is the anniversary or the day after?
1651000	1652560	Yesterday was the anniversary.
1652560	1653560	Wow.
1653560	1654560	Bad day for her parents.
1654560	1660840	I look, I look right at Leo and I go, do you know anyone that drives a white Honda Toyota?
1660840	1661840	A white Honda Toyota?
1661840	1664920	A white Toyota Honda Accord Civic.
1664920	1667000	Leo, you know anybody in town who has a white Toyota?
1667000	1670160	Leo, do you know anybody that drives a, is it a Toyota?
1670160	1671160	Yeah.
1671160	1672160	Do you know anybody?
1672160	1673160	Sorry.
1673160	1674160	No, it's really funny.
1674160	1676480	No, this is definitely the guy you should ask about this.
1676480	1678480	Do you know anybody in town?
1678480	1681480	Leo, where's the chief?
1681480	1687480	Hey, I'm a, I'm a, I'm a good detective.
1687480	1691480	Leo, do you know anybody in town that drives a white Toyota?
1691480	1692480	What?
1692480	1693480	Don't.
1693480	1694480	Why are you changing that?
1694480	1699280	My hand goes back to my taser.
1699280	1701760	Tell me if you know anybody that drives a white Toyota.
1701760	1704000	I don't know anybody that drives a white Toyota.
1704000	1707920	How can I believe you?
1707920	1708920	Roll human.
1708920	1711120	That's exactly how I get it.
1711120	1712120	Yeah.
1712120	1713120	There's mechanics for that.
1713120	1714120	I got a 74.
1714120	1715120	On a what?
1715120	1716120	On an 80.
1716120	1717120	Oh, for real?
1717120	1718120	For real.
1718120	1719120	Okay.
1719120	1720120	Damn.
1720120	1721120	He, he is scared.
1721120	1722720	He is very, very scared.
1722720	1725400	Is there an intimidate roll that I can do?
1725400	1726480	Leo, I'm really sorry.
1726480	1728120	We are not our best today.
1728120	1729120	We're a little unfocused.
1729120	1730560	Can I have my key back?
1730560	1734480	We frankly don't know why we're here.
1734480	1735480	I just want my key.
1735480	1736480	It just seemed like the right thing to do.
1736480	1737840	I just want my key back.
1737840	1740600	We're going to need that for a couple more days probably.
1740600	1741600	What happened?
1741600	1744000	Well, we were hoping you could fill in some blanks earlier.
1744000	1748440	I just came out last night and brought y'all the key and then I left and y'all said something
1748440	1749440	bad happened.
1749440	1750440	What happened?
1750440	1754040	Hey, I know it didn't have a face and all, but did you recognize that body laying in
1754040	1755040	your garbage yard?
1755040	1756040	There was a what?
1756040	1757960	And he immediately gets back on the phone.
1757960	1758960	Did he?
1758960	1760120	Did we not?
1760120	1764600	My taser is unholstered.
1764600	1767720	He turns around and he's like walking back towards his truck.
1767720	1770920	George, George, there was a body found at the junkyard.
1770920	1773180	Yeah, I don't know.
1773180	1774180	I don't know.
1774180	1775180	I come up behind Leo.
1775180	1778120	Hey Leo, is that George on the phone there?
1778120	1779120	Yeah.
1779120	1781120	Would you mind if I talked to him?
1781120	1788120	Okay, George, I'm going to give the phone to Clark Bishop, the chief man, the cop police.
1788120	1789640	And he hands you the phone.
1790160	1791160	Hey, George.
1791160	1792160	It's Clark.
1792160	1793160	Hey.
1793160	1794160	Hi.
1794160	1795160	Yeah, this is me.
1795160	1796160	I'm George.
1796160	1797160	We're up here.
1797160	1798160	We're returning your brother's key to the lot.
1798160	1799160	Yeah.
1799160	1801160	Will you stop giving him so much trouble and give him the key?
1801160	1802160	Yeah.
1802160	1806360	I got to tell you though, George, we found a body last night out there at the yard.
1806360	1809960	Yeah, that's what Leo just said.
1809960	1810960	What kind of body?
1810960	1813000	Are you talking a weirdly coyote?
1813000	1814000	Talking coyotes?
1814000	1817400	No, it's a human body.
1817400	1819200	We found a dead woman on your property.
1819760	1820760	The fuck you did?
1820760	1821760	What?
1821760	1826240	Yeah, so we've got some questions for you and your brother.
1826240	1828240	Is there a time you guys can meet us down at the station?
1828240	1830680	Yeah, I suppose we can make that happen.
1830680	1833640	Gosh, does it have to be today?
1833640	1834640	Preferably, yeah.
1834640	1838400	As he's talking, I'm poking him on the arm like, I want to talk.
1838400	1841120	We'll meet you there around five.
1841120	1842120	Does that work?
1842120	1843120	Yeah, that sounds good.
1843120	1844120	All right.
1844120	1845120	Now will you give my brother his key back?
1845120	1846120	Of course.
1846120	1847120	Get off our property please.
1847120	1848120	We're heading out of here right now.
1848120	1849120	What does he say?
1850040	1851040	What does he say?
1851040	1852040	I want to talk to him.
1852040	1853040	Let me talk to him.
1853040	1854040	I put him back on with Leo.
1854040	1855040	What does he say?
1855040	1856040	Yeah, he's going to come in and talk to us.
1856040	1858360	Don't need to give him any time to talk to each other and plan something out.
1858360	1859360	I want to talk to him right now.
1859360	1864440	A smart thing to do as RPG players, but probably a bad thing to do as cops would be to have
1864440	1866280	made a copy of that key.
1866280	1872880	Well, you know, hindsight is a crit success.
1872880	1877220	Hindsight screwed the pitch, bro.
1877220	1879340	It's like three o'clock or so, right?
1879340	1880340	Yeah, it's like three o'clock.
1880340	1882620	So it's only a couple hours.
1882620	1884420	If you're concerned about it, we could watch the house.
1884420	1886460	Keith Vigna is very suspicious.
1886460	1887460	I'm going to stay here.
1887460	1890660	I'm going to stay here and make sure they don't leave before they go to the PD.
1890660	1891660	Okay, for sure.
1891660	1893180	Do you give Leo his key back?
1893180	1894180	Okay, cool.
1894180	1896460	As soon as he gets it, he gets it back on the key ring.
1896460	1898580	As I'm handing it over, I'm like, so I'm sorry about this, Leo.
1898580	1901900	I know it was real, real frightening, but we just had to figure some stuff out.
1901900	1902900	We're all good though now.
1902900	1903900	We're good?
1903900	1904900	Yeah.
1904900	1905900	You and your brother are going to come down and talk.
1905900	1906900	You'll have him there.
1907580	1911300	And hopefully over the course of the day, we all get a lot more focused and disciplined.
1911300	1912300	I believe in you.
1912300	1914300	I bet y'all can do it.
1914300	1916700	Really get our heads straight on what we're trying to do here.
1916700	1921260	I really bet y'all have direction and purpose in all of your decisions.
1921260	1924120	Leo, you are nothing short of an angel.
1924120	1925980	And you, sir, are my wings.
1925980	1929380	All right, I'll see you at clinkers, buddy.
1929380	1934420	While I stay here, I want to find somewhere that I can hide out, that I can see the entrance,
1934420	1936860	but I don't want them to know that I stayed behind.
1936860	1937860	Okay.
1937860	1939940	Is there like a tree line close or like-
1939940	1942360	Are you doing this to hide to see if they talk to each other?
1942360	1943360	They live together?
1943360	1944360	No.
1944360	1945360	Which we also knew.
1945360	1948940	In my mind, I knew that they lived together all the time.
1948940	1954820	I just, I wanted to see the comings and goings and kind of like try to be a little spy.
1954820	1956460	Can I roll something besides stealth?
1956460	1958500	You can roll law.
1958500	1959980	That's a 30 on a 40.
1959980	1960980	Oh, nice.
1960980	1963860	So yeah, you can find a nice spot where you would be able to keep an eye on their comings
1963860	1965980	and goings.
1965980	1967940	Tell me how much I can get away with here.
1967940	1975740	I get into my car and I pull it into a little clearing in the woods and my car is hidden,
1975740	1980860	but I'm standing outside of my car, eyes scanning for now, because I think what I'm going to
1980860	1982480	do is do a little walk around.
1982480	1983480	For sure.
1983480	1984480	Sounds good.
1984480	1985480	Cool.
1985480	1986480	Thomas and Joe, what do you guys want to do?
1986480	1988700	Probably I'm heading back to the station to get ready for the interview.
1988700	1989700	Okay, cool.
1989700	1993820	When I get to the station, I'm probably looking at any updates as far as maybe the information
1993820	1998180	from the hospital about Julie, maybe checking in with Drew about the chief, all that kind
1998180	1999180	of stuff.
1999180	2000860	Okay, so when you get back to the police station-
2000860	2002860	I want to read the chief's journals.
2002860	2004220	Okay, sounds good.
2004220	2009260	You would know from working with Chief Maggie Cook that she always carried a blue notebook
2009260	2010660	with her everywhere she went.
2010660	2013460	What was the color of the notebook that Drew gave her?
2013460	2015980	Yellow was the color of the notebook that was gifted.
2015980	2018200	The blue one is on her desk.
2018200	2020380	The yellow one is not in her office.
2020380	2023020	A red leather notebook and a yellow leather notebook?
2023020	2026460	I was thinking more of like, Zach, what's your favorite Bourne Ruffins album?
2026460	2031220	And why is it red, yellow, and blue?
2031220	2033640	There are three colors that these notebooks come in.
2033640	2037980	The third is red and there is not a red notebook in this office.
2037980	2041020	The blue notebook is a day-by-day journal of sorts.
2041020	2044580	It has to-do lists, grocery lists, and random thoughts.
2044580	2049140	It's basically her notepad app for a phone, but it's physical copies she carries around
2049140	2050140	everywhere she goes.
2050140	2051460	Oh my God, Zach.
2051460	2056940	It's basically her notepad app for her phone, but she carries it around physically.
2056940	2057940	It's her notepad.
2057940	2059940	Yeah, that's what I said.
2059940	2060940	Dog.
2060940	2061940	Cat.
2061940	2067100	What are we doing?
2067100	2072180	Millennial trash.
2072180	2077460	It is dated on the front and then a dash and no end date on it, but the first date is like
2077460	2079940	November 3rd or something like that.
2079940	2084460	So this is since November 3rd to December 1st are her notes.
2084460	2086820	And it fills up like three quarters of this notebook.
2086820	2087820	Chief is thorough.
2087820	2088820	She's very thorough.
2088820	2089820	She's very good at her job.
2089820	2092620	But most of what's in there is notes about her job.
2092620	2095540	Clark Bishop, as you sit down, what were you looking into?
2095540	2101140	Seeing if we got anything back about Julie in the hospital about her death and all that
2101140	2102140	stuff.
2102140	2103140	Oh yeah.
2103140	2108660	The hospital actually called and this is the craziest thing, but they heard screaming coming
2108660	2113820	from the morgue and it turns out that Julie Maxwell pronounced dead.
2113820	2115060	Not actually dead.
2115060	2116060	Yeah.
2116060	2122040	They, somebody did it wrong and how can you live without a face?
2122040	2129260	So you say to yourself as you're in the office reading a notebook runs down my spot.
2129260	2131980	This face stuff is really getting to John Lee.
2131980	2133860	Pettymore values his face.
2133860	2135000	Is it drew?
2135000	2136000	She in the city.
2136000	2137220	This is the hospital in the city.
2137220	2138220	Yeah, yeah, yeah.
2138780	2139780	I'll head that way.
2139780	2140780	You guys want to talk to my mom?
2140780	2141780	Yes.
2141780	2142780	Put her on air.
2142780	2143780	Hey mom.
2143780	2144780	Hello.
2144780	2145780	Are you going to have time for dinner or not?
2145780	2146780	If you don't, that's fine.
2146780	2147780	No.
2147780	2153740	Uh, so right now you're on speakerphone with Zach, Thomas and Joe and millions of listeners
2153740	2154740	across the nation.
2154740	2155740	Hi guys.
2155740	2156740	Hello.
2156740	2157740	Hi.
2157740	2158740	How are ya?
2158740	2159740	Good.
2159740	2160740	What did you make for dinner?
2160740	2162740	Um, Texas Roadhouse was going to make us a stay.
2162740	2163740	Hell yeah.
2163740	2167220	And I would, I would love to come, but I am.
2167220	2172420	I bet I'm playing the game with them and we're recording it for a podcast right now.
2172420	2175780	So am I going to get to be in the podcast?
2175780	2176780	Yeah.
2176780	2178460	Here, let's find a good level for you.
2178460	2179840	Say something spooky.
2179840	2180840	Say something spooky.
2180840	2181840	Dragons are scary.
2181840	2183840	Dragons are scary.
2211840	2221840	I'm the only one trying to fool.
2221840	2231840	How can you have enough drowning out of the noise?
2231840	2245840	I'm the only one trying to fool.
