start	end	text
3020480	3021920	Let's go back to what Thomas said.
3025040	3026160	Let's go to the south gate.
3026800	3030160	I used to work at a church called South Gate.
3030160	3032880	Oh, this is probably pretty triggering for you.
3032880	3034320	Yeah, I was the janitor.
3034320	3035360	That sounds like a nice job.
3035360	3037680	It was lovely as the nighttime janitor.
3037680	3038960	Yeah, nobody's around.
3038960	3040400	You're in a neat big building.
3040400	3043680	I was also like solidifying my lack of faith at that point.
3043680	3046720	So it was a nice setting.
3046720	3048480	Did you just piss on the pews and be like,
3048480	3050240	well, they were clean when I got done with them.
3050240	3051280	Did you play the organ?
3052400	3054000	There was no organ, unfortunately.
3054800	3056480	I grew up in a church with an organ.
3056480	3058480	Very fun, but not that one.
3058480	3058980	Bummer.
3060160	3061200	You want to call for Stevie?
3061200	3061700	Stevie!
3063360	3064640	Stevie, Stevie!
3064640	3065200	Stevie!
3065200	3066000	Stevie!
3066000	3066400	Stevie!
3066400	3067200	It's us!
3067200	3067920	Hey, hey!
3067920	3069200	Cal Colorado!
3069200	3071600	You guys are at the northeast corner of the Natcher Hole.
3071600	3073520	Exactly where we're supposed to be.
3073520	3073840	Exactly.
3073840	3076400	To catch the crooked cops.
3077280	3078560	Got all cops.
3078560	3080480	You saw Stevie, this scrawny little dude
3080560	3084720	wearing cigarette legged jeans and an oversized black hoodie.
3085360	3088000	They have earbuds plugged into their ear holes
3088000	3093040	and a thick wall of dark wavy hair covers their eyes, nose, and top lip,
3093040	3098640	only revealing a black lipstick covered bottom lip, pierced with a small hoop.
3098640	3102720	It's a good thing our trusted comrade and colleague Stevie Gotel is here
3102720	3107120	to help us apprehend these men who are meeting the mysterious and criminal SG.
3107120	3108400	The SG, yep.
3109360	3110800	As written down in their notes.
3113120	3117280	Beck, I'm so glad Stevie's here to help us find the nefarious SG.
3117280	3119200	I thought that meant South Gate.
3119200	3120960	I did too, to be honest.
3120960	3125600	I have many fond memories of coming to this Natcher Hole with my father.
3125600	3127600	We'd always come in the South Gate, the people's gate.
3129360	3130880	He insisted we sit in the bleachers.
3131680	3134320	I wasn't around when it was still a ballpark.
3134320	3138320	I was actually at the game where the sinkhole ate Lefty Rodriguez.
3139360	3140640	Well, he wasn't very good.
3142640	3144000	He insisted on batting right.
3149120	3151440	If you could both roll at a negative...
3152880	3155840	Well, I'll just give you a negative 20 for the conversation that you're having.
3158320	3159120	I fail.
3159120	3160000	I crit fail.
3163840	3164640	Oh, wait, wait, wait.
3164640	3166320	Stevie, Stevie, where did they go?
3167040	3167840	Oh, shit.
3169680	3170240	Stevie?
3171360	3171920	Stevie?
3171920	3180480	As you're looking around, Cal, you look out of the driver's side window and you see that there is
3181280	3189120	blood on the street next to your car and then it's going in a line back around.
3189120	3193440	And then at that very moment, you see Stevie coming back around the front of the car
3194160	3200080	with some sort of contraption in their hand and they are spilling out blood.
3200880	3203200	They finally connect the circle.
3203200	3204240	Oh, I hate blood.
3204880	3206240	I slam on the gas.
3213920	3216240	You described her making the circle for too long.
3219120	3221600	I'm just gonna sit here and let you trap me?
3222240	3226000	Well, I mean, I am going to finish what I was doing because you failed.
3226560	3227200	You check.
3229440	3237840	And so Stevie is muttering something under their breath and as you go to hit the gas
3237840	3244320	and the blood finally meets back up around this Cadillac, I need you both to roll power.
3248560	3249600	Critical success.
3252000	3253280	33 on a 60.
3254000	3256640	I pass a 30 on a 75.
3257440	3263920	Immediately, the two of you are standing in front of a large estate.
3264560	3271280	You're standing on a sort of synthetic, almost bouncy material, like a sidewalk.
3273040	3275520	And there's a row of homes in front of you.
3275520	3281040	And one of these homes is slightly larger, slightly nicer than the rest.
3281120	3283200	Absolutely gorgeous architecture.
3284000	3285760	Well kept garden.
3285760	3286480	Well kept.
3292320	3295280	What's the first thing that goes through Cal Colorado's mind?
3295280	3295920	Oh my God.
3295920	3296560	What the fuck?
3298560	3305040	And in that moment, as you speak with each word that comes out of your mouth,
3305040	3311440	the reality around you sort of loses its shimmer, loses its sharpness.
3312400	3317680	It's almost like you're speaking away the reality that you're currently in.
3317680	3318560	This isn't happening.
3318560	3319440	This isn't happening.
3319440	3320720	I'm in my C class.
3320720	3321920	I'm in my C class.
3321920	3322960	That's where I am.
3322960	3327120	And as you say that, you are sitting in your C class.
3327120	3333120	You're looking over at Beck and Beck's eyes are kind of like rolled back in his head.
3333120	3334240	I started slapping him.
3334240	3336640	Beck Wilder, you feel the slaps?
3337360	3338800	Beck, Beck, come back.
3338800	3339200	Come back.
3339840	3341120	You're in the C class.
3341120	3343040	I'm in the C class.
3343040	3345520	You are Beck Wilder.
3345520	3346640	I'm Beck Wilder.
3346640	3348800	The best damn camera man in the world.
3348800	3351040	I'm the best camera man in the world.
3352400	3352960	What the fuck?
3353680	3354960	Is Stevie still around?
3354960	3360480	In the rear view mirror, you see Stevie Gautilus slipped into the back seat of the Cadillac,
3360480	3362080	seemingly while you were out.
3363040	3365760	However, they are out currently.
3366640	3371760	Eyes kind of rolled back, but like they might come to at any moment.
3372400	3372900	Stevie?
3373920	3374420	Stevie?
3375600	3376160	Cal, hit her.
3376160	3382880	I open my driver's side door and I pour my coffee out on part of the blood circle and
3382880	3385760	try to disperse, like make it no longer complete circle.
3385760	3386160	Cool.
3386160	3386880	Very nice.
3386880	3389920	As you do so, Stevie kind of like rouses.
3389920	3397200	Hey, Stevie, what the fuck?
3398800	3400240	What did you just do to us?
3400240	3400960	That's fair.
3402720	3403200	What's up?
3404960	3412080	Stevie, I don't like to speak harshly to the people that I work with, but you are rapidly
3412080	3415440	declining on my list of favorite can interns.
3415440	3417200	Why don't you tell us what's up?
3417200	3418000	Yeah.
3418000	3418500	Yeah.
3421600	3423200	Stevie, where's Fox?
3423200	3423920	I don't know.
3424640	3426800	I mean, you saw the news, right?
3427440	3428720	Did you take him to the bridge?
3428720	3430960	No, I didn't take him to the bridge.
3430960	3432400	Like that's not Fox.
3432400	3436160	Like that thing just like, I mean, now that it-
3436160	3439840	You admit though that you blew the plant because we were supposed to keep him tied up down
3439840	3441680	there and we could tell that you let him loose.
3441680	3448160	I thought I could, I mean, clearly I'm not as good at it as my dad is.
3449920	3450640	Fuck.
3450640	3453200	That was Grover's Gorge that we saw, wasn't it?
3453200	3457040	Oh, were you in there for a second?
3457040	3457540	Yes.
3458000	3459520	And it was Grover's Gorge.
3459520	3460720	Was it my house?
3460720	3464400	Well, I don't think we visited your house, Stevie, but it was a nice house.
3465280	3465780	Yeah.
3466480	3468080	Those damn bouncy sidewalks.
3468080	3469440	Was that your house?
3469440	3469680	Yeah.
3469680	3471360	I mean, it was probably my house.
3471360	3472880	It's like where it was going to start.
3472880	3474000	Stevie, why did you do this?
3474000	3476160	Did you know a place like home us?
3476160	3478640	Well, I mean, no, it's like in your-
3478640	3480560	That's one of my favorite movies, Stevie.
3481120	3484800	I would appreciate it if you didn't give it negative connotations from me.
3484800	3488000	If I could try, I mean, honestly, if I could do it again, that would be-
3490240	3492800	I think you guys would maybe like-
3492800	3494720	No, I don't think so, Stevie.
3494720	3497200	They want us like dead there, right?
3497200	3498720	Like we escaped a trial.
3498720	3499680	Like you weren't there.
3499680	3501040	You were just there in your brain.
3502000	3506080	Like we all got out together and like I know that I bailed
3506080	3508800	and I'm really sorry about that, but I-
3508800	3509920	So what, Stevie?
3509920	3515760	We spend the rest of our lives in this parking lot, imagining ourselves in Grover's Gorge?
3515760	3516080	Okay.
3516080	3522080	So like it's a little confusing, but mostly I'm just scared right now, honestly,
3522080	3525680	because there's some shit going down.
3525680	3525920	Yeah.
3525920	3528080	Clearly you could handle it yourself, Stevie.
3528080	3534880	Why don't you tell us what the shit is and maybe while we're still your friends,
3534880	3538000	if we're still your friends, we can help you out of it.
3538000	3538320	Okay.
3538320	3542560	So I know the footage got stolen, right?
3543440	3543760	Yes.
3544480	3547360	Beck does a kind of embarrassed nod.
3547360	3552000	And so like I'm getting it back?
3553360	3554800	To give to us or-
3555040	3560080	So like maybe not?
3560080	3564880	Like what, like I had maybe a different plan, but-
3564880	3570560	Cal looks very, very seriously at them and says, Stevie, this is the news.
3572560	3572800	Yeah.
3573600	3579120	It was probably enough to like get my dad to give me whatever I wanted.
3579120	3581040	So I was just going to like-
3581040	3582080	Use it as blackmail?
3582640	3583120	Yeah.
3585120	3585600	You could have-
3587200	3588800	I do not condone blackmail.
3589360	3591360	I thought that you might not.
3591360	3596160	Beck, maybe if you passed a role, definitely Julius, you could have just gotten a copy.
3598960	3601440	But a copy is no good if it goes on the news.
3601440	3604400	If it's already out there, then what's the blackmail good for?
3604400	3605040	I mean-
3605040	3610480	You were all very, very specifically intent on wanting to get it on the television.
3610480	3613440	Stevie, is there really something your father could have given you
3613440	3617760	that was more valuable than a letter of recommendation from Cal Colorado?
3618480	3619120	Yeah.
3619120	3619680	Oh, what?
3621440	3624000	Like name a number or like-
3624000	3624640	Five.
3624640	3625280	Yeah.
3625280	3626080	27.
3626080	3626560	18.
3627120	3628080	Negative 90.
3628080	3628800	11.
3628800	3629280	Okay.
3629280	3631920	Put a million on the end of any of those except for the negative one,
3631920	3633280	because I don't know how that would work out.
3633920	3636720	And then yeah, that's probably like on the table.
3636720	3639360	You would owe him then if it was a negative probably.
3639360	3641840	Oh yeah, so I don't want to do that one.
3641840	3642340	No.
3643600	3651360	But I thought that it might be enough to where I could actually take over
3651360	3654560	and get him to like fuck off, but maybe not.
3654560	3655040	I don't know.
3655600	3657520	Stevie, I've got to question your logic there,
3657520	3663120	that your father would voluntarily give you enough of his fortune for you to take him down with.
3663120	3663360	Yeah.
3663360	3666800	I think in that case, you would just blackmail him to have the company,
3666800	3669920	not for a number that would then be enough to buy it from him.
3669920	3671600	See, this is why you should watch the news.
3676880	3678240	So what do you guys think?
3678240	3679440	How much should I ask for?
3687520	3688880	Cow like sighs deeply.
3689840	3692080	Well, what is he worth?
3692080	3699440	I mean, the company I think is 8.3 something, maybe 8.4, somewhere in there.
3700400	3700640	Bill.
3701200	3702960	Oh, I thought you meant negative million.
3710000	3710240	No.
3713840	3715680	Stevie, do you have the tape?
3716240	3716880	What?
3716880	3718480	Have you made the pickup yet?
3718480	3719120	No.
3719120	3720320	I want to human that.
3722560	3723760	Past 20 on 70.
3724560	3729360	Clearly Stevie was caught completely off guard and it's almost like you
3729360	3733040	stripped them down to their veneer by asking the question.
3733840	3740320	And you can just see right through a very simple like, no, that hasn't happened yet.
3740320	3741840	How did you set up this meeting?
3741840	3743680	Like, did you know the cops?
3743680	3745680	The cops, by the way, did you know that?
3745680	3747440	Well, see, it hasn't even happened yet.
3747440	3751120	So we need to figure out where they are.
3751120	3753120	Yes, I hold on.
3753120	3755040	I'd like a sidebar with Beck.
3755040	3756000	Yeah, for sure.
3756000	3758320	Could you put yourself in your circle or something?
3762320	3764640	Just do like a really tiny one in your seat there.
3764640	3768160	Or just, you know, you could remake the one you made and we'll step out of the car.
3768160	3768480	Okay.
3768480	3774800	So I, because you guys both like passed your power and especially with the crit success,
3774800	3780160	like I didn't have you roll grip in the moment and that starting to feel a little bit.
3780160	3783680	You're right, but I could see this dawning on us how fucked up with that was.
3783680	3787120	I mean, as you say, as you mentioned that we didn't take a grip test, I'm like,
3787120	3790640	oh yes, by the way, Stevie, what the fuck?
3791440	3791940	Yeah.
3793840	3794800	Can you both roll grip?
3796800	3797200	Pass.
3797200	3799040	10 on a 42.
3799040	3801280	I pass a 25 on a 49.
3802080	3807440	You were both whisked away somewhere mentally for a second, but it's not as if they couldn't
3807520	3812800	have, you know, maybe projected some sort of image onto your eyeballs or something technologically
3812800	3817280	speaking, like something could have happened that made you feel like you were elsewhere.
3817280	3821360	And I don't know, like we were real tired and just dozed off real quick.
3821360	3822000	Yeah.
3822000	3822880	Quick nap.
3822880	3823360	Why not?
3823360	3824960	That makes way more sense than mine.
3826240	3830960	I'm like, it's some wild tech thing that it's hot and new in the city.
3830960	3833600	Cause you know, the tech in the city is getting out of hand these days.
3833600	3834400	Not even in the city.
3834400	3836800	Like it could just be Grover's Gorge tech.
3836800	3838640	We saw all kinds of amazing things there.
3838640	3841680	It makes sense that they, oh, you did a little VR.
3841680	3844640	Like what are those in the fluid?
3844640	3846800	Like aggressive attack VR.
3848160	3848880	That's awesome.
3848880	3852880	Actually, there are nano projectors in the fluid that you encompass.
3852880	3855600	You know how they film the Mandalorian on that circular green screen?
3855600	3856000	Right, right.
3856000	3856480	Yeah.
3856480	3859040	It's like that, but a portable technology.
3860000	3860500	Yeah.
3861040	3864880	That's I don't think that they have that like here, but that sounds like a Grover's Gorge
3864880	3865200	kind of thing.
3865200	3865600	Exactly.
3865600	3866160	It was wild.
3866240	3866960	Remember what they did?
3866960	3868640	You know, when you got jackaloped?
3868640	3869140	Yeah.
3869680	3870640	Picture right up.
3870640	3873280	So of course they could Mandalorian us in my C class.
3873280	3874400	Deck feels his backside.
3875120	3875440	Yeah.
3875440	3876000	I remember.
3876000	3879520	It feels better than you think as you have the memory of the pain.
3881040	3887760	And Stevie just kind of like slips out of the Mercedes Cadillac.
3887760	3891040	And Stevie just kind of slips out of the Cadillac at this point.
3891040	3893040	What's it for fucking Mercedes?
3893040	3893680	Other way around.
3894640	3901280	And Stevie, why don't you stay right there in the back seat and we'll slip out.
3901280	3901840	Okay.
3901840	3902560	Gotcha.
3902560	3903040	Of this.
3903040	3904160	What kind of car is this?
3904160	3905360	It's a Mercedes C class.
3905360	3905860	Cool.
3908080	3908580	Yeah.
3908580	3910400	Which Luke assured us was nice.
3918400	3918640	Okay.
3918640	3923440	So we slip out of the car, but back since we lost sight of Stevie.
3923440	3928080	So easily a few minutes ago is going to like be staring into the back seat as we talk.
3928080	3928320	I think.
3928320	3928820	Yeah.
3930160	3931440	What you got cow?
3931440	3933520	Well, that's the question back.
3933520	3934880	What do we have here?
3934880	3938320	I mean, I've been kind of nervous about once we get to this point in every place we've
3938320	3941760	gone so far about like how we physically get it back.
3941760	3944400	Like they probably got guns, dude.
3944400	3945840	And they're expecting Stevie.
3946480	3951920	If we can keep Stevie on our side, I think they're our best bet at getting the footage back.
3952480	3955760	So we probably need to stay out of sight though for the handoff, right?
3955760	3957200	I don't think we can be a part of it.
3957760	3963360	Cal is thinking very seriously for a minute and he says, I think our best bet at getting
3963360	3969600	the footage and showing the public is if for now we let Stevie believe that they can go
3969600	3971040	through with the blackmail.
3971040	3971280	Yeah.
3971280	3977840	I think at the very least cow vomits on the steering wheel or remember we're out of the
3977840	3978080	car.
3978080	3978880	You're in the car.
3978960	3980000	God damn it.
3981840	3983440	You are where we can see you.
3985760	3986720	It's really smart.
3986720	3988880	That's what we mean when we say family.
3988880	3990320	Beck wants to open his door real quick.
3990320	3991120	Pop his head in.
3991120	3993280	Stevie, what was the like terms of the deal?
3993280	3997120	Were you going to pay them money or how are you going to get the stuff from them?
3997120	4001040	Oh, they're like, uh, already on the gato payroll.
4001040	4004720	So I just acted like they just think you're an agent of.
4004720	4005280	Exactly.
4005280	4005600	Yeah.
4005600	4008720	You're like the next higher up that they're passing it on to.
4008720	4010320	What time are you supposed to meet them, Stevie?
4010320	4011600	Uh, well, they're late.
4012240	4012480	Fuck.
4013600	4014320	Beck looks around.
4014320	4015680	Where were you supposed to meet them?
4015680	4016720	Like the south gate?
4016720	4017520	Yeah, the south gate.
4017520	4018480	Oh, the people's gate.
4018480	4021840	You know, I used to go there with my father, but we don't have time for that Stevie.
4025760	4027840	You need to go right away.
4027840	4029680	We're going to let you carry out your blackmail.
4029680	4030080	What?
4030080	4030640	Really?
4030640	4032240	We think it's for the good of the people.
4032240	4033600	Yeah, it is.
4033600	4036400	And then once you've got yours, we get ours.
4036400	4036960	That's right.
4036960	4038000	We need a copy though.
4038000	4038320	Okay.
4038320	4038640	Yeah.
4038640	4040240	You guys get a exclusive.
4040240	4042720	Like you're the first people who get it right.
4042720	4044000	Cal looks hard at Beck.
4044000	4044400	Yeah.
4044400	4046880	Beck returns the same kind of face.
4046880	4048400	So you guys look hard at each other?
4048400	4048880	Yeah.
4048880	4049200	Yeah.
4049200	4049760	Real hard.
4050320	4050480	Yeah.
4050480	4051120	It's hot.
4051120	4052880	And then, um, don't.
4053920	4056800	I mean, what do you expect me to fucking do with that?
4056800	4058720	I said, no, you can just don't.
4058720	4062320	I like bit down on that laugh earlier and it still came out.
4062320	4064000	I like really tried to hold it in.
4064000	4066400	I just specifically leave the part out where I say it's hard.
4066400	4067920	So the fucking discord doesn't.
4070080	4076240	The spoiler chat just doesn't become the horniest place on earth.
4076240	4078720	And even though what we're saying is funny right now, please cut it.
4079760	4082160	Because I'm serious about those discord fucks.
4085760	4087120	Can't give them an itch.
4087120	4089680	You're gonna have to say something way worse for it to get cut.
4092240	4093200	Don't try to bait me.
4093280	4096320	All right.
4096320	4096560	Back.
4096560	4097520	Do you want to try to bait him?
4102160	4107040	Cow looks real hard at Beck Beck gets an erection.
4119920	4121040	That's not appropriate.
4121040	4127120	That even though you could read into it some other way, what we have here is a father son
4127120	4128160	type dynamic.
4128160	4128720	Oh yeah.
4128720	4129040	No.
4129040	4130720	So knock it off for sure.
4130720	4131040	For sure.
4131040	4131520	For sure.
4131520	4131840	For sure.
4133520	4134800	Which one of you is this step?
4137680	4138560	I'm the daddy.
4139360	4140080	I'm the daddy.
4144720	4145920	So now it's in your hands, Zach.
4146480	4148320	What you unleash on the world.
4152000	4153360	On the edit, baby.
4153360	4154160	It's on the edit.
4155120	4155440	We'll see.
4156640	4159120	Stevie, you got to, you should get going then.
4159120	4160480	You're going to, you have to meet them.
4160480	4163600	Well, yeah, I was just popping out because I'm hungry.
4163600	4165040	Oh, are you meeting them in the subway?
4165040	4169120	Oh, yeah, they're going to meet me down by the subway.
4169120	4172560	If you're meeting them in the subway, couldn't you have just gotten a sandwich there?
4172560	4174880	Oh my God.
4174880	4176080	I'm so stupid.
4176880	4177840	Why did I talk like that?
4177840	4180080	Stevie, Stevie, you're not stupid.
4180080	4183360	You're just at the beginning of your life and you've got a lot to learn.
4183360	4183840	Yeah.
4183840	4185200	But I believe in you, kiddo.
4185200	4186000	That's awesome.
4186720	4188000	That's so cool.
4188000	4190560	Okay, well, do you guys want to like come with me or?
4190560	4195760	I don't think they should see us, but if you wanted to, I don't know,
4195760	4201760	FaceTime us from your phone pocket or something or from your shirt pocket with your phone in it.
4201760	4203120	Yeah, I'll put you in my hoodie pocket.
4203680	4206240	I mean, I've already got your earbuds in all the time.
4206240	4209440	So like that's, that's kind of my steez, right?
4209440	4211360	So like, they're not going to know that.
4211360	4212560	I thought your name was Stevie.
4212560	4213440	It's Stevie.
4213440	4217920	And they're not going to know that I've got one earbud that's talking to you guys.
4217920	4219360	Beck, I thought their name was Stevie.
4219360	4219860	Yeah.
4220240	4222880	No, Stevie's like a thing that you say.
4222880	4224880	They say like kids say it.
4224880	4226240	Like we say it.
4226800	4234720	Oh, everybody says here in the city in 2022, all the kids are saying Stevie.
4234720	4240960	And at that moment, you see a familiar car turn the corner
4241920	4245360	inside this parking garage and pull up next to you.
4245920	4246640	How familiar?
4247200	4249600	Well, how much do you know about?
4250160	4251360	Julia Summers?
4251360	4251860	No.
4254000	4257520	The intern, Jeremy and what he drives.
4257520	4265680	Cal, uh, to answer your question, Cal looks over and says, who the fuck is that?
4268000	4271200	I think if it's, if it's an internet can Beck would know.
4271200	4276400	Who got you coffee and energy drinks earlier, like yesterday and like for your jobs and stuff.
4276400	4279200	It was the one that was running alongside our car.
4279200	4279680	Absolutely.
4279680	4280480	This is Jeremy.
4281680	4282880	Dude, Cal, it's Jeremy.
4282880	4287440	And sitting shotgun is decide.
4288800	4289200	Oh no.
4289200	4293680	I'm just going to wait for Luke to like describe what you guys see as sitting shotgun.
4293680	4294240	Nice.
4294240	4294560	Hell yeah.
4294560	4296800	That's also perfectly in time with when I need to pee.
4302320	4304800	All right, let's get down to the end of the app.
4305440	4311920	Cal Colorado in the driver's seat of his Mercedes C-class Beck Wilder sitting shotgun.
4313600	4319200	And pulling up is the car of Jeremy, the city action news intern.
4320000	4322480	He's driving and sitting shotgun.
4323600	4324320	What do they see?
4325360	4331360	Julius opens the door, hops out of the passenger's seat, looks at Jeremy.
4332640	4333140	Thanks.
4334480	4340480	Slams the door and goes to get in the back seat of Cal's car.
4340480	4346240	Cal presses the lock button and crank, like rolls down the driver's window, just a tad.
4346240	4350400	Which makes sense because when you look at Julius Summers, you see.
4351200	4357760	He is covered in blood and like bits of brain and flesh.
4357760	4358260	What?
4359280	4360800	Oh shit.
4360800	4361360	We're all good.
4362080	4363120	You got promotions.
4363120	4364400	I got promotions.
4364400	4365520	Julius, dude.
4365520	4367200	Dude, Julius, you're covered.
4367200	4369520	What's the, yeah, Julius, you are.
4369520	4372320	Oh, there's a lot of viscera on you.
4372320	4375760	There was water features and stuff like a fountain.
4376400	4377120	It got all wet.
4377760	4378400	Yeah.
4378400	4378900	What?
4380000	4380500	Yeah.
4381440	4382480	Blood fountain?
