start	end	text
1486880	1490960	And then he comes back to the door, opens it up
1490960	1496240	and hands you a bag, a tote bag.
1496240	1499520	Julius grabs the bag, hands over the package
1499520	1502400	and then kind of like gestures to the yard.
1502400	1506480	And it's like, so like, what's, uh, what's all that?
1506480	1508240	Oh, do you enjoy the pieces?
1509040	1510160	They're interesting.
1510160	1510720	Yes.
1510720	1510960	Yes.
1510960	1516800	I, uh, I, every single time I drive back or leave my home,
1516800	1521760	I get to look at them and be reminded of all the wonderful things.
1521760	1524560	He gets an off distance look.
1524560	1532560	He's gone in the, in the sunrise as he's off on my mini expeditions.
1532560	1537360	But Julius looks down at his watch and back up at this guy.
1537360	1539120	And he's still smiling.
1539280	1543520	He nods his head and, uh, is gonna head out.
1543520	1545840	Yes, have an excellent morning, sir.
1546800	1551120	Julius is going to walk away and, uh, he's going to look in the bag.
1552160	1553200	Oh, he looks in the bag?
1553200	1553440	Yeah.
1553440	1558160	Since if it was a package, he was going to not unwrap it, but it's in a bag.
1558160	1558960	He's going to look.
1558960	1559200	Yeah.
1559200	1560320	There's a piece of parchment.
1561520	1562480	He's going to read it.
1562480	1573120	Uh, it is this parchment that has a language on it that you've never seen before.
1573760	1577280	And do you have any skills?
1580560	1582400	I guess I need my character sheet.
1584720	1585040	Okay.
1585040	1586240	Do I have any skills?
1586240	1586640	I do.
1588160	1589200	What specifically?
1589280	1598000	I'm looking for a SIGINT or a specific language or archeology, history.
1598560	1601120	Julius has a 70 SIGINT.
1601120	1603680	Oh, oh, does he?
1603680	1604240	Interesting.
1604240	1604720	Okay.
1604720	1608480	Uh, and with this, uh, 70 SIGINT, let's roll baby.
1610720	1612400	61 on a 70.
1612400	1614800	61 on a 70.
1616400	1617520	It tells you two things.
1618240	1626880	One, this is a stone rubbing and two, you've never seen this language before, but you think
1626880	1630320	you might know someone who can help you out with it.
1632400	1634640	Julius makes a note of it.
1634640	1641280	In fact, he takes a picture of it on his phone, puts it back in the bag, kind of how it was.
1642080	1646320	And then, um, Julius is going to jog home.
1647520	1652000	He can leave it on the kitchen counter for his handler, who is his roommate.
1660320	1662000	Let's go now to July 6th.
1662000	1665200	Let's pick up exactly where we were with Julius Summers.
1665200	1672800	As you walked up through the hall, the Cannes studio, you hear Tife whistling.
1677520	1685280	You open up the door and you see your uncle Tife Raylan standing behind his desk.
1685280	1690800	And you see two other people sitting at chairs on either side, closer to you.
1690800	1693200	Both kind of turned back looking at you.
1693200	1699040	You see cops, one tall kind of spindly, one short ball jacked.
1699680	1700720	And they all look at you.
1701440	1705120	Julius fucking my baby boy.
1705120	1706160	What's up, Neff?
1706160	1707200	How's it going?
1707520	1708640	How you living?
1708640	1710400	Oh, forget about it.
1710400	1712320	Come hungry for you.
1712320	1714800	We got some stuff we need to take care of.
1714800	1715520	Where's your boys?
1715520	1716160	Where's Beck?
1716160	1716800	Where's Cal?
1717360	1719680	I'm the only one that's going to be here.
1719680	1720720	Why is that?
1720720	1724400	I thought I told you to bring the whole team down, baby.
1724400	1727600	They're not going to do what you want them to do.
1727600	1730160	And what is that that I want them to do?
1730160	1732000	Give up on the Godel company.
1732000	1732640	Give up?
1733680	1734320	Give up?
1734320	1736080	No, no, absolutely.
1736080	1738320	I would never give up on the Godel company.
1738320	1744480	And you see Officer Riley and Officer Wiley sitting in these chairs, smiling real big,
1744480	1746400	kind of laughing to themselves.
1747200	1751520	No, no, we are absolutely not giving up on the Godel company.
1751520	1756400	The Godel company is what's taking us into the future, baby boy.
1756400	1757200	Come on, Neff.
1757200	1757840	Come on.
1757840	1758400	Let's go.
1759120	1760240	Let's go.
1760240	1761920	It's promotion time.
1761920	1765920	Now, you have some videos on your phone, I believe, Julius.
1766480	1768640	Photos, videos, stuff like that.
1768640	1769280	Yeah.
1769280	1770400	Let's see that phone.
1771360	1776080	Before I show you any of this, I, you know, I have some demands.
1776800	1777440	Okay.
1777440	1777840	Okay.
1777840	1778400	Calm down.
1778400	1782960	Demands of one thing, requests or another for our new promotion man.
1783600	1784000	Okay.
1784000	1791760	Well, and Julius reaches into his pocket and pulls out a list that is written on a napkin
1791760	1793360	from where are we?
1793360	1796080	We're at the kids bar.
1797760	1799760	I need a personal assistant.
1799760	1808400	And I want a fully catered breakfast buffet every day from the day goal for the whole
1808400	1808800	staff.
1809360	1810480	Interesting.
1810480	1810880	Wow.
1810880	1811840	That's a weird one.
1812400	1813200	I'm not done.
1813200	1816880	I want your, I want your private executive bathroom.
1817600	1821120	Oh, come in, come in.
1821760	1826640	And I want you to pay for it to get remodeled by the team at Bedeagle.
1828400	1831120	I want full control of what gets played on can.
1832160	1832960	Wow.
1832960	1833840	That's a big one.
1834480	1836560	I want Cal to be the lead anchor.
1836560	1836880	Okay.
1836880	1838800	That's kind of doable more so.
1838800	1844240	I want Beck to get any equipment or really anything that he asked for.
1844240	1846640	Yeah, to a certain monetary amount.
1846640	1847200	Sure.
1847200	1850480	I want the title of executive producer.
1850480	1850880	Okay.
1851920	1855600	I want a free pass from all the cops.
1855600	1864000	Um, the, the, the short jacked one immediately stands up with like almost bald fists and
1864000	1867520	is like, um, uh, sorry, sorry.
1867520	1870720	Um, what did you just say?
1870720	1872880	I don't want to get pulled over for speeding.
1874960	1876080	Oh, okay.
1876080	1877840	Oh, yeah, yeah, yeah, yeah.
1877840	1880160	Um, no speeding is fine.
1880160	1880960	Fine, fine.
1880960	1881440	Sure.
1881440	1885040	But what did you call us just then?
1885040	1887040	Was it cops, right?
1887040	1889680	I said the cops, city PD.
1890880	1892400	Julia starts to sweat a little bit.
1892400	1898400	He slowly kind of sits back down and says, uh, yeah, that's what I fucking thought.
1899040	1901600	Uh, I, I want hush money.
1901600	1903840	I want them to pay me not to show this.
1904400	1908960	How much, how much do they pay you money?
1908960	1910080	No, no, no.
1910080	1911760	I'm not in it for the money, dude.
1911760	1912480	Come on, man.
1912480	1913760	This is, this is the future.
1913760	1914320	Julius.
1914320	1916400	We're talking about a whole new world, man.
1916400	1918560	We're talking about a million dollars.
1919760	1921680	I mean a bonus, a signing bonus.
1921680	1922960	Is that what we'll talk about it later?
1922960	1924560	We'll get the details down later.
1925600	1927280	Now, listen, this is important.
1927280	1928320	This is an important one.
1928320	1934160	I want a Tony little's gazelle freestyle glider home fitness exercise machine with the workout
1935040	1936080	DVD in my office.
1936720	1938400	Is that like hard to find?
1938400	1938880	I don't know.
1939920	1943200	I remembered it and it's good for your thighs.
1945280	1945600	Okay.
1945600	1946320	I'm almost done.
1948800	1953280	I want to travel and fitness show that runs after the five o'clock news.
1953280	1955200	And I want to call it summer's vacation.
1957440	1962080	He laughs like I just laughed at that one and is like, that actually sounds like a great
1962080	1963440	pitch and we can at least.
1963440	1963840	Yay.
1963840	1965520	We can talk about that for sure.
1965520	1965920	Okay.
1965920	1968960	And then this one, I will not concede on this one.
1968960	1974880	I want the marbles re-installed in the walkway of the entrance and he pulls out a marble
1974880	1976160	from his little pocket.
1976160	1976640	Of course.
1976640	1977040	Yeah.
1977040	1981600	And he flicks it over towards one of the gobs.
1981600	1986160	The tall spindly one kind of catches it as he's reaching out to catch it.
1986160	1988560	Julius pulls out two pistols.
1988560	1989120	Oh my God.
1989680	1991120	Oh my God.
1991120	1994560	And shoots at both of the gobs.
1994560	1995280	Oh my God.
1995280	1995840	Okay.
1995840	1996320	Shit.
1996320	1996640	Fuck.
1996640	2001120	What's your, what's your, uh, what's your dexterity?
2001120	2002880	My dexterity is 75.
2002880	2003440	Okay.
2003440	2003920	Yes.
2003920	2006000	You also caught him by surprise.
2006000	2012560	So you get to go first and that is after your surprise round.
2012560	2016560	So let's start with a deeply surprising round.
2019760	2022720	That's a five, that's a five.
2025360	2026240	Okay.
2026240	2026720	All right.
2026720	2029200	Roll a d10 for each of the shots.
2029920	2030800	Gets these two dudes.
2031600	2032800	A two and a 10.
2032800	2034880	A two and a 10.
2034880	2035600	Okay.
2035600	2038160	You flick this marble in the air.
2038160	2044080	Wilson Wiley, the tall spindly cop reaches up to grab it and you fire directly through
2044080	2047920	his hand with one of your shots as the other one.
2047920	2054560	Hits the marble, which embeds itself directly between the other guy's eyes.
2054560	2055040	Yup.
2055040	2058640	And he has to roll constitution.
2058640	2064880	He does stay conscious, uh, but he's lying flat on the ground at this point.
2064880	2073360	Blood is like spraying out around where the marble has embedded itself and type is freaking
2073360	2075280	the absolute fuck out.
2075280	2084080	But Wilson Wiley immediately dives for cover behind the desk with Tife and flips it on
2084080	2084640	its side.
2085440	2093920	Tife's enormous solid wooden desk is now in between you and Wilson Wiley, the tall spindly
2093920	2101440	cop and Tife Rayland, your uncle, while Richard Riley lays on the floor.
2101440	2103680	Tife yells out to you with his turn.
2103680	2105920	Whoa, whoa, whoa, whoa, whoa, whoa.
2105920	2107520	Come on, Julius.
2107520	2109200	What the fuck?
2109200	2111840	I ain't going back to Barstow.
2112480	2116800	And with that, it's Richard Riley's turn and on the ground.
2116800	2120240	He moans back up to the top of the order.
2120240	2121280	It's your turn.
2121280	2123920	Tife, if you're not armed, you better not arm yourself.
2123920	2125280	This is not over.
2125280	2129920	And then he starts running towards the desk towards Wilson.
2130000	2135520	And he wants to, in his mind, he's going to hop the desk, catch Wilson's head between
2135520	2141040	his legs, spin, and then land on the ground with his gun aimed at Tife.
2141040	2141600	Okay.
2141600	2147440	You were super close, so this is just going to be a melee attack, but I need you to roll
2147440	2151520	an athletics first to successfully dive over the desk.
2153520	2154020	Uh-oh.
2155280	2156160	I rolled a 90.
2157040	2160960	90 is not going to do it.
2160960	2167680	So as you're running up, Wilson Wiley just kind of stands at the last possible moment,
2167680	2169600	throws his hands up as kind of a block.
2170240	2172640	His hands are the only thing up above.
2172640	2178640	And so they're kind of grabbing on either side of the inner thighs and just kind of
2178640	2180160	like holds you right there.
2180160	2184240	And you're like sitting on top of the desk at this point in time.
2184320	2188640	And the two of you are grappling each other, essentially at this point.
2188640	2189920	And it's Tife's turn.
2189920	2193680	You can now see him as you're looking down directly at him.
2193680	2198800	And he just kind of sits back and he's like, I don't have a fucking gun, Julius.
2198800	2200480	What the fuck, man?
2200480	2201280	I'm not going to-
2201280	2202080	Good.
2202080	2203440	Yeah, duh.
2203440	2205920	And it's Richard Riley's turn.
2205920	2212960	You hear just kind of this like, ugh, and he's slowly getting himself off the ground
2212960	2218240	behind you, but that's going to take his entire turn to just kind of like right himself at
2218240	2218880	this point.
2218880	2220240	And it's back to you.
2220240	2227360	So Julius is sitting on the overturned desk with Wilson's hands basically clenched between
2227360	2228240	his legs.
2228240	2228740	Yeah.
2229360	2231920	He's going to shoot Wilson right in the face.
2231920	2232640	Jesus Christ.
2234240	2240960	Okay, so because you're within distance of him, he's going to roll unarmed combat against
2240960	2241840	your firearms.
2241840	2242340	Okay.
2243520	2245440	I got a 19.
2245440	2246960	I failed with a 77.
2247680	2250080	Oh, so-
2250080	2251680	So how do you execute this man?
2253840	2259520	Julius is sitting on the overturned desk with Wilson's hands clenched between his thighs.
2260880	2265120	Julius spreads his legs, lets Wilson's hands free.
2266240	2268160	Julius is like, whoa, whoa, whoa.
2268160	2270480	And then just shoots him right between the eyes.
2270480	2276080	He's literally like fumbling for his gun and can't get it out of his holster.
2276080	2283440	And as you're firing, he's like, and his gun goes off as well.
2284160	2293200	Typh is there with a bullet through his shin and he's like, whoa, no, what the-
2293200	2295040	Oh my God, he's dead.
2295040	2296080	Oh, he's fucking-
2297040	2299600	As he's throwing up, he's about to pass out.
2299600	2302240	And he's like, I'm about to pass out, man.
2304880	2312800	Yet he just continues to vomit as Richard Riley is finally standing, slowly looking
2312800	2318000	up with you just executing his partner.
2318960	2320720	That's probably good, right?
2320720	2321600	For him?
2321600	2322720	He fires at you.
2326480	2332480	And he puts a bullet right into your shoulder for three points of damage.
2332480	2333920	How many hit points do you have?
2333920	2335200	I was at six.
2335200	2335760	Oh, God.
2337760	2341360	So yeah, he is down to three hit points and it hurts.
2343440	2349040	With that, you need to roll a constitution check in order to stay conscious as you take
2349040	2354240	half of the hit points in damage that you currently have.
2354240	2360320	With a 24, you stay with it and it is your turn once again.
2360320	2363760	This dude behind you has just shot you through the shoulder.
2364560	2369200	There's a dead man in front of you and Typh is puking his brains out with a hole in his
2369200	2370480	shin to the left of you.
2370480	2372240	As soon as Julius gets shot.
2372240	2373840	God damn it.
2374640	2376240	I thought you're fucking dead.
2377200	2382480	You turn around and you see a dude with a marble deeply embedded, so deeply that if
2382480	2389520	you miniaturized yourself to the point to where each hair on an eyebrow was the same
2389520	2395120	height as you and then you walked across his forehead, you would have no trouble traversing
2395120	2395760	the terrain.
2400080	2404400	Julius looks at the guy who just shot him, looks over at his uncle.
2405280	2405840	Fuck.
2406000	2414240	And he walks up to Richard Riley and is going to just try to punch the marble into his brain.
2416320	2417360	Finish what he started.
2417360	2419760	Okay, so he's going to put up a fight here.
2419760	2422080	We're going unarmed combat against each other.
2423040	2424960	He succeeds with an ought six.
2426640	2427440	83.
2427440	2429040	Oh shit.
2429040	2429200	Okay.
2429200	2430480	With one arm.
2430480	2433040	I mean, he got shot through the left shoulder.
2433040	2436240	He rolls a two, so that's only one point of damage.
2436880	2442960	As you go to punch him, he just grabs your arm, kind of throws you back and throws a
2442960	2444800	left hook at you at the same time.
2445680	2452640	Your nose has recently been like completely obliterated and then healed by some sort of
2452640	2453440	wild tech.
2454240	2461520	You immediately feel your nose kind of like bust back open as you go to two hit points.
2461520	2466880	You once again have to roll a constitution check to stay conscious as the world around
2466880	2471200	you vibrates and your stomach just nope.
2471200	2472480	The vibration is gone.
2472480	2479520	Your stomach feels like fucking steel and you've never, ever been more focused.
2479520	2480320	Crit success.
2480880	2481920	Your turn.
2481920	2482720	Let's go.
2482720	2483520	Julius shoots him.
2484960	2486320	He gets punched in the face.
2486880	2493920	No thoughts go through his mind other than this has to end and he just unloads his clip
2493920	2494960	into this guy.
2494960	2495360	Okay.
2495360	2496960	We're on against each other once again.
2498800	2500960	59, which is a pass.
2500960	2502960	26, which is a pass.
2504160	2512000	And as you both go for your guns at the exact same time, you kill him, your back is up
2512000	2512560	against the wall.
2512560	2513760	It's unceremonious.
2513760	2516560	You wanted to do the fun marble thing in your mind.
2516560	2521440	You're like still bummed that you didn't quite finish him off in that way, but you
2521440	2523360	know, you were about to fucking die.
2523360	2523860	Yeah.
2524160	2527280	Julius's vision is kind of tunneling in a little bit.
2527280	2528640	He's losing some blood.
2529280	2536960	His face is on fire from his re-broken nose and who knows probably facial bones as well.
2537840	2539200	Julius walks over to type.
2544000	2547840	Oh, what the fuck, Julius?
2547840	2549840	Julius, seriously, you can't.
2549840	2551920	We were onto something, Julius.
2551920	2554080	We were, we were onto something.
2554080	2556800	What you want and what I want.
2558640	2559440	I don't match up.
2560480	2563840	I have one more thing on my list of demands.
2564960	2566080	Whatever you want.
2566080	2567440	Whatever you want, Julius.
2567440	2568960	Whatever you want is yours.
2568960	2570320	Tell me I'm a real Raylan.
2571680	2573120	I'm a real Raylan?
2573120	2575120	No, you're not a fucking Raylan.
2575120	2579840	A Raylan wouldn't shoot anybody with his cold blood like this coming in my office shooting
2579840	2580240	cops.
2581280	2581840	What is it?
2581840	2584240	Why am I going to have to call the police?
2584240	2586080	Everything's fucked now, man.
2586080	2586960	Everything's fucked.
2586960	2588400	You fucking ruined everything.
2588400	2590000	You fucking ruined everything.
2590720	2597520	Julius holsters the gun that he emptied the clip on, pulls out the one that he still has
2597520	2601360	bullets in, puts it up against type's head.
2601360	2602400	Are you fucking serious?
2602400	2604560	Tell me I'm a real Julius.
2604560	2605600	Tell me I'm a Raylan.
2605600	2607360	Is that what this is about?
2607360	2609280	Tell me I'm a fucking Raylan.
2609280	2611760	You've lost your grip is what, Julius.
2611760	2616480	Tear runs down Julius's face as he pulls the trigger.
2618000	2624560	The body of Typh Raylan slumps down into a pile of his own vomit.
2626720	2629840	Immediately, the body of Wilson Wiley farts.
2633280	2636480	God damn it.
2644160	2646560	I'll never get used to this stench of death.
2646560	2647120	Roll grip.
2652800	2654000	No, that's not going to do it.
2654000	2655840	That's an 89 on a 25.
2656480	2660400	For murdering unarmed family member.
2661040	2663920	I'm going to go ahead and say D4 plus one.
2663920	2664420	Yeah.
2666640	2667440	One plus one.
2667440	2668240	Two grip.
2668240	2670560	And that puts me past a breaking point.
2670560	2671840	Hey, that's fitting.
2674400	2675200	What should we go with?
2675840	2679760	We've got a fucking mess is the situation that you're in.
2680720	2681760	It's a giant mess.
2681760	2687440	Julius just killed his uncle who, you know, whether they got along, he still killed his
2687440	2688560	uncle that he loved.
2689120	2698000	And so Julius, instead of dealing with the horrific situation in front of him, goes somewhere
2698000	2698500	else.
2698960	2700080	Just leaves?
2700080	2702240	No, in his mind.
2702880	2703680	Oh shit.
2704320	2708160	He doesn't see the dead body of Typh Raylan.
2708160	2710400	He doesn't see two dead cops.
2712640	2718160	He sees interesting little figurines reminiscent of-
2718160	2720720	The sculptures from the front yard.
2722880	2723920	And the vomit.
2723920	2724880	A water feature.
2724880	2725380	Of course.
2726080	2726880	The blood.
2726880	2727600	A little pond.
2729120	2731920	He sees little koi fish swimming in it.
2732880	2735760	Oh, Typh wouldn't like this.
2735760	2736880	Oh no, no.
2736880	2738000	He likes it a lot neater.
2738640	2740640	I gotta get this stuff out of here before he sees it.
2740640	2749440	And Julius starts cleaning up the office to get out the sculptures.
2750800	2757120	All right, roll forensics to clean up the murder scene that you just created.
2759200	2759920	An 81.
2760720	2761920	So that's not gonna cut it.
2761920	2763440	That's not gonna cut it.
2763440	2764560	That's not gonna do it.
2765600	2769280	You've gotten the sculptures where?
2769440	2771360	How are you getting rid of these sculptures?
2771360	2772960	Are they in the bathroom?
2772960	2774240	The executive bathroom?
2774240	2775440	They're in a-
2775440	2777760	Well, Typh has his closet-
2777760	2778320	Shower.
2778320	2784720	Well, Typh in the office has his closet full of suits in case he needs to change for a
2784720	2787360	different occasion or if he works late.
2787360	2792720	So Julius gets the sculptures and puts them in the shed.
2793760	2794260	Yep.
2794960	2796640	Which is the closet there.
2796640	2797040	Yep.
2797040	2798640	He kind of likes the water features.
2798720	2801760	He thinks maybe they're not too bad, so he leaves those.
2802960	2806400	Plus he doesn't know how he's gonna fill it in or something.
2806400	2807440	Yeah, it's too much.
2808160	2812080	Julius, he wants to meet back up with his friends, honestly.
2812080	2812960	He's had a hard day.
2814000	2821200	Julius walks out of the office confident that he's at least gotten rid of the sculptures
2821200	2826080	that some people might think are a little gaudy or ugly, but they're hidden away in
2826080	2826960	the shed.
2826960	2835360	He walks out of the office, goes downstairs, and then once he sees the marble entrance
2835360	2836560	without the marbles-
2836560	2837280	Yeah.
2837280	2838960	He kind of comes back to-
2838960	2840240	You hear a voice from behind you.
2844320	2844820	Julius?
2845680	2846240	Julius?
2846240	2848800	And you turn around and it's the intern.
2850000	2856720	Can I get you a coffee or anything?
2856960	2860480	Can you drive me to the Natcher Hole?
2864960	2866080	Okay, where's your car?
2869360	2871200	Roll Persuade.
2874640	2876240	41 on a 60.
2876240	2878640	He fails deeply and he's just like,
2879440	2883600	Oh, oh, fuck, okay, okay, fuck.
2883600	2891200	All right, and he turns around and you see kind of the office has a mass all kind of
2891200	2893200	in hushed tones speaking to each other.
2893200	2894400	People are on their phones.
2894400	2902320	People are taking pictures and video as Jeremy kind of walks toward you nervously looking
2902320	2903280	back at everyone.
2904800	2907600	Okay, okay, we're going to the Natcher Hole.
2908720	2910640	All right, see you guys.
2910640	2912560	Let's go you.
2914960	2915460	Yeah.
2924480	2925040	Stevie!
2925040	2926000	Stevie!
2926000	2926480	Over here!
2926480	2927280	It's us!
2927280	2927920	It's us!
2927920	2928960	It's Cal Colorado!
2928960	2935200	Cal Colorado and Beck Wilder, the two of you are in Cal's vehicle, which is a-
2935840	2937280	Sweet Mercedes C-Class.
2937280	2941920	And you are sitting at the northeast corner of-
2941920	2943200	The Natcher Hole.
2943200	2944320	Oh, look at that.
2944320	2946880	I pointed at each of them and they were like,
2946880	2950400	Hey, I just took notes on this actually.
2954960	2956320	30 more seconds to silence.
2959360	2962240	I was going to comment that your house is so perfectly still.
2962240	2964800	Like that was a real silent silence.
2964800	2965200	Thank you.
2965920	2972240	I mean, if we heard it shift like the foundation or something, like during the 30 seconds of
2972240	2974480	silence, that would be very unsettling.
2975120	2977360	I don't know why I was just like, Oh, you're probably wrong.
2978080	2980160	Well, that's kind of our thing, right?
2982800	2984240	We're supposed to be at the south gate.
2984240	2986640	Are we parked at the northwest corner?
2987920	2991760	My notes say northeast side of the Natcher Hole.
2991760	2993440	What south gate are you talking about?
2993440	2994880	SG, the Natcher Hole.
2995760	2998560	SG, we think, is for Stevie Gotel.
2998560	3000240	Well, now that we've seen her-
3000240	3002400	I was going to say, it's been a while.
3002400	3004240	Scratch, scratch, scratch all that.
3004240	3006320	Yeah, that's the part where I look dumb.
3007200	3007760	That's fair.
3010080	3010640	I do that for me.
3010640	3013120	To be fair, the Natcher Hole used to be a stadium.
3013120	3016320	So having a south gate isn't the most ridiculous thing.
3016320	3017280	No, it's absolutely not.
