start	end	text
4382480	4383280	That's blood, dude.
4383840	4384880	Are you hurt?
4384880	4388560	Julius looks down at himself and is like, I'm fine.
4388560	4391440	My face hurts a little bit, but I'm good.
4391440	4393920	What do we see if we look at his face specifically?
4393920	4394420	Blood.
4395360	4397440	No, but no like specific face trauma.
4397440	4399120	No wounds or injury.
4399200	4402560	You can't really, you wouldn't really be able to tell through the blood.
4402560	4403120	Yeah.
4403120	4410160	And he seems to be, maybe there's like a hole in his shoulder and he's probably like kind
4410160	4412720	of holding it just a little bit.
4412720	4418640	Julius, just so we're clear here, you think you're just a little wet right now?
4419360	4420400	Yeah, it'll be fun.
4420400	4421040	From water?
4421600	4422400	From the fountain.
4423120	4427360	Well, if you were, wouldn't I be terrified because that's my phobia?
4429120	4441360	That's a wrap on the episode.
4441360	4442160	God damn it.
4442160	4442880	Holy shit.
4444240	4444880	Holy shit.
4444880	4446800	And you said pieces of viscera, like brain?
4447360	4447860	Yeah.
4447920	4448420	Wow.
4450160	4450660	Wow.
4452560	4453680	What's happening now?
4455040	4455840	Holy shit.
4459120	4466880	It's all mine for, cause my life is great.
4468000	4481200	And it's all mine, cause my life is great.
4482080	4492160	For if I do, my mom would say.
4492160	4493200	God damn.
4493200	4495600	See, old women were terrifying in the nineties.
4498800	4500640	That aesthetic was not fucking chill.
4505120	4508400	That was like an Andrew Dice Clay crowd shot.
4511200	4513440	Whoa.
4513440	4514480	He made his mistake.
4514480	4517600	Relatable moment.
4518160	4518640	Hell yeah.
4518640	4521360	Raffi even Raffi makes mistakes.
4522000	4522320	Okay.
4522320	4523600	Can't believe he did it.
4523600	4530400	And we back and we back and we back and we back and we back and we back.
4530400	4537600	Welcome everyone to the 26th episode of season two of pretending to be people.
4541200	4541600	Wow.
4546000	4547360	I'm curious guys.
4547360	4549840	We've, we've been through a lot and it's been a while.
4549840	4553760	And last we left you, we left you on a bit of a cliffhanger, but let's not talk about
4553760	4554560	that.
4554560	4559440	We just did four full episodes as different characters.
4559440	4560560	I don't know if it's the headphones.
4560560	4562080	You sound crazy blown out to me.
4562080	4562580	Yeah.
4563360	4564800	So you might want to check that before we.
4565760	4566880	What the fuck were you talking about?
4566880	4569360	I was trying to think of words that rhymed with all your names.
4570000	4572400	All right, let's run it down.
4572400	4573200	Joe.
4573200	4576000	Have you ever seen Joe blowing his load down by the bay?
4577520	4578720	That's as far as I got.
4578720	4580320	Okay, well let's go to Thomas.
4581440	4582480	That's where I got stuck.
4582480	4582720	Right.
4582720	4585600	So I guess me next probably would be easier.
4585600	4595040	Have you ever seen Zach attack a rack of snacks down by the shack where he's at down
4595040	4598160	by the bay?
4598160	4598560	Mac.
4598560	4603840	Have you ever seen Justin busting down by the bay?
4605280	4606960	It was like Michael unicycle.
4606960	4609200	I was taking inspiration from the man himself.
4609920	4612320	What Michael on a unicycle.
4612320	4612640	Yeah.
4612640	4614800	He just said, have you ever seen Michael?
4614800	4615120	Unicycle.
4615120	4619360	And then he paused and he said, unicycle down by the bay.
4620000	4621280	Well, rhymes with Thomas.
4621280	4621780	Promise.
4623680	4624180	No.
4625520	4626020	Okay.
4626720	4627840	Is that the only thing, Thomas?
4631120	4631840	Dude, I don't know.
4631840	4632880	My last name is a lot more.
4632880	4633600	I mean your whole.
4633600	4634320	Oh, right.
4634320	4636240	That would have been the move.
4636240	4638160	Can't think of anything that rhymes with that either.
4638160	4638660	I saw.
4639360	4644400	I saw Thomas Cox box of Fox eating locks in his socks.
4644400	4645120	Kicking rocks.
4645120	4646080	Kicking rocks.
4646080	4646880	Getting off his rocks.
4646880	4647600	Getting off.
4648720	4648880	Yeah.
4648880	4650080	You can play around with all that.
4650080	4650320	Yeah.
4650320	4651360	Down by the bay.
4652160	4653760	So everyone's jerking off.
4653760	4653920	Yeah.
4653920	4654800	Except for me.
4654800	4656000	I'm attacking a rat.
4657200	4658560	I was watching a box.
4658560	4659520	Oh, is that code?
4659520	4660960	Is that euphemism?
4660960	4661680	No, no, no, no.
4661680	4663360	We were just attacking the rat.
4663360	4664480	You got to do me now.
4665760	4668000	I saw Luke eating puke down by the bay.
4668000	4672080	Have you ever seen Luke eating so much cum that he pukes down by the bay?
4672080	4672560	Oh no.
4673600	4674320	Never eat the beach.
4674320	4675200	Real good energy.
4677200	4678960	Definitely a good take to stick with.
4679680	4681680	Down by the bay.
4682640	4685440	And it's all my fault.
4701360	4707040	In season two, episode 16 of the Pokemon anime, Go West Young Meowth, Meowth reveals that he
4707040	4710960	stumbled across a female Meowth when he was young and fell head over heels for her.
4710960	4716160	She didn't return his affection though because she had a rich trainer and said Meowth and
4716160	4721440	saw Meowth as a street Meowth who couldn't impress her because he wasn't human.
4721440	4724080	So Meowth decided to make himself as human as he could.
4724080	4728640	He learned to walk on two legs by watching people practice at a local dance academy,
4728640	4733760	which also just so happens to offer pronunciation lessons over time.
4733760	4737520	And with a little help from a picture book, he learned to sound out words.
4737520	4742000	Unfortunately, that didn't impress the female Meowth who went so far as to call him a freak.
4742640	4746640	A broken hearted Meowth eventually left to join team Rocket because Rocket
4746640	4749440	was the first word he ever understood the meaning of.
4752240	4757520	According to the logic of this episode then, there isn't anything special about Meowth
4757520	4759040	that makes them able to talk to humans.
4759040	4763200	Theoretically, any Pokemon that is able to speak their own name articulately
4763200	4764880	could learn our language.
4764880	4768800	They just need the proper motivation, a little help, and a lot of determination.
4768800	4771600	That makes us wonder why more Pokemon haven't bothered to learn our language.
4772160	4777040	It took Pikachu almost 20 years to finally speak in Pokemon I Choose You,
4777040	4779440	and that might have just been a hallucination.
4779440	4784560	And he even needed help from Ryan Reynolds and a pretty wild plot twist to speak in
4784560	4786560	the Detective Pikachu movie.
4786560	4790080	Shouldn't Pikachu have been motivated to talk to Ash way before that?
4790160	4792560	Wait, was Pikachu in love with Ash?
4792560	4797680	Because romantic love was the only thing to drive a Pokemon previously to learn English.
4797680	4798480	I don't think he was.
4800320	4804080	But then again, having more Pokemon speak like humans would probably run some of the
4804080	4805280	magic of the franchise.
4806240	4809520	It's part of the series charm that they can only say their names.
4809520	4811440	It also makes Meowth special.
4811440	4815120	Of course, maybe Pikachu doesn't care about Ash as much as Team Rocket's Meowth
4815120	4816560	cared about the other Meowth.
4817120	4820080	Oh, so they were on the same page as me?
4820080	4822000	Yeah, that was written by Seamus Kelly.
4822000	4822880	Thanks Seamus.
4822880	4824080	Wow, what a-
4824880	4830480	Radio Hedge Fund, nice, says it does also make Team Rocket idiots.
4830480	4834240	They want to capture a nondescript Pikachu because he is in some way special,
4834240	4836080	and yet they have a talking Meowth.
4836800	4838400	The only one in the world.
4838400	4842160	This little guy is beyond special, and yet they mistreat him all the time.
4842720	4847760	Chris says, Slowking also spoke in Pokemon 2000.
4847760	4849760	Slowking.
4850800	4855440	Dude, I'm so Slowking stoked for this episode we're about to record.
