start	end	text
2814880	2816800	Should we do anything more with John Peters?
2816800	2819360	I feel like there's a lot more we need to do.
2819360	2820840	Autopsy, for sure.
2820840	2821840	Just get a coroner out there?
2821840	2823360	I mean, send him to the coroner.
2823360	2825240	Yeah, if we take him to the coroner.
2825240	2829000	Load him up in the tow truck.
2829000	2831040	So the coroner isn't counting.
2831040	2834160	Is that where the cruiser repair shop is too?
2834160	2839600	No, you guys, there's a place in town that Drew will have your cruisers towed to.
2839600	2844680	What if we send John Peters to the repair shop and see what they can do?
2844680	2847720	Work your magic, boys.
2847720	2850540	Bit of a special request this time.
2850540	2853480	You did say he was part of the car now.
2853480	2857280	Man, they're going to overcharge you for those.
2857280	2858540	Oh, that's true.
2858540	2859540	We are going to have to like, yeah.
2859540	2860540	Yeah, put it on our tab.
2860540	2862560	He's going to need some extraction.
2862560	2864560	It's a lot of body work.
2864560	2865560	Hey!
2865560	2866560	Hell yeah.
2866560	2873880	Podcast over.
2873880	2882880	This has been pretending to be people with Zach Thomas, Luke, and our star, Joe Terry.
2882880	2885000	Thank you.
2885000	2886920	Thank you.
2886920	2888060	Okay.
2888060	2890060	And then let's have the cruisers towed.
2890060	2892640	We can ride with the tow truck back to...
2892640	2895000	Or we could have Drew drive the cruiser to us.
2895400	2897200	And then he could ride with the tow truck back.
2897200	2898200	That's true.
2898200	2899960	Also, the tow tump...
2899960	2903600	The tow truck company is called Towed Truck and they just have a towed logo.
2903600	2904600	Oh, of course.
2904600	2905600	Love it.
2905600	2906600	I like it.
2906600	2907800	And the frog has huge toes.
2907800	2910200	Yeah, that's why it's a toad.
2910200	2914120	Anyway, so yeah, he brings the cruiser up here.
2914120	2916680	We all hop in my cruiser.
2916680	2921160	And then, well, I would say we would go to the mill, but do you want to push us in a
2921160	2923880	certain direction?
2923880	2929240	Ouch, and yes.
2929240	2934720	So Drew comes rolling up in Keith Vigna's police cruiser.
2934720	2941480	He gets out and he looks at all three of you suspiciously and he says...
2941480	2943480	It's pronounced specifically.
2943480	2946480	One, two, three.
2946480	2948480	Bubble gum tree.
2948480	2949480	Bubble gum tree.
2949480	2950480	Bubble gum tree.
2950960	2951960	Let's try that one more time.
2951960	2953160	I forgot what it actually was.
2953160	2954160	Bubble gum tree.
2954160	2957000	Okay, I think we're good.
2957000	2958000	What happened here?
2958000	2959120	I mean, you don't have to tell me now.
2959120	2963480	I'll see the paperwork later when I fill it out, but that, I mean, this looks crazy.
2963480	2968760	Well, John Peters fell out of the sky causing me to lose control of my patrol vehicle, which
2968760	2971620	careened across the highway into oncoming traffic.
2971620	2975800	And because of that, two civilians are dead and another is seriously injured and Keith's
2975800	2978760	penis fell off and he broke his nose.
2978760	2981120	For the record, my penis is still attached.
2981120	2982600	Oh, they got that back on.
2982600	2983600	I don't know.
2983600	2984600	That was a weird joke to make.
2984600	2986320	It kind of makes me mad since...
2986320	2987640	You were screaming and my penis fell off.
2987640	2988640	I don't know.
2988640	2991640	I probably have a concussion.
2991640	2992640	I don't know.
2992640	2993640	That might make sense.
2993640	2995800	Keith, is your penis okay?
2995800	2999080	I unbuckle my big britches.
2999080	3005120	I unbuckle my big britches, open them up about a foot past my stomach and I look at it and
3005120	3006760	I'm like, yep, it's on there.
3006760	3007760	Okay, thank goodness.
3007760	3014840	Okay, so guys, I hate to do this, but I just got a call from the estate salesman and he's
3014840	3023840	at James's house and he found some unsettling writing in blood and many guns after accidentally
3023840	3027520	triggering some sort of secret door-like trap.
3027520	3032560	So he's wondering if he can sell the guns in the estate sale.
3032560	3038040	I told him probably not, but that you guys would go over and check it out because it
3038040	3042560	seems like it might be a crime scene, what with the weird blood writing and such.
3042560	3044160	Who was James?
3044160	3045160	He was the waiter guy.
3045160	3046160	He said see you later guy.
3046160	3047160	That's what I thought.
3047160	3048160	Yeah.
3048160	3050800	He wasn't good enough for us.
3050800	3057560	Also, he had his foot missing in the explosion radio and he was also the guy with the vacuum.
3057560	3060540	Wait, was James the one over the table?
3060540	3063900	He was the one hunched over the table, foot missing.
3063900	3066140	Also the guy with the vacuum in the neighborhood.
3066140	3067540	And was he eating a plate of foot?
3067540	3072660	He had a plate of foot in front of him, but we don't know if he was eating it.
3072660	3073660	Oh yeah.
3073660	3076180	Have we ever had the coroners looked at if those feet matched?
3076180	3077700	Well, they blew up.
3077700	3078700	Remember?
3078700	3079700	Oh, man.
3079700	3080700	Okay.
3080700	3081700	Again, Joe fucking up.
3081700	3084980	But back at that house, you walked in and it was Maggie?
3084980	3089300	Maggie was dead, stabbed in the face to death with a foot missing.
3089340	3096340	James slumped at the table with the foot meat or whatever, shot in the head, his foot missing.
3096340	3097340	Holding a gun.
3097340	3098340	Holding a gun.
3098340	3099340	And a fork.
3099340	3105980	Drew passed out and the Harold Dorsey of what'sbehinddorsey.tumblr.com.
3105980	3108160	By the way guys, I know who did it.
3108160	3109160	Don't tell us.
3109160	3110160	We got to figure it out.
3110160	3111160	Don't tell us.
3111160	3114380	A guy with a scar over his eye and a gun.
3114380	3117960	An overweight guy wearing all black with a scar over his eye.
3117960	3119520	And we have not seen that guy since.
3119520	3120520	No.
3120520	3121520	Correct.
3121520	3122520	Okay.
3122520	3123520	That's what I was trying to remember.
3123520	3124520	Okay.
3124520	3128480	After Drew says all that, he kind of looks at John Lee Pettymore.
3128480	3130920	Hey, can we talk for a minute right now?
3130920	3132280	Yeah, it'd probably be best.
3132280	3133280	Okay, sure.
3133280	3134280	Yeah.
3134280	3135280	What's up, buddy?
3135280	3139040	And so he kind of pulls you over to the side of the road, maybe off the ditch in the side
3139040	3140040	of the road.
3140040	3141040	Do you guys want to head out?
3147960	3148960	Hey, John.
3148960	3149960	Yeah, buddy.
3149960	3150960	What's up?
3150960	3151960	Hey.
3151960	3153680	So, um, I got a message from the Duke.
3153680	3154680	Oh yeah.
3154680	3155920	What is, what's it say?
3155920	3157640	The deal is going down tonight.
3157640	3158920	Well, what time?
3158920	3160400	Uh, 2am.
3160400	3164560	Whatever, whoever sent it to me said the location will be sent later tonight.
3164560	3165560	All right.
3165560	3169840	I just wanted to give you a heads up, obviously, and not really text about it like we talked
3169840	3170840	about before.
3170840	3175520	Man, you've got great, I had to say this, consider it a lot of work, but great.
3175520	3176520	Criminal instincts.
3176520	3177520	Thank you.
3178080	3179080	I have to think I learned quickly.
3179080	3183280	You know, also, around here, this is just more general rascalism than actually criminal.
3183280	3184280	Oh.
3184280	3185280	That's the way the Pettimores look at it.
3185280	3186280	Absolutely.
3186280	3189400	No, I mean, if we didn't sell these drugs, someone else would.
3189400	3191480	All right, I need, I want you to try something.
3191480	3192480	Okay.
3192480	3195880	And if you can pull this off, I'll give you 5% of my share.
3195880	3196880	Okay.
3196880	3197880	All right.
3197880	3200880	I want you to try to negotiate with the Duke and say, hey man, we're the ones with the
3200880	3202280	drugs.
3202280	3206880	We picked the location and I wanted to come out to my farm where we got the drugs buried.
3207240	3208240	Okay.
3208240	3209240	Sounds good.
3209240	3210240	You're a good man.
3210240	3211240	That's perfect.
3211240	3213240	What should we say we were talking about?
3213240	3214240	Um.
3214240	3215240	I'll wing it.
3215240	3216240	I'll figure it out.
3216240	3217240	Okay.
3217240	3218240	Sounds good.
3223240	3229360	Keith and Clark, what are you guys talking about when John and Drew go walk off into
3229360	3230360	the ditch?
3230360	3231360	Hey, dude.
3231360	3234040	I know, like, I'm really sore.
3234040	3239640	I remember not losing consciousness in the car and my nose definitely wasn't broken.
3239640	3241200	Like how, how did that happen?
3241200	3245400	Oh, I mean, we, we slammed into the back of John's pretty fucking hard.
3245400	3249080	I remember that, but I remember crawling out of the window with my nose intact.
3249080	3250080	I don't remember that.
3250080	3251080	My man.
3251080	3252080	Can I do a human on?
3252080	3256160	Well, hey, Clark didn't actually see this, but I like that you think this is going to
3256160	3259440	somehow possibly make up at all.
3259520	3263280	Like meet me on the same level as trashing my house.
3263280	3265520	That's really exactly what I'm going for.
3265520	3266520	Yeah.
3266520	3267520	Not going to work.
3267520	3269520	He's probably going to break it again.
3269520	3275840	No, uh, Keith, I heard you smash out the window, but I was, I was occupied trying to get myself
3275840	3277320	out of my side.
3277320	3278800	I don't, I don't know what happened.
3278800	3279800	Hey.
3279800	3282000	Well also they told me that you saved that kid.
3282000	3283000	So good on you for that.
3283000	3284000	That was good.
3284000	3287920	I just, I just jumped, you know, I mean, it's a shame you couldn't save the other people,
3287920	3289360	but I don't think that's on you.
3289360	3292960	And I put my arm around Clark and I comfort him just a little bit.
3292960	3295600	I think I'll be hearing those screams for a while though.
3295600	3302700	I'm glad I was unconscious for it because that would fuck me up.
3302700	3307720	As you guys are finishing up this conversation, Drew and John walk back toward you.
3307720	3313200	So as, as I walk up, I like slap a big hand on Keith's back and I'm like, Hey man, really
3313200	3314480	sorry about the nose.
3314480	3319040	I was rushing over, trying to give you some existence and I, uh, I tripped on your big
3319040	3322040	pants and kind of need you right in the face there.
3322040	3325200	I'm really sorry about that, buddy, but you know, I, I didn't mean anything by it.
3325200	3327760	You know, just the, the, it's the thought that counts.
3327760	3332640	So I, you know, I appreciate you trying to help me cause I know I can't do anything to
3332640	3333640	hurt me.
3333640	3334640	Yeah.
3334640	3339040	I know that I was about to say like, you know, I'm a, I don't know if I would have done the
3339040	3340080	same thing for you.
3340080	3342840	Not out of spite, but out of pure fear.
3342840	3345080	I mean, yeah, I would have definitely helped you too.
3345080	3346080	Sorry.
3346080	3347080	Forget.
3347080	3348080	I said anything.
3348080	3349080	Thank you for breaking my nose.
3349080	3351640	Uh, John isn't like thinking about your faux pas.
3351640	3354600	He's just like, did Keith call me brave?
3354600	3355760	Yeah.
3355760	3362240	As you guys are having this conversation, Drew says, Oh my, Oh my God, what is that?
3362240	3369400	And you guys see an extremely wet black cat running toward you from the water.
3370400	3379080	And the extremely wet black cat jumps up onto your leg, John, and it's like,
3379080	3382560	I bring him up to my face and I say, hold on, Doug, we're going to get you the help
3382560	3383560	you need.
3383560	3384560	Perfect.
3384560	3385560	Perfect.
3385560	3386560	Hell yes.
3386560	3387560	Whooped it is.
3387720	3388720	Hell yes.
3388720	3389720	Whooped it is.
3417560	3418560	Hell yes.
