start	end	text
0	6880	Hello all my nephews and nieces, it is your fun uncle, Wolf the Dog, and I'm here to
6880	14120	weird y'all out from 694.2 PTBP Contention's Greatest Radio Show.
14120	20800	This episode is brought to you by Fire Lizard Games, a tabletop games company based in Springfield
20800	23480	run by just three brothers.
23480	31200	They currently have a Kickstarter launched in their first game, Base, a card PG.
31200	38680	Base is a setting agnostic storytelling game using a simple, uniquely designed system.
38680	44120	They designed the game to be appealing for everyone, whether you are a newcomer to roleplaying
44120	47520	games or a stone cold pro.
47520	52680	All you need to play the game is the rulebook, a standard deck of cards, and a few six-sided
52680	53680	dice.
53680	59560	The Kickstarter tiers start as low as $3 and it will end on April 16th, my babies.
59560	65840	Give them a follow on Facebook for your buddy Wolf, or Instagram, or Twitter, or how about
65840	70200	all three, at Fire Lizard Games for more updates.
70200	76040	And now let's get back to my favorite segment, Howlin' with Wolf, where we get to hear from
76040	80720	our caring, adoring, and intelligent listeners.
80760	86280	This week's Howlin' with Wolf comes from Hot Donna on Twitter, who writes,
86280	90880	After careful consideration, my request is as follows.
90880	96200	Instead of making an actual announcement, I would love for Wolf to make one incredibly
96200	99880	long and possibly melodic fart noise.
99880	105040	Ahem, I guess it might go something like,
115320	122160	Well, Hot Donna, I hope that made you happy inside, cuz, uh, yeah.
122160	127760	Anyway, it's time to remember what happened last time, it's the news.
127760	133640	Turns out, maybe Keith is a monster to be around because his dad was a dick who clearly
133640	137000	preferred his older son, Ferguson.
137000	142280	Now that's not an excuse, Officer Vigna is the worst person in contention.
142280	147560	While playing on the family's sprawling estate, Keith and Ferguson heard the sirens blaring
147560	152880	as strange, gaunt men in suits appeared to fall from the sky and were shot down by the
152880	155360	Bean's security personnel.
155360	160520	Later that night, William Beans gave Ferguson a watch and told him about a prophecy that
160520	162800	says he will save the world.
162800	168400	Back in whatever year it is now, the officers took the pastor's helmet to the police station
168400	173360	and locked it up with the other items from the booth at Forgotten Treasures.
173360	179000	The light on the camera was green, so John took a picture of Keith outside the station.
179000	184480	Unsurprisingly, the picture was not of Keith, but of two men in a strange room that lacked
184480	185720	color.
185720	190560	On the way to the mill, on the other side of the city, John saw something strange in
190560	197480	the sky, causing a fiery three car wreck on the main longitudinal drag of contention.
197480	203040	Taking us to that scene now, is Kudzu with no backbone.
227480	236840	I need everyone to roll power.
236840	240720	I fail.
240720	244840	I'm the most powerful motherfucker.
244840	248600	I fail, 96 on a 60.
248600	251440	I got an 86 on a 50.
251440	252440	Okay.
252440	256000	You have all been in a car wreck.
256000	262880	You have the choice to either stay put in the exact position that you're in or to move.
262880	268460	Now real quick, I'm going to have you all roll a D6 for hit points to see how many you
268460	270320	lost from the wreck.
270320	271320	Four.
271320	272320	One.
272320	273320	Two.
273320	277240	That puts me at 24.
277240	280240	I'm at 14.
280240	281880	Luke said he was at 19.
281880	283080	I'm at 19.
283080	284080	My name is Keith.
284080	285080	Oh yeah.
285080	286080	Oh no.
286080	287080	Oh no.
287080	288080	Keith.
288080	289080	Oh no.
289080	290080	Luke, it's you.
290080	291080	I'm at 19.
291080	296320	Guys, I was in a car wreck tonight, I don't know if I can finish the episode.
296320	303560	You all hear this vehicle that is flown off the side of the road on fire.
303560	305880	Do you move or do you stay put?
305880	306880	I move.
306880	307880	I move.
307880	309880	Is my car still operational?
309880	310880	Is it on?
310880	311880	No.
311880	312880	I move.
312880	313880	Okay.
313880	315680	I got their power check.
315680	316680	Just John.
316680	321960	John, you lose one willpower and I need the other two to roll a D4 for me.
321960	322960	One.
322960	323960	Three.
323960	326040	That was willpower?
326040	327040	It was indeed.
327040	331320	Well, Clark Bishop is at seven willpower, John Lee Pettymore is at 11 willpower.
331320	332320	I'm at one.
332320	335560	However, yes, Keith Vigna is at one willpower.
335560	337880	I thought you did all the coke to gain willpower.
337880	342560	I did the coke to not have a minus 20 to my rolls.
342560	349280	When you get down to one or two willpower, you're at a negative 20% on all rolls.
349280	354840	Now, Keith Vigna, having lost willpower at this point, you were back at a negative 20%
354840	356600	on all rolls.
356600	360600	And so your high of your cane-
360600	362220	It was so harsh, dude.
362220	364360	It was harsh as fuck.
364360	365680	You no longer have the-
365680	366680	I do more.
366680	367680	Advantages.
367920	372960	So you guys are all in the car wreck and John passed his power roll and so he's spending
372960	374720	one willpower to move.
374720	380480	Keith and Clark both failed their power rolls and so they had to roll a D4 in order to find
380480	383560	out how much willpower they were going to lose in order to move.
383560	386140	Keith is losing one willpower point to move.
386140	389740	Clark failed and is spending three willpower points to move.
389740	396400	Clark is driving one cruiser with Keith sitting shotgun and John is driving the cruiser ahead
396440	399240	that got rear ended by Clark's cruiser.
399240	403960	Now, John, I need you to roll luck for me.
403960	405600	John's luck is 55.
405600	406600	Yes.
406600	407600	98.
407600	409160	And he fails.
409160	416760	So I need you to roll a dexterity check to try to get out of your seat, which your seat
416760	420880	belt is completely jammed and you're stuck in your seat currently.
420880	421960	11.
421960	423040	Critical success.
423040	427320	You want to describe how you get out of this car in a very cool way?
427320	428320	Yeah.
428320	430300	We describe how I'm stuck again real quick.
430300	436520	You got crunched from the back and so your seat literally moved forward and your knees
436520	442400	went into the console of your cruiser, breaking through the plastic on either side of the
442400	447280	steering wheel and so your knees are like cut up and bleeding from the plastic and you
447280	452760	hit your head on the steering wheel and so you're kind of dazed and your seat has moved
452760	456120	forward in a way to where your seat belt has jammed you into position.
456120	458240	Oh, I don't know how I'm going to get out of that.
458240	459400	That sounds really bad.
459400	463920	You can do anything to get out of this because you rolled a critical success.
463920	466200	He chews his way out.
466200	467600	Like a rat in a...
467600	473280	Yeah, I think he just takes his flashlight and just bangs it against the seat belt a
473280	475360	few times and gets lucky.
475360	481520	Yeah, wiggles out the window basically while doing a somersault because it's a crit success.
481560	486400	Oh, can I trade in for doing something really cool for my crit success with noticing a little
486400	490700	bit more about the situation as I get out because what I'm really interested in is what's
490700	495160	happened to what was hit, who was hit, and what's all going on.
495160	496160	Absolutely.
496160	503460	So as you make it out of your police cruiser, you would notice not only has your police
503460	509900	cruiser caught fire, but you look over and you actually see the other vehicle that you
509900	513140	ran off the road by swerving into their lane.
513140	514540	It's a minivan.
514540	520300	It is flipped over and it is currently leaking fluid all over the ground.
520300	523300	Keith, I need you to roll luck.
523300	527100	A 70 and a 65.
527100	529060	You are pinched.
529060	534540	Your cruiser with Clark driving smashed into the back of John's cruiser.
534540	536100	Your airbag went off.
536100	538380	It knocked you back and...
538380	541220	My penis fell off.
541220	542220	I used my penis to unlock...
542220	543220	Grab it.
543220	544220	Grab it with the door.
544220	545220	I grab his penis.
545220	546220	Thanks, Clark.
546220	553580	Your side of the car got completely smashed in and so your door is unable to open.
553580	558300	So you're going to have to smash through the window to get out of this vehicle.
558300	560340	So I need you to roll strength for me.
560340	562780	10 on a 55.
562780	563780	All right.
563780	564780	So...
564780	565780	I...
565780	567660	Give me a second to think about it.
567660	573700	Oh, I take my handy dandy handgun and use the butt of it to just...
573700	576900	And I am very careful not to cut myself.
576900	579340	Fire some warning shots outside for you.
579340	586620	No, I like to conserve my ammunition for people that threaten me or people I want to threaten.
586620	587940	So yeah, I do that.
587940	589980	And then do I have a move or...
589980	597220	So you can use your turn to get out of the vehicle and as you do get out of the vehicle,
597220	602620	you would notice that this cruiser that you were in, Clark's cruiser, is also leaking
602620	605540	fluid all over the ground underneath the vehicle.
605540	608020	Clark, I need you to roll luck for me.
608020	610460	53 on a 75.
610460	611460	Okay.
611460	616460	I mean, you already spent your three willpower to make a move action this round.
616460	622220	So you can use that to get out of the car or do anything else that you want to do.
622220	623780	No, I just want to get out of the car.
623780	624780	Okay, awesome.
624820	628860	You get out of the car, you would notice as well that there is liquid underneath your
628860	633180	car and you would also see John's cruiser is catching fire.
633180	640460	You all look over and see this minivan that has swerved off the road is completely upside
640460	645780	down and dark liquid coming out all over the place.
645780	646780	Round two.
646780	649140	I need everyone to roll power in order to move.
649140	650140	Fuck.
650140	652620	No, 68 on a 60.
652620	655100	I pass with a 45 on a 60.
655100	656100	Crit failed.
656100	657820	Your other penis falls off.
657820	660180	Clark, we'll start with you this time.
660180	661180	You succeeded.
661180	662180	Mm-hmm.
662180	664260	So you're only going to lose one willpower right now?
664260	667340	Am I going to lose willpower because I have one willpower?
667340	669700	Does that mean I die?
669700	672980	Going to zero willpower doesn't mean that you die, but I will describe what happens
672980	675980	to you in just a second.
675980	681260	What's my distance from the front of John's car and what's my distance from the van?
681260	684420	You are one move action away from either.
684420	686220	Shit.
686220	690180	But is one closer?
690180	691180	They are equidistant.
691180	692180	Okay.
692180	693180	I'm going to go to the van.
693180	694180	Okay.
694180	695180	Sounds good.
695180	697020	You run up to the van.
697020	700300	Roll an alertness check for me.
700300	701300	Fuck.
701300	704300	A 90 on a 70.
704300	705300	Okay.
705300	708780	So you see two people in the front seats.
708780	714100	There's a woman driving and a young boy in the front seat.
714100	715100	Okay.
715100	717180	John, you failed your power check.
717180	718180	Yeah.
718180	720020	So I need you to roll a D4 for me.
720020	721020	What?
721020	722020	Okay.
722020	724860	So you lose one willpower in order to move this round.
724860	725860	I'm down to 10.
725860	726860	Yeah.
726860	728600	Just for the record, I'm down to six.
728600	733900	I would like to grab the fire extinguisher from my cruiser and attempt to put out the
733900	735740	fire on my engine.
735740	737900	Does it look extinguishable at this juncture?
738020	739020	Yes, absolutely.
739020	741740	So go ahead and roll law for me.
741740	744140	I got a 50-50 shot.
744140	745140	13.
745140	746780	Describe what you do.
746780	752300	Calmly and efficiently, like seeing Clark taking care of the civilians, I demonstrate
752300	755940	an excellent knowledge of law and procedure.
755940	757400	Go right to the compartment.
757400	763720	My extinguisher is locked in and calmly, but professionally and with the quickness, I put
763720	764720	the fire out.
764720	765720	Wonderful.
765720	770640	After you do that, you see Clark's cruiser begins to go up in flames.
770640	774320	The engine is smoking and you see flames licking out from underneath the hood.
774320	777400	I'm just going to Benny Hill style run between both cars.
777400	780200	So you've taken care of your cruiser.
780200	784840	Keith Vigna, you failed your power check in order to move.
784840	790120	I need you to roll a D4 for me, although it doesn't really matter.
790120	791120	One.
791120	792640	That means I'm at zero.
792640	794840	Keith has hit zero willpower.
794960	802240	Keith hops out of the side door of Clark's police cruiser and desperately looks around,
802240	808520	smelling the gas, seeing the oil, seeing the flames, seeing this minivan.
808520	812160	Your head begins spinning and you black out.
812160	818980	The two of you look over and see Officer Vigna, just eyes go blank and he falls backward onto
818980	824000	the ground right next to Clark's cruiser.
824000	825000	And three.
825000	826000	Fight!
826000	830720	I need John and Clark to roll power for me.
830720	833040	Oh, God damn it.
833040	835040	Sixty two on a sixty.
835040	836040	Thirty two on a sixty.
836040	837040	Okay.
837040	841480	Clark, you're going to lose one willpower and John, go ahead and roll a D4 for me.
841480	842480	Four.
842480	844720	John loses four willpower and Clark loses one.
844720	845720	I'm now at five.
845720	846720	I'm at six.
846720	847720	All right.
847720	851440	Clark, I need you to roll a luck check for me real quick.
851440	853080	Ah, fuck.
853080	855720	Uh, ninety on a seventy five.
855720	856720	Awesome.
856720	857720	Fuck you.
857720	863760	That will come into play in just a second.
863760	865600	So John, what do you want to do this round?
865600	870240	I get, yeah, I want to try to extinguish the fire in on the other cruiser.
870240	873720	Is there enough juice left in the container or do I need to get theirs?
873720	876640	Why would you ask that?
876640	888640	I'll go ahead and let you, uh, by the way, this is a super important role and I'm going
888640	895360	to let you finish out the rest of this canister on their car, but I need you to roll law in
895360	897720	order to put it out.
897720	899360	Okay.
899360	902000	Forty.
902000	903520	Fuck you.
903520	904520	Well done.
904520	905520	Thank you.
905520	906520	Nice.
907400	912120	Once again, like fucking calmly as shit, John Lee Pettymore, who has lost a lot of willpower
912120	915680	and HP, like bleeding all over the extinguisher.
915680	921000	I just nailed that shit and save this family, the passed out Clark's, like all the converging
921000	923480	fluids you've been sending at us.
923480	925840	So you have had all the fluid that didn't combust.
925840	933840	So you have successfully, you have successfully stopped the combustion of the fluids of your
933840	937040	police cruiser as well as Clark's police cruiser.
937040	944760	Clark, you, you are crouched down at this minivan and the flames are growing taller
944760	954080	and taller coming out of the bottom of the front of this minivan and the smell is overwhelming.
954080	955640	What would you like to do with your turn?
955640	958040	Are either of the occupants conscious?
958040	960840	Roll first aid.
961840	965560	Oh, crit fail 77 on a 30.
965560	966560	They died on impact.
966560	974600	As far as you can tell, these aren't people at all, they're bears.
974600	979400	You would have absolutely no idea, but they might be beyond saving at this point.
979400	981920	They look pretty dead.
981920	984840	Save them anyway.
984840	988920	I assume I'm on the, actually I don't assume, what, what side am I on when I, when I walked
988920	989920	up to it?
990000	991000	What side do you want to be on?
991000	993160	I guess I would prefer to be on the passenger side.
993160	994320	You are on the passenger side.
994320	995320	I break it.
995320	996320	I break in the window.
996320	997520	Go ahead and roll.
997520	1000720	You can roll strength or law.
1000720	1002720	I'm rolling strength.
1002720	1006080	Uh, four on a 65.
1006080	1007080	Okay.
1007080	1013440	Good old smash it, uh, smash in the window and it's a kid you mentioned.
1013440	1014440	Yes.
1014440	1015440	It's a young boy.
1015440	1019520	I try to get up under kind of underneath him and hit his seatbelt and kind of catch him
1019520	1022320	as he falls and then pull, drag him out.
1022320	1027160	And as far away from the cars, I feel as a safe distance, but not too far away because
1027160	1029520	I'd like to try and go back for the driver.
1029520	1030520	Absolutely.
1030520	1038360	And as you pull him away from the car, the minivan explodes and I wouldn't say mushroom
1038360	1046160	cloud, but there is one of those wily coyote, like small ones, tiny wily coyote mushroom
1046160	1050120	cloud erupts from this minivan.
1050120	1052520	And the entire thing, I mean, this is loud.
1052520	1062900	The entire thing is up in flames and you guys just hear all this and you also hear the screaming
1062900	1064640	of a young girl.
1064640	1074640	I need the two of you who are still conscious to roll sanity, uh, 16, uh, 56 on a 37 fail.
1074640	1075640	Okay.
1076120	1086200	You are hearing the sounds of rubber popping and plastic melting and your stimuli are completely
1086200	1090160	overwhelmed and you don't, it just sounds like ringing in the ears to me.
1090160	1091160	Exactly.
1091160	1101680	And Clark, you absolutely know that there's someone screaming for help inside this burning
1101680	1102680	vehicle.
1102680	1105240	I need you to lose one sanity.
1105240	1109080	That puts me at 36 with a breaking point of 31.
1109080	1113680	Oh, you've got to drink when you're a sanity hits your age.
1113680	1114680	Is that how old you are?
1114680	1115680	I missed it.
1115680	1116680	No.
1116680	1119680	Oh, you got to drink twice.
1119680	1120680	Okay.
1120680	1124840	I keep forgetting you're younger than I am in the game.
1124840	1132280	You old motherfuckers is like eight months older than you or something.
1132280	1134120	I know it's like a year and a half, right?
1134120	1135400	You're 26, right?
1135400	1136400	Yeah.
1136400	1137400	Luke is 17.
1137400	1141680	I'm almost 17.
1141680	1143080	New character voice.
1143080	1145800	I'm almost 17.
1145800	1149920	That's what Keith speaks like after the explosion.
1149920	1156600	I hit my head really hard when I passed out.
1156600	1162300	This is how Keith finds his character voice.
1162300	1163300	It's perfect.
1163300	1166660	Just a shitty Russell Brand.
1166660	1175900	I talk like, oh, from London, you talk like you're from London, from London, London, London.
1175900	1180820	I'm almost 17, I'm almost 17.
1180820	1182380	Sounds awful.
1182380	1185300	John, what do you do?
1185300	1187180	Can I do an awareness roll?
1187180	1189920	Well, I don't know how realistic that is.
1189920	1191860	Have I noticed Vigna lying there?
1191860	1192860	Yeah.
1192860	1194900	I just go over to him and try to resuscitate.
1194900	1195900	Okay.
1195900	1196900	Sounds good.
1196900	1199100	Go ahead and roll first aid for me.
1199100	1200100	Oh, wow.
1200100	1201100	This could go, yeah.
1201100	1202420	I don't have that.
1202420	1203740	What is your first aid?
1203740	1205140	The basic 10%.
1205140	1206140	Cool.
1206140	1207140	Good luck.
1207140	1210460	Which is exactly how confident I think I would feel as a real person in an emergency
1210460	1211460	situation.
1211460	1215740	There's like, okay, if I can wrap my shirt around it, then I've seen that in a movie.
1215740	1216740	Otherwise 33, crit fail.
1216740	1217740	Yeah.
1217740	1218740	I thought it was crit success.
1218740	1224140	You try to CPR me and you give me a heart attack.
1224140	1225140	Break your collarbone.
1225140	1228500	Also, what is the extent of, I'm not like cut up or anything.
1228500	1229500	I'm just-
1229500	1230500	No, you're just like unconscious, right?
1230500	1231820	Just passed out and probably hit my head.
1231820	1233820	You're probably bleeding from your face a little bit.
1233820	1236860	I'm trying to slap your face and maybe I like accidentally-
1236860	1237860	A little too hard.
1237860	1238860	Yeah.
1238860	1239860	Poke you really hard in the eye.
1239860	1240860	Yeah.
1240860	1242860	He lost the eye on the rack.
1242860	1243860	It was weird.
1243860	1250980	Jon, you run over to Keith to try to resuscitate him and as you're running over, you actually
1250980	1259460	trip and fall and your knee comes down right on Keith Vigna's nose.
1259460	1263440	Does it fall off like his penis?
1263440	1270540	You hear a crunch as your knee goes down onto his face, but you immediately catch yourself
1270540	1277620	and get up, but he is bleeding just way more profusely than he was before.
1277620	1280020	And Keith, I need you to roll, actually, you know what?
1280020	1281020	You did the damage.
1281020	1282620	Jon, go ahead and roll a-
1282620	1283620	Oh, no.
1283620	1284620	D4.
1284620	1285620	I'll really try not to.
1285620	1286620	One.
1286620	1287620	Ah.
1287620	1290620	Keith, you take one hit point of damage.
1290620	1296380	I only broke in as a little, just a little.
1296380	1298460	I am down to 18 hit points.
1298460	1299460	Clucks.
1299460	1300460	Your turn, what do you do?
1300460	1301780	I've got the kid over by the side.
1301780	1303980	Can I discern better if he's conscious or not?
1303980	1305400	Is he lucid at least?
1305400	1306980	Is he lucid or not lucid, I guess?
1306980	1308820	He is still very unconscious.
1308820	1309820	Okay.
1309820	1311780	Check for a pulse.
1311780	1313580	How engulfed is the van?
1313580	1314580	Holy.
1314580	1319540	I want to, yeah, I want to run over to the driver's side and just see if I can get close
1319540	1323140	enough to kick the window in.
1323140	1324140	Crit failure.
1324140	1327260	Kick her in the face while she's talking.
1327260	1330060	Okay, cool.
1330060	1333380	So I don't know, I don't know how to, you know, what do you guys-
1333380	1336820	Have you seen the movie Crash?
1336820	1339460	If it's, if it's, it won an Oscar, so.
1339460	1341080	So yeah, it's possible.
1341080	1343700	This episode will probably win the podcast if it won one of the Oscars.
1343700	1345700	I've seen all the best movies.
1345700	1349580	The worst episode of our podcast will win a, what does a podcast win?
1349580	1350580	A potty.
1350580	1351580	No, they have a name.
1351580	1352580	Anywho.
1352580	1353580	Blowy.
1353580	1354580	A blowy.
1354580	1357140	If you're saying it's so hot that no human could get close enough to do this, then just
1357140	1359700	say that I won't, I won't roll for it or anything.
1359700	1362420	You are more than welcome to do anything that you want.
1362420	1366060	But I just mean, I'm not, I'm not, I'm not physically there.
1366060	1370820	So if you picture it being so hot that it would deter me, I need to know that.
1370820	1373980	It will cause you damage if you go in there.
1373980	1374980	Okay.
1374980	1375980	I'm not going to do it.
1375980	1376980	I'm going to run back to the boy.
1376980	1377980	Okay.
1377980	1381300	And as a, as I'm running back to the boy, I'm going to go ahead and radio in to Drew
1381300	1383020	unless I have a direct line to paramedics.
1383020	1385300	Oh, you absolutely do.
1385300	1386940	We need emergency services up here.
1386940	1388140	We've got some hurt people.
1388140	1390260	We're just up the road from the clinic.
1390260	1391260	Send ambulances.
1391260	1392260	The clinic.
1392260	1393900	And then I want to try and first aid the kid.
1393900	1394900	Okay.
1394900	1396900	Go ahead and roll first aid for me.
1396900	1397900	Fuck.
1397900	1401540	A 72 on a 30.
1401540	1406500	He is still very unconscious and his breathing begins to slow.
1406500	1410740	I'm going to have you go ahead and roll luck for me.
1410740	1411740	Fail.
1411740	1414020	93 on a 75.
1414020	1416100	You chip over him and break his nose.
1416100	1417100	Also.
1417100	1418100	Yeah.
1418100	1421260	That's all of my fails from here on out.
1421260	1426940	You tripping fall on someone and it hurts him real bad fucking idiot fail on hacking
1426940	1429100	that computer.
1429100	1433620	You trip over it and break your nose.
1433620	1437340	A broken nose is my favorite thing to do in a role playing game.
1437340	1440620	Just in case you can get people to talk like this.
1440620	1442260	Is that how you're going to give him this character?
1442260	1449140	I was hoping that Luke might have the new broken nose character voice.
1449140	1453180	It's funny because when we started, he thought about holding his gun to do this the whole
1453180	1457460	time and I'm so glad I did not do that.
