start	end	text
1457460	1458460	Okay.
1458460	1462860	So after that very funny exchange, you see this boy begin to die.
1462860	1468140	As the ambulances arrive on the scene, two paramedics hop out immediately.
1468140	1471340	One of them comes over, comes up to you, Clark, cause you have the boy.
1471740	1473660	Hey man, what happened here?
1473660	1475660	I don't, I don't, I don't know.
1475660	1480140	It's all I'm a, it was an accident.
1480140	1482620	They went off the road.
1482620	1484020	I don't, I don't think he's doing so good.
1484020	1485020	Okay.
1485020	1489380	So they are loading him up on the stretcher as you're, as you're telling them this and
1489380	1491000	they get the boy into the ambulance.
1491000	1497220	The fire truck arrives and firemen hop out and begin putting out the flames on this minivan.
1497220	1498220	What are you guys doing?
1498260	1504700	Well, I want to send one of a paramedic after Keith and then I want to go investigate the
1504700	1506580	body on the hood of my car.
1506580	1509780	I want to talk to a fireman or more like yell.
1509780	1511900	There was, there was somebody in the driver's seat.
1511900	1512900	They were screaming there.
1512900	1517620	I don't think they're, I think they're, I think they're dead, but if we can get in there.
1517620	1519100	Calm down officer.
1519100	1520100	We're on it.
1520100	1521100	Oh God.
1521100	1523340	You guys remember 9-11 fucking firemen?
1523340	1528140	Sorry if my voice is really weird, but I'm really hoarse from a three day bachelor party.
1528180	1531180	I'm really horny from a three day bachelor party.
1531180	1534060	I'm a horse from a three day bachelor party.
1534060	1535060	Ooh.
1535060	1536060	Naaay.
1536060	1537060	Edited that out.
1537060	1538060	Um.
1538060	1540100	Do not edit what he's saying.
1540100	1543660	I'm a horse from a three day bachelor party out.
1543660	1544940	That's so good.
1544940	1549060	So as soon as they get the young boy up into the ambulance, they pull another stretcher
1549060	1552660	out, get Keith on it, get him into an ambulance.
1552660	1553660	Amber lamps.
1553660	1558580	One, you would see them take Keith away on a stretcher as you walk over to the front
1558580	1566700	of your police cruiser, which is completely covered in fire foam or fire foam, the detritus
1566700	1568020	of a fire machine.
1568020	1569020	Oh God.
1569020	1570020	I can't.
1570020	1572020	Oh, that was so adorable.
1572020	1576260	I was trying to do a fireball, but my voice can't get up there.
1576260	1577260	Anyway.
1577260	1582580	Do it again.
1582580	1583580	Fire foam.
1584500	1592820	So as you go up, you see this body that fell from the sky like an angel on his back into
1592820	1593820	the cruiser.
1593820	1602100	And when you walk around, you see him and you kind of move some of the foam away from
1602100	1604140	his face.
1604140	1611380	And he is a short balding man with large eyes and a tiny nose.
1611380	1616300	And he has fool seared into his forehead with a brand.
1616300	1618860	I shout over to, uh, to Clark.
1618860	1621660	Hey Clark, I think we found John Peters.
1634140	1649660	Keith, you were looking at all of this chaos around you and your mind just couldn't handle
1649660	1655260	it and your body just shuts down and everything goes black.
1655260	1661940	You wake up in bed, it's Christmas morning and you hear the faint sounds of laughter
1661940	1663660	coming from downstairs.
1663660	1669540	I rub my eyes and I get out of bed and I, I look around and I realize I went to bed
1669540	1675180	early last night so that Santa Claus could come bring me some gifts.
1675180	1677560	So I immediately realized that it's Christmas day.
1677560	1685300	So I excitedly run down the stairs and I see my entire family, my mom, my dad, my brother
1685300	1688100	Ferguson, all sitting around a bunch of gifts.
1688100	1692180	Half of them are already open and they all turn their heads at me.
1692180	1699740	My mom goes, oh, I guess we forgot to wake up Keith and they all laugh.
1699740	1706220	And I, and you actually, you hear your father chortles and says, yes, that's right.
1706220	1707220	We forgot.
1707220	1714500	I pretend like I didn't hear that and I sit down, uh, directly across from my brother
1714500	1715500	Ferguson.
1715500	1717660	I say, Hey, what, what have you gotten already?
1717660	1721960	Ferguson just stares at you with a blank expression.
1721960	1726020	His eyes have looked different ever since your dad gave him that watch.
1726020	1731980	William, your father says, we got Ferguson some games that will help him train for his
1731980	1733060	path.
1733060	1734060	That's cool.
1734060	1736580	Maybe once you beat the games, I can play them.
1736580	1739940	Well, they aren't really for you.
1739940	1742260	Can I, I can watch you play them.
1742260	1743260	Perhaps.
1743260	1744260	Okay.
1744260	1746580	Well, Hey, Hey dad.
1746580	1749260	I get, where's my presence at?
1749260	1755500	Your mom, without breaking her smiling eye contact with your father, points to a box
1755500	1759740	on the other side of the room, like, okay, is it my turn to open it yet?
1759740	1765500	In unison, your parents say, no, as they push another present toward Ferguson.
1765500	1766500	Okay.
1766500	1769580	Uh, Hey Fergie, I'm excited to see what you got.
1769580	1771060	Can I help you open it?
1771060	1777740	Ferguson looks to your parents, both of them, sternly shaking their heads and his eyes begin
1777740	1781220	to tear up as he opens his present.
1781220	1784100	What did you want more than anything else for Christmas this year?
1784100	1790020	I wanted the pro players extended pack of Pokemon cards with all the holograms that
1790020	1796820	had all of the rare cards and super rare and all the shiny ones you see Fergie open up
1796820	1803260	this present and it's all these Pokemon cards that you desperately wanted and kept asking
1803260	1807820	for and dropping hints for the past couple months that this is what you wanted.
1807820	1813680	And Fergie looks up with these begging eyes as your father says, do it.
1813680	1819280	And Ferguson shuts his eyes tight, a single tear running down each cheek as he picks up
1819280	1827120	his Christmas hot cocoa and pours it all into the box filled with these cards of pocket
1827120	1828400	monsters.
1828400	1834440	I start crying immediately and then I don't, I don't even ask.
1834440	1842520	I just rip open my gift expecting to see more Pokemon cards, but I open it up and it's a
1842520	1849660	white box, one that I've recognized from years prior from Christmases past and I knew that
1849660	1853300	it contained just clothes.
1853300	1855260	It's just a clothes box.
1855260	1859600	And when you open it, it is a brand new jacket.
1859600	1863820	Something you're not accustomed to since you are typically the recipient of Ferguson's
1863820	1865020	hand-me-downs.
1865020	1870600	And it is exactly the style of jacket all the young boys are envious of at this time.
1870600	1875480	My immediate disappointment turns into pure excitement and I look at my father and my
1875480	1882240	mother and a tear is rolling out of my eye and I say, thank you so much.
1882240	1886180	And I put it on and it droops over you.
1886180	1889640	It is, the sleeves go past my hands.
1889640	1891680	It is at least two sizes too big.
1891680	1896240	And I look at him and I'm like, well we can take it back and exchange it for my size.
1896240	1900480	And your parents are staring at Ferguson.
1900480	1905280	He begins sobbing uncontrollably as he walks toward you.
1905280	1909900	Your father barks, emotion is weakness.
1909900	1911920	You need to be strong.
1911920	1913920	Take what is yours.
1913920	1917280	It's the only way to succeed.
1917280	1923360	Ferguson beans, wipes his tears away and takes the jacket from off your back, putting it
1923360	1926860	on and turning away from you.
1926860	1931540	It looks really cool on you, Ferguson.
1931540	1936900	And you wake up in the back of this ambulance, what are they called?
1936900	1937900	Ambulance people.
1937900	1938900	EMT.
1938900	1939900	The EMT.
1939900	1940900	Paramedic.
1940900	1942700	Oh, hey, you're back.
1942700	1943700	How are you feeling?
1943700	1944700	What?
1944700	1945700	What?
1945700	1946700	Ah.
1946700	1952660	And your nose is just super broken and you got blood splattered all over your chest.
1952660	1955900	Oh, hey, we can give you something for that.
1955940	1961580	He hands you a bunch of pills and you take them, I'm guessing.
1961580	1962580	Oh yeah.
1962580	1965460	Alright, so we're going to put you back up at one willpower.
1965460	1967580	So you're still at a negative twenty percent.
1967580	1973900	Go ahead and roll a D4 for me as he begins doing first aid on you.
1973900	1974900	Dose.
1974900	1975900	So you gain two hit points back.
1975900	1976900	Cool.
1976900	1978800	That puts me back up to twenty, I believe.
1978800	1980220	Do you think you can stand up?
1980220	1981700	How are you feeling?
1982020	1985780	Yeah, I think, I mean, my face just hurts.
1985780	1990860	It feels a lot better after that, thank you, but, you know, I think I just, I just took
1990860	1995380	a, I smelled some of that gas and stuff, it just kind of got to my head, but I, help me
1995380	1997020	up and let me see if I can.
1997020	1998180	Okay, for sure.
1998180	2004020	And he helps you up and he kicks over in the back of the ambulance and the scene is still
2004020	2005020	out there.
2005020	2009620	There, it's, I mean, it's not chaos anymore, but there are people running around all over
2009620	2011300	the place, taking care of business.
2011300	2015600	The fire has been put out, they're getting information, blah, blah, blah, blah, blah.
2015600	2021700	You see John and Clark standing on the other side of John's cruiser, just ahead of you,
2021700	2023620	and you walk out of the back of the ambulance.
2023620	2024620	Cool.
2024620	2025620	What?
2025620	2026620	Whoop-de-de-scoop.
2026620	2045740	God damn it, I was, I almost put this through your eye, holding a mechanical pencil.
2045740	2047500	He's holding a mechanical pencil.
2047500	2052020	For the listeners, Thomas is holding a mechanical pencil that he threatened the life of Luke
2052020	2053020	with.
2053020	2054020	No, just the eye.
2054420	2055420	That's like my depth perception.
2055420	2056420	What's behind your eye?
2056420	2057420	Luke, you would look really cool.
2057420	2058420	Your brain.
2058420	2059420	No, I don't think I'd look cool with an eye patch.
2059420	2069120	I would have a fake eye, but I would get like an eight ball, no, a magic eight ball.
2069120	2073580	And when I like shook my head, I could, you know, answer your questions for you.
2073580	2074580	That's really good.
2074580	2081820	Okay, so John and, John and Clark are standing in front of John's police cruiser and you've
2081820	2084620	just had this revelation about who the body is.
2084620	2089940	When you guys look up and you see Keith Vigness stumbling out of the back of the ambulance.
2089940	2090940	Wow.
2090940	2091940	Hey, you guys.
2091940	2098060	You guys were in the slum room for a long time.
2098060	2102540	Just to set up that joke.
2102540	2108380	Real fast though, I did want to watch and see if the body of the driver came out of
2108380	2110860	the car before I was going to go over to John.
2110900	2112340	They haven't pulled anything out yet.
2112340	2113340	Okay.
2113340	2116860	Then yeah, I'll walk over to John and I now see that it's John Peters.
2116860	2117860	You do.
2117860	2119700	And you said fool was on his head.
2119700	2120700	Correct.
2120700	2125100	And that was from, we saw that when he was in the stock stocks in a picture that came
2125100	2126100	from the camera.
2126100	2127820	I'd like to feel for a pulse.
2127820	2129380	Roll first aid.
2129380	2130380	Fuck.
2130380	2132960	A 37 on a 30.
2132960	2134580	You feel no pulse.
2134580	2136460	Also, you killed him.
2136460	2138340	Good job, dude.
2138340	2141620	He is one with the vehicle.
2141620	2143180	He fell on his back.
2143180	2144180	He fell on his back.
2144180	2146020	Like his FAQ.
2146020	2147020	His FAQ back?
2147020	2149700	His FAQ bell in first.
2149700	2154820	So you would clearly see, well, it's not out of the ordinary for you to try to find a pulse,
2154820	2157100	but this body is extremely dead from what you can tell.
2157100	2158460	I want to look up in the sky.
2158460	2161100	Do I see any remnants of the stuff we saw earlier?
2161100	2162100	No.
2162100	2165740	Also, we were all in the room when it was being recorded, but John is the only one who
2165740	2168220	saw the body fall from the sky.
2168220	2169220	Oh really?
2169220	2171180	And all the stuff happened like around the sky.
2171180	2173380	I don't, I don't look up then.
2173380	2178220	Hopefully, John says, did you, did you see where this came from?
2178220	2184380	I mean, he must've been standing in the road when he fell from the sky.
2184380	2190620	I look up, you see a giant swirl.
2190620	2193900	Did you not see the clouds go crazy?
2193900	2194900	The clouds go crazy.
2195140	2199220	They were swirling all around and a technicolor light was coming from.
2199220	2202260	And then this motherfucker right here just fell on the head of my car.
2202260	2204780	I didn't, I didn't see any of that, John.
2204780	2205780	Can you feel my forehead?
2205780	2206780	Fuck.
2206780	2207780	I feel his forehead.
2207780	2208780	It's wet.
2208780	2209780	It's wet.
2209780	2210780	Warm, wet, or cold wet?
2210780	2211780	Warm, wet.
2211780	2212780	Warm, wet.
2212780	2213780	I'm not seeing things though, buddy.
2213780	2214780	I saw this.
2214780	2218420	I mean, I'm not, I'm not going to discount it just because of all the stuff we've seen,
2218420	2220060	but I didn't see it, my man.
2220060	2221060	Okay.
2221260	2226300	I'm just coming up and just now I'm noticing John Peter's body on the hood of your car,
2226300	2227300	in the hood of your car.
2227300	2228900	I, uh, I pat him on the shoulder.
2228900	2229900	Keith, you all right?
2229900	2230900	Oh, that hurts.
2230900	2231900	Please don't do that.
2231900	2232900	Ooh.
2232900	2233900	Ooh.
2233900	2234900	I'm very sore.
2234900	2235900	What, uh, what got you?
2235900	2241080	Oh, just a car wreck and passing out and hitting my head and, uh, I don't know how my nose
2241080	2246140	got broken, but somehow I fell on the back of my head and ended up with a broken nose.
2246140	2248180	So I assumed the airbag, right?
2248500	2250460	Oh man, so much stuff was flying around.
2250460	2251460	Who can tell really?
2251460	2252460	Oh yeah.
2252460	2253460	It's, it's weird.
2253460	2257780	I thought this would have maybe changed the way you talk or something.
2257780	2265300	I decided against doing that cause it's, it would be annoying for me to have to do.
2265300	2269100	Also I did it once and then immediately forgot to do it and I don't want to have to.
2269100	2271700	I don't want to have to go do that again.
2271700	2273020	Looking at you, are you bandaged?
2273020	2274600	Yeah, I'm bandaged up.
2274600	2280260	They gave me some medication so that I could just like stand talking and standing and walk
2280260	2281260	and stuff.
2281260	2285000	So I'm feeling beat up, but you know, definitely worse for wear.
2285000	2288620	But also I'm able to, yeah, like not feeling good.
2288620	2293400	So I go up to the body and I look down at it and I look up at both of you guys.
2293400	2297480	I'm like, wait, do you know who this is?
2297480	2299360	Who do you think it is?
2299360	2300360	Do you know who this is?
2300360	2302360	Who do you think it is?
2304600	2307800	Wait, would I not know who it is?
2307800	2310800	I would though, right?
2310800	2316840	I'm no fool, but I think this is John Peters.
2316840	2318600	And he moonwalks out of the scene.
2318600	2322920	We'll make a cop of this boy, yeah.
2322920	2325240	That's what a fool believes.
2325240	2328680	He puts his sunglasses on and you hear a scream from a distance.
2328680	2332600	I put my sunglasses on and then I take them off.
2332600	2341720	I want to get out my phone and take a picture, take a bunch of pictures even of this whole
2341720	2342720	scene.
2342720	2343720	Okay.
2343720	2347720	I need you all to roll sanity for me for this body being John Peters.
2347720	2351520	I say, hey Clark, is that for your spank bank?
2351520	2352520	I failed this.
2352520	2353520	I failed it too.
2353520	2354520	I failed it hard.
2354520	2356680	I don't even know what we're rolling for, but I definitely failed.
2356680	2357680	Sanity.
2357680	2358680	Yep.
2358680	2359680	71 on a 31.
2359680	2360680	And a 95.
2360680	2361680	63 on a 36.
2362080	2371560	For our fucking nerd listeners, who are all, for those of you who might be fucking nerds.
2371560	2374480	Likely all of you.
2374480	2375480	Roll a D4.
2375480	2377480	That's how much you each lose.
2377480	2378480	Yay.
2378480	2379480	Got that out.
2379480	2380480	One.
2380480	2381480	Fuck.
2381480	2382480	Four.
2382480	2383480	This was sanity?
2383480	2384480	Correct.
2384480	2387120	I am at sanity 32 with my breaking point at 31.
2387120	2392840	Clark lost four sanity, Keith lost four sanity, and John lost one sanity.
2392840	2394120	I don't remember if we talked about this.
2394120	2396280	I hit my breaking point last time.
2396280	2401800	Did we decide on something to go along with my other disorder?
2401800	2404960	We are going to worry about the disorders.
2404960	2408320	Once your psyche's really had time to stew on what fucked it up.
2408320	2409320	Exactly.
2409320	2410320	Gotcha.
2410320	2411320	Gotcha.
2411320	2412320	Gotcha.
2412320	2413320	Marsha, Marsha, Marsha.
2413320	2414320	What?
2414320	2415320	Got him.
2415320	2416320	Got him.
2416320	2420400	He got me pretty good.
2420400	2425720	That was a, dude, burn.
2425720	2427560	What kind of clothes is John Peters wearing?
2427560	2435240	John Peters is wearing a pair of jeans and a button down shirt.
2435240	2436240	Are they cool jeans?
2436240	2437240	No.
2437240	2439280	Am I able to get to his pockets?
2439280	2440280	Yes.
2440280	2441280	Hold on.
2441280	2450040	Luke just actually broke his nose on the mic.
2450040	2454400	Oh, this hurts really bad.
2454400	2457480	We'll get you that character voice.
2457480	2461600	If we have to break your nose for real, we'll get you that character voice.
2461600	2464480	I'm method acting for this podcast.
2464480	2466520	Luke just slammed his face into the wall.
2466520	2468920	To all 30, to all 30 listeners.
2468920	2469920	What would Leto do?
2469920	2470920	What would Leto do?
2471560	2473600	He just slammed his face.
2473600	2476000	I would like to search John Peters pockets.
2476000	2477200	Get police instincts.
2477200	2481920	They're full of cum.
2481920	2482920	You reach in.
2482920	2486920	Ew, it's cum, guys.
2486920	2490920	Oh, let me double check.
2490920	2494520	Yep, that's cum.
2494520	2495520	Give me some.
2495520	2497080	Keith, taste it.
2497080	2499800	Oh, he needs to change his diet.
2499800	2501600	There's nothing in his pockets.
2501600	2502600	Sorry.
2502600	2503600	Except cum.
2503600	2510360	He's a masochist and a skydiver.
2510360	2511840	I hope that makes it on.
2511840	2513040	It probably won't.
2513040	2517800	I crit success staying in the podcast.
2517800	2522760	You search John Peters' pockets and you don't find anything inside them.
2522760	2523760	Sorry.
2523760	2524760	Cummer.
2524760	2526160	I wish I could give you something here.
2526160	2528880	It just doesn't make any sense for him to have anything on him.
2528880	2536920	I was like, I wonder if you keep your wallet once you've transported to the goo plane.
2536920	2537920	Can I do a...
2537920	2538920	Wait, do I have forensics?
2538920	2539920	Okay, yeah.
2539920	2543200	I'm going to do a forensics roll to see how he died.
2543200	2545200	I think it was blunt trauma.
2545200	2547200	Hell yeah.
2547200	2550440	Wait, can we do that again?
2550440	2552000	Can we get a tight hell yeah on that?
2552000	2555100	This feels shitty, but yeah.
2555100	2558800	Can I do a roll to see if I can tell how he died?
2558800	2559800	Hell yeah.
2559800	2560800	All right.
2560800	2561800	Let's try to fight against...
2561800	2562800	Yeah.
2562800	2563800	He did pass his roll though.
2563800	2564800	How did he die?
2564800	2565800	Yeah, he did.
2565800	2566800	He did nail it.
2566800	2567800	It was 17 for that first roll.
2567800	2568800	Oh, was it?
2568800	2569800	Okay, cool.
2569800	2570800	Yeah, I have a zero in forensics though.
2570800	2571800	Oh, really?
2571800	2572800	Oh, fuck.
2572800	2573800	Oh, shit.
2573800	2585720	Yeah, I was just going to say that I pass it no matter what.
2585720	2587720	So an unusable bit.
2587720	2596040	Okay, so as you guys are standing around looking at the body in John's cruiser, you
2596040	2603680	see the firemen are pulling a woman's charred remains from the driver's seat of the minivan.
2603680	2604680	Is she hot?
2604680	2609460	Oh, she was.
2609460	2614280	Then you see two more firefighters and they're going into the back of the van.
2614280	2615280	Don't pull out a dog.
2615280	2617200	Pull out a kid, not a dog.
2617200	2620840	They pull out the body of a small girl.
2620840	2624440	Oh, we should have been a dog.
2624440	2626600	Go ahead and roll sanity for me.
2626600	2627600	Pass.
2627600	2628600	Fail.
2628600	2630600	42 on a 30.
2630600	2632600	The crit failed.
2632600	2634400	I rolled 100.
2634400	2635400	It was your daughter.
2635400	2638280	This is going to stack nicely with...
2638280	2641600	Hey, remember how smoothly the first half of this went?
2641600	2648360	So John, you lose one sanity, Clark, you lose two sanity, and Keith, you lose no sanity.
2648360	2650600	That makes me hit my breaking point.
2650600	2653640	32 now, I'm at 30 with a breaking point of 31.
2653640	2654640	How do I recalculate that again?
2654640	2655640	I always forget.
2655640	2659800	So you're at 30 now, and so you subtract your power, which is 12.
2659800	2661620	From that breaking point, right?
2661620	2662800	From your current sanity.
2662800	2663800	Oh, okay.
2663800	2667680	So if you go past your breaking point, it starts over from where your sanity is currently.
2667680	2668680	Gotcha, cool.
2669680	2673800	We all know is 18, and I didn't use my calculator for that.
2673800	2677920	Joe, I'm bad at math, and that one's a little sad.
2677920	2682520	The only reason I didn't lose sanity is because I am a terrible police officer, and I was
2682520	2685520	not paying attention at all.
2685520	2686520	Perfect.
2686520	2690400	You're trying to figure out how to pick your nose in a nose cast?
2690400	2695040	No, they popped my nose back into place and said, don't let your coworkers fall on you.
2695400	2698920	What if they put one of those clear masks over your face?
2698920	2702600	It's like when you have to play basketball, yeah, yeah.
2702600	2703600	Perfect.
2703600	2711200	Because I was too busy messing with the clear face mask they put over me to not break my
2711200	2712880	nose.
2712880	2716840	The cone that they put on me, dog.
2716840	2724960	What if they gave you a gun on both of his hands so that he can't scratch his face?
2724960	2729320	I'm wearing the clear face mask and cones over my nose.
2729320	2730320	No.
2730320	2732520	We're turning him into a monster.
2732520	2733520	Too funny.
2733520	2734520	Oh, man.
2734520	2735840	No, just ridiculous.
2735840	2740800	I'm guessing that you are going to need- We're going to need new cars.
2740800	2741800	New cars.
2741800	2743360	Good thing we're not out of town yet.
2743360	2746600	Thankfully, Keith's Cruiser is still at the police department.
2746600	2747600	True that.
2747600	2749720	Let's call Drew and have it bring it to us.
2749720	2750720	Grab it.
2750720	2753160	Bring it to us.
2753160	2754160	We respect you, Drew.
2754160	2757000	I put a lot of emotion into that character.
2757000	2760080	You can't just call him an it.
2760080	2761880	Have the fang bring us.
2761880	2766880	Also, the Chief's Cruiser is still feasible, so we could just steal hers.
2766880	2768360	She's not going to be using it.
2768360	2770240	Yeah, stealing's an interesting way to put it.
2770240	2771240	Well, not steal.
2771240	2772240	Utilize.
2772240	2773240	We can certainly utilize.
2773240	2776840	It's still police department property.
2776840	2781280	When we call Drew, can we also have him get a tow truck and bring in our cruisers and
2781280	2784000	maybe start working on fixing them bad boys back in shape?
2784000	2787760	Well, we could also, instead of this mill thing, we could just go to the cruiser store.
2787760	2791360	Wait, also, didn't we fix the four wheeler?
2791360	2792360	That is true.
2792360	2793840	Drew did fix the four wheeler.
2793840	2795900	I want to drive the four wheeler.
2795900	2796900	Around town?
2796900	2798120	I mean, following you guys.
2798120	2800400	We're going to be on the highway and stuff, man.
2800400	2803720	I'll attach a rope to the front of my four wheeler.
2803720	2804720	Put it in neutral.
2804720	2805720	Put it in neutral.
2805720	2806720	Have you?
2806720	2808520	No, Keith, you're going to have to ride with us.
2808520	2809520	I'm sorry.
2809520	2810520	Yeah, good, because my drive is-
2810760	2813880	Hey buddy, we'll have more four wheel adventures real soon.
2813880	2814880	Okay.
