start	end	text
0	6120	It's your moon howling and scowling.
6120	10400	Pepperoni with the side of extra cheese wulf the dog.
10400	14660	The moistest DJ this side of the solar highway.
14660	22480	And I am a-woo-ing at you live from 694.2 PTBP, the greatest radio station that ever
22480	23480	did.
23480	27280	Now lets move on to the greatest things y'all ever did.
27280	28960	Write me fan mail.
28960	35140	This week's howlin with wulf is from at black goat underscore m10 who instagrammed about
35140	38160	the show and tagged at pretending pod.
38160	41800	What a super cool way to let your friends know you're a freak.
41800	44880	He writes greetings Mr. Wolf.
44880	48480	Pretty new listener and first time howler here.
48480	49480	Great show.
49480	56160	I've not really been into RPGs before but I really enjoy the gangs escapades and contention
56160	57160	and the city.
57360	59040	Keep up the good work.
59040	61800	Big shout out to Victor for sending me your way.
61800	66280	Appreciative howls from Mattias in Sweden.
66280	71480	Mattias are you telling me that THE Victor sent you?
71480	73200	What did he tell you?
73200	75360	Who do you work for?
75360	80700	Mattias you're on thin ice buddy and you better watch your back.
80700	86280	And you tell Victor tell him that wulf says hello.
86400	91800	If you want to write up something for your wulf to howl tag at pretending pod on twitter.
91800	98540	Tag at pretending pod on instagram like Mattias or tag at pretending to be people on facebook.
98540	104960	Wolf and his producer haven't spent a single dime on advertising so y'all all here because
104960	110420	of words in mouths or words in posts or words in comments sections.
110420	113040	The point is words are powerful.
113040	119880	Please use yours to share this show with your friends, your co-workers, your grandparents
119880	121640	and step cousins.
121640	124920	And as a reward for your sharing I'll do two things.
124920	131540	One, I might choose you to submit a howling with wulf and two I might and definitely always
131540	134380	do put the links in the show notes.
134380	142520	And while you're posting on them socials about 694.2 PTBP keep them ear holes open and receiving
142520	144480	my dulcet tones.
144480	147360	It's time for the news.
147360	153120	Last time the field team at City Action News showed the good people of TikTok a glimpse
153120	159660	into the calzone on their way to a potential story from a woman named Kaylee Silver.
159660	163680	What they found was the scene of a gruesome homicide.
163680	168760	After watching footage from the Furbo it's clear that Kaylee Silver walked over to her
168760	174600	fridge, cracked a beer and her friend Kaylee Gold's head unnaturally snapped toward the
174600	180820	kitchen before this differently dispositioned Kaylee Gold lunged at the apartments resident
180820	182200	Kaylee Silver.
182200	188320	The attack took place out of view behind the kitchen counter but it seems Kaylee Silver
188320	193760	stabbed her friend repeatedly in the neck with her broken beer bottle until Kaylee Gold's
193760	196320	head was all but decapitated.
196320	202160	Thankfully for this story the Cannes crew called the city cops, made statements and
202160	206320	headed off to cleanse their palates with a drink at the foundry.
206320	212280	Taking us there now is a bop that don't stop, good shit that don't quit, an anthem for the
212280	213520	handsome.
213520	218560	It's Altagirl with My Life is Great and It's All My Phone.
226320	255360	And it's all mine, cause my life is great and it's all my phone.
255360	258000	So why would we do a season one name?
258000	260940	Everyone from season one is dead to this podcast, Luke.
260940	262960	We are moving on, this is season two.
262960	266880	Dude, Thomas, ask me anything about season one.
266880	267880	What's season one?
267880	271400	I don't remember.
271400	274080	Welcome back to season two of Pretending to be People.
274080	279600	If you got into this podcast because of season one, thank you, but honestly, that shit is
279600	281560	over and done.
281560	290280	And this is a new era of excellence and groundbreaking podcast roleplay, so fucking get your two
290280	293480	tight britches on, which is a reference to nothing.
293480	297920	If you listen to season one...
297920	298920	Stop listening right now.
298920	299920	Stop.
299920	300920	Yeah, you need to stop.
300920	301920	Cut that out.
301920	304760	Nope, nope, nope, nope, keep going.
304760	308660	The britches this, oh, I feel like I'm, am I clipping for you guys?
308660	309660	A little bit.
309660	310660	I feel very loud.
310660	311660	I'll turn you down.
311660	312700	Turn me down a little bit.
312700	313900	I'll just talk louder.
313900	315780	Oh, the cats, the cats going in the pod box.
315780	317020	Cat in the pod box.
317020	318020	I will say main difference...
318020	320480	She might knock the pod box off the couch.
320480	325620	After listening to the edited version of the first episode of this season.
325620	329020	Yeah, like edited, once it was edited, we were funny and good.
329020	330020	Exactly.
330020	331020	That was the big difference I noticed.
331020	333820	But after listening to that, huge differences.
333820	336560	The britches are going to be small this year.
336560	337560	This years.
337560	338560	This years.
339560	341560	Oh right, they were big in that thing that doesn't exist.
341560	343560	They were big last time and now they're small.
343560	346560	Hey Zach, are they coming out of the f***ing world right now?
346560	347560	No.
347560	348560	Oh, okay.
348560	349560	Nevermind.
349560	352560	Which is a reference to nothing.
352560	353560	Zach is currently...
353560	354560	That cat is going to leave.
354560	356560	Zach is, yeah, aggressively kissing our cat.
356560	359560	Aggressively kissing the top of Niko Case's head.
359560	361560	And the first two times she was like, yeah, sure.
361560	364560	And then the fifth time she was like, I'm not going to sit on this f***ing couch with
364560	365560	you anymore.
365560	367560	You lost cat privilege.
367560	372560	So obviously I know the answer to this, but Joe, where exactly did we leave off last time?
372560	375560	Oh dude, you should have seen the crazy s*** that I saw.
375560	380560	A girl killed another girl in an apartment and it was messed up.
380560	382560	And we were all kind of exasperated by it.
382560	387560	And so Cal Colorado asked us to go to the foundry to maybe wind down.
387560	393560	Which is not a reference to the old Joplin, Missouri music venue.
393560	395560	It's a reference to what, Zach?
395560	397560	Oh, it's a reference to what, Thomas?
397560	400560	I don't remember exactly, but isn't it a newsman's bar?
400560	403560	I believe it's a bar specifically for newsman's.
403560	404560	That's right.
404560	406560	I remember the whole thing.
406560	408560	I knew the whole time I knew that.
408560	410560	So, vroom vroom?
410560	411560	Vroom vroom.
411560	412560	Vroom vroom.
414560	420560	Julius Summers pulls into the parking lot of the foundry.
420560	422560	Yeah, where's the foundry located, Thomas?
422560	424560	What kind of bar is this?
424560	432560	It's got dive bar aesthetics, but much like Cal Colorado's house, there are pictures all over the walls of local news people.
432560	438560	And it's kind of maybe equidistant downtown from the three different local news stations.
438560	444560	And so they all come and relax and unwind there and talk shop afterwards.
444560	447560	Are there any TVs on the walls at all?
447560	453560	Are they showing the news at this place or is it specifically to unwind away from that?
453560	457560	I think they are. I think they never play sports, just the news.
457560	459560	How many news channels are in the city?
459560	461560	He just said there are three.
461560	463560	Okay, there's three TVs then.
463560	470560	I think the foundry is in an older building downtown, but just absolutely always in the shadow of these skyscrapers.
470560	476560	We're in the downtown railroad intersect.
476560	481560	I love it. It's right where the train rolls by and there's a...
481560	483560	They do train shots.
483560	485560	Yeah, of course they do train shots.
485560	494560	So pretty much every time this foundry is rumbling with the train that is basically right outside its back door.
494560	501560	There's just a shitload of attractive people in good suits getting fucking hammered.
501560	503560	And the trains come by a lot.
503560	509560	That's one of the reasons that they chose this place because it's very hard to overhear the conversation like anybody else is having.
509560	513560	You have to lean in close. It's a great place to protect your sources.
513560	521560	In your mind, is this place filled with producers and talent or is my ilk of the camera man and crew there?
521560	525560	Everyone comes to the foundry. We're all friends at the foundry.
525560	528560	Cullerton, KY3, any of the other ones?
529560	539560	I don't think we're referencing specific networks, but it would definitely be the local ABC, CBS, NBC, Fox, local anchor people all hanging out there.
539560	545560	Except it's CAN, NNN, Nightly News Now.
545560	547560	ETC is there.
547560	549560	ETC, which is...
549560	551560	Ethical...
551560	553560	This is going to be like PBS and nobody watches it.
553560	554560	Ethical...
554560	555560	Television.
555560	557560	Television channel.
559560	561560	Joe, did you do one?
563560	565560	Yeah, now that we said them all.
565560	567560	RBQ. You guys have fun.
567560	570560	It's sponsored by Arby's and it's barbecue.
570560	573560	Barbecue. Yeah, Royal Broadcasting.
573560	575560	Quarterly.
575560	577560	They only air.
579560	581560	Anyway...
582560	585560	I speedily pull into...
585560	587560	Who packed the ostrich?
587560	590560	I screech into the parking lot of the foundry.
590560	592560	Does Beck say that?
592560	594560	Unless Julius goes...
597560	602560	Julius pulls in, as any normal person would, into a parking spot.
602560	604560	But as he's doing it, he goes...
604560	609560	And then he kind of looks around at the other two and sees Cal is not laughing.
609560	612560	No, Cal is holding onto the oh shit handle.
612560	615560	And is clutching at his chest.
615560	622560	Keep in mind throughout these interactions of the sights you just saw at the apartment.
622560	624560	The high rise that you were just at.
624560	627560	Yeah, I bet you we land in silence.
627560	629560	I bet you we pull in a little somber.
629560	631560	I was going to mention, I don't think...
631560	633560	He would not bring his camera in here.
633560	636560	I think that this is a sacred place that he knows not to film.
636560	637560	Nice.
637560	639560	And that's a very out of character for him.
639560	640560	So you guys walk across...
640560	643560	This is like where the witches and the witch hunters meet.
644560	648560	There are as many people outside smoking as there are inside.
648560	650560	Also smoking?
650560	651560	Yes.
651560	654560	This is a smoking bar, but it's a nice day.
657560	661560	It's a cool evening from an oppressively hot, hot day.
661560	664560	The humidity kind of dies off into the night.
664560	669560	And you've got kind of a cool summer evening as you guys walk across this gravel parking lot.
669560	675560	And head around back to the entrance of the foundry on the train track side.
675560	678560	A train is currently finishing up.
678560	682560	It's bustling through this back area.
682560	689560	And you see a server is haphazardly making their way through the smokers outside with train shots.
689560	691560	He's yelling, train shots!
691560	693560	Who had the train shots?
693560	695560	We got a whole mess of them here.
695560	700560	Cal just like silently takes one off the tray and downs it and puts it back on the tray.
700560	706560	Julius grabs one, takes it, and then puts two dollars down on the tray.
706560	707560	Nice.
707560	711560	Which train shots are specifically a special here at the foundry.
711560	715560	It is a single dollar for a shot of whiskey.
715560	716560	Whisky.
716560	717560	Whisky.
717560	721560	When the train toots its horn as it drives by.
721560	723560	Scoot! Scoot!
723560	724560	Oh god.
724560	728560	If it's fucking dollar whiskey, we're talking Old Crow or worse.
728560	729560	Oh, it's Old Grandad.
729560	730560	Brown Derby Select.
730560	731560	It's Old Grandad.
731560	732560	It's Old Grandad.
732560	733560	Oh yeah.
733560	737560	Orange bottle label.
737560	745560	And you set this down and the server looks at Cal Colorado with a certain appreciation as he carries on with his job.
745560	747560	I think he knows to just add it to Cal's tab.
747560	748560	Nice.
748560	758560	Julius did put the two dollars down on his tray even though he knew that those were not poured out for Cal and Julius.
758560	764560	Immediately you hear him as he walks over to a group who's calling him over with the train shots.
764560	768560	He's reassuring them like, yeah, yeah, no, I'll be right back, I'll be right back.
768560	777560	And their understanding after seeing the looks on the pained faces of Cal Colorado, Julius Summers, and Beck Wilder.
777560	779560	Probably like we recognize.
779560	781560	Are they just like local news crew?
781560	783560	Yeah, it's just another local news crew.
783560	791560	They hold up their shots to you as they all wait on the other two shots to come which come quickly and you're all able to.
791560	795560	Beck takes his head off and does an exaggerated bow and puts it back on.
795560	799560	Guys, this is my first time in here.
799560	801560	I'm very excited.
801560	803560	I've heard a lot about it.
803560	806560	This is the first thing that maybe like brightened Cal's face in a while.
806560	810560	Like he gives a very knowing look to Beck.
810560	812560	Well, we have a first timer here.
812560	814560	I think you know what that means, Beck.
814560	818560	We exchange a look and you see a big smile on Beck looking at you.
818560	823560	Are you thinking like we're going to do the full set up like now?
823560	829560	Maggie doesn't let any first timers in without putting them through the printing press.
829560	833560	Oh, Julius, my man.
833560	835560	You're going to have fun tonight, dude.
835560	836560	It's going to be good for you.
836560	838560	You're going to want to shake off what we saw earlier.
838560	842560	You're going to forget all about that weird horrible homebrew murder.
842560	848560	I mean, I don't know that I'll forget about that anytime soon, but...
848560	854560	No, the images will haunt you for the rest of your life.
854560	857560	But we can obliterate them temporarily.
857560	858560	The printing press?
858560	859560	You'll see.
859560	864560	Julius starts walking faster and wants to be the first one in there
864560	870560	because he's stoked to see what the hell the printing press is.
870560	873560	Do you think that you and I have a booth that we haunt?
873560	874560	Probably, yeah.
874560	875560	I think that'd be cool.
875560	881560	Julius has done his research asking his uncle all about these guys,
881560	883560	so he knows which booth it is.
883560	887560	What?
887560	891560	So Julius goes and sits down in the booth that you guys usually go sit down in.
891560	894560	Do you go sneak in right before Beck gets there?
894560	896560	No, I'm just leading the way.
896560	899560	I'm just going and sitting down and turning around like,
899560	901560	look what I know.
901560	902560	Hey, that's the one we always sit at.
902560	905560	That's weird, dude. Cool.
905560	909560	Hanging Wes Anderson-style directly center frame of the booth
909560	917560	is an old picture of Cal from the night after his first television broadcast
917560	919560	as a head news anchor.
919560	924560	And it's beautifully framed in this old oak wooden frame
924560	926560	and is sitting gloriously.
926560	927560	He looks like a kid.
927560	929560	The suit's wearing him.
929560	932560	Yeah, Cal sits purposely with us back to that.
932560	933560	In what way?
933560	936560	When people look at it, do they see your face next to your face?
936560	942560	No, what they're going to see is a much younger, more handsome man
942560	947560	with a huge smile on his face next to that aged 30 years
947560	950560	and looking absolutely miserable tonight.
950560	952560	It does have that effect that those are contrasted,
952560	955560	but he's not trying to do it as a power move or anything.
955560	957560	He just doesn't want to catch sight of it.
957560	958560	Sure, sure, sure.
958560	963560	As Julius slides into the booth, he's not saying anything
963560	965560	but wiggling with excitement.
965560	967560	He's wanted to do this for so long.
967560	971560	Just be a producer and be part of the news and be able to get into this place.
971560	973560	He is so fucking stoked.
973560	975560	Julius, if you wiggle like that during the printing press,
975560	977560	you could lose a finger.
980560	981560	Printing press.
981560	983560	I want to find out what it is.
983560	985560	Your research didn't tell you what it is.
985560	988560	My uncle would not tell me.
988560	989560	That makes sense.
989560	991560	It's kind of a closely guarded secret around here.
991560	993560	I don't think that anybody goes out there
993560	995560	just telling other people about it, you know?
995560	998560	They never do, if they want to live.
998560	1000560	Only kidding.
1000560	1003560	It's a process that happens in three steps.
1003560	1008560	The first step, you are laid across the bar
1008560	1011560	and your belly is exposed.
1011560	1015560	Julius pulls his shirt up as he lays on the table
1015560	1017560	and then realizes what was said,
1017560	1019560	and then he goes and sits back down again.
1019560	1021560	Tell them the second part.
1021560	1025560	Well, this is kind of like your last moment of choice here,
1025560	1027560	but you get to decide what liquor you want.
1027560	1030560	Once you're laying on the bar with your shirt up?
1030560	1031560	Uh-huh.
1031560	1034560	So what would be your choice if you said your favorite liquor?
1034560	1035560	Tequila.
1035560	1038560	Ooh, that's a bad choice.
1038560	1040560	Right on.
1041560	1045560	The third step is more tequila than you've ever had in your life
1045560	1051560	with hungry news crews eagerly licking it off your midriff.
1051560	1053560	Oh, God.
1054560	1059560	As Maggie, the hardened barkeep, pours a bottle into your mouth.
1059560	1061560	Great name, by the way.
1062560	1066560	So the tequila gets poured into my mouth and...
1066560	1067560	And your belly button.
1067560	1069560	On my belly button.
1069560	1073560	And they let the older interns just absolutely go at you.
1073560	1075560	The older interns!
1080560	1083560	So at this point you're probably asking what's in it for you.
1085560	1087560	The deep respect that comes.
1087560	1095560	I spent a lot of my time in college practicing for this day.
1095560	1097560	Oh, you've had a lot of people lick you.
1097560	1099560	I wish.
1099560	1100560	Oh.
1100560	1102560	Has anyone licked you?
1102560	1106560	Julius gets up from the booth and walks over to the bar with his...
1106560	1110560	While he's like untucking his shirt from his pants.
1110560	1114560	His all-tan suit.
1116560	1118560	I thought you were going to describe your body and I was like,
1118560	1120560	he strikes me as a very pale man.
1120560	1122560	He's pretty pale, yeah.
1122560	1126560	You see a trunk of a woman in a denim vest with long...
1126560	1128560	A vest of a woman in a denim trunk.
1128560	1132560	And in a long braid down the back of her hair.
1132560	1136560	She clinks a bell above her head.
1136560	1138560	And she's like...
1140560	1142560	Hot off the press.
1144560	1146560	Hot off the presses.
1146560	1148560	Oh, that's right.
1148560	1153560	We got a newbie over at City Action News.
1153560	1155560	Come on down.
1156560	1163560	Everyone, give it up for Julius Summers.
1163560	1165560	He's in for the printing press.
1165560	1167560	Clang, clang, clang, clang, clang.
1167560	1169560	And the entire crowd...
1169560	1172560	In circles. All the smokers come inside when they hear the bell.
1172560	1174560	And immediately jackets come off.
1174560	1177560	Ties are loosened. Top buttons are undone.
1177560	1179560	And these very dorky...
1179560	1182560	You see the interns start circling.
1182560	1184560	And they all look like Jonah from Veep.
1184560	1186560	And Julius...
1188560	1192560	Julius is laying on the bar with his shirt kind of pulled up.
1192560	1194560	Exposing his stomach.
1194560	1200560	And then one of the Jonah interns just rips all of his upper clothing off.
1200560	1208560	printing press!
1208560	1211560	And the chants fade away.
1211560	1214560	Much like Julius's memories.
1214560	1217560	From the entire night.
1217560	1223560	Beck and Cow, however, don't get printing pressed by a bunch of rabid interns.
1223560	1228560	And therefore are able to keep their wits in their brain helmets for the evening.
1228560	1230560	Let's go check that out.
1230560	1234560	Hey, thanks so much for listening to Pretending to Be People.
1234560	1236560	Probably means you're fucking cool.
1236560	1245560	We've got a very special guest on today's episode of Pretending to Be People.
1245560	1250560	I had an idea in my head when we were discussing the recording of Season 2.
1250560	1256560	Joe and I had talked about who his character would interact with the most.
1256560	1259560	And your answer to that was...
1259560	1261560	Mother.
1261560	1263560	The answer was mother.
1263560	1269560	I think you specifically told me I can't have dead parents this time.
1269560	1271560	Well, not yet.
1271560	1274560	Not yet, exactly.
1274560	1284560	And when you said mom, immediately I thought, well, let's get our podcast dad to come on and play Beck Wilder's mom.
1284560	1288560	It's Scott Norwood is back, baby!
1288560	1290560	Thank you very much for having me back on.
1290560	1295560	This isn't the first time I've been called a mother, but at least the circumstances are different.
1295560	1299560	Well, we really appreciate you coming on.
1299560	1305560	For those of you who are just hearing Scott on Pretending to Be People for the first time for some fucking reason.
1305560	1311560	Scott is my parasocial RPG mentor.
1311560	1313560	He didn't know that he was my mentor.
1314560	1322560	But listening to his podcast that he does with Matt Sanderson and Paul Fricker, good friends of Jackson Elias,
1322560	1328560	truly developed me into the GM that I am today.
1328560	1334560	And I am super appreciative of all the lessons I've learned listening to their podcast over the years.
1334560	1339560	Oh, blimey. I'm still amazed that anyone even listens to it, let alone learns.
1340560	1345560	Scott, before I was ever aware of who you were, I knew that Zach listened to your podcast,
1345560	1350560	and you answered some questions for him one time, and he was so excited and told us all about it.
1350560	1355560	And that was way before there was ever a glimmer of hope of meeting you, let alone playing with you.
1355560	1360560	Oh, yeah. We weren't even talking about recording a podcast, but I was running Hell in Texas,
1360560	1367560	which is a scenario that you wrote for the book The Things We Leave Behind by Stigine Fox Publishing.
1367560	1373560	And that's a great book, and your scenario in it is so terrifying and awesome.
1374560	1379560	So I posted some questions on the subreddit, and you yourself came in and answered them,
1379560	1382560	and I lost my fucking shit, Scott.
1387560	1394560	I waste half my life on Reddit. It is my main time sink, and I am not proud of that.
1395560	1402560	Well, that time sink made this nerd super happy and validated many, many years ago, so thank you for that.
1402560	1408560	Some might say this podcast wouldn't exist without you, Scott. You gave him the hope, the drive.
1408560	1410560	Oh, it's all my fault now, is it?
1412560	1414560	We have to pin it on somebody.
1415560	1429560	I would like to take us to the home of Beck and Kim Wilder as Ramona scoots her cat.
1432560	1436560	Zach has a cat food bowl that is one of those ones that's like a maze.
1436560	1438560	Yeah, it keeps Ramona nice and...
1438560	1439560	But it kind of becomes a game.
1439560	1441560	Smart, yeah.
1442560	1448560	Yeah, she grabs each piece individually and then eats it out of her own paw, which is rad.
1449560	1451560	But noisy, I imagine.
1451560	1454560	Quite noisy. I'm going to move it into the back room.
1457560	1463560	I barely get through a recording session without one of my cats running into the room and screaming like a seagull,
1463560	1466560	or jumping all over things and knocking shit over.
1467560	1468560	Yep.
1468560	1472560	My cats are named Chaos and Anarchy and it's with good reason.
1472560	1473560	That's great.
1475560	1480560	Beck Wilder has had a brutal day.
1480560	1482560	Started off fine.
1482560	1487560	Woke up around 2 p.m. in your tighty-whities, in your messy bedroom.
1489560	1492560	Headed off, shot a segment out on a farm.
1492560	1495560	He had a rough evening? Was it evening?
1495560	1502560	Yeah, it was a rough evening. You were called out for a potential story that was...
1502560	1505560	We weren't even 100% sure what we were going out there for.
1505560	1507560	And what did you find?
1507560	1509560	Oh man, it wasn't good.
