start	end	text
1509560	1515560	It was a terrible, terrible crime scene, including a partially severed head.
1515560	1516560	Yeah.
1516560	1520560	That wasn't what Beck was thinking was going to happen that day.
1520560	1525560	Yeah, I mean, a severed head is bad enough. A partially severed head sounds worse.
1527560	1529560	Yeah, it's a lot worse.
1531560	1533560	Just holding on.
1533560	1534560	Just a little hinge.
1536560	1538560	Beck isn't in the greatest headspace.
1538560	1543560	He's now just gotten back from the foundry where he had a nice night trying to drink his troubles away.
1543560	1547560	Are you feeling a little loose? You feeling a little warm in the face?
1547560	1549560	Beck always feels loose.
1549560	1556560	He's maybe a little bit looser than normal, but he kind of lives in an equilibrium of inebriation.
1557560	1559560	A loose state. I like that.
1559560	1570560	So as you arrive home, it's late at night. It's 1130 PM, maybe even midnight, which is about as late in the night as you can get.
1571560	1573560	Before it starts becoming morning.
1573560	1574560	That's right.
1575560	1591560	Kim Wilder has the home to herself. Her son is a mid 30s field cameraman for City Action News, and he is still living in your house, Kim.
1593560	1594560	For now.
1596560	1600560	What is Kim Wilder up to on a random Saturday evening?
1600560	1607560	I think she's sitting there on the sofa, knitting and watching television.
1607560	1613560	The sound is way down on the TV and there's just the clack, clack, clack of knitting needles.
1613560	1618560	And somehow she is managing to make knitting look angry.
1620560	1629560	Out of the corner of her eyes, she just keeps darting her eyes over and stabbing them into the corner where Beck keeps his camera equipment,
1629560	1640560	which is not there at the time, but there's like a whole corner of this room that is specifically set up to house Beck's livelihood.
1640560	1646560	Oh, yeah. You can tell exactly where it is just by all the scuff marks and the skirting board and the floor tiles.
1649560	1656560	And the last you saw Beck, it was maybe even yesterday, because today you knew that he was in his bedroom.
1656560	1664560	You knew that he, you know, had been sleeping in, but you went to knock on his door for tea or snack or he wasn't even in there.
1664560	1672560	He just left the house without saying anything. And as those thoughts are flowing through your brain, the front door swings open.
1672560	1679560	Hey Ma, you're up. Oh, this is awkward.
1679560	1692560	Oh, dear. Oh, dear. Oh, dear. I thought that was a burglar coming in, but no, it's just my son staying out all hours again.
1692560	1695560	And where have you been tonight, young man?
1695560	1702560	Get some drinks with the boys. You know, it's... I had a bad night, Mama.
1702560	1708560	Yes, I can smell just how bad your night was from here. Yes.
1710560	1715560	You're not going to bed until you put something in your stomach to soak up some of that beer.
1715560	1723560	There's still some hot dog casserole in the oven. It's probably, oh, it's probably burnt to a crisp by now.
1723560	1728560	But, well, give it a try. Cut up the wieners nice and small, just the way you like it.
1728560	1732560	Just the way I like it. Cut up more hot dogs.
1733560	1740560	Beck starts walking toward the fridge and you can tell now that he's a little drunker even than you've ever seen him.
1740560	1746560	He's a stumble-ier than you've ever seen him. And he kind of catches himself, woo, a little woozy.
1746560	1757560	Sorry. Sorry about that, Ma. I know we don't like to talk about like what I do, but like I saw some shit tonight, Mom. It was bad.
1757560	1761560	And what exactly did you see?
1761560	1770560	Oh, it's kind of like a thing that's like under investigation now. I don't know if like I might need a lawyer to talk to you about it.
1770560	1777560	Honestly, I really don't understand why you can't have a proper job. You're out all hours.
1777560	1786560	I never know whether I'm going to find you sleeping in your room in the middle of the afternoon or whether you're going to stay out until three o'clock in the morning.
1786560	1791560	Clearly, what you're doing isn't making you enough money for you to actually move into your own place.
1791560	1796560	And now you're saying that it's dangerous as well and it's going to get you into trouble.
1796560	1801560	Why do you do this? Why can't you just get a proper job?
1801560	1813560	You know, Macey Grindel's son, Deke, he's got he's got a nice thriving business for himself selling secondhand sofa beds and he's moved into a new apartment downtown.
1813560	1820560	It's all his own. Well, I think he's got a couple of flatmates, but he's not living with his mother anymore. That's the important thing.
1820560	1828560	Yeah, but Deke's a fucking asshole. Oh, not this again. Jesus Christ.
1828560	1833560	He's a financially solvent asshole.
1833560	1837560	Sorry, the internet connection cut out a little bit right there.
1837560	1847560	He's a financially solvent asshole.
1847560	1850560	Brilliant.
1850560	1861560	As Kim started to go into that diatribe, Beck had his back to her and he was kind of mouthing along with these words. He's heard it so many times.
1861560	1868560	Oh, she's got to mention Deke again. She's got to mention Deke. Oh, there we go.
1868560	1874560	If you love Deke so much, why didn't you give birth to him?
1874560	1882560	Don't think that I haven't thought about that every day. Ew, gross, mom. You think about fucking Deke's dad?
1882560	1886560	A wistful look crosses Kim's eyes.
1886560	1891560	Oh my God.
1891560	1900560	For like half a second, I thought we were going to get something really meaningful when Kim was like, why do you even do this job?
1900560	1908560	And then Beck's like, go fuck my friend's dad.
1908560	1920560	At this point, Beck has lost the gusto for the hot dog casserole and is just kind of like slopping it onto a plate and throwing it in the microwave and is trying his best to like avoid eye contact with you.
1920560	1927560	Look, Ma, I know that it's like not like the best paying thing in the world, but it's like what I want to do.
1927560	1934560	Like, I don't know if you can understand like happiness from that perspective, but that's what I've got for me right now.
1934560	1949560	Look, you've got to understand that part of being a grown up is that we all have to do things that we don't want to do, because that's just how we get through life.
1949560	1957560	And yes, all right, you can run around doing your camera stuff and whatever it is you do at three o'clock in the morning.
1957560	1964560	And I try not to judge you, but sooner or later, you've got to grow up.
1964560	1970560	You can't just carry on like this and pretend that everything's all right.
1970560	1975560	You've got to you've got to grow up someday, boy.
1975560	1982560	Beck is now kind of a little more solemn and a little more introspective visually.
1982560	1987560	And he pulls the food out of the microwave and he's holding the plate and he's kind of picking at it with a fork.
1987560	1993560	Yeah, I mean, fine. We disagree on like fundamental things, Ma.
1993560	2003560	I just maybe someday you'll see that I can I can do this and also like be successful, whatever that means to you.
2003560	2005560	I'm going to my room.
2005560	2008560	All right. You'll have to pick up the clean sheets.
2008560	2011560	I've left them out for you, but you'll have to make the bed yourself.
2011560	2022560	And I tried to get the stains out, but we're going to have to try a new brand.
2022560	2028560	Yeah, OK, thanks. Thanks, Mommy. You got any milk?
2028560	2033560	Sounds a bit flogging.
2033560	2046560	Scott, we didn't bring you on here to roleplay anything other than what's about to happen.
2046560	2055560	Scott, thank you so much. I think I think that's perfect.
2055560	2058560	Scott, as always, an absolute pleasure.
2058560	2065560	Oh, thank you. Zach, we live in a weird, privileged world that we just had Scott Dorward on to play with my mom.
2065560	2071560	And I said, thanks, Mommy. Got any milk?
2071560	2073560	And then we said, have a good day.
2073560	2079560	That is good to hold me.
2079560	2082560	All right, Scott, thank you so much. Seriously, thank you so much.
2082560	2089560	And for those of you who enjoyed Scott just now, you can hear him.
2089560	2095560	He runs two different full scenarios for us on pretending to be people in our bonus episodes.
2095560	2096560	Episodes? Episodes?
2096560	2104560	Here on the main feed, Scott, you ran Bleak Prospect, a Call of Cthulhu scenario that you wrote so fucking creepy.
2104560	2106560	It's one of my favorite things that we've done on the show.
2106560	2111560	Starts in a Hoover town and goes to worse places.
2111560	2119560	And you also recently ran a Pulp Cthulhu scenario, both of which, by the way, that Scott wrote.
2119560	2121560	This one was A New Age of Wonders.
2121560	2129560	And that was, for me personally, I think one of my absolute favorite player experiences I've ever had in an RPG.
2129560	2134560	Oh, man. Oh, I'm glad you liked it. I had an absolute blast running it.
2134560	2135560	We did, too.
2135560	2138560	That's so fun.
2138560	2144560	All right, well, I'm going to stop gushing and we'll see you soon, Scott.
2144560	2146560	Oh, marvelous. Look forward to it.
2146560	2148560	Good night, Mommy.
2148560	2151560	Oh, God. I've got to go and have a bath now.
2151560	2163560	We're Team Press! We're Team Press! We're Team Press! We're Team Press! We're Team Press! We're Team Press!
2163560	2167560	If you're just now joining us, welcome back to Pretending to Be People.
2167560	2170560	We are here with a special guest right now.
2170560	2180560	It is the GM of the Lost Mountain Saga, one of the best players from Glass Cannon Networks, and droids, and aliens.
2180560	2186560	It is Eleanor de Lorenzo.
2186560	2191560	Let's get one that the people can hear.
2191560	2197560	It's fun to talk like this, but I don't know if anybody can understand Eleanor de Lorenzo.
2197560	2198560	Hey, Ellie.
2198560	2206560	Hello. I understood. There were compliments in that. I understood that. I sucked that up right up.
2206560	2208560	I picked those out right away.
2208560	2210560	Thank you so much for coming back on.
2210560	2212560	Ellie, thank you so much for coming and joining us again.
2212560	2216560	Oh, dude. I'm so excited to be back. Thank you for inviting me.
2216560	2221560	If you're listening to this and you haven't heard Ellie on Pretending to Be People before,
2221560	2227560	Ellie was a guest and a player when I ran a homebrew scenario that I wrote, Bigfoot Underground Search and Hunt.
2227560	2232560	for her and some other guest players, and we had an absolutely phenomenal time.
2232560	2237560	You were such a wonderful player that I was so excited to bring you back on.
2237560	2242560	But another huge reason that I was so excited to bring you on is when I told Thomas, I was like,
2242560	2247560	Hey, dude, Ellie from A&A is coming on Pretending to Be People.
2247560	2253560	Yeah, and then you had her play with a bunch of people who weren't fans of that show.
2253560	2257560	Which as a fan was like, well, that's a bummer.
2257560	2263560	Couldn't have anyone except me getting too starstruck on her first appearance on Pretending to Be People.
2263560	2266560	Fair enough. You wanted to protect her from...
2266560	2269560	From what's about to happen, yes.
2269560	2273560	From the slobbering idiots of the PTBP pod.
2273560	2278560	I love slobbering idiots, though. That's what I'm more comfortable with, you know what I'm saying?
2278560	2283560	Now I played with very talented, wonderful women and they were all great, but I will say...
2283560	2284560	That sounds deeply intimidating.
2284560	2286560	Intimidating, yeah.
2286560	2290560	They were hot. They stared at me with their hot eyes.
2290560	2293560	And one of them was apparently married to you, Zach.
2293560	2295560	That is correct, yeah, apparently.
2295560	2296560	Apparently.
2296560	2297560	Apparently?
2297560	2299560	Yeah, allegedly married.
2299560	2303560	Allegedly, Taylor and her hot eyes are married to Zach.
2303560	2305560	I'm an allegedly lucky man.
2308560	2315560	Okay. I'm not going to correct that because I'm waiting for all the chinks in your marriage's armor to collapse at once.
2315560	2319560	Coming in hot. Coming in hot. Love it.
2319560	2321560	I'll have to beat Luke off, but...
2321560	2324560	Wow, I'd watch that.
2324560	2326560	So, Thomas, are you married?
2326560	2328560	Uh, no. No, I'm not married.
2328560	2332560	You said that very quickly, no. It was like a gut reaction, no.
2332560	2334560	Well, I remembered that I wasn't.
2334560	2336560	Oh, right. Well...
2336560	2339560	You looked back at your whole life and you thought...
2339560	2342560	Did I leave a wife somewhere?
2342560	2343560	Along the road?
2343560	2346560	It's like when people ask you if you're like, do you have any kids?
2346560	2348560	And you're like, not that I'm aware of.
2348560	2350560	It's like, do you have a wife? Not that I'm aware of.
2350560	2352560	Not that I'm aware of.
2352560	2359560	I'm known for not knowing much about America and I just realized that I know you guys are from a state.
2359560	2363560	But I don't remember which state right this second.
2363560	2365560	Is it Missouri?
2365560	2366560	Yeah.
2366560	2367560	Wow.
2367560	2371560	I was going to make a joke about you have a one in 50 shot, so just go for it.
2371560	2372560	You fucking nailed it.
2372560	2373560	I did.
2373560	2374560	Got it in one.
2374560	2378560	It is indeed Missouri, which we like, but a lot of people don't.
2378560	2380560	Oh, yeah. We love it.
2380560	2383560	It's nice here. It's really hot right now, actually. It sucks here.
2383560	2386560	Oh, but still, I would love to go.
2386560	2392560	But is it nice because it's like, you know, you can be on a horse ranch and...
2392560	2393560	I'm sorry.
2393560	2395560	Yeah, you can be on a horse ranch.
2395560	2396560	Okay.
2396560	2403560	Well, I mean, I don't make very much money and this is my house that we're recording in.
2403560	2411560	Oh, screw you and making fun of my bullshit New York studio cabin.
2411560	2412560	But that's true.
2412560	2414560	That's a really cool thing about Missouri.
2414560	2417560	You have an actual kitchen. I love that.
2417560	2420560	I want a Missouri kitchen.
2420560	2425560	Let's get into Cal, Colorado.
2425560	2427560	Cal, you've had a very interesting night.
2427560	2432560	I want to dive back into some of the things that you've seen here on this random night.
2432560	2433560	I don't.
2433560	2438560	Oh, yeah. That makes sense because one of these memories that keeps just blasting into your head
2438560	2446560	as you're leaving the foundry is just this headless, almost headless neck
2446560	2449560	held on by a couple of tendons and skin on ones.
2450560	2458560	Your mind drifts immediately from this severed neck off to your daughter.
2458560	2462560	A little bit. Mostly my mind is just shouting neck hole, neck hole, neck hole
2462560	2468560	as I see like this horrifying like red flash and this image of this nearly headless neck.
2468560	2471560	Neck hole, neck hole, neck hole as you get into your car.
2471560	2476560	Neck hole, neck hole, neck hole as you drive really far back to your home.
2476560	2480560	Neck hole, neck hole, neck hole, neck hole everywhere.
2480560	2485560	Neck hole, neck hole, neck hole as you sit into your chair.
2485560	2489560	And he turns on a 24-hour news channel like he always does.
2489560	2491560	Natch. Drown it out, baby.
2491560	2495560	Honestly, the cleaning person must have turned it off because he kind of likes to just keep it on all day.
2495560	2501560	But yeah, he turns that on. He goes over to his pretty dusty home bar.
2502560	2508560	He grabs a glass and takes a bottle of cheap white wine out of the refrigerator
2508560	2512560	and pours it to the brim and then downs that and pours another.
2512560	2517560	And at that moment, you feel a vibration coming from your pocket
2517560	2522560	and it's not the vibration of a text or a call. Do you not have a phone that vibrates?
2522560	2528560	No, he does, but we don't do vibrates here. We have a ring on this podcast.
2528560	2529560	That's right.
2529560	2531560	Ring, ring, ring, ring.
2531560	2534560	Yeah, he hears the ringtone set to his daughter, Carol.
2536560	2542560	Eleanor de Lorenzo, what does Carol's face look like on the screen of Cal's phone here?
2542560	2545560	It's a young woman, young 20s.
2545560	2550560	She currently looks a little flushed, as if she might have been, I don't know, working out or something.
2550560	2554560	But since Saturday night, you might assume that she might be a little tipsy.
2554560	2559560	And she's sitting down on a couch that you recognize to be her student room.
2559560	2560560	Hey!
2563560	2571560	Carol, it's lovely to hear from you. I'm sorry, I've had kind of an extraordinary evening.
2572560	2573560	Honey, how are you?
2573560	2578560	Dad, can you tilt your phone up a little bit? I can't see you.
2578560	2580560	Like you're filming your forehead again.
2580560	2582560	He tilts it down and you can just see his chin.
2583560	2584560	Is this better?
2584560	2585560	No, please.
2586560	2591560	You remember, like you can put it a little bit further away from your face. That works better.
2591560	2594560	You just see one giant eye as he's looking into the camera lens.
2594560	2598560	Alright, and she puts down the phone and it's just voiceover.
2603560	2608560	Honey, I'd love to see your darling face, especially with you so far away from home.
2608560	2610560	Please explain FaceTime to me.
2613560	2616560	Oh, Dad, have you been drinking?
2616560	2624560	Just a little wine. It's a Saturday night. I'm a single man. Can I not enjoy a sifter of wine?
2624560	2628560	No, of course. Actually, that's what I wanted to talk to you a little bit about.
2628560	2633560	I wondered if you... Have you been doing anything fun lately? Like, except working?
2633560	2637560	Work is fun, sweetie. Your mother and I always tried to tell you that.
2637560	2646560	No, I know. I know. I just... I don't know. I worry about you. That's why... I just wish you, you know, would get out there a little bit.
2646560	2652560	Cal thinks about where he just got out to and pauses and he kind of gulps and he's like,
2652560	2658560	I get out, sweetie. Just today I saw some corn wrestling while I was out on assignment.
2658560	2664560	They also had crabs. Not the men. The farm. They raised corn and crabs.
2664560	2665560	Alright.
2665560	2667560	So I get out.
2667560	2677560	Yeah, no, I get it. I know. I just... I don't know if you... I'm sure you already heard, but Mom, I think... Mom's seeing someone.
2677560	2683560	Yes, I heard. He's quite a bit younger, too. I heard he was 40.
2683560	2689560	Yeah, but, I mean, after you turn 25, it's like age doesn't matter anymore.
2689560	2691560	Oh.
2691560	2700560	She says that with 100% sincerity because she thinks that if you're over 25, you're ancient.
2700560	2705560	And you can tell that suddenly Carol seems a little bit nervous.
2705560	2706560	Yeah, I don't know.
2706560	2708560	Is there something else on your mind, sweetie?
2708560	2712560	Well, promise you won't get angry.
2712560	2713560	I promise.
2713560	2723560	Well, you know that I always wanted to make you happy, and that's why I went to journalism school.
2723560	2729560	Of course. Just like your mother and I, you went on to journalism school to continue the family business.
2729560	2733560	Which is your ultimate dream and desire, of course, right?
2733560	2740560	Right. But, well, I've decided, and she suddenly gets defensive as if she's ready to fight.
2740560	2743560	I've decided that I'm not going to do that anymore.
2743560	2749560	I've decided that I am going to pursue something else, something that I am passionate about.
2749560	2753560	And it's not journalism, it's not writing, it's not any of that.
2753560	2759560	I have decided I'm going to become a nature photographer.
2759560	2764560	Well, sweetie, that's... that's wonderful.
2764560	2765560	Really?
2765560	2769560	You know, photography is still technically journalism.
2769560	2772560	No, no, okay, what...
2772560	2777560	Sweetheart, I just want you to know that no matter what you choose,
2777560	2785560	even if you're not a world-class news anchor like me or a Pulitzer Prize-winning journalist like your mother,
2785560	2796560	we're happy that what you have chosen is still inexplicably linked to the nexus of reporting and,
2796560	2799560	well, you know, showing the truth of our world to the people.
2799560	2800560	That's what it's all about.
2800560	2805560	Okay, well, see, see, that was like... I knew that you were going to react like that,
2805560	2809560	so now I'm going to tell you the real... my real job.
2809560	2811560	A bait and switch.
2811560	2815560	I'm going to tell you the real... it's still related to photography.
2815560	2817560	Yeah?
2817560	2824560	But it's like for, like, beautiful women posing without clothing.
2824560	2825560	Pornography?
2825560	2826560	Pornography?
2826560	2827560	No, it's not pornography.
2827560	2828560	Carolina?
2828560	2831560	It's not pornography.
2831560	2834560	It's boudoir photography.
2834560	2835560	Oh, I'm sorry.
2835560	2840560	Nerd pornography.
2840560	2841560	See, this is the thing.
2841560	2842560	You never understand.
2842560	2843560	You mock everything I do.
2843560	2845560	That's the problem with you and mom.
2845560	2848560	You're both academics and I don't want to be involved with this.
2848560	2849560	Like, I don't want to go to school anymore.
2849560	2851560	I'm going to buy my camera.
2851560	2856560	I'm going to take pictures of my friends and they will pay me eventually.
2856560	2859560	And then I'll start an Instagram account and I'm going to make a lot of money.
2859560	2861560	And there's nothing you can say or do.
2861560	2862560	And, yeah.
2862560	2864560	Roll a grip check, Dad.
2864560	2865560	No, I think he's...
2865560	2866560	No, no, no. This is...
2866560	2867560	Hold on.
2867560	2869560	This is specifically because of what you've seen tonight
2869560	2871560	and the amount of grip that you lost.
2871560	2874560	It is going to affect the relationships that you have.
2874560	2877560	Yeah, I know, but what I was just about to say was all about that.
2877560	2878560	Oh, okay.
2878560	2880560	And why it actually wouldn't.
2880560	2885560	Well, that's part of the game is you have to roll to do that.
2885560	2887560	Yeah, he hates the dice.
2887560	2889560	But he succeeds.
2889560	2890560	Okay, yeah.
2890560	2891560	All fair enough.
2891560	2897560	So you see from the part of your father's chin that you can't see.
2897560	2899560	It, like, quivers a little bit.
2899560	2903560	But then he composes itself and he says,
2903560	2908560	Honey, your mother and I will support you no matter what you choose to do.
2908560	2910560	We only want you to be happy.
2910560	2916560	And tonight I saw some horrible things that I can never unsee.
2916560	2921560	If you can make beautiful art and put it into this world,
2921560	2923560	that is enough for me.
2923560	2927560	You're going to want to approach this more carefully with your mother.
2927560	2930560	We may not tell her until you've graduated.
2930560	2932560	Well, I'm not going to graduate. That's the thing.
2932560	2933560	Right, right, right.
2933560	2937560	Until you burlesque photography.
2937560	2943560	Well, this is a whole new world for me, pumpkin.
2943560	2946560	So, Dad, are you all right?
2946560	2948560	You said you've seen some horrible stuff.
2948560	2950560	I didn't see a neck hole.
2950560	2953560	Sorry, one of the wrestlers broke his arm.
2953560	2955560	It bent the wrong way.
2955560	2958560	It was gnarly.
2958560	2962560	I love that Cal picked up the word gnarly from Beck.
2962560	2965560	Oh, no, Jesus. Is he going to be okay?
2965560	2967560	Yes, sweetie, I think he'll be fine.
2967560	2969560	Everything will be fine in the world.
2969560	2972560	And you will, no matter what you choose to do,
2972560	2975560	you will be an important contributing part of it.
2975560	2977560	And your mother and I love you very deeply.
2977560	2979560	Well, I love you too, Dad.
2979560	2981560	And she's starting to get worried.
2981560	2984560	Like, wow, he really needs to start getting out there.
2987560	2989560	I don't know, Dad, I know it's not my business,
2989560	2992560	but I think it would be good for you to, like,
2992560	2995560	there are apps you can download that would, like,
2995560	2998560	match you with other women.
2998560	3001560	I just don't want you to be, like, be alone.
3001560	3004560	I'm not alone, sweetie.
3004560	3007560	I have you. I have my memories.
3007560	3009560	He points to all the pictures around the house.
3009560	3010560	Oh, my God.
3010560	3013560	See, that's the definition of being alone.
3013560	3017560	But I will try to get out there more.
3017560	3020560	What are these women apps you told me about?
3020560	3023560	Well, one of them is called Bumble.
3023560	3024560	Bumble?
3024560	3026560	I mean, like, when you've downloaded them, let me know
3026560	3029560	and I'll give you some advice because you can't be, like,
3029560	3033560	don't start commenting on women's profiles like a weirdo.
3035560	3037560	How do you comment like a normal-o?
