start	end	text
3037560	3039560	Well, you just wait for them to, like,
3039560	3041560	you put up a nice picture of yourself
3041560	3043560	and then you write something nice about you,
3043560	3045560	like you're an established journalist,
3045560	3048560	and then you wait for women to contact you.
3048560	3052560	Is there an app that finds me a woman exactly like your mother?
3052560	3054560	Oh, no.
3054560	3055560	Dad.
3055560	3056560	What?
3056560	3057560	No.
3060560	3063560	Maybe you should go for the complete opposite.
3063560	3064560	Like a guy?
3067560	3069560	Well, maybe.
3069560	3070560	I don't know, man.
3071560	3076560	Carol, I promise you, I will look into online dating.
3076560	3078560	Carol, exciting news.
3078560	3081560	Do you post your boudoir pictures on TikTok?
3081560	3082560	Well, okay.
3082560	3084560	So, Dad, you can't follow my friends.
3084560	3086560	Like, they are not part of the dating pool.
3086560	3087560	Is that why you're asking?
3087560	3088560	No, no.
3088560	3089560	Have you heard of this?
3089560	3091560	Have you heard of TikTok?
3092560	3094560	Of course I've heard about TikTok.
3094560	3095560	Oh, I'm sorry.
3095560	3098560	Well, I learned about it today and I did a dance.
3098560	3099560	No, no.
3099560	3102560	Carol, no, you should see the dance I did.
3102560	3105560	It's posted on the Cannes TikTok for the station.
3105560	3106560	People liked it.
3108560	3109560	You'll see, I'm out there.
3109560	3112560	Hey, Carol, when you pull it up on your phone,
3112560	3115560	you see it's called the Calzone.
3115560	3116560	Oh, God.
3116560	3117560	Oh, God.
3117560	3120560	And he's doing a dance with a random guy on the street
3120560	3122560	who's doing a very cool dance
3122560	3125560	where it looks like he's sitting while he's upright
3125560	3128560	and dancing around in a sitting position.
3128560	3131560	And Cal does it perfectly alongside of him.
3131560	3133560	Wow, Dad, actually, that's pretty impressive.
3133560	3136560	You should, actually, you should keep doing that.
3136560	3139560	In a weird, twisted reality that we currently live in,
3139560	3143560	you would actually find more dates based on this video.
3143560	3145560	With women like your mother?
3148560	3150560	Women like my mom, sure.
3150560	3153560	But you should not narrow your, like,
3153560	3156560	there are plenty of women out there that aren't like mom.
3156560	3158560	Oh, well, that's the problem.
3159560	3161560	All right, Dad.
3161560	3166560	I have to go, but thank you for being supportive of my choices.
3166560	3168560	Try to get some sleep and then maybe we'll,
3168560	3170560	yeah, I'll check in with you tomorrow.
3170560	3173560	But I still, until I have some money,
3173560	3177560	maybe don't cancel my credit card yet.
3179560	3181560	I wouldn't dream of it, sweetie.
3181560	3183560	But again, don't tell your mother
3183560	3185560	she would cancel them in a heartbeat.
3186560	3187560	Thanks, Dad.
3187560	3190560	Yeah, take care of yourself and I'll talk to you tomorrow.
3190560	3192560	I love you very much.
3192560	3193560	I love you too, Dad.
3193560	3195560	And I, yeah, thank you.
3197560	3198560	Thank you.
3198560	3201560	This has been Cal Colorado.
3201560	3202560	Have a pleasant evening.
3203560	3205560	You really don't have, okay, fine.
3208560	3210560	Ellie, thank you so much for coming on the show.
3210560	3211560	Yeah, thank you, Ellie.
3211560	3212560	Oh, my God. That was great.
3212560	3213560	That was fun.
3213560	3215560	I'm very much looking forward to seeing
3215560	3219560	how this relationship thrives or...
3219560	3221560	Yeah, it was very, like, I love how, like,
3221560	3223560	I expected Zach to come in and be like,
3223560	3226560	and then all of a sudden her head falls off
3226560	3228560	and I'm like, she dies.
3228560	3229560	And I'm like, okay, cool.
3229560	3230560	We got a long ways to go.
3230560	3232560	We got time to fuck this shit up.
3232560	3234560	Yeah, there can definitely be a phone call
3234560	3235560	where your head falls off.
3235560	3237560	Hey, if that's what you want.
3237560	3239560	Is season two a homebrew as well?
3239560	3240560	Yeah.
3240560	3241560	Yeah, very nice.
3241560	3242560	It's all I can do.
3242560	3243560	I don't like reading.
3244560	3245560	You actually can't.
3246560	3247560	I'm too stupid.
3248560	3249560	It's a shame.
3272560	3274560	Life is great.
3275560	3277560	And it's all my fault.
